title,content
Indonesia di PBB serukan pentingnya stabilitas siber, Jakarta Pemerintah Indonesia dalam pertemuan Arria Formula Dewan Keamanan DK PBB bertajuk Cyber Stability Conflict Prevention and Capacity Building pada Jumat menyerukan pentingnya stabilitas siber Indonesia bersama Estonia Belgia Kenya dan Republik Dominika menjadi co sponsor pertemuan Arria Formula DK PBB tersebut menurut keterangan tertulis PTRI New York yang diterima di Jakarta Minggu Arria Formula diselenggarakan melalui fasilitas telekonferensi video dan dipimpin oleh Menteri Luar Negeri Estonia Urmas Reinsalu Pertemuan itu membahas upaya global dalam penguatan stabilitas dan pencegahan konflik terkait dengan ancaman di ranah siber Perdana Menteri Estonia JÃ¼ri Ratas dalam sambutan pembukaannya menekankan pentingnya stabilitas di ranah siber serta kerja sama internasional melawan ancaman keamanan siber khususnya seiring dengan peningkatan digitalisasi layanan publik selama pandemi COVID Wakil Tetap RI untuk PBB di New York Duta Besar Dian Triansyah Djani dalam pernyataannya menekankan pentingnya penghormatan hukum dan norma internasional sebagai kunci stabilitas di ranah siber Baik aktor negara maupun nonnegara perlu mengedepankan perilaku yang bertanggung jawab di ranah siber kata Dubes Trian Pemerintah Indonesia dalam pertemuan itu juga menyoroti pentingnya peran organisasi regional dalam upaya pencegahan konflik di ranah siber khususnya dengan memajukan langkah langkah untuk membangun kepercayaan Dalam kaitan tersebut pemerintah Indonesia menyebutkan tentang kesuksesan sejumlah inisiatif ASEAN di kawasan maupun dengan negara mitra dalam mendorong rasa saling percaya dan lingkungan siber yang aman Melengkapi aspek teknis perlu juga diperhatikan penguatan kapasitas nasional dan kawasan dalam implementasi hukum dan norma internasional terkait siber ujar Trian Selain dalam kerangka DK PBB Indonesia juga aktif dalam proses perumusan norma terkait siber dan pemanfaatan Teknologi Informasi dan Komunikasi TIK dalam kerangka Open ended Working Group on developments in the Field of Information and Telecommunications in the Context of International Security OEWG Siber yang melibatkan seluruh anggota PBB Komitmen dan kepemimpinan Indonesia dalam pemajuan perdamaian dan perumusan norma siber juga terus diperkuat salah satunya melalui keanggotaan dalam UN Group of Governmental Experts on Advancing responsible State behaviour in cyberspace in the context of international security GGE Siber periode RI usung tema terorisme pada Presidensi DK PBB Pewarta Yuni Arisandy SinagaEditor Tia Mutiasari 
Pola makan dan lingkungan, Keduanya hewan dan tumbuhan berperan penting dalam mengatur bumi melalui suhu iklim dan penyerbukanJakarta Persoalan lingkungan saat ini menjadi pekerjaan rumah bagi sejumlah negara termasuk Indonesia setiap tahunnya harus meningkatkan anggaran untuk menjaga dan melestarikan keragaman hayati Hari keanekaragaman hayati pada Mei seharusnya mulai menggugah kesadaran masyarakat Indonesia terhadap pentingnya menjaga kelestarian lingkungan Di tengah penyebaran virus corona ini persoalan melestarikan keanekaragaman hayati menjadi hal yang sangat penting Saat ini hampir semua sektor terfokus pada upaya upaya kesehatan untuk menyelamatkan nasib umat manusia bahkan hampir sebagian besar anggaran tersedot ke sektor tersebut Persoalan wabah corona ini seharusnya tidak dirasakan oleh hewan hewan liar yang selama ini berada di pusat konservasi taman nasional bahkan kebon binatang Hewan hewan ini seharusnya tetap merasakan makanan yang biasa dikonsumsi setiap hari Langkah melestarikan lingkungan dapat dimulai dari cara yang paling mudah namun memberikan kontribusi yang besar terhdap lingkungan salah satunya dengan mengubah pola makan Terkait hal itu beberapa lembaga swadaya masyarakat bidang perlindungan hewan di Indonesia mengajak masyarakat agar lebih sadar adanya hubungan antara kelestarian keanekaragaman hayati di bumi ini dengan pola makan yang selama ini kita jalani Menurut laporan World Wild Fund for Nature WWF lebih dari persen populasi mamalia burung ikan dan reptil telah lenyap dalam rentang waktu sampai dengan Berdasarkan laporan itu lenyapnya populasi hewan ternyata juga dipengaruhi pola makan dari salah satu produk hewan Dian Pitaloka juru kampanye perlindungan hewan Act For Farmed Animals mengatakan ketidakseimbangan pola makan ini bukan hanya berisiko membahayakan hewan tetapi juga berpengaruh pada ancaman kehidupan manusia di bumi Keduanya hewan dan tumbuhan berperan penting dalam mengatur bumi melalui suhu iklim dan penyerbukan katanya Dian melalui kampanye yang dilakukan oleh LSM Sinergia Animal dan Animal Friends Jogja mengatakan salah satu cara untuk merayakan Hari Keanekaragaman Hayati yaitu dengan berkontribusi melakukan bagian kita untuk bumi agar pulih Dengan mengubah kebiasaan pola makan dan mengurangi konsumsi produk hewani merupakan salah satu kontribusi yang dapat kita semua lakukan untuk melestarikan lingkungan Terkadang peternak dalam mencari lahan usahanya harus bersaing dengan satwa dilindungi HO Sinergia Animal Hewan ternak Berdasarkan data Organisasi Pangan dan Pertanian PBB FAO sebanyak persen lahan pertanian di dunia digunakan untuk hewan ternak Hal ini mengakibatkan kerusakan yang signifikan terhadap hutan hujan yang dapat membahayakan satwa liar Persoalan ini yang juga mengakibatkan terjadinya deforestasi penggundulan hutan di sejumlah negara sehingga mengancam kelangsungan hewan hewan liar yang ada Dian mengatakan Indonesia mengimpor kedelai dari Brazil untuk diberi makan ke hewan ternak Saat kita mengurangi konsumsi produk daging berarti kita mengurangi permintaan jenis produk tersebut sehingga mengurangi beban lahan yang dipakai di negara itu Sedangkan produksi sayur sayuran untuk konsumsi manusia membutuhkan lahan yang jauh lebih sedikit jelas Dian Kemudian di sisi lain para peternak masih menganggap hewan liar sebagai ancaman untuk produksi mereka contohnya bison kangguru zebra dan kerbau bersaing dengan hewan ternak untuk merumput serta ular dan keluarga kucing besar yang memangsa hewan ternak Alasan ini menyebabkan para peternak sering memburu hewan hewan tersebut Jika kita mengurangi konsumsi daging para peternak akan lebih berdedikasi untuk mengolah sayuran sedangkan hewan liar dapat hidup dengan bebas Fakta juga memperlihatkan peternak membangun pagar untuk menjaga hewan liar jauh dari kandangnya Namun langkah ini justru menghalangi rute migrasi jutaan hewan Jika mereka tidak dapat melanjutkan migrasinya banyak hewan yang dapat sekarat karena dehidrasi atau kelaparan Tentunya keadaan tidak harus seperti ini Dengan mengonsumsi makanan berbahan dasar nabati sedikit banyak memberikan kontribusi terhadap pelestarian lingkungan Foto HO Sinergia Animal Polusi air Mayoritas air yang dikonsumsi oleh hewan ternak kembali ke alam dalam bentuk pupuk cair zat yang sarat akan patogen logam berat residu obat hormon antibiotik Berdasarkan data FAO limbah tersebut menyerap banyak oksigen yang menyebabkan adanya pertumbuhan ganggang berlebih di danau waduk atau daerah pesisir Selain oksigen ganggang juga menghasilkan toksin yang mengancam spesies lain untuk bertahan hidup Hewan ternak berkontribusi sebanyak sampai jumlah emisi gas rumah kaca yang dihasilkan manusia Berdasarkan FAO daging bertanggung jawab terhadap emisi dari sektor tersebut sedangkan produksi susu berkontribusi sebesar dalam jumlah emisi yang sama Tidak dapat dipungkiri bahwa peternakan hewan berperan secara signifikan dalam perubahan iklim dan juga kerusakan lingkungan sebagai dampaknya Tentu saja konsekuensi tersebut berdampak pada hewan liar seperti yang terjadi di kebakaran Australia pada September Bukan hanya itu perubahan iklim juga berdampak pada rusaknya terumbu karang yang disebut oleh Unesco sebagai sumber pembibitan laut dan sumber keanekaragaman hayati Menurut Unesco jika tidak ada perubahan di tahun lebih dari setengah dari spesies biota laut berada dalam ancaman kepunahan karena adanya penangkapan ikan yang berlebihan yang diambil terlalu banyak dibandingkan jumlah yang dapat diproduksi Jika kita mengurangi konsumsi ikan dari piring kita maka tidak ada hewan yang harus mati tercekik kehabisan udara hanya untuk kita makan dan jutaan kura kura lumba lumba dan hewan lainnya tidak akan tertangkap secara tidak sengaja di jaring ikan yang mematikan Alasan alasan tersebut cukup untuk membuktikan bahwa dengan mengurangi produk hewani dengan mengurangi konsumsinya akan mencegah banyak hewan liar tersakiti bahkan punah Ini adalah waktunya untuk kita mengubah pola hidup untuk melindungi keanekaragaman hayati bumi ini Tantangan untuk membatasi konsumsi makanan berbahan dasar hewani kemudian digagas salah satu LSM perlindungan hewan yang menyelenggarakan tantangan berupa pola makan berbasis nabati selama hari Makanan berbahan dasar nabati jika diolah juga dapat menggugah selera HO Sinergia Animal Tantangan yang dapat diikuti semua lapisan masyarakat ini tentunya dipandu ahli gizi yang akan menjawab setiap pertanyaan melalui surat elektronik Peserta juga akan mendapatkan resep tip dan panduan selama mengikuti tantangan tersebut Dengan berbagai gerakan dengan melibatkan peran serta masyarakat diharapkan dapat ikut membantu melestarikan kekayaan hayati termasuk mencegah terjadinya konflik manusia dengan satwa liar yang juga kerap terjadi di Indonesia Oleh Ganet DirgantaraEditor Edy Sujatmiko 
"Perayaan Hari Quds, Iran sebut masalah Palestina isu kemanusiaan", Masalah Palestina adalah masalah kemanusiaan Pengusiran terhadap jutaan orang dari rumah mereka lahan pertanian serta tempat tinggal dan mata pencahariannya yang dilakukan dengan pembunuhan dan kejahatan pasti akan menyakiti setiap hati nurani manJakarta Pemimpin Agung Republik Islam Iran Ayatullah Seyed Ali Khamenei pada peringatan Hari Quds Internasional Jumat mengatakan masalah yang dihadapi Palestina merupakan isu kemanusiaan sehingga ia menyerukan solidaritas dunia untuk terlibat aktif mendorong perdamaian di wilayah tersebut Masalah Palestina adalah masalah kemanusiaan Pengusiran terhadap jutaan orang dari rumah mereka lahan pertanian serta tempat tinggal dan mata pencahariannya yang dilakukan dengan pembunuhan dan kejahatan pasti akan menyakiti setiap hati nurani manusia kata Ayatullah Khamenei dalam pidato politiknya sebagaimana dialihbahasakan ke Bahasa Indonesia oleh Kedutaan Besar Iran di Jakarta Oleh karena itu membatasi masalah ini hanya pada isu Palestina semata ataupun masalah Arab tentu saja merupakan kesalahan besar tambah dia Dalam pidato setebal tujuh halaman itu Khamenei menyerukan tujuh poin kepada para pendukung perjuangan rakyat Palestina Salah satu poin itu mengajak warga dunia untuk membantu membebaskan seluruh wilayah sengketa dari kekuasaan Israel dan mengembalikannya ke rakyat Palestina Tujuan dari perjuangan ini adalah pembebasan seluruh wilayah Palestina dari laut ke sungai dan kembalinya semua warga Palestina ke tanah air mereka kata Khamenei seraya menyebut pembentukan pemerintahan otonom di wilayah sengketa bukan tindakan yang tepat Dalam peringatan Hari Quds itu Khamenei juga mendukung adanya referendum yang melibatkan seluruh agama dan etnis di Palestina untuk menentukan masa depan negara mereka Palestina adalah milik orang orang Palestina dan harus diatur oleh kehendak mereka sendiri Prakarsa referendum yang melibatkan semua agama dan etnis Palestina yang tela kami sampaikan hampir dua dekade lalu adalah satu satunya kesimpulan yang perlu diambil untuk menghadapi tantangan Palestina saat ini dan esok ujar dia Dukungan terhadap referedum menurut Khamenei merupakan upaya menanggapi tudingan anti semit yang dituduhkan negara negara barat ke Iran dan Palestina Sesuai rencana ini orang orang Palestina baik Yahudi Kristen maupun muslim bersama sama mengikuti referendum untuk menentukan sistem politik negara Palestina kata dia Lewat pidato politiknya Khamenei mengkritik Perserikatan Bangsa Bangsa karena dinilai tidak membantu penyelesaian konflik di Palestina Ia juga menuding negara negara barat bertanggung jawab atas aksi penjarahan dan penjajahan yang dilakukan Israel terhadap Palestina Ia juga mengkritik negara negara di kawasan Arab yang tidak banyak membantu penyelesaian konflik di Palestina Setelah kedatangan Amerika Serikat sebagai penjaga kepentingan ini mereka telah melupakan tugas tugas kemanusiaan Islam dan politik serta semangat dan kebanggaan Arabnya dengan harapan palsu di mana perjanjian Camp David contoh nyata dari fakta pahit tersebut kata Khamenei Camp David Accords atau Perjanjian Kamp David merupakan kesepakatan politik yang ditandatangani oleh Presiden Mesir Anwar Sadat Perdana Menteri Israel Menachem pada September setelah rampungnya perundingan rahasia selama hari di Kamp David di Maryland AS Perjanjian itu berisi kesepakatan damai mengenai pengelolaan dan pembagian wilayah Palestina tanpa melibatkan rakyat Palestina Sementara itu Hari Internasional Quds atau Hari Yerusalem merupakan hari yang diperingati tiap Jumat terakhir pada bulan suci Ramadhan diinisiasi pertama kali oleh Iran pada Hari Internasional Quds diperingati tiap tahun sebagai bentuk dukungan terhadap rakyat Palestina dan bentuk kecaman terhadap Israel Pewarta Genta Tenri MawangiEditor Azis Kurmala 
"China sahkan aturan keamanan, aktivis ajak warga Hong Kong unjuk rasa", Hong Kong Aktivis pro demokrasi Hong Kong pada Jumat lewat dunia maya mengajak warga berunjuk rasa menentang rencana China mengesahkan rancangan undang undang keamanan baru yang dinilai dapat mengikis kebebasan di wilayah semi otonom itu Rancangan undang undang itu juga dinilai dapat mengancam posisi Hong Kong sebagai salah satu pusat keuangan dunia Meskipun sampai saat ini belum jelas kapan unjuk rasa tanpa izin itu dilaksanakan beberapa mengusulkan aksi akan digelar pada siang hari dekat lokasi kantor sejumlah lembaga keuangan dan berakhir di dekat Kantor Perwakilan Pemerintah China Usulan itu jadi sinyal Hong Kong akan kembali menghadapi aksi massa Upaya untuk memberlakukan aturan keamanan itu sempat dilakukan pada tetapi ditentang oleh kurang lebih warga yang turun ke jalan Usulan itu pun kemudian ditangguhkan Langkah China saat ini terjadi setelah adanya rangkaian aksi massa yang cukup besar dan diselingi kekerasan pada Unjuk rasa itu jadi krisis politik terbesar di wilayah bekas koloni Inggris itu sejak Hong Kong dikembalikan ke China pada Sejumlah aktivis pro demokrasi dan politisi selama bertahun tahun menentang rancangan undang undang keamanan nasional Mereka berpendapat aturan itu dapat mengikis otonomi Hong Kong seraya memastikan wilayah itu akan tunduk pada kesepakatan satu negara dua sistem yang menurut China telah dirusak oleh para demonstran Sementara itu beberapa anggota dewan setempat pada Kamis turut menentang rencana itu menyebutnya sebagai akhir dari Hong Kong Pembahasan undang undang keamanan di Hong Kong di parlemen China yang akan memulai sidang tahunan Jumat juga memancing peringatan dari Presiden Amerika Serikat Donald Trump Sidang parlemen sempat tertunda selama beberapa bulan akibat pandemi COVID Trump mengatakan Washington akan menanggapi keras undang undang itu Departemen Luar Negeri AS juga memperingatkan China seraya mengatakan otonomi tingkat tinggi dan penghargaan kepada hak asasi manusia merupakan kunci mempertahankan status khusus wilayah sebagaimana diatur dalam konstitusi AS Menurut dia prinsip tersebut membantu AS mempertahankan posisinya sebagai pusat keuangan dunia Tajuk rencana pada Koran China Daily pada Kamis mengatakan usulan undang undang itu akan membantu menjaga pembangunan Hong Kong Reaksi berlebih dari para pengacau didukung warga asing yang melihat undang undang itu sebagai duri justru menunjukkan pentingnya dan betapa mendesaknya aturan hukum itu tulis China Daily dalam tajuk rencananya Sumber Reuters 
