title,content
Sinergi Pelindo III-TNI tanam ratusan ribu bibit bakau, Jakarta PT Pelabuhan Indonesia III Persero atau Pelindo III turut memperingati Hari UlangTahun ke TNI bersama sama TNI saat melaksanakan penanaman bakau secara serentak di titik satuan TNI dari Sabang sampai Merauke dengan tema Selamatkan Bumi Untuk Anak Cucu Kita Siaran pers PT Pelindo III yang diterima di Jakarta Selasa menyebutkan dalam kegiatan tersebut Pelindo III turut serta menanam sebanyak bibit yang ditanam bersama TNI dan elemen masyarakat di Cilacap Semarang Benoa Kupang Lembar Tanjung Wangi dan Maumere Ditemui di Tempat Pelelangan Ikan TPI Romokalisari dan wilayah Pulau Galang tempat penanaman bakau untuk kota Surabaya Toto Heliyanto Direktur Sumber Daya Manusia menuturkan bahwa Pelindo III menyambut positif program penanaman bakau secara serentak yang dilakukan TNI dari Sabang sampai Merauke Saya sangat bangga dapat langsung melakukan penanaman bakau bersama TNI di seluruh Indonesia dari Sabang sampai Merauke berperan nyata menanam bakau dimana kepedulian Pelindo III terhadap lingkungan adalah dengan menjaga ekosistem hutan bakau di wilayah kerjanya ujar Toto Komandan Koarmada II Laksda TNI Heru Kusmanto dalam sambutannya menuturkan bahwa kegiatan ini merupakan sebuah langkah awal bagi TNI bersama dengan BUMN kepelabuhanan dan masyarakat sekitar untuk melestarikan lingkungan terutama di sekitar laut dan pantai Hadir pula Wakil Gubernur Provinsi JawaTimur Emil E Dardak mengatakan Jawa Timur memiliki hektare hutan bakau Namun kerusakan yang terjadi mencapai persen Hutan bakau rusak akibat penjarahan liar Tak hanya penjarahan liar Emil melanjutkan kerusakan tersebut disebabkan antara lain adanya sejumlah kawasan hutan mangrove berubah menjadi pemukiman industri dan tambak penebangan liar hama penyakit pencemaran dan praktek budi daya yang tidak berkelanjutan Akibatnya luas hutan bakau di Jawa Timur terus menyusut Sementara itu lokasi penanaman bakau lainnya seperti di Bali juga dihadiri oleh Gubernur Bali Wayan Koster yang tampak langsung ikut turun menanam bibit pohon bakau di Pelabuhan Benoa Saya sangat mendukung program penghijauan semacam ini karena pembangunan di pelabuhan Benoa pasti didukung jika turut memperhatikan kelestarian lingkungan alam ujar Koster Hadirnya hutan bakau sangat berperan penting dalam menjaga garis pantai agar tetap stabil Mengingat kehadiran populasi pohon dan semak yang ada pada hutan bakau tersebut dapat melindungi tepian pantai dari terjangan ombak langsung yang berpotensi menghantam dan merusak bibir pantai Selain itu peran penting hutan bakau lainnya yakni melindungi pantai dan tebing sungai dari kerusakan seperti erosi dan abrasi Aksi penghijauan ini sebagai wujud sinergi antara TNI bersama dengan PT Pelindo III Persero dan masyarakat yang memberikan manfaat bagi lingkungan khususnya di sekitar wilayah laut dan pantai Penanaman bibit bakau merupakan bentuk nyata Pelindo II dalam perwujudan pelestarian lingkungan melalui penghijauan dan untuk keberlanjutan kehidupan anak cucu di masa yang akan datang Pewarta Ahmad WijayaEditor Subagyo COPYRIGHT 
British Museum tampilkan koleksi  topeng dan wayang milik  Raffles, London Koleksi topeng dan wayang dari Jawa yang dikumpulkan Sir Stamford Raffles pejabat Letnan Gubernur di Jawa selama tahun dipamerkan di lantai gedung British Museum dan berlangsung dari September hingga Januari mendatang Zeynita Gibbons British Museum London menghadirkan beragam benda dari Jawa dan Sumatera yang dikumpulkan oleh Sir Stamford Raffles pejabat kolonial Inggris yang mendirikan Singapura modern dan menjadi tokoh kontroversial sebagai seorang imperialis yang berkomitmen dan reformis progresif selama beberapa dekade Pameran koleksi Raffles mulai dari wayang dan topeng teater hingga alat musik dan patung mengeksplorasi masyarakat Jawa abad ke dan tradisi Hindu Buddha didukung oleh Kedutaan Singapura di London Inggris Tercatat sekitar jenis benda yang berhubungan dengan Raffles hampir jenis berasal dari Jawa Indonesia dikumpulkan saat menjadi Letnan Gubernur di Jawa selama tahun itu dipamerkan di lantai gedung British Museum yang ramai dikunjungi wisatawan mancanegara dan berlangsung pada September hingga Januari Mengawali pameran koleksi Raffles di musim gugur dengan kurator Dr Alexandra Green pementasan wayang kulit dengan lakon Brubuh Alengka cuplikan dari Serat Ramayana dengan dalang Ki Sujarwo Joko Prehatin diiringi gamelan Southbank Acara ini berhasil menarik perhatian lebih dari penonton yang sebagian besar warga asing yang memenuhi gedung British Museum bahkan ada yang rela berdiri Berbagai Topeng yang dikoleksi Raffles di antaranya topeng yang disebutnya topeng Raden Andaga yang terbuat dari kayu dan emas topeng Dewi Bikang Mardeya dari kayu dan emas Topeng monyet dari kayu dan emas Topeng Setan Denawa Kecubung dari kayu dan emas yang kesemuanya dibuat diawal tahun an Selain koleksi berbagai benda benda seni serta kain batik Raffles juga membuat buku yang diberi judul History of Java yang diterbitkan pada Buku yang ditulis oleh Raffles menjelaskan sejarah pulau Jawa dari zaman kuno Itu dicetak ulang dari master digital Cambridge University Press pada British Museum mengadakan pameran tentang Raffles dimaksudkan untuk menyelidiki bagaimana dan mengapa ia mengumpulkan koleksinya dan menyentuh penelitian yang sedang berlangsung di museum yang bertujuan untuk menjelaskan lebih banyak tentang pengumpulan dan kolonialisme di bagian dunia ini Sebagian besar koleksi dan dokumen resmi dan pribadi Sumatera milik Raffles hilang ketika kapalnya tenggelam tidak lama dalam perjalanan pulang ke Inggris pada tahun dan tidak ada yang pernah tahu pasti bagaimana benda benda itu diperoleh Meskipun tidak banyak yang diketahui tentang praktik pengumpulannya di Sumatera benda benda yang dipamerkan di British Museum memberikan catatan penting tentang seni dan budaya istana Jawa dari abad ke hingga awal abad ke Dr Alexandra Green adalah Kurator Henry Ginsburg untuk Asia Tenggara di British Museum Ia meraih gelar PhD tentang subjek lukisan dinding Burma abad ke dari School of Oriental and African Studies University of London Dia baru baru ini merancang pameran berjudul Pilgrims Healer dan Wizards Buddhism and Practices Practices in Burma and Thailand di British Museum Pameran ini mengeksplorasi koleksi koleksi Sir Stamford Raffles dari Jawa dan Sumatera yang tiba di British Museum antara tahun dan Pertunjukan tersebut menginterpretasikan bentuk koleksi dalam hubungannya dengan publikasi Raffles mengungkapkan minatnya untuk menjadi orang Eropa Sementara tujuan di balik koleksi Raffles terkait dengan konsep Pencerahan objek itu sendiri memberikan sekilas hubungan antara penjajah dan penduduk setempat Fitur gaya dan kondisi yang tidak digunakan dari topeng ini menunjukkan bahwa itu mungkin hadiah atau dibeli Raffles daripada diambil secara paksa atau diperoleh melalui penjarahan Topeng Jawa ini dikumpulkan Raffles menjadi terkenal karena mengotorisasi serangan terhadap pengadilan Jawa yang paling kuat Selama berada di sana ia mengumpulkan koleksi dan menyusun laporan tentang aspek aspek pulau yang menarik bagi gagasan awal Eropa abad ke tentang apa yang membentuk budaya beradab Dia sangat tertarik pada sejarah nasional dan barang antik Pengumpulan Raffles tampaknya dimotivasi oleh keinginan untuk membujuk politisi Inggris bahwa Jawa harus dipertahankan sebagai koloni Koleksi Raffles disumbangkan ke British Museum pada tahun setelah kematian jandanya Pewarta Zeynita GibbonsEditor Mohamad Anthoni COPYRIGHT 
Revitalisasi Pos Tomang-Slipi yang dibakar tunggu situasi kondusif, Jakarta Revitalisasi Pos Polisi Tomang dan Slipi yang sempat dibakar massa pericuh saat demonstrasi berlangsung di Gedung DPR MPR RI tinggal menunggu Jakarta kondusif kata Kepala Satuan Lalu Lintas Wilayah Jakarta Barat Komisaris Polisi Hari Admoko Sekarang menunggu perintah Bapak Dirlantas untuk revitalisasi dan situasi juga belum kondusif total kata Komisaris Polisi Hari Admoko di Jakarta Rabu Pos Polisi Tomang dan Slipi yang dibakar kata Hari massa masih tertutup terpal untuk menyelamatkan sisa bangunan Tidak hanya bangunan yang terbakar sejumlah sepeda motor yang terparkir di dua pos polisi itu juga dibakar massa pericuh yang mengamuk Kerugian sementara akibat pembakaran dua pos polisi di Jakarta Barat itu pihaknya belum memperkirakan Sebelumnya Pos Polisi Slipi Jakarta Barat dengan sejumlah motor yang terparkir dibakar pedemo pada hari Selasa Selang tak lama kemudian Pos Polisi Palmerah Jakarta Pusat juga dibakar Aksi penjarahan di pos polisi tersebut juga sempat terjadi Pos polisi yang berada di jembatan layang persimpangan Tomang Jakarta Barat dibakar oleh perusuh yang masih beraksi pada hari Kamis Pewarta Devi Nindy Sari RamadhanEditor D Dj Kliwantoro COPYRIGHT 
Papua Terkini- Pelaku perusakan di Oksibil ditangkap, Jayapura Aparat gabungan TNI dan Polri kembali menangkap seorang terduga pelaku perusakan dan pembakaran kios kios di Jalan Balusu Distrik Oksibil Kabupaten Pegunungan Bintang Papua Kabid Humas Polda Papua Kombes Pol AM Kamal di Kota Jayapura Selasa mengatakan terduga ditangkap pada Minggu sekitar pukul WIT Bertempat di Jalan Dabolding Distrik Kalomdol Kabupaten Pegunungan Bintang personel gabungan telah melakukan penangkapan terhadap seorang pemuda berinisial KA yang merupakan salah satu pelaku aksi perusakan dan pembakaran kios pada September katanya Adapun kronologis penangkapan ungkap Kamal bermula dari personel Polres Pegunungan Bintang mendapatkan informasi dari warga terkait keberadaan salah satu pelaku perusakan dan pembakaran yang berada di Jalan Dabolding Distrik Kalomdol Kabupaten Pegunungan Bintang Mendapat informasi tersebut pada pukul WIT personel gabungan yang dipimpin langsung Kasat Reskrim Polres Pegunungan Bintang Iptu Gondam Prienggondani menuju ke TKP untuk mengamankan pelaku katanya KA lanjut dia kemudian dibawa dan diamankan ke Mapolres Pegunungan Bintang tanpa ada perlawanan Selama proses penangkapan berlangsung pelaku kooperatif atau bisa dikatakan menyerahkan diri dan tidak melakukan perlawanan katanya Lebih lanjut Kamal mengemukakan pelaku merupakan salah satu pemuda yang berasal dari Kampung Yapimakot Distrik Serambakon dan mengaku telah melakukan perusakan pelemparan penjarahan barang serta mengajak sejumlah pemuda untuk melakukan pembakaran sejumlah kios di Jalan Balusu Distrik Oksibil kabupaten Pegunungan Bintang Sebelumnya personel gabungan berhasil mengamankan orang pelaku masing masing berinisial YD BM YD dan KB total saat ini Polres Pegunungan Bintang telah mengamankan orang pelaku perusakan dan pembakaran kios kios di Jalan Balusu Distrik Oksibil Kabupaten Pegunungan Bintang pada hari Kamis September pukul WIT katanya Kamal mengimbau semua pihak agar memercayakan penanganan kasus tersebut kepada aparat berwajib Diimbau kepada seluruh masyarakat untuk bersama sama menjaga situasi di Kabupaten Pegunungan Bintang agar tetap aman dan kondusif katanya 
Pos polisi  Tomang dibakar perusuh, Jakarta Pos polisi yang berada di jembatan layang persimpangan Tomang Jakarta Barat dibakar oleh perusuh yang masih beraksi Kepala Satuan Lalu Lintas Polres Metro Jakarta Barat Komisaris Polisi Hari Admoko saat dikonfirmasi di Jakarta Kamis dini hari membenarkan perihal tersebut Betul ujar Hari Hari mengatakan terbakarnya pos polisi fly over simpang Tomang terjadi pada Kamis pukul WIB Hingga saat ini proses pemadaman pos polisi masih berlangsung Sebelumnya pos polisi Slipi Jakarta Barat dengan sejumlah motor yang terparkir dibakar pedemo pada Selasa Selang tak lama kemudian pos polisi Palmerah Jakarta Pusat juga dibakar Aksi penjarahan di pos polisi tersebut juga sempat terjadi Pewarta Devi Nindy Sari RamadhanEditor Taufik Ridwan COPYRIGHT 
Legislator kutuk aksi perusakan kantor DPRD Sumbar, Sekretaris DPRD Sumatera Barat Raflis mengatakan pihaknya akan melaporkan tindakan perusakan gedung tersebut kepada kepolisian saat unjuk rasa mahasiswa berujung aksi anarkis ke kantor DPRD Sumbar Padang Wakil Ketua DPRD Sumatera Barat sementara Irsyad Syafar mengutuk aksi perusakan aset negara oleh mahasiswa yang melakukan unjuk rasa berujung tindak anarkis di gedung DPRD Sumatera Barat pada Rabu Kami mengutuk keras aksi anarkis demonstran yang melakukan perusakan karena melanggar hukum dan perundang undangan kata dia selepas aksi unjuk rasa di Padang Rabu Ia menjelaskan sejak awal unjuk rasa pihaknya telah menerima aspirasi mahasiswa yang menyampaikan tuntutannya Ribuan mahasiswa tersebut diterima oleh dirinya bersama anggota DPRD Sumbar lainnya seperti Suwirpen Suib Irwan Afriadi Maigus Nasir Yusuf Abit Mario Syah Johan Afrizal Hidayat dan Mesra Peserta aksi memasuki gedung DPRD Sumbar sekitar pukul WIB pihaknya langsung menerima mahasiswa menerima tuntutan mereka dan menandatangani tuntutan tersebut lalu dikirimkan melalui surat DPRD Sumbar nomor Fas tertanggal September yang ditujukan kepada Presiden RI dan surat DPRD Sumbar nomor Fas kepada pimpinan DPR RI Kedua surat tersebut dikirimkan langsung hari ini juga melalui jasa pengiriman ketika mahasiswa masih melakukan aksi katanya Ia mengatakan selepas surat dikirim mahasiswa masih melakukan aksi dan pada pukul WIB organisasi mahasiswa mengajukan permintaan untuk berdialog dengan anggota DPRD Sumbar Pihaknya mengizinkan mereka berdialog dengan syarat peserta unjuk rasa tidak melakukan tindak anarkis Kesepakatan ini dijamin oleh koordinator lapangan bahwa mahasiswa tidak melakukan tindak anarkis katanya Mereka diizinkan masuk jumlah terbatas sekitar hingga orang hal tersebut dikarenakan keterbatasan ruangan Akhirnya dialog mahasiswa dengan anggota DPRD Sumatera Barat digelar di Ruang Khusus II DPRD Sumatera Barat Pada saat dialog mahasiswa yang berada di luar gedung mencoba masuk ke dalam dan terjadi aksi dorong antara mahasiswa dan petugas kepolisian Karena jumlah mahasiswa yang lebih banyak dan tidak dapat dikendalikan mereka berhasil menjebol barikade polisi dan masuk Mereka melakukan perusakan seperti pemecahan kaca perusakan meja dan kursi sound system pencoretan dinding dan menghancurkan perpustakaan kata dia Selain itu para mahasiswa juga melakukan aksi penjarahan di ruang fraksi Golkar dan fraksi Nasdem dengan mengambil tas yang berisi surat penting berupa paspor laptop dan telepon genggam Selain itu mereka juga melakukan aksi pembakaran di samping kanan dan kiri ruang paripurna dan segera dipadamkan petugas Kemudian di luar ruangan mahasiswa juga melakukan aksi pembakaran berbagai fasilitas DPRD Sumbar yang dibawa dari dalam gedung Sementara Sekretaris DPRD Sumatera Barat Raflis mengatakan pihaknya akan melaporkan tindakan perusakan gedung tersebut kepada kepolisian saat unjuk rasa mahasiswa berujung aksi anarkis ke kantor DPRD Sumbar Kita akan biarkan kondisi gedung ini seperti ini agar pihak kepolisian dapat bekerja mengumpulkan barang bukti dan mereka juga ada di sini saat aksi perusakan oleh mahasiswa katanya Ia mengatakan hal yang akan dilakukannya adalah menginventarisir barang barang yang mengalami kerusakan akibat aksi anarkis mahasiswa seperti kaca gedung meja kursi barang elektrik dan lainnya Menurut dia seluruh barang yang ada di DPRD Sumbar sudah terdata dan pihaknya akan menghitung barang yang rusak serta nilainya dan melaporkan kepada pimpinan DPRD Sumatera Barat Kita juga melaporkan kepada pihak kepolisian agar persoalan ini diproses lebih lanjut katanya Pewarta Mario Sofia NasutionEditor Ganet Dirgantara COPYRIGHT 
Polisi periksa anggota DPRD Papua Barat terkait pembakaran kantor, Manokwari Penyidik Direktorat Kriminal Umum Polda Papua Barat memeriksa seorang anggota DPRD setempat terkait kasus pembakaran gedung wakil rakyat di Manokwari saat terjadi kericuhan Agustus Direktur Kriminal Umum Polda Papua Barat Kombes Robert Dacosta pada jumpa pers di Manokwari Rabu mengatakan anggota dewan berinisial RT itu diperiksa dengan status sebagai saksi terkait peristiwa tersebut Polisi terus mengembangkan kasus ini untuk mengungkap pihak pihak yang terlibat Dia anggota DPR provinsi kami periksa hanya sebagai saksi Kasus perusakan dan pembakaran gedung DPRD Papua Barat masih terus kita kembangkan kata Dacosta Gedung DPRD Papua Barat di Jalan Siliwangi Manokwari dibakar massa pada kericuhan Agustus Selain pembakaran diduga juga terjadi penjarahan di kantor wakil rakyat tersebut Terkait kericuhan di Manokwari saat itu lanjut Dacosta polisi sudah menetapkan tersangka di antaranya ditahan dan dua orang lainnya diberikan diversi karena anak anak dan terjangkit penyakit menular berbahaya Lima belas tersangka kasus pembakaran kantor DPRD Papua Barat sedangkan dua orang yang diversi ini terkait kasus pembakaran bendera sebut Robert Ia mengutarakan tersangka yang kini ditahan merupakan pelaku di lapangan saat kericuhan pecah Polisi masih menelusuri kemungkinan adanya aktor intelektual atau pihak yang mendesain kericuhan tersebut Kericuhan di Manokwari pada Agustus itu pecah karena masyarakat terhasut oleh seruan dari Jayapura Papua Dia anggota KNPB Komite Nasional Papua Barat dan sekarang sudah ditahan jadi para pelaku di Manokwari bertindak anarkis karena terhasut sebutnya Terkait pembakaran gedung DPRD penyidik berharap memperoleh bukti berupa rekaman CCTV namun setelah receiver CCTV tersebut diperoleh kejadian Agustus itu tidak ada dalam rekaman Receiver nya sudah kami dapat namun setelah dibuka ternyata rekamannya tidak ada ujarnya seraya menambahkan bahwa penyidikan dilakukan dengan memanfaatkan alat bukti lain yang diperoleh di lapangan 
Kemenag berupaya kembalikan peran IAIN Palu pascatsunami, Tahun dari Kementerian Agama akan membangun beberapa gedung yang dibiayai lewat Surat Berharga Syariat Negara SBSN untuk kembali merekonstruksi IAIN PaluPalu Kementerian Agama terus berupaya mengembalikan peran optimal Institut Agama Islam Negeri IAIN Palu Sulawesi Tengah dalam pembangunan peradaban manusia pascabencana gempa disertai tsunami Kementerian Agama dan beberapa kementerian terkait berupaya untuk melakukan kegiatan rehabilitasi dan rekonstruksi untuk pemulihan kembali IAIN Palu ucap Direktur Jenderal Pendidikan Islam Kemenag Kamaruddin Amin di Palu Kamis IAIN Palu Perguruan Tinggi Keagamaan Islam Negeri di bawah naungan Kemenag menjadi salah satu komponen yang terdampak langsung tsunami pada September Gedung dan sarana penunjang kegiatan akademik di kampus itu rusak total akibat tsunami Selain karena tsunami IAIN Palu juga menjadi satu komponen sasaran penjarahan oknum oknum tertentu yang menambah beban perguruan tinggi Islam negeri itu Mulai dari uang hingga mesin pendingin ruangan dan aset lainnya hilang karena ulah penjarah Penjarah juga menghamburkan ijazah para alumnus setelah beberapa hari terjadi tsunami Kerugian negara dari bencana itu ditaksir ratusan miliar rupiah Oleh karena itu IAIN Palu butuh perhatian pemerintah untuk bangkit secara optimal pascabencana Kamaruddin Amin mengemukakan pada Kementerian Agama akan kembali membangun beberapa gedung perkuliahan dan gedung pelayanan administrasi akademik untuk IAIN Palu Tahun dari Kementerian Agama akan membangun beberapa gedung yang dibiayai lewat Surat Berharga Syariat Negara SBSN untuk kembali merekonstruksi IAIN Palu katanya Ia menyebut bahwa IAIN Palu aset Kementerian Agama yang strategis di Sulawesi Tengah untuk membangun sumber daya manusia yang unggul masa kini dan akan datang Eksistensi IAIN Palu ini sangat signifikan sehingga semua dari kita punya komitmen yang sama untuk memulihkan bahkan mengembangkan IAIN Palu pascabencana kata dia Kamaruddin Amin menyampaikan hal itu usai menjadi narasumber kuliah umum semester ganjil Tahun Akademik di IAIN Palu Kamis Terkait pemulihan kampus itu Rektor IAIN Palu KH Sagaf S Pettalongi mengemukakan pemulihan secara perlahan lahan dan bertahap terus dilangsungkan Ia menguraikan pascabencana IAIN Palu membutuhkan kurang lebih ruang kelas belajar untuk mengoptimalkan kegiatan akademik dan perkuliahan di kampus tersebut Berkaitan dengan itu Wakil Rektor Bidang Perencanaan IAIN Palu Kamaruddin mengatakan pascabencana IAIN Palu mendapat bantuan dari pemerintah pada kurang lebih senilai Rp miliar untuk pembangunan dua gedung perkuliahan yang dibangun di Desa Pombewe Kecamatan Sigi Biromaru Kabupaten Sigi Pada katanya IAIN Palu direncanakan kembali menerima bantuan kurang lebih senilai Rp miliar dari Kementerian Agama lewat SBSN untuk membangun kurang lebih tiga gedung perkuliahan Proses pembangunan dua gedung perkuliahan milik IAIN Palu di Desa Pombewe Kecamatan Sigi Biromaru Kabupaten Sigi Kamis Muhammad Hajiji Dirjen Pendis Kemenag Prof Dr Kamaruddin Amin didampingi Rektor IAIN Palu Prof Dr KH Sagaf S Pettalongi MPd berbincang dengan salah satu karyawan perusahaan pemenang tender pelaksana proyek pembangunan dua gedung perkuliahan di Desa Pombewe Kecamatan Sigi Biromaru Kabupaten Sigi Kamis Muhammad Hajiji Dirjen Pendis Kemenag Prof Dr Kamaruddin Amin didampingi Rektor IAIN Palu Prof Dr KH Sagaf S Pettalongi MPd berbincang dengan salah satu karyawan perusahaan pemenang tender pelaksana proyek pembangunan dua gedung perkuliahan di Desa Pombewe Kecamatan Sigi Biromaru Kabupaten Sigi Kamis Muhammad Hajiji Dirjen Pendis Kemenag Prof Dr Kamaruddin Amin berjabat tangan dengan salah satu mahasiswa saat berjalan meninggalkan tempat kuliah umum usai Dirjen Pendis menyampaikan materi pada kegiatan tersebut di Palu Kamis Muhammad Hajiji Pewarta Muhammad HajijiEditor M Hari Atmoko COPYRIGHT 
Prestasi BJ Habibie - Pengamat: mampu tahan krisis tidak lebih dalam, Manado Pengamat Ekonomi Universitas Sam Ratulangi Samrat Manado Sulawesi Utara Sulut Agus T Poputra mengatakan salah satu prestasi BJ Habibie mampu adalah menahan terjadinya krisis di Indonesia tahun sehingga tidak lebih dalam lagi Krisis ekonomi dan keuangan Indonesia masih berlangsung hingga masa pemerintahan SBY Namun demikian BJ Habibie mampu menahan terjadinya krisis yang lebih dalam saat itu kata Poputra di Manado Kamis BJ Habibie secara resmi dilantik menjadi Presiden ketiga Republik Indonesia pada Mei Habibie menggantikan Soeharto yang mundur sehari sebelumnya Saat itu situasi yang dihadapinya tidaklah mudah Saat itu Habibie dihadapkan pada prospek ekonomi Indonesia yang benar benar terpuruk dan tidak memiliki arah yang jelas Bank rush terjadi secara masif karena ketakutan masyarakat kehilangan kekayaan Sementara itu arus barang dan jasa mengalami hambatan karena adanya penjarahan perusakan dan berbagai aksi anarkis lainnya akibat kekerasan sosial di masyarakat Distribusi bahan pokok khususnya beras mengalami hambatan yang semakin berat karena kekeringan sehingga terjadi gagal panen Kelangkaan bahan pangan terjadi di mana mana Harga harga komoditas melambung tinggi sehingga memunculkan adanya ketakutan terjadinya kelaparan Namun prestasi BJ Habibie mampu memulihkan kondisi perekonomian yang hanya berlangsung dalam kurun waktu bulan dan tak lepas dari andil semua pihak Dia mengatakan Pak Habibie adalah sosok fenomenal yang pemikiran melampaui rata rata pemikiran orang pada masanya terutama di Indonesia Sayangnya beliau membangun industri dirgantara tanpa didukung oleh industri pendukung secara memadai sehingga bagaikan orang melompat dari anak tangga pertama ke anak tangga keempat sehingga jatuh Dari prestasi BJ Habibie dia telah meletakkan dasar dasar penting pada industri dirgantara Indonesia Pengembangan hasil karya ke depan adalah mengembangkan industri backward dari industri dirgantara untuk memperkuat local content dan daya saing industri Habibienomics katanya sebenarnya belum dapat dianggap sebagai suatu mazhab namun beliau telah meletakkan dasar dasar yang baik untuk transparansi anggaran Dan di tangan beliau lahir UU No thn tentang Pemerintah Daerah serta UU No tentang Perimbangan Keuangan antara Pemerintah Pusat dan Daerah yang menjadi dasar Otonomi daerah yang ada saat ini Ini merupakan karya terbaik di zaman beliau di tengah goncangan ekonomi politik dan keamanan jelasnya Pewarta Nancy Lynda TigauwEditor Triono Subagyo COPYRIGHT 
