title,content
Turki tangkap 38 orang terkait serangan bersenjata, Istanbul Otoritas Turki menangkap orang termasuk ketua Partai Demokrat Rakyat HDP proKurdi setempat sehubungan dengan serangan bersenjata yang menewaskan dua orang di Provinsi Van menurut kantor gubernur pada Jumat Serangan pada Kamis menargetkan dua personel pemerintah kota dan seorang warga sipil yang baru pulang mendistribusikan bantuan ke lingkungan yang menerapkan karantina wilayah sebagai bagian dari langkah pencegahan penyebaran virus corona Direktur komunikasi Turki Fahrettin Altun dan sejumlah pejabat lainnya menuding Partai Pekerja Kurdi PKK menjadi dalang serangan tersebut PKK yang melancarkan pemberontakan terhadap negara Turki sejak dianggap sebagai organisasi teroris oleh Turki Amerika Serikat dan Uni Eropa Lebih dari orang tewas dalam konflik tersebut Sumber Reuters 
WARSI dorong solusi pangan bagi orang Rimba di tengah pandemi COVID-19, Jakarta Komunitas Konservasi Indonesia KKI WARSI mengatakan terus mendorong solusi bagi orang Rimba untuk memperoleh bantuan pangan dari program pemerintah di tengah pandemi COVID Kami sejak COVID ini terus berupaya agar kelompok kelompok ini mendapatkan bantuan dari program program pemerintah kata Direktur Eksekutif KKI WARSI Rudi Syaf dalam Webinar Pusat Pengajian Islam PPI Universitas Nasional UNAS bertema pemberdayaan umat di sekitar kawasan hutan di masa pandemi COVID di Jakarta Jumat Ia mengatakan di tengah wabah yang melumpuhkan perekonomian kelompok orang Rimba yang hidup di perkebunan sawit adalah kelompok yang dinilai sangat terdampak Terlebih lagi menyusul konflik dengan perusahaan sawit yang menyebabkan mereka semakin kesulitan untuk mendapatkan sumber pangan Karena tidak ada lahan yang bisa ditanam untuk pangan oleh mereka Tidak ada umbi umbian yang tumbuh yang bisa mereka ambil secara subsisten katanya Orang Rimba yang hidup di perkebunan sawit kata dia hanya mengandalkan hasil berburu sebagai sumber pangan mereka Namun sejak wabah COVID melanda hampir seluruh provinsi di Indonesia hasil buruan mereka tidak laku dijual sehingga mereka benar benar kesulitan mendapatkan pangan Untuk itu WARSI katanya sejak pandemi COVID berlangsung terus berupaya membantu agar kelompok masyarakat adat terutama orang Rimba mendapatkan bantuan tunai berupa sembako dari pemerintah Supaya mereka dapat terutama yang hidup di kebun sawit katanya Sudah berjalan di beberapa kelompok di Kemensos itu sudah ditemukan solusi melalui Dinas Sosial Kabupaten disalurkan langsung berupa bahan pokok sembako katanya lebih lanjut Upaya untuk memikirkan kelangsungan hidup kelompok kelompok tersebut menurut dia penting dilakukan bersama sama seluruh komponen bangsa sehingga konflik terkait lahan dan sumber penghidupan bagi kelompok kelompok masyarakat adat bisa menjadi solusi jangka panjang Mekanisme penyelesaian konflik terkait dengan lahan itu memang cukup sulit di perkebunan sawit karena itu penting ke depan kita bersama sama memikirkan kelompok kelompok ini katanya WARSI bersama Direktorat Jenderal Perhutanan Sosial Kementerian Lingkungan Hidup dan Kehutanan KLHK sejak katanya telah berhasil membangun mekanisme perhutanan sosial yang merekognisi masyarakat untuk bisa terlibat bahkan berkolaborasi dengan perusahaan Ke depan mereka ingin mendorong mekanisme tersebut di sektor perkebunan sehingga bisa menjadi solusi tidak hanya perusahaan perkebunan kelapa sawit tetapi juga bagi masyarakat yang tinggal dan mencari penghidupan di lingkungan sekitarnya Pewarta KatrianaEditor Triono Subagyo 
"Konflik terjadi, Orang Rimba kesulitan pangan saat pandemi COVID-19", Jakarta Akibat pandemi COVID banyak masyarakat yang mengalami kesulitan baik pangan maupun ekonomi termasuk juga Orang Rimba kelompok Sikar di Sungai Mandelang Kabupaten Merangin Jambi yang harus menyambung hidup dengan memungut sawit Menurut aktivis Komunitas Konservasi Indonesia KKI Warsi Orang Rimba kelompok Sikar harus mengambil buat sawit yang jatuh di lahan perkebunan PT Sari Aditya Loka SAL Jambi yang dulu merupakan hutan tempat rumah mereka Ini merupakan kelompok rentan dan mengalami kesulitan melanjutkan hidup kesulitan mendapatkan pangan yang baik dan kesulitan meningkatkan derajat kehidupan melalui pendidikan dan layanan kesehatan yang memadai kata Robert Aritonang antropolog KKI Warsi dalam rilis yang diterima di Jakarta Jumat Menurut pimpinan Orang Rimba Sungai Mendelang bernama Tumenggung Sikar yang ditemui Warsi mereka kehilangan sumber penghidupan setelah pandemi karena tidak ada yang membeli babi yang mereka jual Permasalahan pangan itu juga berujung dengan konflik yang terjadi antara Orang Rimba dan PT SAL ketika mereka ingin mengumpulkan buah sawit yang jatuh di area perkebunan pada Selasa Menurut Warsi ketika ingin mengumpulkan sawit yang jatuh kelompok Orang Rimba bertemu dengan petugas keamanan dari PT SAL yang menyuruh mereka kembali Setelah mereka berputar balik rombongan Orang Rimba masih terus diikuti oleh petugas keamanan yang berujung dengan konflik yang berlanjut sampai ke pemukiman mereka di Sungai Mandelang mengakibatkan kerusakan pondok dan motor Orang Rimba ditempatkan di kantor polisi Menurut Robert persoalan konflik antara Orang Rimba adalah peristiwa berulang yang seharusnya tidak terjadi Orang Rimba sudah tinggal di daerah itu sebelum berubah menjadi kebun sawit dan mereka tidak dijadikan bagian dari perubahan hutan yang menjadi sumber penghidupan mereka kata dia Berdasarkan data Warsi Orang Rimba di Jambi terdapat keluarga yang hidup dalam perkebunan sawit dan di kawasan hutan tanaman industri HTI Menanggapi hal itu Robert berharap negara hadir melindungi mereka apalagi mereka bisa masuk dalam kelompok rentan di tengah pandemi Orang Rimba sangat rentan terhadap wabah juga sangat rentan mengalami kesulitan pangan harusnya mereka masuk kelompok yang dilindungi perusahaan Bagaimanapun perusahaan yang hadir di hutan mereka bukan mereka yang menumpang di sana Itu yang harusnya dipahami perusahaan ucap Robert PT SAL sendiri membantah adanya konflik dengan Orang Rimba Menurut pernyataan resmi perusahaan yang disampaikan Manajer Humas Mochamad Husni ketika dihubungi oleh pada Jumat petugas keamanan perkebunan hanya menjalankan tugas bertanggung jawab terhadap keamanan semua pihak termasuk keselamatan Orang Rimba yang hidup berdampingan di sekitar perusahaan Menurut dia petugas keamanan bertemu Orang Rimba kelompok Sikar mencoba berdialog terkait larangan selain karyawan memasuki perkebunan Hal itu dilakukan karena adanya protokol operasional pencegahan COVID Meski sempat menuruti imbauan itu Husni mengatakan petugas keamanan mengalami pengeroyokan yang diduga dilakukan oleh Orang Rimba pada malam harinya Konflik yang terjadi di pemukiman Orang Rimba terjadi ketika orang desa sekitar melihat warganya yang menjadi petugas keamanan dikeroyok mencari pelakunya Husni mengatakan PT SAL lalu menghubungi polisi setempat untuk menghindari konflik lebih lanjut Upaya mediasi terus dilakukan sampai saat ini PT SAL ingin hidup dalam suasana harmonis seperti selama ini sudah berjalan bersama masyarakat desa sekitar maupun Orang Rimba Apalagi di tengah suasana pandemi yang mengharuskan semua pihak bekerja sama lebih erat lagi kata dia Dia mengatakan PT SAL telah memberikan bantuan beras dan sembako selama pandemi kepada masyarakat termasuk kepada Orang Rimba Bahkan menurut dia bantuan juga diberikan kepada Orang Rimba setiap bulannya sebelum pandemi Pewarta Prisca Triferna ViolletaEditor Masuki M Astro 
Pakar sebut karhutla berulang karena sengaja dibakar, Jakarta Pakar kebakaran hutan dan lahan dari Institut Pertanian Bogor Prof Bambang Hero Saharjo menyebut alasan kebakaran hutan dan lahan karhutla terjadi berulang karena sengaja dibakar Bambang saat memberi kuliah umum secara daring dengan tema Memahami Kebakaran Lahan Gambut yang dilaksanakan Badan Restorasi Gambut BRG di Jakarta Kamis mengatakan biasanya penyebab terjadinya kebakaran di lahan konsesi karena memang sengaja dilakukan untuk pembukaan atau penyiapan lahan Karena dengan cara dibakar lebih murah menurut dia menjadi pertimbangan konsesi sehingga biaya untuk pembukaan lahan bisa dimanfaatkan untuk lainnya seperti membeli pupuk Karenanya pembakaran dengan disengaja itu perlu dicegah melalui proses penegakan hukum Bisa jadi by design karena mereka tidak bisa lakukan land clearing dengan benar ujar dia Faktor lain yang dapat memicu karhutla di wilayah konsesi ia mengatakan akibat pembiaran atau omission baik karena kelalaian maupun kesengajaan Penyebab lain karhutla terjadi di kawasan konsesi menurut Bambang karena mengabaikan kewajiban melakukan manajemen air dalam rangka mempertahankan ground water level GWL di batas yang ditolerasi Bambang juga mengatakan persoalan lain yang membuat area konsesi kerap terbakar karena tidak bekerjanya sistem peringatan dini dan sistem deteksi dini titik api Adanya konflik atau sengketa lahan dengan masyarakat menurut Guru Besar Fakultas Kehutanan IPB itu juga menjadi salah satu pemicu karhutla Selain tentunya sumber daya manusia yang tidak memiliki kemampuan minimal Kuncinya menyelesaikan semua ini kita harus sepakat karhutla merugikan karenanya harus dikendalikan dengan cara dicegah dipadamkan dan pelaku perlu diproses hukum ujar Bambang Persoalan di lapangan soal implementasi pencegahan karhutla menurut dia banyak persoalan Kita selalu bilang lakukan pencegahan tapi ketika karhutla sudah terjadi Apakah itu pencegahan Ya tidak katanya Karenanya ia mengingatkan pencegahan hendaknya dilakukan jauh jauh hari gunakan sistem peringatan dini dan sistem deteksi dini titik api Kejadian seperti di SBY Presiden Susilo Bambang Yudhoyono sempat tanya kok karhutla lagi ya Makanya di ada audit compliance dari perusahaan di Riau dan ternyata tidak ada satupun yang comply sehingga itu jadi persoalan kata Bambang Bagaimana mungkin mereka kendalikan karhutla kalau sarpras sarana dan prasarana tidak ada Dari Pemda juga hanya satu sampai dua saja yang lulus Malah mereka tanya oh itu tugas saya ujar Bambang Ia mengatakan kalau kondisinya seperti itu dan tidak dibenahi maka karhutla akan terjadi berulang Tolong lah aturan main itu dihormati Bukan sekadar soal kewajiban saja karena ada tujuannya ujarnya Pewarta Virna P SetyoriniEditor Masuki M Astro 
Iran hiraukan ancaman AS soal sanksi PBB, Klaim bodoh oleh pejabat AS bukan sesuatu yang baru Dubai Menteri Luar Negeri Iran Mohammad Zarif pada Kamis menghiraukan klaim bodoh Amerika Serikat berisi ancaman akan mendorong kembali diberlakukannya seluruh sanksi Perserikatan Bangsa Bangsa apabila Dewan Keamanan PBB tidak memperpanjang embargo senjata ke Teheran demikian laporan berita setempat Utusan khusus AS untuk Iran Brian Hook pada Rabu membenarkan secara terbuka strategi itu dua minggu setelah seorang pejabat yang tidak ingin diketahui identitasnya mengatakan Washington telah menyampaikan rencana itu ke Inggris Prancis dan Jerman Embargo senjata PBB akan berakhir pada Oktober tahun ini setelah Iran menandatangani kesepakatan nuklir dengan AS pada Akan tetapi perjanjian itu dibatalkan secara sepihak oleh Presiden AS Donald Trump pada Washington berpendapat pihaknya dapat mendorong PBB kembali menjatuhkan sanksi ke Teheran karena resolusi Dewan Keamanan yang menjadi dasar kesepakatan masih menyebut AS sebagai anggota Klaim bodoh oleh pejabat AS bukan sesuatu yang baru kata Menteri Luar Negeri Iran Mohammad Zarif ke wartawan Tidak mengejutkan klaim semacam itu didengar dari orang yang menyarankan warganya meminum disinfektan sampai meremehkan virus corona SARS CoV dan pernyataan itu disampaikan untuk menunjukkan mereka merupakan bagian dari perjanjian yang telah mereka tinggalkan secara resmi kata Zarif Pernyataan Zarif tampaknya merujuk pada saran Trump ke para peneliti Trump sempat menyampaikan ke publik COVID kemungkinan dapat disembuhkan dengan menyuntikkan cairan disinfektan ke tubuh pasien Sementara itu juru bicara Kementerian Luar Negeri Iran menyindir laporan Departemen Luar Negeri AS pada yang disiarkan Rabu Isi laporan itu menyebutkan Iran dan empat negara lainnya tidak bekerja sama penuh dengan AS melawan terorisme Dengan sejarah membentuk mendanai dan mempersenjatai beberapa kelompok teroris yang berbeda ditambah catatan terorisme negara dan dukungan penuhnya terhadap rezim teroris AS bukan contoh yang baik untuk mengukur upaya melawan terorisme kata juru bicara Kementerian Luar Negeri Iran Abbas Mousavi lewat unggahannya di Twitter Sumber Reuters 
ACT beri bantuan ke pengungsi di Somalia jelang Idul Fitri, Jakarta Tim Global Humanity Response Aksi Cepat Tanggap GHR ACT memberikan bantuan pangan kepada ratusan keluarga yang tinggal di kamp pengungsian di Kota Mogadishu Somalia jelang Idul Fitri pada Sabtu lalu Paket paket pangan ini adalah hadiah dari masyarakat Indonesia kepada keluarga yatim dan pengungsi internal dari konflik di Somalia Target kami ada jiwa yang akan menerima bantuan paket pangan Ramadhan ini ujar Andi Noor Faradiba dari Tim GHR ACT dalam siaran pers yang diterima di Jakarta Kamis Menurut dia pandemi COVID memperburuk kondisi dibandingkan tahun sebelumnya dengan harga makanan naik jelang Idul Fitri dan pandemi memberikan dampak kepada perekonomian negara yang terletak di Afrika itu Menurut beberapa pengungsi yang ditemui ACT di kamp pengungsian di Mogadishu selain ekonomi mereka juga sulit menjaga jarak dan menjalankan protokol kesehatan lain di kamp yang padat dengan sanitasi yang buruk Kami tidak memiliki sabun untuk membersihkan tangan kami saat virus menyebar kata Khadija Diriye salah satu pengungsi konflik internal Somalia yang ditemui ACT di kamp tersebut Menurut laporan Organisasi Kesehatan Dunia World Health Organization WHO Somalia terkonfirmasi memiliki kasus positif COVID dengan kematian per Rabu Bantuan pangan yang diberikan ACT sudah disalurkan kepada ratusan keluarga untuk membantu kondisi mereka menjelang Lebaran Sebagai pengungsi tentu untuk memenuhi kebutuhan dasar mereka sangat sulit Tambah sulit lagi dengan adanya virus corona Mudah mudahan paket ini dapat membantu mereka dalam melewati Ramadhan kali ini kata Faradiba dari Tim GHR ACT 
TNI lakukan langkah konkret bantu penanganan Corona, Operasi penanganan medis telah dilaksanakan beberapa kegiatan di antaranya menyiapkan tiga rumah sakit sebagai tempat rujukan utama dan rumah sakit sebagai tempat rujukan pendukungJakarta Panglima TNI Marsekal TNI Hadi Tjahjanto menyebutkan TNI telah melaksanakan beberapa langkah konkret yaitu Operasi Penanganan Medis Operasi Pengamanan dan Operasi Dukungan dalam membantu menangani penyebaran COVID di Indonesia Upaya Pemerintah untuk menekan pandemik COVID pada dasarnya merupakan upaya seluruh komponen bangsa Sesuai kebijakan Pemerintah untuk membantu penanganan pandemik COVID di Indonesia TNI juga telah melakukan langkah langkah kata Panglima TNI pada acara Web Internet Seminar Webinar KBRI Singapura melalui video conference di Mabes TNI Cilangkap Jakarta Timur Kamis Menurut dia kebijakan penggunaan kekuatan TNI itu dalam rangka Operasi Militer Selain Perang OMSP dalam membantu Pemerintah pada kegiatan bantuan kemanusiaan civic mission khususnya penanggulangan bencana alam dan pengungsian penanganan wabah penyakit pencarian dan pertolongan dalam kecelakaan atau Search And Rescue SAR serta pengamanan pelayaran dan penerbangan Operasi penanganan medis telah dilaksanakan beberapa kegiatan di antaranya menyiapkan tiga rumah sakit sebagai tempat rujukan utama dan rumah sakit sebagai tempat rujukan pendukung tutur Hadi Di samping itu TNI juga menyiapkan Kapal Bantu Rumah Sakit KRI dr Soeharso dan KRI Semarang serta lima rumah sakit lapangan dari Batalyon Kesehatan TNI Operasi pengamanan dalam rangka percepatan penanganan COVID juga telah dilaksanakan berbagai kegiatan seperti pengamanan perbatasan darat dan laut dengan menggelar kekuatan teritorial TNI dan alutsista gabungan Yaitu KRI dan pesawat patroli maritime satuan teritorial dan pengamanan perbatasan membantu pemeriksaan arus orang masuk di pelabuhan bandara Pos Lintas Batas Nasional serta mengawasi jalur jalur tikus yang dapat digunakan di sepanjang perbatasan dengan negara tetangga Selain itu pengamanan jalur logistik untuk menjamin keamanan rantai logistik selama diberlakukannya pembatasan sosial berskala besar PSBB di sebagian Provinsi dan Kabupaten Kota Upaya ini dilaksanakan dengan koordinasi yang ketat bersama Pemprov Pemkab dan Pemkot Polri Kemenkes serta lembaga terkait khususnya dalam distribusi jaring pengaman sosial di berbagai daerah ujar Marsekal Hadi TNI juga pengamanan PSBB yang dilakukan bersama instansi terkait berupa patroli bersama untuk menegakkan aturan PSBB dan larangan mudik menjelang Hari Raya Idul Fitri Hijriah yang diterapkan di tengah masyarakat Kesadaran masyarakat luas sangat penting karena saat ini vaksin belum ditemukan dan harus memutus rantai penyebaran melalui berbagai protokol yang telah ditetapkan Pemerintah Bersama Gugus Tugas kata mantan Irjen Kemhan ini TNI juga melaksanakan pengamanan di titik titik pemeriksaan termasuk di jalur jalur yang digunakan untuk mudik Pada Operasi Dukungan yang dilaksanakan TNI kata mantan Kepala Staf TNI Angkatan Udara KSAU ini antara lain membantu mendistribusikan alat kesehatan ke berbagai provinsi dengan menggunakan pesawat angkut dan truk truk TNI TNI juga turut membantu mendata masyarakat yang berhak menerima bantuan sosial membantu penyaluran bantuan logistik ke masyarakat yang membutuhkan menggelar dapur umum di seluruh wilayah Kotama Operasi TNI untuk membantu kinerja Gugus Tugas Percepatan Penanganan COVID dan memberikan bantuan perkuatan kepada Polri untuk mengantisipasi tindakan kriminal anarkis ataupun konflik sosial 
"Webseries ""Curhat Online"" hadirkan Acha Septriasa hingga Gading Marten", Jakarta Kuy Entertainment mempersembahkan sebuah webseries berjudul Curhat Online yang menampilkan akting dari Acha Septriasa hingga Gading Marten Webseries Curhat Online disutradarai oleh Ryan Manoarfa dan ceritanya ditulis oleh Stephany Josephine Penggarapan webseries ini direkam dari jarak jauh melalui video call menggunakan aplikasi Zoom dan personal camera dari rumah masing masing pemain Memang tantangannya mulai dari koneksi internet di beberapa daerah beda Selain itu saya juga bersyukur bisa kerja sama dengan cast yang telah senior jadi kerjaan lebih gampang Udah lumayan perfect dengan cast ini kata Ryan Manoarfa dalam jumpa pers virtual Kamis Curhat Online bercerita tentang Nadif Gading Marten seorang Human Relation yang bekerja di sebuah start up berkembang di Jakarta Secara mendadak dikarenakan pandemi COVID semua pegawai diminta untuk melanjutkan pekerjaan dari rumah Biasa bekerja dalam lingkungan kerja yang serba cepat sekarang semua orang jadi melamban Karena hal tersebut beberapa pegawai mulai kehilangan pegangan Memasuki bulan Ramadhan dengan beberapa karyawan berpuasa dan berusaha tenang situasi pekerjaan malah terasa makin sulit Maka pihak korporat dan Human Relation mengadakan sesi terapi online yang dipimpin oleh Nadif di mana kita bisa melihat semua orang curhat tentang masalah yang mereka hadapi Curhatan ini akan dikaitkan dengan ayat Al Quran Setiap episode akan mempunyai konflik yang berbeda dengan resolusinya Gading Marten yang juga bertindak sebagai produser di webseries ini mengatakan bahwa cerita Curhat Online sangat relevan dengan kehidupan sehari hari Ceritanya gue banget jadi memang bikin se relater mungkin Bukan cuma menghibur tapi juga ada pesan moral ujarnya Menurut dia kehadiran webseries Curhat Online sebagai bentuk para pekerja seni untuk tetap berkarya di tengah keterbatasan yang ada saat ini karena pandemi COVID Untuk tetap waras dalam kondisi seperti ini kita harus melakukan sesuatu yang positif dan tetap tenang Kita mencari ide yang relate dengan keadaan sekarang kata Gading Marten Curhat Online akan tayang sebanyak episode dengan durasi menit mulai tanggal Mei sampai Mei Setiap harinya akan ada dua episode yang diunggah ke YouTube di kanal Kuy Entertainment Webseries ini juga menampilkan Enzy Storia sebagai Mira Sultan Djorghi sebagai Rama Cantika sebagai Aldo Aras Fachri Albar dan Renata Kusmanto yang menjadi pasangan suami istri yang merupakan Operations Manager 
Menlu: tidak ada pasukan perdamaian Indonesia terinfeksi COVID-19, Jakarta Menteri Luar Negeri Retno Marsudi menyatakan tidak ada pasukan pemelihara perdamaian asal Indonesia yang terinfeksi COVID Hingga saat ini tidak ada pasukan pemelihara perdamaian Indonesia yang terinfeksi COVID Namun kami tetap waspada dan terus mengikuti perkembangan di lapangan kata Retno dalam konferensi pers daring dari Istana Kepresidenan Jakarta Kamis Berdasarkan data Sekretariat PBB kasus COVID telah dikonfirmasi di negara dan wilayah yang memiliki pasukan pemelihara perdamaian PKO Merujuk data tersebut Menlu Retno mengatakan bahwa personnel penjaga perdamaian telah tertular COVID dengan sebagian besar kasus muncul di Mali Dari jumlah tersebut orang di antaranya sudah sembuh kata dia Sebagai salah satu penyumbang pasukan perdamaian terbesar bagi PBB Indonesia menaruh perhatian besar pada keselamatan dan kesehatan para pasukan terutama pada masa pandemi saat ini Secara terus menerus Indonesia memonitor situasi di wilayah wilayah konflik yang diperparah oleh wabah COVID karena keterbatasan infrastruktur kesehatan keamanan yang rapuh situasi ekonomi yang menantang dan kondisi kemanusiaan COVID kata Retno telah berdampak pada implementasi mandat PKO antara lain kesulitan untuk terhubung dengan pihak pihak yang berkonflik guna melaksanakan upaya perdamaian dan mediasi mereka Wabah tersebut juga menyebabkan keterbatasan pergerakan dan kegiatan personel penjaga perdamaian serta akses kemanusiaan dan logistik selain juga kesulitan rotasi karena transportasi dan perjalanan udara tidak tersedia Karena itu dalam pertemuan pertemuan Dewan Keamanan PBB Indonesia selalu menekankan pentingnya keselamatan dan keamanan serta kesehatan personel penjaga perdamaian ujar Retno Terkait kepentingan itu Indonesia turut mensponsori Resolusi DK PBB Nomor tentang keselamatan dan keamanan personel penjaga perdamaian Resolusi tersebut disahkan pada Maret DK PBB Sebagai anggota tidak tetap DK PBB Indonesia juga menyambut baik seruan Sekretaris Jenderal PBB bagi gencatan senjata global untuk memungkinkan pengiriman bantuan kemanusiaan di wilayah konflik Indonesia bersama dengan para anggota DK lainnya ikut aktif dalam merumuskan rancangan resolusi DK PBB tentang langkah langkah yang perlu diambil untuk mengatasi tantangan COVID di bidang perdamaian dan keamanan Sayangnya rancangan resolusi ini belum mencapai konsensus kata Retno Retno berpendapat bahwa semakin lama DK PBB tidak mencapai kesepakatan dalam rancangan resolusi tersebut keadaan itu akan mengirim sinyal negatif di lapangan dan bahkan bisa memperburuk situasi di banyak daerah konflik Semua anggota DK PBB harus berkonsentrasi pada peningkatan kerja sama demi melindungi orang orang di daerah konflik Indonesia siap untuk terus berkontribusi dalam negosiasi rancangan resolusi di DK PBB Retno menegaskan TNI bakal kirim pasukan ke negara rawan konflik Pewarta Yashinta Difa PramudyaniEditor Tia Mutiasari 
Ombudsman NTT: Gencarkan sosialisasi kriteria penerima bansos, Kupang Kepala Ombudsman Perwakilan Provinsi Nusa Tenggara Timur NTT Darius Beda Daton mengatakan bahwa pemerintah daerah perlu menggencarkan sosialisasi kriteria penerima bantuan sosial bansos dampak pandemi COVID untuk mengantisipasi kesalahpahaman di tengah masyarakat Kriteria siapa warga yang mendapatkan bansos ini harus terus menerus disosialisasikan Di daerah daerah desa desa hingga saat ini orang masih bertanya tanya kenapa saya tidak dapat kenapa yang ini dapat dan seterusnya katanya dalam keterangan yang diterima di Kupang Kamis Ia mengatakan pihaknya juga sudah mendapat banyak pengaduan masyarakat yang pada umumnya bukan terkait penanganan COVID melainkan berkaitan dengan masalah penyaluran bansos Untuk itu lanjut dia kriteria penerima bansos dampak COVID harus disosialisasikan secara memadai hingga tingkat pemerintahan yang paling bawah mengingat bantuan ini dari banyak sumber Darius mengatakan saat ini penyaluran Bantuan Sosial Tunai BST dari Kementerian Sosial sedang disalurkan kepada masyarakat NTT Selain itu Bantuan Langsung Tunai BLT Dana Desa juga sebagian sudah berjalan BST kabupaten sebagian juga sudah berjalan dan sebagian belum disalurkan Sementara itu lanjut dia dari hasil koordinasi dengan Dinas Sosial NTT diketahui bahwa bansos dari pemerintah provinsi hingga saat ini belum disalurkan Kondisi ini bisa menimbulkan pertanyaan di masyarakat karena ada yang sudah ada yang belum dan seterusnya Ini yang jadi soal katanya Darius mengatakan kondisi ini bisa menimbulkan bibit bibit konflik baru di lapangan Untuk itu pemerintah daerah melalui perangkatnya di tingkat terbawah harus bisa menjelaskan skema bansos dari banyak sumber tersebut Ada berbagai skema bantuan dari BST pusat provinsi kabupaten kota hingga Dana Desa dan semua tidak pada saat bersamaan sehingga ini perlu disosialisasikan secara jelas kepada masyarakat katanya Pewarta Aloysius LewokedaEditor Bambang Sutopo Hadi 
