title,content
Konflik internal dinilai bisa hilangkan kepercayaan klub kepada LIB, Jakarta Direktur Madura United Haruna Soemtiro yang juga anggota Komite Eksekutif PSSI menyebut konflik internal yang terjadi di PT Liga Indonesia Baru LIB bisa menghilangkan kepercayaan klub terhadap operator Liga dan itu Ya pasti klub bisa hilang kepercayaan Itu kan artinya pemimpin atau direktur utamanya tidak bisa mengelola bawahannya kata Haruna kepada di Jakarta Kamis Haruna menyesalkan mengapa masalah internal perusahaan harus diselesaikan dengan surat menyurat padahal persoalan di LIB bisa dilaporkan kepada komisaris perusahaan Jika ada masalah di perusahaan itu kenapa tidak dilaporkan ke komisaris tutur Haruna Pada Kamis beredar surat dari tiga anggota direksi PT Liga Indonesia Baru LIB yaitu Direktur Bisnis PT Liga Indonesia Baru Rudy Kangdra Direktur Operasional Sudjarno dan Direktur Keuangan Anthony Chandra Kartawiria tentang Pengaduan Mengenai Keresahan di Internal Perusahaan Dokumen bertanggal Mei itu ditujukan kepada semua pemegang saham PT LIB Di dalam surat yang ditembuskan ke Ketua Umum PSSI Wakil Ketua Umum PSSI Exco PSSI Plt Sekjen PSSI dan Dewan Komisaris PT LIB tersebut ketiga direktur LIB menjabarkan empat poin yang intinya menyatakan bahwa Direktur Utama PT LIB Cucu Somantri yang juga menjabat wakil ketua umum PSSI kerap mengambil keputusan secara sepihak Ketika dikonfirmasi Rudy Kangdra menyebut surat tersebut hanya pemberitahuan kepada pemilik saham dalam hal ini klub Liga dan juga PSSI bukan mosi tidak percaya seperti yang banyak disebutkan Meski demikian bagi Haruna tidak ada bedanya pemberitahuan atau mosi tidak percaya dalam konteks tersebut Sama saja Itu menepuk air kena muka sendiri Jadi role model baru masalah internal perusahaan harus pakai surat menyurat begitu ya Aturan atau ketentuan mana ada direksi bisa membuat mosi tidak percaya kepada dirut kata Haruna Haruna bahkan menyebut bahwa pembuat surat tersebut tidak memiliki integritas yang baik Orang orang itu harus masuk daftar persona non grata tidak boleh terlibat di perusahaan yang berafiliasi kepada PSSI tutur dia Sementara terkait permintaan para direktur LIB yakni Rudy Sudjarno dan Anthony kepada pemegang saham untuk mengadakan rapat umum pemegang saham RUPS luar biasa agar kepengurusan perseroan bisa dievaluasi Haruna menegaskan bahwa itu terbalik Lazimnya seperti menurut Ayat Pasal Undang Undang Nomor Tahun tentang Perseroan Terbatas RUPS dilaksanakan atas permintaan pemegang saham atau Dewan Komisaris kepada Direksi Apalagi membaca suratnya seolah olah memerintahkan kepada pemegang saham untuk segera melakukan RUPS benar benar dunia dibalik balik ya kata Haruna 
Direktur bantah buat mosi tidak percaya kepada Dirut LIB, Jakarta Direktur Bisnis PT Liga Indonesia Baru LIB Rudy Kangdra membantah bahwa dia dan dua sejawatnya yaitu Direktur Operasional Sudjarno serta Direktur Keuangan Anthony Chandra Kartawiria membuat mosi tidak percaya kepada Direktur Utama LIB Cucu Somantri Itu bukan mosi tidak percaya Kami hanya memberitahukan kepada pemegang saham tentang kondisi internal perusahaan kata Rudy kepada di Jakarta Kamis Rudy Sudjarno dan Anthony mengirimkan surat Pengaduan Mengenai Keresahan di Internal Perusahaan kepada semua pemegang saham PT LIB pada Mei Menurut Rudy mereka melakukan itu karena beranggapan bahwa para pemegang saham termasuk klub dan PSSI berhak mengetahui situasi terkini perusahaan Di dalam surat yang ditembuskan ke Ketua Umum PSSI Wakil Ketua Umum PSSI Exco PSSI Plt Sekjen PSSI dan Dewan Komisaris PT LIB tersebut ketiga direktur LIB menjabarkan empat poin yang intinya menyatakan Direktur Utama PT LIB Cucu Somantri kerap mengambil keputusan secara sepihak Indikasi ini sudah terjadi sejak bulan Maret dan semakin lama semakin dominan Kami sudah memberikan saran saran tetapi tidak dilibatkan Seharusnya setiap keputusan itu ada sirkulernya dan semua direktur membubuhkan paraf Ini tidak ada tiba tiba surat keluar Lama lama kami merasa kalau seperti ini kami harus memberitahukan kepada pemegang saham tutur Rudy Beberapa keputusan sepihak direktur utama LIB kata Rudy seperti soal pengangkatan Pradana Aditya Wicaksana sebagai General Manager PT LIB Soal ini menjadi polemik karena Pradana adalah anak kandung Cucu Somantri Kemudian yang terkini Cucu Somantri yang juga wakil ketua umum PSSI disebut Rudy memutuskan sendiri pemangkasan subsidi untuk klub klub Liga dan musim Kebijakan itu dituangkan dalam surat bernomor LIB COR V yang ditujukan ke PSSI Di sana LIB menyatakan akan melakukan pembayaran persen atas kontribusi komersial tahap kedua kepada klub klub Liga tahun sehingga setiap klub menerima Rp juta Lalu untuk tim Liga pembayaran persen atas kontribusi komersial tahap satu kepada klub Liga sehingga setiap klub menerima Rp juta Padahal sesuai kesepakatan LIB harus membayar Rp juta untuk setiap tahap cicilan kepada masing masing klub Liga dan Rp juta untuk klub Liga PSSI sendiri sudah memerintahkan LIB untuk tidak mengurangi jumlah pembayaran subsidi tersebut Rudy sendiri menegaskan bahwa semua pernyataan LIB soal subsidi tersebut belum diberitahukan Cucu Somantri kepada direktur direktur LIB lainnya Surat itu sudah ditandatangani tanpa pemberitahuan kepada kami kata Rudy Oleh sebab itu Rudy Kangdra Sudjarno dan Anthony Chandra Kartawirya meminta kepada para pemegang saham untuk mengadakan rapat umum pemegang saham RUPS luar biasa Mereka berharap RUPS luar biasa itu menjadi ajang evaluasi internal LIB dan mengambil langkah langkah penyelamatan perseroan Untuk waktu pelaksanaan RUPS luar biasanya kami menyerahkan sepenuhnya kepada pemegang saham Kalau merasa memang rapat itu penting mungkin segera digelar ujar Rudy Berikut empat keresahan terkait kepemimpinan Cucu Somantri dari Direktur Operasional LIB Sudjarno Direktur Bisnis LIB Rudy Kangdra dan Direktur Keuangan LIB Anthony Chandra Kartawiria yang dituangkan dalam surat bertanggal Mei Pertama Bahwa menurut pendapat dan apa yang kami rasakan pengurusan dan pengelolaan PT Liga Indonesia Baru Perseroan tidak dilakukan dengan cara cara yang semestinya yaitu sebagaimana diatur oleh perundang undangan di bidang Perseroan Terbatas Anggaran Dasar Perseroan dan prinsip prinsip Good Corporate Governance Kedua Bahwa pengambilan keputusan keputusan Perseroan banyak dimonopoli dan diputuskan secara sepihak oleh pejabat Direktur Utama di antaranya kebijakan terkait HRD keuangan sponsor dan lain lain tanpa melalui mekanisme rapat direksi sebagaimana mestinya Ketiga Bahwa praktek monopoli dan pengambilan keputusan secara sepihak tersebut telah menimbulkan keresahan di kalangan internal Perseroan dan dikhawatirkan dapat menimbulkan demoralisasi di kalangan karyawan dan berpotensi menimbulkan permasalahan permasalahan hukum yang dapat merugikan perseroan di kemudian hari Keempat Bahwa kami sebagai anggota Dewan Direksi Perseroan dengan ini menyangkal keterlibatan dan tanggung jawab kami atas keputusan keputusan yang dibuat secara sepihak oleh pejabat Direktur Utama karena keputusan keputusan tersebut dibuat tanpa persetujuan kami dan tanpa melalui proses rapat direksi sebagaimana mestinya Belum ada komentar dari Cucu Somantri mengenai hal ini 
Ombudsman apresiasi gubernur Sumbar buat layanan pengaduan bansos, Padang Ombudsman RI Perwakilan Sumatera Barat Sumbar menyampaikan apresiasi atas respons cepat Gubernur Sumbar Irwan Prayitno dalam menindaklanjuti hasil kajian Ombudsman untuk membuat layanan pengaduan khusus bantuan sosial bagi warga terdampak virus corona atau COVID Alhamdulillah gubernur merespons dengan cepat saran Ombudsman dengan menerbitkan surat nomor Humas tertanggal Mei perihal Penyediaan Layanan Informasi dan Pengaduan Penyaluran Bantuan Sosial Bansos COVID kata Kepala Ombudsman Perwakilan Sumbar Yefri Heriani di Padang Kamis Ia mengatakan Ombudsman sudah menerima surat tembusan dari gubernur Sumbar yang meminta bupati dan wali kota menyediakan layanan informasi dan pengaduan penyaluran bansos COVID Sebelumnya berdasarkan hasil kajian cepat yang dilakukan Ombudsman pada April telah melakukan penelusuran ke berbagai media komunikasi seperti website pemerintah daerah Organisasi Pemerintah Daerah OPD terkait dan berbagai jenis platform media sosial yang dimiliki oleh pemerintah daerah dalam penanganan COVID Hasilnya tidak ditemukan satupun pemerintah daerah termasuk Pemerintah Provinsi Sumatera Barat yang memiliki kanal infomasi pengaduan penyaluran bansos COVID ujarnya Ombudsman menilai ketiadaan saluran informasi dan pengaduan jelas perbuatan malaadministrasi pemerintah daerah telah mengabaikan kewajiban untuk menyediakan layanan informasi pengaduan dalam hal pelayanan publik Ketiadaan layanan pengaduan internal juga menyebabkan potensi malaadministrasi penyaluran bansos dalam bentuk lain menjadi terbuka terjadi di antaranya adalah penyimpangan prosedur tidak melayani pungli konflik kepentingan penyalahgunaan wewenang dan berpihak kata dia Ombudsman berharap dengan disediakannya layanan itu berbagai malaadministrasi dalam penyaluran bansos dapat dicegah secara dini Masyarakat tidak bingung dan bertanya tanya lagi karena ada saluran informasi atau pengaduan katanya Namun Yefri mengingatkan surat ini baru langkah awal diharapkan bupati dan wali kota juga merespons dengan cepat Tentu saja gubernur tidak hanya menerbitkan surat ke bupati dan wali kota namun juga memulai langkah perbaikan terlebih dahulu dengan menyediakan saluran itu di website Pemprov Sumbar OPD terkait dan media sosial pemrov yang ada Kami akan pantau terus seminggu ke depan akan cek lagi Kami berharap para kepala daerah merespons dan melakukan langkah perbaikan kata dia Pewarta Ikhwan WahyudiEditor Bambang Sutopo Hadi 
"Terkait SDA, Guru Besar IPB sarankan perumus omnibus law kaji daerah", Jakarta Guru Besar Fakultas Kehutanan Institut Pertanian Bogor Prof Hariadi Kartodihardjo menyarankan agar perumus RUU Cipta Kerja omnibus law mendalami permasalahan di Pemerintah Daerah yang selama ini tidak cukup konsisten menjalankan undang undang terkait dengan pengelolaan sumber daya alam Prof Hariadi dalam webminar seri Evalusi Pemberantasan Korupsi pada Sektor Sumber Daya Alam yang digelar Komisi Pemberantasan Korupsi KPK di Jakarta Rabu mengatakan jika dikaitkan dengan SDA maka RUU tersebut memang menyentuh banyak sektor dan jika dilihat persoalannya sekarang sebenarnya hampir seperti perumus sedang membuat asumsi Bahwa ketika banyak daerah melakukan hal tidak wajar terhadap SDA persoalan ditarik ke pusat dan semua akan beres Padahal kita tahu persoalan dasarnya adalah kemampuan satu otoritas menguasai kekayaan negara itu lemah sekali dan kalau tidak ada peran daerah maka bisa kacau sekali ujar dia Menurut dia yang dibutuhkan perumus untuk membuat omnibus law adalah pemikiran untuk melakukan kajian mendalam Sebab persoalan terkait SDA penuh dengan konflik kepentingan sayangnya Indonesia tidak memiliki undang undang untuk menyelesaikan konflik kepentingan Ahli hukum tata negara Bivitri Susanti mengatakan agar hukum dapat efektif yang dilihat adalah mengapa aktor yang melaksanakan undang undang tersebut melakukan hal sedemikian rupa dihadapan hukum RUU Cipta Kerja bisa menjadi ilustrasinya perlu dibongkar ramai ramai kenapa tidak lakukan analisis soal aktor tadi katanya Dalam pembuatan RUU Cipta Kerja menurut dia perumus tidak menelaah dulu sebenarnya aktor permasalahannya di mana Jika dianalisis memang lebih banyak yang dibahas masalah berinvestasi di Indonesia dibanding soal kesempatan kerja Ia mengatakan di Indonesia investasi erat kaitannya dengan persoalan korupsi SDA dan itu sangat dipengaruhi oleh kapasitas aktor pelaksana di sektor tersebut dan perizinannya Karena perlu dianalisis lebih lanjut meski hasilnya akan menyakitkan tapi justru yang dilakukan sekarang melakukan jalan pintas mengambil kewenangan daerah langsung ditarik ke pusat Mantan Komisioner KPK Laode M Syarif pada kesempatan yang sama menyarankan masyarakat yang memiliki informasi yang baik dan cukup terkait isu SDA tersebut ikut memperhatikan satu per satu pasal pasal yang sekarang sedang dibahas yakni omnibus law Kita sampaikan concern kita ke parlemen Karena hampir semua yang berhubungan dengan SDA di sana itu tidak baik perlu kita pikir kembali agar itu tidak terjadi katanya Pewarta Virna P SetyoriniEditor M Arief Iskandar 
"Pemerintahan Trump susun ""Pakta Artemis"" untuk tambang di bulan", Washington Pemerintah Amerika Serikat di bawah kepemimpinan Presiden Donald Trump menyusun landasan hukum untuk kegiatan penambangan di bulan melalui perjanjian internasional yang dinamakan Artemis Accord Pakta Artemis demikian kata sejumlah narasumber yang mengetahui isu tersebut Perjanjian usulan AS itu akan jadi upaya terbaru Badan Antariksa Amerika Serikat NASA menggalang dukungan guna mewujudkan rencana menempatkan manusia dan stasiun ruang angkasa di bulan pada beberapa dasawarsa mendatang Langkah itu turut menunjukkan pesan NASA mulai memainkan peran aktif menerapkan kebijakan luar negeri AS Walaupun demikian draf resmi buatan AS itu belum dibagikan ke negara negara mitra Pemerintahan Trump dan negara dengan aktivitas luar angkasa lainnya menempatkan bulan sebagai salah satu aset strategis Bulan dianggap memiliki nilai penelitian jangka panjang yang dapat mewujudkan misi masa depan di Planet Mars Walaupun demikian misi yang diatur hukum luar angkasa internasional itu dinilai mulai kehilangan popularitasnya The Artemis Accord perjanjian internasional yang meminjam nama misi ke bulan NASA mengusulkan penetapan zona aman yang mengelilingi bulan di masa depan Zona aman itu dibuat demi mencegah konflik antarnegara atau antarperusahaan yang beroperasi dalam jarak dekat di bulan Pakta itu turut dibuat sebagai landasan hukum bagi perusahaan perusahaan untuk menguasai sumber daya mineral yang mereka tambang di bulan kata sejumlah narasumber Sejumlah pejabat AS berencana merundingkan secara resmi perjanjian itu dengan pihak lain seperti Kanada Jepang negara negara Eropa serta Uni Emirat Arab pada beberapa minggu mendatang AS kemungkinan akan membuka pembicaraan dengan negara yang sepaham mengenai rencana penambangan di bulan Rusia mitra utama NASA di Stasiun Luar Angkasa Internasional ISS kemungkinan tidak akan dijadikan mitra dalam rencana tersebut kata beberapa sumber Pasalnya Pentagon telah menghadapi sejumlah manuver berbahaya Moskow terhadap satelit mata mata AS yang mengorbit Planet Bumi Amerika Serikat anggota Perjanjian Luar Angkasa beranggapan zona aman di bulan sebagai penerapan salah satu poin pakta yang banyak diperdebatkan Kesepakatan itu menyebutkan benda langit dan bulan tidak dapat dikuasai lewat klaim kedaulatan pendudukan penjajahan atau cara lainnya Perjanjian itu bukan upaya mengklaim teritori bulan red kata seorang sumber yang enggan disebut namanya Aturan mengenai zona keselamatan kemungkinan dibuat dengan mengizinkan adanya koordinasi antarpemangku kepentingan sehingga mereka secara teknis tidak perlu mengklaim kedaulatan negara di wilayah tertentu Zona keselamatan itu rencananya dibuat dengan luas bervariasi tergantung jenis dan besaran kegiatan Jika kalian akan mendekati wilayah operasional pihak lain dan mereka telah menetapkan zona keselamatan di sekitarnya maka kalian perlu menghubungi pihak tersebut terlebih dahulu berkonsultasi dan berkoordinasi mengenai cara aman mencapai wilayah tersebut sehingga aman bagi seluruh pihak ujar sumber tersebut Artemis kekuatan nasional AS Pakta Artemis merupakan salah satu rencana pemerintahan Trump untuk menggalang dukungan dari negara negara sepaham tanpa melibatkan Perserikatan Bangsa Bangsa Langkah itu dilakukan karena suatu perjanjian membutuhkan waktu yang panjang sampai akhirnya disepakati Tidak hanya itu perundingan dapat jadi tidak efektif jika melibatkan negara tanpa program luar angkasa demikian kata pejabat senior AS Saat banyak negara menjadikan luar angkasa sebagai tujuan pangkalan militer yang baru pakta yang diusulkan AS itu turut menunjukkan peran NASA sebagai alat diplomasi luar negeri AS Langkah itu diyakini dapat memicu perdebatan di antara para pesaing misalnya China Program program NASA terkait dengan pengembangan ilmu pengetahuan teknologi dan penemuan yang kesemuanya penting tetapi saya pikir gagasan bahwa NASA merupakan alat diplomasi kurang relevan dibahas kata pimpinan NASA Jim Bridenstine Selasa Tujuan penting kami negara negara di seluruh dunia menjadi bagian dari program ini Itu menunjukkan kekuatan nasional AS kata Bridenstine Ia menambahkan keterlibatan negara negara lain pada program Artemis bersifat sementara bergantung dengan perilaku yang ditunjukkan saat menjalani misi di luar angkasa NASA menanamkan modal puluhan miliar dolar AS ke program Artemis misi yang berupaya menempatkan manusia di bulan pada Misi itu juga bertujuan memastikan keberadaan manusia secara berkelanjutan di kutub selatan bulan Program itu juga berencana memfasilitasi perusahaan swasta menambang batu dan menghisap air bawah tanah di permukaan bulan yang dapat diubah jadi bahan bakar AS pada mengesahkan undang undang yang melindungi hak kepemilikan terhadap sumber daya yang ditambang para pengusaha di luar angkasa Namun aturan hukum semacam itu belum pernah dibuat dan diakui komunitas internasional Joanne Gabrynowicz pemimpin redaksi jurnal sains Journal of Space Law mengatakan perjanjian internasional harus dibuat terlebih dahulu sebelum menetapkan sejumlah wilayah eksklusif untuk pengembangan ilmu pengetahuan atau untuk alasan apapun Persoalannya bukan apa yang suatu negara dapat perbuat secara sepihak dan tetap menganggapnya legal kata Gabrynowicz Sumber Reuters 
Puluhan perangkat desa yang diberhentikan protes ke DPRD, Rejang Lebong Sebanyak orang perangkat desa dari tiga desa di Rejang Lebong Provinsi Bengkulu yang diberhentikan dari jabatannya oleh kepala desa terpilih mendatangi kantor dewan perwakilan rakyat setempat guna mengadukan nasib mereka Ketua DPRD Rejang Lebong Mahdi Husen usai menerima rombongan perangkat desa Rabu siang mengatakan perangkat desa yang diberhentikan oleh kepala desa terpilih pada Pilkades Februari lalu ini berasal dari Desa Pal Kecamatan Bermani Ulu Raya kemudian Desa Tanjung Agung Kecamatan Sindang Beliti Ulu dan Desa Duku Ulu Kacamatan Curup Timur Intinya perangkat desa ini mengeluhkan karena proses pengangkatan yang dilakukan kepala desa terpilih terkesan tidak objektif dan mungkin lebih mementingkan kelompok tertentu tapi dalam Perbup mengenai perangkat desa di situ memungkinkan kepala desa terpilih mengatur perangkat desanya masing masing ujar dia Kendati dalam Perbup Rejang Lebong No tentang tata cara pengangkatan dan pemberhentian perangkat desa ini kata dia seorang kepala desa terpilih memiliki kewenangan mengangkat dan memberhentikan perangkat desa harus dilakukan oleh kepala desa terpilih tidak dilakukan sewenang wenang sehingga bisa menimbulkan konflik Para kepala desa terpilih tolong jaga situasi dan kondisi pascaplikades di lapangan jangan sampai terjadi konflik coba ciptakan sinergi jangan ketika kepala desa sudah terpilih serta merta perangkat desa harus diganti seolah olah tidak melibatkan pihak yang ada di desa katanya Untuk itu dia meminta kepada Pemkab Rejang Lebong ke depannya agar mengevaluasi peraturan bupati tersebut sehingga bersifat sederhana dan tegas Jangan sampai perbup ini dijadikan bola liar jika ada yang terpilih dan tidak terpilih atau mendukung dan tidak mendukung Sementara itu kepala Dinas Pemberdayaan Masyarakat Desa PMD Suradi Rifai mengatakan jika perangkat desa ini merasa keberatan diberhentikan dari jabatannya oleh kepala desa terpilih namun pihaknya akan terus melakukan mediasi dengan kepala desa terpilih sesuai dengan Perbup No Masalah perangkat tadi sudah menjadi haknya kepala desa terpilih untuk menentukan pergantian perangkat desa Sejauh ini juga belum ada perangkat desa yang ditentukan karena masih penjaringan di tingkat desa kata dia Para perangkat desa yang diberhentikan ini berjumlah orang terdiri dari delapan orang dari Desa Tanjung Agung lima orang dari Desa Duku Ulu dan orang dari Desa Pal Menurut perangkat desa yang diberhentikan ini mereka menuntut DPRD Rejang Lebong menengahi permasalahan yang mereka hadapi dengan kepala desa terpilih masing masing desa karena dilakukan tidak sesuai dengan ketentuan yang berlaku Pewarta Nur MuhamadEditor M Arief Iskandar 
"Guru Besar IPB: Dampak korupsi sumber daya alam ""beyond"" ekonomi", Jakarta Guru Besar Fakultas Kehutanan Institut Pertanian Bogor Prof Hariadi Kartodihardjo mengingatkan kembali dampak korupsi sumber daya alam yang sangat besar melebihi atau beyond kerugian ekonomi Prof Hariadi dalam webminar seri Evalusi Pemberantasan Korupsi pada Sektor Sumber Daya Alam yang digelar Komisi Pemberantasan Korupsi KPK di Jakarta Rabu mengatakan korupsi sumber daya alam SDA biasanya bersinggungan dengan sektor kehutanan perkebunan pertambangan pertanahan pertanian perikanan dan nilai kerugian negara mencapai triliunan rupiah dari waktu ke waktu Perusakan fungsi ruang bukan hanya kekayaan secara finansial tapi akumulasi bencana alam meningkat dari tahun ke tahun termasuk jumlah korban dan sebarannya Jadi korupsi SDA itu beyond ekonomi katanya Jumlah bencana alam meningkat setiap tahunnya melewati angka kejadian di Sementara angka korban dari yang terluka hingga meninggal dunia menembus angka juta jiwa di ujar dia Bencana kekeringan di dan bergerak menuju angka kali kejadian sementara di tahun tahun sebelumnya grafiknya sangat rendah Sedangkan jumlah kejadian kebakaran hutan dan lahan di bergerak ke angka kejadian sementara di tidak melewati kejadian Dari cataran tim evaluasi Gerakan Nasional Penyelamatan Sumber Daya Alam GNP SDA KPK sektor SDA yang merupakan salah satu pendukung ekonomi nasional berkontribusi sekitar persen atau Rp triliun dari total Produk Domestik Bruto PDB Indonesia yang mencapai Rp triliun Penyerapan tenaga kerja di sektor SDA mencapai juta orang sedangkan kontribusi pajak dan Pendapatan Negara Bukan Pajak PNBP hanya Rp triliun atau persen Sedangkan untuk penguasaan lahan dari sektor SDA perkebunan sawit tim evaluasi GNP SDA KPK mencatat juta hektare ha dimiliki perusahaan sementara ha dikelola juta pekebun Dan untuk penguasaan lahan hutan tercatat ha dipegang pemilik Hak Pengusahaan Hutan HPH sedangkan ha dikelola masyarakat Dan ekses ketimpangan dalam penguasaan lahan tersebut antara lain eksternalitas lingkungan ketimpangan ekonomi dan askes serta pelanggaran hak korupsi Masih mengambil data tim evaluasi GNP SDA KPK ia mengatakan korupsi terjadi secara masif tidak jarang menyandera kepentingan negara Suap menyuap pemerasan terjadi hampir di setiap lini administrasi dari perencanaan hingga pendenalian misalnya di sektor kehutanan suap per izin per tahun mencapai Rp juta sampai dengan Rp miliar per tahun Aset sumber daya alam tidak pernah dianggap kekayaan negara nilainya dengan sengaja dimanipulasi dikaburkan atau tidak divaluasi Pada Perhutani diperkirakan kehilangan aset tegakan hutannya senilai Rp miliar pet tahun Lalu tim evaluasi juga menyebutkan potensi PNBP sektor kelautan Rp triliun per tahun namun hanya diperoleh Rp miliar per tahun Sedangkan untuk potensi pendapatan sawit di diketahui mencapai Rp triliun namun pajak terpungut hanya mencapai Rp triliun Sementara itu tim evaluasi GNP SDA KPK untuk mencatat dari sektor minerba potensi kerugian bersumber dari kurang bayar pajak sebesar Rp triliun dan dari administrasi serta perizinan yang buruk mencapai Rp triliun Konflik kepentingan menghambat upaya penataan kewajiban pemanfaatan SDA berbagai bentuk kerugian negara terjadi secara masif dan tidak melaksanakan pengendalian dan pengawasan ujar Prof Hariadi Sebagai catatan di sektor perkebunan kelapa sawit tingkat kepatuhan WP Orang Pribadi hanya persen dan WP Badan sebesar persen 
Liga Arab kecam pengambilan lahan dekat Masjid Ibrahim oleh Israel, Kairo Liga Arab AL pada Selasa mengecam persetujuan pemerintah Israel untuk membuat rute baru di sekitar Masjid Ibrahim di Kota Hebron Tepi Barat selatan Saeed Abu Ali asisten sekretaris jenderal AL untuk urusan Palestina dan wilayah Arab yang diduduki melalui pernyataan mengatakan bahwa rencana pemerintah Israel bertujuan membangun sebuah jalan dan elevator listrik untuk memfasilitasi penyerbuan dan Yahudisasi Masjid Ibrahim di kota tersebut Keputusan ini menjadi bagian dari eskalasi Israel terhadap sejumlah monumen agama dan sejarah Palestina di Yerusalem dan Hebron kata pejabat AL Ia mendesak komunitas internasional dan PBB menekan Israel agar segera menghentikan aktivitas atau rencana apa pun yang semakin memperparah kondisi rumit di wilayah Palestina yang diduduki Pada Minggu Menteri Pertahanan Israel Naftali Bennett memberikan persetujuan akhir untuk membangun jalan baru ke masjid tersebut yang dikendalikan oleh Otoritas Palestina PA di bawah kesepakatan antarkedua belah pihak Masjid Ibrahim dan Kota Tua Hebron masuk dalam daftar UNESCO sebagai situs warisan dunia Palestina pada Dianggap oleh kaum Muslim sebagai situs paling suci keempat sekitar tahun yang lalu Masjid Ibrahim mengabadikan makam Nabi Ibrahim putranya Ishak serta cucunya Yakub dan istri mereka Tempat ini juga dianggap sebagai tempat suci oleh orang orang Yahudi dan Israel telah lama memberlakukan pembatasan akses warga Palestina ke masjid tersebut Sumber Xinhua 
