title,content
Kaum marginal di tengah pandemi COVID-19, Jakarta Di tengah pandemi virus corona jenis baru penyebab COVID yang menyerang sejumlah negara tak terkecuali Indonesia gerak orang mulai dibatasi untuk mencegah penyebaran virus Masalah itu bagi kalangan berada mungkin masih dapat diatasi sebab mereka memiliki cadangan makanan simpanan uang serta fasilitas yang memadai di rumah masing masing Namun pertanyaannya ialah bagaimana nasib orang orang yang hidup dengan serba keterbatasan di saat keadaan semakin genting Jangankan dalam situasi sebagaimana dirasakan hari ini pada situasi normal saja mereka mesti bercucuran keringat dan membanting tulang mencari nafkah agar dapur mereka tetap berasap Sebut saja kaum marginal atau masyarakat ekonomi lemah yang mengandalkan sambungan hidup dari penghasilan per hari Jumlah pendapatan mereka tak dapat diukur dengan nominal tertentu atau sebut saja tidak menentu Ada yang bekerja sebagai pemulung buruh kasar pengemudi ojek pedagang kaki lima dan sebagainya Mereka sehari hari bertarung melawan kerasnya ibu kota Di saat wabah pandemi COVID sedang berkecamuk mereka terpaksa beraktivitas di luar rumah seperti biasa Bukannya mereka tidak takut terinfeksi virus yang pertama kali ditemukan di Kota Wuhan Provinsi Hubei China tersebut hanya saja mereka tak punya pilihan selain bertaruh nyawa demi sesuap nasi Pemerintah Indonesia di bawah komando Presiden Joko Widodo telah mengumumkan untuk melakukan pembatasan sosial berskala besar demi memutus mata rantai penyebaran COVID Pernyataan Presiden merujuk pada Undang Undang UU nomor tahun tentang Kekarantinaan Kesehatan Berpatokan pada UU tersebut tepatnya pada pasal ayat mengatakan bahwa pembatasan sosial berskala besar merupakan bagian dari respon kedaruratan kesehatan masyarakat Pembatasan sosial berskala besar juga bertujuan mencegah meluasnya penyebaran penyakit kedaruratan kesehatan masyarakat yang sedang terjadi antar orang di suatu wilayah tertentu Cakupan dalam UU itu meliputi peliburan sekolah dan tempat kerja pembatasan kegiatan keagamaan dan pembatasan kegiatan di tempat umum Selain itu dalam implementasinya yang lebih ketat melibatkan aparat penegak hukum jika diperlukan Sosiolog sekaligus dosen dari Universitas Indonesia UI Imam B Prasodjo mengatakan pemerintah perlu memerhatikan beberapa hal sebelum memberlakukan karantina wilayah atau pembatasan sosial berskala besar Pertama ialah ketersediaan anggaran dan kedua pasokan logistik Dua hal itu jelas harus dipersiapkan bagi kaum marginal yang betul betul membutuhkan bantuan saat mobilitas atau interaksi sosial dibatasi Menurut sosiolog kelahiran Purwokerto tahun silam itu jika kedua hal tersebut telah disiapkan secara matang oleh pemerintah maka kebijakan terkait pembatasan wilayah skala besar atau karantina wilayah tidak akan menjadi masalah besar jika diterapkan Sebab keberadaan kaum marginal atau masyarakat ekonomi lemah telah terselamatkan di tengah pandemi COVID Itu fokusnya masalah di lockdown atau karantina wilayah dan sebagainya selagi itu semua diberesin tidak akan menimbulkan letupan seperti yang terjadi di India kata dia Sosiolog sekaligus dosen di Universitas Indonesia Imam B Prasodjo Humas BNPB Ia mengkhawatirkan apabila pemerintah tidak memerhatikan ketersediaan anggaran dan pasokan logistik maka gejolak sosial sebagaimana terjadi di sejumlah negara misalnya India dapat pula terjadi di Indonesia Oleh sebab itu pernyataan pembatasan sosial skala besar saja tidak cukup apabila kaum marginal tidak diselamatkan lebih dahulu Sebagai gambaran mereka dipaksa untuk berdiam diri di rumah dan tidak boleh mencari nafkah apalagi berkeluyuran bebas namun pada saat bersamaan logistik dan kebutuhan pokok mereka tidak diberikan Hal ini tentunya dapat berdampak munculnya masalah baru di antaranya kriminalitas penjarahan pusat perbelanjaan dan lainnya Solusinya ialah kalau mau diketatkan orang tidak boleh bergerak ya diberi makan Kalau itu tidak dilakukan secara cepat ya jangan Anda bicara masalah lockdown katanya Antisipasi karantina wilayah Terkait rencana penerapan pembatasan sosial skala besar atau karantina wilayah analis kebijakan publik dari Universitas Trisakti Trubus Rahadiansyah juga mengingatkan hal yang sama apabila langkah itu diterapkan Ini harus diantisipasi mengenai efek domino dari karantina wilayah kata dia Efek domino yang bisa terjadi di antaranya muncul penjarahan pusat perbelanjaan Belum lagi tingkat kriminalitas di berbagai aspek juga diperkirakan dapat melonjak Hal tersebut dapat terjadi apabila masyarakat kelaparan disebabkan pasokan logistik yang tidak terpenuhi Sebagai contoh ujar dia situasi sebagaimana dimaksud terjadi di beberapa negara baik itu Italia Spanyol Meksiko maupun India Oleh karena itu Indonesia diminta mewaspadai kondisi tersebut sebelum terjadi Itu salah satu dampak buruknya Itu namanya efek domino kata pengajar di Universitas Trisakti tersebut Sebenarnya gambaran kecil dari efek domino itu sempat muncul di Indonesia Yakni terjadi usai Presiden Joko Widodo pertama kali mengumumkan kasus Warga Negara Indonesia WNI positif virus corona Dapat dilihat bersama kata dia bahwa setelah pengumuman itu ada kelompok masyarakat yang berbondong bondong memborong logistik serta obat obatan karena panik Di sisi lain ia juga menyarankan agar pemerintah mengkaji atau menyiapkan program jangka menengah apabila karantina wilayah diberlakukan Termasuk pula di dalamnya terkait ketersediaan alat alat kesehatan obat obatan rumah sakit tenaga medis dan sebagainya Langkah pemerintah Melihat situasi dan kondisi di Tanah Air yang belum kunjung reda akibat bencana nonalam ini Presiden Joko Widodo telah mengumumkan beberapa kebijakan untuk mengantisipasi dampak COVID Di Istana Kepresidenan Bogor Presiden Jokowi memaparkan enam program jaring pengaman sosial Pertama jumlah Program Keluarga Harapan PKH yang awalnya hanya juta dinaikkan pemerintah menjadi juta penerima manfaat Besaran manfaat juga dinaikkan persen misalnya ibu hamil naik dari Rp juta menjadi Rp juta per tahun komponen anak usia dini Rp juta per tahun disabilitas Rp juta per tahun dan kebijakan ini efektif April Program kedua yaitu terkait kartu sembako dimana jumlah penerimanya juga akan dinaikkan menjadi juta penerima manfaat termasuk nilainya naik menjadi persen dari Rp ribu menjadi Rp ribu dan diberikan selama sembilan bulan Ketiga kartu prakerja yang anggarannya dinaikkan dari Rp triliun menjadi Rp triliun Jumlah penerima manfaat menjadi juta orang terutama ini untuk pekerja informal dan pelaku usaha mikro dan kecil yang terdampak COVID dan nilai manfaatnya adalah Rp ribu sampai Rp juta per bulan selama empat bulan ke depan katanya Tidak hanya sampai di situ Gubernur DKI Jakarta sejak Oktober hingga Oktober itu mengatakan pemerintah juga akan menggratiskan pelanggan PLN Va yang berjumlah juta untuk tiga bulan ke depan yaitu April Mei dan Juni Sementara untuk pelanggan Va yang jumlahnya sekitar juta pelanggan akan didiskon persen atau membayar separuh saja untuk periode yang sama Kelima untuk mengantisipasi kebutuhan pokok pemerintah mencadangkan Rp triliun untuk operasi pasar dan logistik Keenam keringanan pembayaran kredit bagi para pekerja informal baik ojek online sopir taksi UMKM nelayan dengan penghasilan harian dan kredit di bawah Rp miliar OJK telah menerbitkan aturan mengenai hal tersebut dan mulai berlaku April ini Telah ditetapkan tidak perlu datang ke bank atau perusahaan leasing cukup melalui email atau media komunikasi digital seperti WA saya rasa itu katanya 
Analis ingatkan pemerintah perlu antisipasi dampak karantina wilayah, Ini harus diantisipasi mengenai efek domino karantina wilayahJakarta Analis kebijakan publik dari Universitas Trisakti Jakarta Trubus Rahadiansyah mengingatkan pemerintah agar mengantisipasi dampak terburuk apabila karantina wilayah jadi diterapkan Ini harus diantisipasi mengenai efek domino karantina wilayah kata Trubus dihubungi di Jakarta Senin Efek domino yang bisa terjadi misalnya penjarahan pusat perbelanjaan kriminalitas meningkat dan lainnya Hal tersebut dapat terjadi apabila masyarakat kelaparan dan pasokan logistik tidak terpenuhi Sebagai contoh ujar dia situasi yang terjadi di beberapa negara misalnya Italia Spanyol Meksiko dan India Oleh sebab itu Indonesia diminta mewaspadai hal tersebut sebelum terjadi Itu salah satu dampak buruknya Itu namanya efek domino kata pengajar di Universitas Trisakti tersebut Ketika Presiden Joko Widodo pertama kali mengumumkan kasus Warga Negara Indonesia WNI positif virus corona setelah itu orang berbondong bondong memborong logistik dan obat obatan karena panik Oleh sebab itu pemerintah harus bisa mengantisipasi dan belajar dari gejolak sosial yang terjadi termasuk di berbagai negara akibat penerapan karantina sehingga tindakan melawan hukum yaitu penjarahan dan kriminalitas tidak terjadi Jadi pemerintah daerah harus betul betul menghitung ini untuk jangka pendek Dalam kebijakan publik itu ada skenario planning katanya Setelah itu Trubus menyarankan pemerintah mengkaji atau menyiapkan jangka menengah apabila karantina wilayah diberlakukan Hal itu misalnya ketersediaan alat alat kesehatan obat obatan rumah sakit tenaga medis dan sebagainya Sebagai gambaran ujar dia kondisi di DKI Jakarta di mana pasien COVID terus meningkat secara drastis Bahkan pemerintah telah menyiapkan Wisma Atlet Kemayora hingga hotel bagi tenaga kesehatan Kepala daerah harus siap Mampu menampung adanya lonjakan itu kata dia Pewarta Muhammad ZulfikarEditor Agus Salim 
IPW: Polri perlu antisipasi situasi kamtibmas di tengah wabah COVID-19, Jakarta Indonesia Police Watch IPW menilai Polri perlu mengantisipasi situasi keamanan dan ketertiban masyarakat kamtibmas di tengah wabah virus COVID yang dikhawatirkan berkepanjangan Makin panjangnya masa krisis Covid tentu akan berdampak pada situasi sosial ekonomi masyarakat terutama buruh harian dan kelompok masyarakat yang bekerja serabutan tanpa penghasilan tetap yang banyak bercokol di kota kota besar ujar Ketua Presidium Indonesia Police Watch Neta S Pane dalam keterangan tertulis di Jakarta Senin Menurut dia berdasarkan pantauan IPW dengan adanya instruksi untuk berdiam di rumah yang paling menderita adalah para pekerja harian dan kelompok masyarakat yang bekerja serabutan Neta mencontohkan kalangan ojek sepeda motor yang sejak adanya instruksi diam di rumah mereka menjadi kehilangan penumpang serta pesanan makanan dari konsumen jauh berkurang Padahal kata dia ojek merupakan pekerjaan alternatif setelah banyaknya industri melakukan PHK Memang situasi saat ini masih terkendali Tapi jika wabah Covid terus berkepanjangan hingga puasa Ramadhan dan Lebaran dikhawatirkan akan muncul masalah baru yang sangat serius ucap dia Neta mengatakan kebutuhan sosial ekonomi masyarakat akan meningkat dan tuntutan THR akan muncul sementara industri sudah menerapkan kebijakan diam di rumah yang berdampak pada menurunnya produktivitas dan pemasukan perusahaan Menurut dia hal ini akan menjadi masalah tersendiri Bagaimanapun ini akan menjadi sebuah situasi yg sangat perlu diperhatikan pemerintah terutama jajaran Polri agar tidak berdampak pada ancaman Kamtibmas kata dia Lebih lanjut Neta mengingatkan Presiden Joko Widodo untuk tidak terkecoh dengan berbagai desakan lawan lawan politiknya seperti desakan segera melakukan karantina wilayah atau lockdown Menurut dia untuk melakukan skema karantina wilayah perlu perhitungan yang matang seperti memastikan stok pangan jalur distribusi serta kondisi masyarakat kelas bawah Jika tidak hati hati Neta khawatir kebijakan karantina wilayah justru dapat menimbulkan masalah baru Bahkan lebih parah dari situasi lockdown di India Sebab Indonesia pernah punya pengalaman penjarahan massal di era Dalam situasi lockdown jika tidak hati hati dikhawatirkan bisa menimbulkan kesulitan bahan makanan dan kelaparan di lapisan bawah terutama masyarakat pekerja harian dan pekerja serabutan ujar Neta Bisa bisa yang muncul adalah aksi penjarahan yang tidak hanya ke area pertokoan tapi juga ke rumah orang orang yang dianggap kaya Situasi ini yang perlu dicermati pemerintah terutama Polri sebagai penjaga Kamtibmas agar situasi penjarahan tidak terulang sambung dia Pewarta Fathur RochmanEditor Ruslan Burhani 
"Cegah COVID-19, Sahroni dukung kebijakan ""lockdown"" Jabodetabek", Jakarta Wakil Ketua Komisi III DPR RI Ahmad Sahroni menilai sudah saatnya pemerintah mengambil langkah preventif dan segera melaksanakan lockdown terutama di wilayah Jakarta Bogor Depok Tanggerang dan Bekasi Jabodetabek untuk menanggulangi pandemi COVID Berkali kali saya sudah sarankan dan refrensikan untuk menanggulangi wabah COVID dengan mengambil langkah lockdown terutama untuk wilayah Jabodetabek dengan kasus positif COVID terbanyak dan memiliki tingkat mobilitas orang dan interaksi sosial yang tinggi kata Sahroni dalam keterangan tertulisnya di Jakarta Ahad Menurut politikus Partai NasDem itu mengambil langkah lockdown memang bukan hal yang mudah karena akan memberikan pukulan berat terhadap perekonomian di Indonesia Namun Sahroni mengatakan bahwa saat ini yang terpenting adalah merelakan laju perekonomian sejenak demi memutus mata rantai COVID sebelum terlambat Sekarang yang utama adalah bagaimana kita menyelamatkan nyawa bangsa dengan memutus mata rantai virus yaitu dengan segera melakukan lockdown Jika tidak akan terjadinya krisis kemanusiaan dan keuangan secara bersamaan ujarnya Selain itu lanjut Sahroni lockdown harus dilakukan persiapan yang baik dan matang Ia menyebutkan beberapa poin penting yang harus diperhatikan oleh Pemerintah pada saat pelaksanaan kebijakan lockdown agar tidak terjadinya kerusuhaan dan terlaksana dengan baik Pertama supermarket dan apotek harus tetap dibuka seperti yang dilakukan negara lain Namun harus adanya pembatasan waktu buka seperti hari sekali Tetap melakukan pembatasan jumlah pembeli dan diutamakan untuk lansia maupun wanita yang sedang hamil katanya Langkah kedua menurut dia bagi masyarakat yang tidak mampu mengisi kebutuhan mereka pada saat lockdown pemerintah harus siap dalam melakukan pasokan supply makanan maupun kebutuhan pokok Sahroni menilai langkah tersebut dengan mendistribusikan makanan dan kebutuhan pokok secara langsung ke rumah warga yang benar benar membutuhkan Ketiga perbanyak hotline COVID Hal tersebut dapat dilakukan dengan wilayah hotline sehingga tidak ada lagi yang kesulitan untuk menghubungi tenaga medis untuk meminta pertolongan maupun ambulans ujarnya Keempat lanjut dia menurunkan anggota Polri dan TNI untuk melakukan patroli mencegah kerusuhan ataupun penjarahan yang kemungkinan dapat terjadi Dalam hal ini dia menyarankan patroli tersebut dengan skala per kecamatan agar lebih terawasi Sahroni menjelaskan langkah kelima adalah tindakan tegas yaitu masyarakat tidak boleh ada di luar rumah kecuali mereka punya dokumen yang bisa dijadikan bukti urgensi seperti membutuhkan obat obatan atau ke rumah sakit Jika mereka keluar rumah tanpa special case aparat harus segera menindak lanjut hal tersebut ujarnya Adapun langkah keenam dalam masa lockdown tetap dilaksanakan rapid test COVID dengan menurunkan sejumlah tenaga medis yang akan mendatangi rumah rumah warga setiap hari Pewarta Imam BudilaksonoEditor D Dj Kliwantoro 
"Menjadi UIN, simbol kebangkitan IAIN Palu setelah tsunami", Palu Selalu ada harapan usai kesulitan Ungkapan itu cukup meneguhkan hati dan tekad Civitas Academica Institut Agama Islam Negeri IAIN Palu Sulawesi Tengah Gempa dan tsunami telah berlalu tahun bulan IAIN Palu kini sedang dihadapkan dengan kunjungan utusan Kementerian Agama dan Kemenpan RB untuk peralihan status menjadi Universitas Islam Negeri UIN Datokarama Palu Menjadi UIN merupakan cita cita besar komponen Civitas Academica perguruan tinggi Islam negeri terbesar di Sulawesi Tengah itu Oleh karenanya segala upaya dengan kerja cerdas sistematis dan masif dilakukan dengan dua tujuan untuk percepatan pemulihan setelah bencana dan pencapaian target peralihan status Ini bukan pekerjaan mudah sebab IAIN Palu menjadi salah satu komponen terparah terdampak tsunami saat bencana itu melanda Kota Palu September silam Letak perguruan tinggi keagamaan Islam negeri tersebut yang sangat dekat dengan Teluk Palu menambah kerentanan pada bencana Data bagian perencanaan IAIN Palu menyebutkan bangunan gedung terdampak langsung gempa dan tsunami Gedung dan sarana yang porak poranda dihantam tsunami diantaranya Rektorat sebagai pusat pelayanan administrasi dan central utama penggerak IAIN Palu gedung perkuliahan gedung sekretariat bersama unit kegiatan mahasiswa study centre ICT gedung pelayanan administrasi akademik auditorium gedung perkuliahaan sarana olahraga laboratorium komputer UPT Bahasa perpustakaan dan gudang Tidak hanya diterjang tsunami Perguruan Tinggi Islam Negeri yang dipimpin Prof Dr H Sagaf S Pettalongi MPd itu juga dijarah Aksi penjarahan dilakukan oleh oknum yang tidak bertanggung jawab Tidak hanya mengambil aset dan uang milik negara mereka juga menghambur hamburkan ijazah alumni IAIN Palu Semua peristiwa itu memukul batin komponen Civitas Academica IAIN Palu Namun peristiwa itu tidak menyurutkan semangat untuk berdiri menjadi perguruan tinggi Islam negeri yang mandiri di masa kini dan akan datang Kementerian Agama dan beberapa kementerian terkait berupaya untuk melakukan kegiatan rehabilitasi dan rekonstruksi untuk pemulihan kembali IAIN Palu ucap Direktur Jenderal Pendidikan Islam Kemenag Kamaruddin Amin Aset Kemenag Dia menyatakan IAIN Palu menjadi salah satu aset Kementerian Agama yang strategis di Sulawesi Tengah untuk membangun sumber daya manusia yang unggul masa kini dan akan datang Eksistensi IAIN Palu ini sangat signifikan sehingga semua memiliki komitmen yang sama untuk memulihkan dan mengembangkan IAIN Palu kata dia Langkah pemulihan IAIN Palu diintervensi langsung oleh pemerintah sebagai representatif negara yang juga melibatkan pihak lainnya seperti Asia Development Bank ADB Asia Developmen Bank ADB atau Bank Pembangunan Asia Perwakilan Indonesia menyatakan pembangunan kembali Kampus Institut Agama Islam Negeri IAIN Palu Sulawesi Tengah untuk pemulihan dimulai sekitar Juli Sudah dimulai dan hingga Desember penyiapan Detail Engineering Desain DED Kemudian Januari lelang sampai bulan Juni setelah itu tandatangan kontrak dengan pemenang tender lalu sekitar Juli mulai konstruksi fisik ucap Senior Staf ADB Perwakilan Indonesia Sutarum Wiriono ADB mengucurkan anggaran senilai Rp miliar untuk pembangunan infrastruktur dan sarana prasarana IAIN Palu yang rusak termasuk ruang terbuka hijau RTH Anggaran Rp miliar itu disetujui kata Sutarum Kini kondisi IAIN Palu mulai berubah Bekas bekas tsunami hampir tidak terlihat Jalan lingkungan dan sarana prasarana lainnya telah ditata kembali Perkuliahan berlangsung di gedung permanen bahkan IAIN Palu telah membangun satu gedung pelayanan administrasi akademik rektorat yang megah Visitasi alih status Dibalik kesulitan ada kemudahan begitu kata Allah dalam firmanNya pada Surah Al Insyirah ayat dan Firman ini menjadi pegangan dan keyakinan Civitas Academica IAIN Palu bahwa bencana September yang memprorak porandakan kampus kebanggaan itu akan membawa rahmat sesudahnya Visitasi alih status IAIN Palu menjadi UIN Datokarama Palu oleh Kementerian Agama dan Kementerian Pendayagunaan Aparatur Negera Reformasi Birokrasi Kemenpan RB menjadi penguat keyakinan bahwa dibalik kesulitan ada kemudahan Dua kementerian itu datang dan meninjau langsung kelayakan IAIN Palu menjadi UIN setelah tahun bulan kampus itu diterjang tsunami pada September Penilaian yang dilakukan merupakan tindak lanjut dari penilaian dokumen alih status IAIN Palu menjadi UIN yang telah berlangsung pada bulan September kata Ketua Tim Penilaian Alih Status Kementerian Agama Muhammad Adib Abdushomad IAIN Palu menjalani penilaian lanjutan karena dalam penilaian dokumen alih status pada September mendapat nilai Adib sapaan akrab Muhammad Adib Abdushomad mengatakan bahwa IAIN Palu merupakan satu dari perguruan tinggi keagamaan Islam negeri PTKIN yang menjalani penilaian dokumen alih status pada September Dari perguruan tinggi itu hanya sembilan yang dokumen alih statusnya dipandang layak untuk ditindaklanjuti oleh Kementerian Agama termasuk IAIN Palu IAIN Palu nilainya di atas karena itu berdasarkan Peraturan Menteri Agama PMA Nomor Tahun maka dilakukan visitasi Nah visitasi atau penilaian lapangan hari ini untuk mengecek langsung bagaimana dan seperti apa kondisi lapangan kata Adib Selain tim alih status dari Kemenag tim dari Kemenpan RB juga menilai kelayakan IAIN Palu bertransformasi menjadi UIN Datokarama Palu Anggota tim visitasi dari Kemenpan RB Lukman Rahmadi menyatakan visitasi yang dilakukan untuk mendapat data data yang akurat valid dan kredibel untuk selanjutnya ditindaklanjuti oleh pihaknya sesuai dengan ketentuan perundangan mengenai alih status Visitasi ini berawal dari surat Kemenag RI yang mengusulkan agar dilakukan visitasi terhadap sembilan PTKIN ujar Lukman Dari sembilan PTKIN ada beberapa yang berdasarkan hasil visitasi ditemukan data yang tidak valid tidak akurat Olehnya ia berharap komponen Civitas Academica IAIN Palu dapat mendukung dengan memberikan data data yang valid untuk selanjutnya ditindaklanjuti oleh Kemenpan RB Kemenpan RB mengingatkan bahwa PTKIN IAIN harus lebih menonjolkan program program studi keagamaan meskipun ketika menjadi UIN dimungkinkan untuk membuka prodi umum Setelah ditinjau kelayakannya IAIN Palu menunggu hasil penilaian dari Kemenpan RB yang selanjutnya dokumen alih status akan diteruskan oleh Kemenpan RB ke Kementerian Sekretariat Negara Rektor IAIN Palu Prof Dr H Sagaf S Pettalongi MPd mengatakan IAIN Palu memiliki peran penting dalam pembangunan sumber daya manusia di Sulteng Jumlah penduduk Sulteng kurang lebih juta jiwa dengan alih status ini maka sangat membantu masyarakat memudahkan masyarakat untuk mengenyam pendidikan di perguruan tinggi Islam negeri ucap Prof Sagaf Ia mengutarakan animo masyarakat untuk mengenyam pendidikan perguruan tinggi keagamaan negeri ini meningkat setiap tahunnya Karena itu sudah waktunya IAIN Palu menjadi universitas Islam negeri Lewat transformasi itu selain berperan dalam pembangunan manusia Juga untuk memaksimalkan moderasi beragama yang salah satu tujuannya untuk menangkal faham radikal katanya Dukungan menjadi UIN Upaya komponen Civitas Academica IAIN Palu bertransformasi jadi UIN Datokarama Palu didukung oleh berbagai pihak Pemerintah Provinsi Sulawesi Tengah menilai IAIN Palu pantas beralih status menjadi UIN Datokarama kata Rustam pejabat yang mewakili Gubernur Sulteng Longki Djanggola pada visitasi alih status IAIN Palu oleh Kemenpan RB Rustam mengemukakan rencana alih status IAIN Palu menjadi UIN Datokarama telah lama didengar oleh Pemprov Sulteng bahkan Pemprov Sulteng memberikan dukungan penuh terhadap rencana itu Dukungan juga datang dari Pemkab Sigi melalui Bupati Mohammad Irwan Lapatta Menurut dia dengan menjadi UIN maka peran mencerdaskan kehidupan bangsa di Kabupaten Sigi akan lebih maksimal Elite politik di DPR RI dari daerah pemilihan Sulawesi Tengah Sakinah Aljufri dan Matindas J Rumambi mendukung alih status dan berjanji mengawal hingga Presiden RI Jokowi menerbitkan Peraturan Presiden tentang alih status IAIN Palu menjadi UIN Sakinah Aljufri merupakan politisi dari Fraksi PKS yang duduk di Komisi X dan Matindas J Rumambi politisi PDI P duduk sebagai anggota Komisi VIII Tidak hanya dua elite politik itu Wakil Ketua DPRD Kota Palu Rizal juga mendukung penuh Kini semua pihak di Sulawesi Tengah menanti kebijakan Pemerintah Pusat di Jakarta untuk percepatan pembangunan sumber daya manusia yang unggul mandiri dan berdaya saing Ketua Tim Penilaian Alih Status Kementerian Agama RI Muhammad Adib Abdushomad memeriksa ketersediaan berkas dan dokumen lainnya terkait alih status IAIN Palu menjadi UIN Datokarama Palu dalam asesmen lapangan Muhammad Hajiji Rustam yang merupakan pejabat yang mewakili Gubernur Sulteng Longki Djanggola menyampaikan sepatah kata pada visitasi alih status IAIN Palu menjadi UIN Datokarama oleh Kemenpan RB di IAIN Palu Jumat Muhammad Hajiji Anggota Komisi X DPR RI Sakinah Aljufri dari Fraksi PKS menyerahkan surat dukungan Fraksi PKS mengenai alih status IAIN Palu menjadi UIN Datokarama Palu kepada Rektor Prof Dr H Sagaf S Pettalongi MPd Muhammad Hajiji 
