title,content
Papua Terkini - Suku Arfak: Hargai kami sebagai tuan rumah, Manokwari Suku Besar Arfak mengharapkan semua pihak menghargai warga suku tersebut sebagai tuan rumah di wilayah Provinsi Papua Barat Suku Besar Arfak pada Minggu menggelar pertemuan masyarakat adat untuk menyikapi aksi yang berujung rusuh di Manokwari Papua Barat pada Agustus Arfak adalah suku asli yang mendiami Manokwari Wilayah adat suku ini meliputi Kabupaten Manokwari Manokwari Selatan Pegunungan Arfak Teluk Bintuni Teluk Wondama dan Tambrauw Manokwari ini rumah kita bersama orang tua kami dahulu menerima siapapun dari suku apapun yang datang ke Manokwari kata Kepala Suku Besar Arfak Dominggus Mandacan pada pertemuan yang digelar di Manokwari tersebut Kami menghargai siapa saja tolong hargai kami juga sebagai tuan rumah Siapapun tidak boleh berbuat kerusakan di sini kata dia Ia menyatakan masyarakat Suku Arfak tidak terlibat dalam aksi yang diwarnai dengan pembakaran kantor DPRD Provinsi Papua Barat kantor Majelis Rakyat Papua MRP serta fasilitas publik dan tempat usaha milik warga tersebut Manokwari ini kita juluki sebagai kota Injil karena itu semua orang yang ada di sini harus merasa aman Kita harus jamin kota Injil ini tanah aman tanah yang damai untuk siapapun katanya Masyarakat Suku Arfak berkomitmen untuk melanjutkan apa yang sudah diletakkan para orang tua dalam menjaga kerukunan dan kedamaian Sebagai tuan rumah Suku Arfak menjamin masyarakat dari seluruh suku aman tinggal di Manokwari Suku Arfak mengutuk tindakan persekusi dan rasial yang dialami mahasiswa Papua di Surabaya Jawa Timur Pihaknya mendesak agar para pelaku ditindak tegas sesuai peraturan yang berlaku di negeri ini Pihaknya pun mengutuk aksi anarkis yang terjadi di Manokwari dan beberapa daerah di Papua Barat Suku Arfak mendukung aparat penegak hukum untuk mengusut dan memproses hukum terhadap para pelaku perusakan pembakaran dan penjarahan selama aksi berlangsung Kepala Suku Besar Arfak Keturunan Barens Mandacan Nataniel Mandacan pada kesempatan itu menekankan bahwa aksi anarkis tidak boleh terulang kembali Situasi keamanan Manokwari harus segera pulih agar pembangunan berjalan lancar Stop Cukup kantor DPR dan MRP yang terbakar tidak boleh ada kantor kantor lain lagi yang terbakar Demonstrasi boleh tapi damai tidak boleh merusak menjarah dan bakar bakar fasilitas ujarnya Kepala Suku Besar Arfak Keturunan Irogi Maidodga Keliopas Madodga pun mengimbau seluruh masyarakat Arfak siap menjaga seluruh wilayah adat termasuk Manokwari Menjaga keamanan harus dimulai dengan sikap kasih sayang dan saling menghargai siapapun katanya Pewarta ToyibanEditor Sri Muryono COPYRIGHT 
Papua Terkini - Suku Arfak gelar temu adat sikapi situasi Manokwari, Manokwari Suku Besar Arfak pada Minggu menggelar tatap muka masyarakat adat untuk menyikapi situasi keamanan di Kabupaten Manokwari Papua Barat Pascakerusuhan yang terjadi di Manokwari pada Agustus situasi keamanan di daerah tersebut belum persen pulih Meskipun aktivitas masyarakat sudah berjalan lancar namun kekhawatiran akan adanya aksi susulan masih menghantui warga Temu adat yang dipimpin tiga Kepala Suku Kesar Arfak yakni Dominggus Mandacan Keliopas Maidodga serta Nataniel Mandacan ini dilakukan untuk mempercepat proses pemulihan keamanan di daerah ini Selain tiga kepala suku besar pertemuan yang menghadirkan ribuan warga Suku Arfak itu juga dihadiri para tokoh intelektual pemuda serta perempuan dari kalangan suku tersebut termasuk tokoh Suku Besar Arfak yang kini menjadi Bupati Manokwari Manokwari Selatan Pegunungan Arfak dan Teluk Bintuni Wilayah adat Suku Besar Arfak meliputi Manokwari Pegunungan Arfak Manokwari Selatan Teluk Bintuni Tambrauw hingga sebagian wilayah Teluk Wondama Manokwari adalah rumah kita pusat pemerintahan adat ada di sini kata Dominggus Mandacan pada pertemuan itu Mandacan mengajak seluruh warga suku tersebut bersatu menjaga Manokwari Ia tak ingin peristiwa Agustus terulang kembali Kita punya kantor DPR sudah dibakar begitu pula kantor MRP termasuk fasilitas lain serta tempat usaha masyarakat Jangan sampai kantor gubernur lagi dibakar awas di sana ada Kepala Suku Besar Arfak di lantai lima kata Mandacan Ia pun berharap masyarakat Arfak terutama para kepala suku terbuka dan bisa mencegah kemungkinan buruk yang dapat terjadi Para kepala suku diminta untuk merangkul seluruh masyarakat di lingkungannya Orang tua kita dulu menerima semua masyarakat yang datang dari suku apapun ke sini bahkan mereka diberikan tanah supaya bisa bikin rumah dan bisa mencari makan Maka sekarang kita minta mereka menghargai kita jangan merusak rumah orang kata Dominggus Ia pun mengajak masyarakat Arfak tetap tenang serta tidak mengambil langkah yang dapat memperkeruh suasana Kita harus saling menjaga Suku Arfak harus bisa memberikan rasa aman supaya rumah besar ini damai tidak ada aksi anarkis tidak ada perusakan tidak ada pembakaran dan penjarahan katanya Sejak Penginjil masuk ke Pulau Mansinam tanah ini sudah diberkati termasuk manusianya Sekarang kita harus menjadi berkat bagi orang lain berkat bagi Tanah Papua berkat bagi Indonesia dan berkat bagi masyarakat dari seluruh suku yang ada kata dia Dalam jumpa pers usai pertemuan tersebut Dominggus menjelaskan melalui temu adat itu dia ingin masyarakat dari seluruh Suku Besar Arfak bersatu Selanjutnya seluruh suku yang ada di daerah tersebut baik Papua maupun non Papua akan dirangkul Sekali lagi saya sampaikan Manokwari ini rumah kita bersama Maka semua suku harus saling menghargai dalam kerangka NKRI dan semua harus berkomitmen untuk jaga Manokwari kata dia Pewarta ToyibanEditor Sri Muryono COPYRIGHT 
Papua Terkini - Kapendam Cenderawasih: Massa tidak mau demo lagi, Kodam Cenderawasih telah menyiapkan kurang lebih truk TNI Polri guna mengangkut massaJayapura Sekitar pelaku aksi demo pada Kamis yang berasal dari masyarakat pegunungan merasa telah ditipu oleh koordinator aksi massa yang berakhir ricuh dan anarkis serta secara sadar berkomitmen tidak akan lagi ikut dalam aksi demo dalam bentuk apapun Demikian hal tersebut disampaikan oleh Kepala Penerangan Kodam Kapendam XVII Cenderawasih Lektol Cpl Eko Daryanto dalam siaran pers yang diterima di Kota Jayapura Papua Minggu malam Mereka yang sempat bersembunyi di kompleks Kelurahan Numbay Distrik Jayapura Selatan tadi sore sekitar pukul WIT menyampaikan penyesalan dan merasa ketakutan untuk kembali ke tempat tinggal mereka masing masing di wilayah Abepura dan Waena katanya Menurut dia orang yang merupakan bagian dari massa pendemo sepakat untuk tidak mau lagi ikut ikutan aksi demo massa dalam bentuk apapun Kelompok massa pendemo ini merasa telah ditipu oleh oknum yang tidak bertanggung jawab yang memanfaatkan isu rasisme kata Kapendam Selama tiga hari mereka bersembunyi di wilayah sekitar Kelurahan Numbay Distrik Jayapura Selatan mereka tidak berani kembali ke daerah Abepura dan Waena dengan alasan takut mendapat aksi balasan dari masyarakat yang telah menjadi korban aksi penjarahan pembakaran pelemparan maupun pengrusakan oleh mereka pada waktu melakukan aksi demo yang berujung rusuh dan anarkis sehingga menimbulkan kerusakan dan kerugian material di sepanjang jalan Waena Jayapura katanya Terkait situasi Papua terkini pada Minggu siang itu kata dia perwakilan kelompok yang sebagian besar berasal dari salah satu wilayah di pegunungan Papua itu Wamena menemui salah satu pejabat di Dinas Pendidikan Propinsi Papua yakni Desman Kogaya untuk memohon bantuan agar diberikan jaminan keamanan dan angkutan dalam proses mereka kembali ke daerah Abepura dan Waena Mereka merasa takut mendapatkan aksi balasan dari masyarakat yang telah mengalami kehilangan dan kerusakan aset harta benda yang berharga yang telah mereka rusak atau jarah akibat ulah yang anarkis dan brutal katanya Selanjutnya kata dia Desman Kogoya menghubungi Kodam XVII Cenderawasih dan perwakilan Komnas HAM wilayah Papua sebagai mediator Asintel Kasdam Kolonel Inf JO Sembiring sebagai perwakilan dari Kodam XVII Cenderawasih dan Ketua Komnas HAM Perwakilan Papua Frits Ramanday melakukan mediasi dan negosiasi untuk memberikan solusi terbaik guna proses evakuasi terhadap an orang dalam rangka evakuasi pemulangan dan pengamanan agar terhindar bentrok susulan antarkelompok massa khususnya di wilayah Jayapura katanya Hadir pula dalam proses mediasi tersebut tokoh gereja Wakil Bupati Lanny Jaya dan anggota Majelis Rakyat Papua MRP Kodam XVII Cenderawasih telah menyiapkan kurang lebih truk TNI Polri guna mengangkut massa yang sempat bertahan di wilayah Kelurahan Numbay pasca aksi demo beberapa hari lalu katanya Sekitar pukul WIT dilakukan evakuasi gelombang pertama sebanyak orang dan pukul WIT evakuasi gelombang kedua sebanyak orang Satu orang yang diduga pelaku penjarahan diamankan oleh pihak Polres Jayapura karena pada saat pemeriksaan ditemukan kunci SPM baru di kantong celananya Proses evakuasi pemulangan berjalan aman dan lancar dengan pengawalan ketat dari Kodam XVII Cenderawasih dan Polda Papua katanya berkomentar soal situasi Papua terkini Pewarta Alfian RumagitEditor Dewanti Lestari COPYRIGHT 
Papua Terkini -298 pendemo dipulangkan dengan kendaraan militer, Jayapura Aparat keamanan TNI Polri Minggu memulangkan sekitar pendemo yang sempat bersembunyi di kawasan Kelurahan Numbay Distrik Jayapura Selatan dengan menggunakan kendaraan militer miliki Kodam XVII Cenderawasih Ratusan warga yang sebelumnya ikut demo yang berlangsung anarkis Kamis sebelum dipulangkan sempat bersembunyi di kawasan Kelurahan Numbay Kapendam XVII Cenderawasih Letkol CPL Eko Daryanto ketika dihubungi membenarkan ratusan pendemo yang dibantu pemulangannya setelah sempat bersembunyi Awalnya masyarakat yang berasal dari pegunungan tengah itu sempat ketakutan dan tidak berani pulang ke rumah mereka yang berada di wilayah Abepura dan sekitarnya sehingga bersembunyi selama tiga hari Ketakutan mereka itu karena selain demo juga melakukan penjarahan pembakaran pelemparan maupun pengerusakan sehingga dikhawatirkan terjadi aksi balasan dari warga yang menjadi korban Keberadaan mereka diketahui setelah adanya informasi dari Desmon Kogoya dan Komnas Ham sehingga Kodam XVII Cenderawasih melalui Asintel Kasdam Kolonel Inf JO Sembiring membantu pemulangan mereka kata Eko Letkol CPL Eko mengatakan truk disiapkan untuk memulangkan para pendemo ke kawasan Abepura dan Waena Selain membantu pemulangan mereka satu orang di antaranya diserahkan ke Polres Jayapura Kota karena diduga pelaku penjarahan tambah Letkol CPL Eko Daryanto Sebelumnya aparat keamanan TNI Polri sudah melakukan pemulangan terhadap sekitar orang pendemo yang sempat bertahan di kantor gubernuran Dok II Jayapura 
Papua Terkini  Polisi tetapkan 28 tersangka kerusuhan Jayapura, Kepolisian Daerah Papua menetapkan puluhan tersangka pelaku pembakaran fasilitas publik dan penjarahan dalam aksi demo tolak rasisme Kamis kemarin Sabtu sore seluruh barang bukti berupa senjata tajam dan hasil jarahan digelar di hadapan media berikut para tersangka Laksa Mahendra Sandi Arizona Sizuka 
"Empat Napi Abepura kabur, Menkumham perintahkan jajarannya siaga", seluruh unit kerja yang ada di sana untuk terus siagaJakarta Menteri Hukum dan Hak Asasi Manusia Yasonna Laoly memerintahkan jajarannya di Kantor Wilayah Papua dan Papua Barat untuk siaga menyusul insiden kericuhan yang menyebabkan empat warga binaan di Lembaga Permasyarakatan Lapas Abepura melarikan diri Yang kami sesalkan di Lapas Abepura juga ada sedikit insiden dapur dibakar dan ada empat melarikan diri Saya sudah perintahkan Kepala Kanwil Papua Kakanwil Papua Barat dan seluruh unit kerja yang ada di sana untuk terus siaga kata Yasonna di Kantor Wakil Presiden Jakarta Jumat Yasonna juga mengimbau kepada seluruh aparat Kemenkumham untuk menjaga diri tidak terprovokasi dan memprovokasi dalam menghadapi ketegangan situasi di Papua Jangan terprovokasi dan jangan memprovokasi supaya tetap tenang dan berupaya juga melakukan dialog menemui tokoh tokoh masyarakat di sana untuk dapat merajut kembali bersama sama membangun Papua kata Yasonna Aksi massa yang berujung kericuhan terjadi di Kota Jayapura Kamis dan Distrik Abepura menjadi salah satu titik konsentrasi massa pendemo yang berakibat pada kericuhan dan penjarahan Di Lapas Abepura petugas Lapas menghentikan layanan kunjungan kepada narapidana karena ketegangan aksi massa semakin meningkat Situasi tersebut dimanfaatkan oleh sejumlah narapidana di dalam Lapas untuk menyerang bangunan perkantoran dan petugas Lapas hingga empat orang warga binaan melarikan diri Kericuhan di Jayapura itu merupakan imbas dari insiden bermuatan rasisme kepada mahasiswa asal Papua di Malang dan Surabaya Jawa Timur pada Agustus lalu Kelompok massa di Papua melakukan unjuk rasa untuk memprotes ujaran rasial kepada warga Papua Demonstrasi pada Kamis tersebut berdampak pada perusakan fasilitas umum seperti pembakaran Polsek Jayapura Selatan sejumlah mobil dinas TNI dan Polri dan kantor Majelis Rakyat Papua MRP Pewarta Fransiska NindityaEditor Edy Sujatmiko COPYRIGHT 
Papua Terkini - Situasi Abepura terkini pasca ricuh, Situasi terkini Distrik Abepura Kota Jayapura Jumat pagi masih lengang Pada aksi demo kemarin Abepura menjadi salah satu titik konsentrasi massa Demo massal yang berujung ricuh dan penjarahan memang sudah berakhir namun sebagian besar warga masih trauma Alfian Rumagit Chairul Fajri Sizuka 
Papua Terkini - Aparat TNI dan Polri terus bersiaga menjaga kota Jayapura, Ratusan personel TNI Polri masih melakukan pengamanan di kota Jayapura mengantisipasi aksi balasan dari kelompok massa yang menamakan diri Nusantara Kelompok Nusantara tidak bisa terima karena aksi demo ricuh disertai penjarahan dan pembakaran sejumlah fasilitas publik Laksa Mahendra Chairul Fajri Sizuka 
"Papua Terkini - Pasca ricuh, aktivitas perekonomian di Jayapura masih lumpuh", Pasca aksi demo ricuh di Jayapura Papua sejumlah aktivitas perekonomian masih lumpuh Kantor perbankan yang berada di pinggir jalan seputaran Jayapura terlihat tutup dan kaca kaca hancur akibat lemparan massa Aktivitas pasar belum berjalan normal Massa dalam aksi kemarin juga sempat melakukan pembakaran serta penjarahan fasilitas publik di kota Jayapura Laksa Mahendra Chairul Fajri Sizuka 
"Kondisi Jayapura, wanita pun harus turut meronda sejak malam hari", Jayapura Kondisi Kota Jayapura yang masih belum pasti selepas aksi unjuk rasa yang berujung rusuh pada Kamis pagi hingga petang membuat para warga termasuk kaum wanita menggelar ronda untuk menjaga keamanan lingkungan di sekitar mereka Berdasarkan pantauan para warga tersebut secara bergiliran melakukan ronda sejak malam hari dalam keadaan gelap dan tanpa adanya jaringan komunikasi seperti terlihat di Dok Kelurahan Imbi Distrik Jayapura Kota Jayapura Sebagian besar warga lainnya masih bertahan di kantor atau fasilitas milik negara lainnya karena tidak dapat pulang ke kediamannya pada Kamis malam ketika situasi belum bisa dipastikan kondusif Kondisi Jayapura pada Kamis malam hari jalan raya dalam keadaan gelap karena listrik padam jalanan banyak yang diblokir warga batu sisa bentrok hingga botol air mineral bergeletakan di tengah jalan sisa bangunan yang dibakar juga rata rata masih berasap Sekitar jam WIT massa yang menduduki kantor Gubernur Papua di Jayapura baru membubarkan diri Terlihat juga di beberapa jalan besar ada aksi penjarahan pada toko toko yang dibakar sehingga banyak warga yang memilih jalan lain Sebelumnya terjadi unjuk rasa yang berujung rusuh di kota Jayapura Kamis Unjuk rasa yang dimulai sejak pagi waktu setempat tersebut berlangsung hingga petang Sekitar pukul WIT massa mulai membubarkan diri setelah dipukul mundur oleh aparat gabungan TNI dan Polri dengan menggunakan gas air mata Sementara itu kondisi dan situasi Kota Jayapura Papua pada pukul WIT berangsur pulih pascaunjuk rasa rusuh tersebut Unjuk rasa tersebut menimbulkan kerusakan material di berbagai tempat dari Sentani Abepura Kotaraja hingga Jayapura Massa pengunjuk rasa sebelumnya sempat melakukan pembakaran beberapa gedung dan pertokoan sepanjang Abepura Entrop dan Jayapura lalu bangunan Kantor Telkomsel dan Pos Jayapura Bangunan Kantor Bank Indonesia Perwakilan Papua RS Provita Jayapura Mall Jayapura dan pertokoan yang berada di sekitarnya juga dilempari dan dirusak massa pengunjuk rasa Pewarta Hendrina Dian Kandipi dan Ricky PrayogaEditor Irwan Suhirwandi COPYRIGHT 
Kapolres Manokwari peserta aksi damai 19 Agustus tidak ditangkap, Manokwari Kapolres Manokwari Papua Barat AKBP Adam Erwindi memastikan bahwa tidak ada satu pun peserta aksi damai daerah tersebut pada Agustus yang ditangkap dan ditahan Yang kita amankan dan dilakukan penahanan hanya mereka yang terindikasi dan memenuhi cukup bukti terlibat dalam kasus perusakan pembakaran dan penjarahan Kalau peserta aksi damai saya pastikan tidak ada penangkapan kata Kapolres usai menggelar pertemuan bersama tokoh adat masyarakat dan agama di Manokwari Kamis Sejauh ini kata Adam sudah lima tersangka ditangkap terkait kerusuhan Agustus tersebut Mereka diantaranya terlibat dalam perusakan dan penjarahan mesin ATM Toko Hawai Bakeri serta kasus pembakaran bendera merah putih Ia mengutarakan menyampaikan aspirasi adalah hak bahkan saat itu polisi memberikan pengamanan agar aksi berjalan lancar Sedang para pelaku perusakan dan pembakaran terlepas dari aksi dan aspirasi yang disampaikan masyarakat dan mahasiswa dan menyikapi kasus rasisme di Surabaya Aksinya bagus kami pun mendukung karena perbuatan diskriminasi rasis adalah salah dan harus dilawan karena bisa merusak persatuan dan persaudaraan ujar Kapolres lagi Menurut Kapolres para perusuh merupakan pendompleng aksi damai Atas petunjuk pimpinan pihaknya pun melakukan penindakan Terkait kasus rasis di asrama Mahasiswa Papua Surabaya sebut Kapolres polisi sudah menetapkan satu tersangka berinisial TS Ia meyakini kasus tersebut akan bergulir hingga putusan pengadilan Artinya bahwa apa yang menjadi tuntutan kita di sini sudah dilakukan di Jawa Timur sana Pelaku kasus rasisme sudah ditetapkan satu orang sebagai tersangka selain itu gubernur Jawa Timur juga sudah menyampaikan permohonan maaf sebut dia lagi Ia mengajak masyarakat serta seluruh tokoh di daerah tersebut mendukung TNI dan Polri dalam menciptakan keamanan di Manokwari Tidak perlu ikut turun ke jalan sama sama dengan kami melakukan pengamanan cukup di rumah menjaga lingkungan masing masing Jaga anak anak agar tidak ikut terprovokasi melakukan kerusuhan sebutnya lagi Pewarta ToyibanEditor Unggul Tri Ratomo COPYRIGHT 
DPRD Papua Barat sewa hotel sebagai sekretariat sementara, Manokwari Dewan Perwakilan Rakyat Daerah DPRD Provinsi Papua Barat menyewa hotel sebagai sekretariat sememtara setelah gedungnya dibakar massa pada kericuhan yang terjadi pada Senin Sekretaris DPRD Papua Barat Mathius Asmuruf di Manokwari Rabu mengatakan sudah hampir sepekan pihaknya menjalankan aktivitas kesekretariatan di hotel Itu dilakukan agar tugas tugas DPRD berjalan lancar Ini hanya sementara Pemprov Papua Barat sudah siapkan gedung di kompleks perkantoran Arfai Manokwari Ada gedung pertanian yang belum dipakai untuk sementara akan kita manfaatkan dulu sebut Mathius Menurutnya gedung pertanian di Kompleks Arfai Manokwari cukup representatif untuk mendukung aktivitas kesekretariatan DPR Jumlah ruangan dinilai cukup untuk menjalankan aktivitas sekretariat Gedungnya besar tadi sudah kami cek sekaligus dilakukan pembersihan Fasilitas ruangan pun cukup mungkin fasilitas air yang harus kita pikirkan Setelah semua lengkap kami akan segera pindah ke sana ujarnya lagi Hari ini lanjut Asmuruf DPRD ada agenda sidang terkait pembahasan APBD perubahan Pemprov Papua Barat tahun Sidang itu pun terpaksa dilalukan di hotel karena tidak ada ruang tersisa akibat kebakaran tersebut Khusus untuk kegiatan rapat paripurna tetap harus dilaksanakan di hotel karena membutuhkan gedung berkapasitas besar Kami sudah menjalin kerjasama dengan salah satu hotel di Manokwari ujarnya lagi Gedung DPRD Papua Barat ludes terbakar pada kericuhan di Manokwari Senin Selain membakar gedung rapat utama massa kala itu pun merusak dan menjarah fasilitas di kantor sekretariat DPRD Polisi saat ini masih menyelidiki para pelaku yang terlibat dalam pembakaran dan penjarahan gedung wakil rakyat tersebut Kantor sekretariat kita tidak seluruhnya terbakar tapi kerusakanya cukup parah di dalam seperti kaca pintu mesin AC arsip hingga dokumen dokumen penting semua berantakan Ini harus dilakukan perbaikan kata Asmuruf menambahkan Pewarta ToyibanEditor Ruslan Burhani COPYRIGHT 
Polisi tetapkan seorang Napi tersangka pembakaran Lapas Sorong, Khusus untuk Lapas Sorong kami masih terus melakukan pendalamanManokwari Seorang narapidana ditetapkan sebagai tersangka dalam kasus kebakaran yang terjadi di Lembaga Pemasyarakatan Sorong Papua Barat pada Agustus lalu Direktur Kriminal Umum Polda Papua Barat Kombes Pol Robert Dakosta di Manokwari Rabu menjelaskan terkait kericuhan yang terjadi di Sorong pada Senin hingga Selasa Polisi menerima sebanyak laporan satu diantaranya terkait pembakaran kantor administrasi Lapas kelas IIB Sorong Khusus untuk Lapas Sorong kami masih terus melakukan pendalaman Saat ini sudah ada satu orang berinisial KW yang kami tetapkan sebagai tersangka dia seorang Napi kata Robert Dia menjelaskan Polda Papua Barat bersama sejumlah Polres sedang melakukan pengungkapan kasus perusakan pembakaran serta penjarahan yang terjadi selama kerusuhan berlangsung Dari seluruh daerah yang terjadi aksi menyikapi insiden di asrama mahasiswa Papua di Surabaya tiga daerah yakni Manokwari Sorong dan Fakfak mengalami dampak kerusakan paling parah Selain Sorong polisi juga telah menerima laporan atas kejadian di Manokwari dan Fakfak Di Manokwari Polisi menerima sebanyak laporan dan telah menetapkan tersangka Sedangkan di Fakfak kata dia polisi menerima empat laporan atas kerusuhan yang terjadi pada Agustus Seluruhnya masih dalam proses penyelidikan dan pengumpulan alat bukti Untuk daerah lain selain Manokwari Fakfak dan Sorong hanya ada aksi damai Relatif aman dan tidak ada aksi perusakan dan pembakaran fasilitas umum ujarnya menambahkan Ia mengutarakan dalam menangani kerusuhan tersebut Polda Papua Barat dibantu tim dari Mabes Polri termasuk dalam mengungkap kasus pembakaran Lapas Sorong 
Polisi tangani 26 laporan kerusuhan Papua Barat, Manokwari Kepolisian Daerah Papua Barat menangani sebanyak laporan terkait kerusuhan yang beruntun terjadi di sejumlah daerah sejak Senin hingga Rabu Direktur Krimum Polda Papua Barat Kombes Pol Robert Dakosta di Manokwari Rabu mengutarakan dari laporan dan tempat kejadian perkara itu polisi sudah menahan delapan tersangka Sebagian besar masih dalam proses penyelidikan serta pengumpulan alat bukti termasuk keterangan saksi kata Dakosta Ia menyebutkan pada kerusuhan di Manokwaru pada Agustus polisi sudah menangkap tujuh tersangka Pengembangan masih berlanjut untuk seluruh kasus yang ditangani terkait aksi rusuh tersebut Robert merinci tersangka pelaku pada peristiwa di Manokwari masing masing berinisial ASK BW MA DA YS MSW serta AI Sedangkan satu tersangka terkait kasus Sorong berinisial AI ASK lanjutnya disangka terlibat pembakaran mobil pada kerusuhan di Serum Daihatsu Jl Yossudarso Manokwari BW terkait pembakaran rumah produksi sekaligus toko Haway Bakeri MA terkait perusakan dan pembakaran ATM Bank Mandiri DA perusakan ATM BNI YS terkaolit penjarahan di Toko Emont Store serta AI terkait pembakaran bendera merah putih Sedangkan satu TSK di Sorong berinisial KW ini terkait kasus perusakan dan pembakaran gedung lembaga pemasyarakatan Untuk Fakfak belum ada tersangka yang kami tetapkan ujarnya lagi Dia menambahkan saat ini polisi bekerja keras untuk mengungkap seluruh laporan tersebut Polda Papua Barat dibantu tim Inafis mabes Polri dalam menangani seluruh kejadian Pengumpulan bukti terus kami lakukan Kami berusaha penanganan seluruh bisa selesai secepatnya ujarnya lagi Pewarta ToyibanEditor Unggul Tri Ratomo COPYRIGHT 
