title,content
BBKSDA Riau periksa perusahaan dalam penyelidikan kematian harimau, Pekanbaru Balai Besar Konservasi Sumber Daya Alam BBKSDA Provinsi Riau akan memeriksa perusahaan kehutanan dalam penyelidikan kasus kematian harimau sumatera akibat jerat di dalam area konsesi hutan tanaman industri Tentunya kami akan perdalam kejadian ini dengan memintai keterangan beberapa pihak yang terkait dengan kejadian ini kata Kepala BBKSDA Riau Suharyono di Pekanbaru Selasa Dan ini bukan kasus pertama yang terjadi di Riau ia menambahkan Ia mengatakan bahwa perusahaan pemegang konsesi juga berkewajiban menjaga keamanan di area konsesi BBKSDA Riau sedang menyelidiki kasus kematian harimau sumatera akibat jerat pemburu di area konsesi hutan tanaman industri milik perusahaan PT Arara Abadi di Kabupaten Siak Provinsi Riau Suharyono mengemukakan dugaan bahwa kematian harimau sumatera tersebut berhubungan dengan kegiatan pemburu profesional yang memahami seluk beluk area konsesi anak perusahaan APP Sinar Mas itu Harimau sumatera yang ditemukan mati karena terkena jerat pada Senin usianya diperkirakan antara satu dan dua tahun Berdasarkan kondisi lukanya harimau tersebut diperkirakan kena jerat sekitar lima hari sebelumnya Menurut Suharyono kawasan hutan di area konsesi tersebut memang merupakan bagian dari wilayah jelajah harimau sumatera Area tersebut adalah kantong harimau sumatera katanya Sementara itu Kepala Konservasi APP Sinar Mas Dolly Priatna dalam pernyataan resmi perusahaan menyatakan bahwa PT Arara Abadi mendukung penuh upaya BBKSDA menyelidiki kasus kematian harimau tersebut Kami turut prihatin atas kematian seekor harimau di Desa Minas Barat Riau yang diduga terjadi akibat perburuan ilegal katanya Ia mengatakan APP Sinar Mas beserta berbagai unit bisnis dan pemasoknya termasuk PT Arara Abadi mendukung upaya untuk menekan praktik yang merugikan lingkungan seperti perburuan ilegal di sekitar wilayah konsesi perusahaan Perusahaan antara lain mendukung operasi sisir jerat di wilayah konservasi dan sekitar wilayah konsesi yang dilakukan lembaga dan komunitas konservasi Operasi tersebut telah kami jalankan bersama para pihak dan juga rutin setidaknya sebulan sekali secara mandiri di sejumlah wilayah di Riau Jambi dan Sumatera Selatan kata Dolly Selama program ini berlangsung sudah ditemukan sebanyak jerat yang sudah diamankan oleh tim Kami juga menjalankan sosialisasi rutin untuk warga setempat tentang konservasi keragaman hayati yang dilindungi pencegahan konflik dengan satwa liar dampak negatif perburuan ilegal dan mata pencaharian alternatif yang lebih berkelanjutan ia menjelaskan Ia menambahkan selain itu perusahaan mempertimbangkan pergerakan satwa liar dalam menyusun rencana pengelolaan hutan membangun kantong kantong makan untuk satwa liar memasang sistem kamera untuk memantau populasi spesies di area konsesi serta melakukan sosialisasi dan pelatihan mengenai konservasi satwa liar untuk karyawan dan komunitas Harimau sumatera mati kena jerat pemburu di Riau Harimau sumatera yang terjerat di Riau berisiko kehilangan satu kakiPewarta FB AnggoroEditor Maryati 
Australia sebut tak berperang dagang dengan China, Kami berhak untuk mengajukan banding untuk masalah iniSydney Menteri Perdagangan Australia David Littleproud pada Selasa menyebutkan Canberra tidak menjalani perang dagang dengan Beijing meskipun satu hari sebelumnya China menetapkan bea masuk terhadap gandum impor asal Australia Tidak tidak ada perang dagang Faktanya sampai hari ini ada peningkatan permintaan bijih besi dari China kata Littleproud saat jumpa pers Kenyataannya mereka China telah melalui tahapan yang cukup adil meskipun banyak pihak meyakini hubungan dagang kami tidak begitu adil kata dia Littleproud pada Senin mengatakan Australia berencana mengadukan kebijakan China ke Organisasi Perdagangan Dunia WTO Pemerintah China mengenakan tarif nonsubsidi dan antidumping terhadap persen gandum impor asal Australia mulai Mei Kementerian Perdagangan China menyebut Australia telah melakukan praktik dumping terhadap komoditas gandumnya sehingga merugikan pasar dalam negeri Tiongkok Pernyataan itu diumumkan merujuk pada hasil penyelidikan sejak Bea masuk terhadap gandum impor Australia akan berlaku selama lima tahun Pihak kementerian mengatakan bea masuk atau tarif sebesar persen akan diberikan ke seluruh pengimpor khususnya empat pengekspor utama di Australia yaitu The Iluka Trust Kalgan Nominee Pty Ltd JW JI Mcdonald Sons dan Haycroft Enterprises Di samping bea masuk otoritas di China juga menetapkan tarif nonsubsidi sebesar persen Australia pemasok gandum utama China mengekspor barang dengan nilai sekitar miliar dolar Australia sampai dua miliar dolar Australia sekitar Rp triliun Rp triliun per tahun atau lebih dari setengah dari nilai ekspor Negeri Kangguru Gandum barley biasa digunakan untuk campuran teh dan pakan ternak Tidak banyak pasar lain yang tersedia Gandum dapat dijual ke Arab Saudi tetapi harganya akan terpotong banyak dari nilai yang semestinya dapat diterima petani Australia saat menjual ke China kata seorang pejabat Australia Sementara itu China pengimpor gandum terbesar dunia dapat dengan mudah mengalihkan pemasok ke produsen lain seperti Prancis Kanada Argentina dan beberapa negara di Eropa Pemasok gandum China sangat mudah diganti kata Direktur Pelaksana Evergrain Andries De Groen Evergain merupakan perusahaan penyuplai gandum yang berpusat di Jerman Menteri Perdagangan Australia Simon Birmingham menyebut langkah China itu mengecewakan Kami menolak keputusan itu dan akan memeriksa temuan kami seraya memikirkan langkah selanjutnya kata Birmingham lewat pernyataan tertulis yang dikirim via surat elektronik Kami berhak untuk mengajukan banding untuk masalah ini kata dia Hubungan Australia dan China memburuk sejak setelah Canberra melarang Huawei memasarkan jaringan internet G nya Keduanya kembali bersitegang setelah Australia menyampaikan kekhawatiran terhadap pengaruh China yang menguat di kawasan Pasifik Masalah ini merupakan bagian dari isu lebih luas yang Australia lakukan di antara hubungan politiknya di barat dengan kepentingan ekonominya di timur kata Direktur Strategi Pertanian Commonwealth Bank of Australia Tobin Gorey menanggapi kebijakan tarif gandum impor China sempat dibuat marah dalam beberapa minggu terakhir setelah Australia meminta adanya penyelidikan independen terhadap asal muasal virus corona jenis baru SARS CoV penyebab COVID Duta Besar China untuk Australia pada bulan lalu mengatakan warga Tiongkok dapat merespons sikap Canberra dengan memboikot sejumlah produk seperti daging sapi anggur paket wisata dan universitas Beberapa hari kemudian Beijing menghentikan sementara impor daging sapi dari empat pengolah terbesar di Australia yang nilainya setara dengan persen ekspor daging sapi Australia ke China Sumber Reuters 
Megan Fox dan Brian Austin Green cerai, Jakarta Pasangan selebritas Megan Fox dan Brian Austin Green bercerai setelah tahun menikah People Selasa Green mengonfirmasi perpisahan dia dengan Fox pada acara podcast With Brian Austin Green di episode Senin yang berjudul Context Pengakuan Green itu muncul setelah foto foto sang aktris Transformers itu beredar di internet Fox tertangkap kamera sedang berduaan dengan rapper Machine Gun Kelly Aktor Beverly Hills itu memulai episode podcast nya dengan mencurahkan isi hati dia bahwa hubungan dia dan Fox sebenarnya sudah renggang sejak tahun lalu saat dia harus pergi ke luar negeri untuk syuting film Midnight in the Switchgrass bersama Machine Gun Kelly Tak ada yang banyak berubah saat istrinya itu pulang dari syuting Green mengatakan dia memberi Fox beberapa minggu untuk jeda dan kembali ke kehidupan sebelum melakukan diskusi dari hati ke hati tentang pernikahan mereka Dia berkata aku menyadari saat aku berada di luar negeri bekerja sendirian bahwa aku merasa lebih seperti diriku sendiri dan aku menyukai diriku lebih baik selama pengalaman itu dan kupikir itu mungkin sesuatu yang pantas untuk kucoba kata Green mengingat ucapan Fox Aku terkejut dan marah tentang hal itu tetapi aku tidak bisa marah padanya karena dia tidak meminta untuk merasa seperti itu Itu bukan pilihan yang dia buat itu yang dia rasakan dengan jujur Kami membicarakannya sedikit lebih banyak dan berkata mari kita berpisah sebentar dan itulah yang kita lakukan Kami memiliki hubungan yang luar biasa dan saya akan selalu mencintainya dan saya tahu dia akan selalu mencintaiku kata Green Green dan Fox memiliki tiga orang anak Journey River Bodhi Ransom dan Noah Shannon Dia mengatakan setelah melihat bagaimana orang lain di sekitar mereka melalui perceraian dan hal hal yang menjadi pahit di antara pasangan mereka tahu mereka ingin mengambil pendekatan yang berbeda Sebagai keluarga kami sudah membangun keluarga yang benar benar keren dan sangat istimewa Jadi kami memutuskan bahwa kami tidak kehilangan itu Mari pastikan bahwa kami selalu berteman satu sama lain dan kami utamakan anak anak Kami akan melakukan liburan keluarga dan liburan bersama keluarga dan benar benar menjadikannya fokus dengan anak anak Dia melanjutkan Sejak akhir tahun kami benar benar telah berusaha untuk berpisah dan mencari tahu apa kehidupan sekarang Ini adalah perubahan besar bagi kami berdua Selama podcast Green juga mengatakan bahwa keputusan mereka untuk berpisah tidak ada hubungannya dengan siapa pun yang selingkuh Green melanjutkan membahas hubungan Fox dengan Machine Gun Kelly yang ia temui di lokasi Midnight di Switchgrass Aku belum pernah bertemu dengannya tetapi Megan dan aku berbicara tentang dia dan mereka berteman pada saat ini Dan dari apa yang dia ungkapkan dia benar benar baik pria yang tulus Aku percaya pada penilaiannya Dia selalu memiliki penilaian yang sangat bagus kata dia Meski sudah pisah Green tidak menutup kemungkinan untuk rujuk Jadi jalan telah mulai berjalan secara terpisah untuk saat ini Mereka bisa kembali bersama Mereka mungkin tidak Kita tidak tahu Aku tidak tahu Aku tidak ingin membuat prediksi dengan itu karena aku tidak punya ide Pasangan selebritas ini mengalami pasang surut selama bertahun tahun Pertemuan pertama pada set film Hope Faith pada tahun ketika Fox baru berusia dan Green berusia keduanya merasakan ketertarikan langsung satu sama lain Saya langsung menyukainya kata Megan Fox kepada The New York Times Magazine pada Brian secara tidak sengaja menyentuh kakiku Aku ingat merasakan adanya listrik sungguhan yang menembakiku Itu seperti sihir Berpacaran selama sekitar dua tahun pasangan ini awalnya bertunangan pada November tetapi mereka membatalkannya pada Februari Mereka bertunangan lagi setahun kemudian dan mengikat simpul segera setelah pada Setelah menyambut putra sulung mereka aktris ini pertama kali terlihat tanpa cincin kawinnya pada Desember dan ia melanjutkan untuk bercerai pada tahun berikutnya dengan alasan perbedaan yang tidak dapat didamaikan Pada saat itu sumber mengatakan kepada People bahwa mereka berselisih mengenai bagaimana menyeimbangkan kehidupan keluarga dengan pekerjaan Mereka memiliki beberapa konflik yang menyebabkan perceraian kata sumber keluarga Megan banyak bekerja tahun lalu dan dia terus bekerja banyak Ketika dia pergi Brian tinggal bersama anak anak Sebelum mereka mengajukan perceraian mereka memiliki ketidaksetujuan tentang situasi ini Green juga memiliki putra Kassius dari hubungan sebelumnya dengan Vanessa Marci 
Persiraja harapkan perubahan setelah empat direksi PT LIB mundur, Jakarta Manajemen Persiraja Banda Aceh mengharapkan perubahan signifikan dalam tubuh PT Liga Indonesia Baru PT LIB pascamundurnya empat petinggi operator liga ini saat rapat umum pemegang saham luar biasa RUPSLB Senin Kita apresiasi atas hasil dari RUPS siang tadi Tentunya kita berharap dengan pengunduran diri beberapa direksi tadi membawa perubahan yang lebih baik di tubuh PT LIB termasuk subsidi bisa dicairkan tepat waktu kata Presiden Persiraja Banda Aceh Nazaruddin Dek Gam seperti dilansir dari laman resmi klub Selasa Sebelumnya pada RUPSLB yang digelar pada Senin empat petinggi PT LIB yakni Cucu Somantri dan tiga komisaris LIB yaitu Sonhadji Hasani Abdulgani dan Hakim Putratama memilih mundur dari jabatannya Tak jelas alasan pengunduran diri keempatnya namun adanya konflik internal dalam tubuh PT LIB beberapa pekan terakhir disinyalir menjadi salah satu penyebab keputusan tersebut Nazaruddin berharap ke depan direksi PT LIB bisa diisi oleh orang orang profesional yang bisa membawa perubahan berarti dalam tata kelola kompetisi persepakbolaan Tanah Air Persiraja juga mengharapkan kelanjutan kompetisi segera menemui titik terang meski PSSI tetap pada keputusan awal yang tetap menunggu status dari pemerintah hingga Mei mendatang Semoga jajaran direksi dan komisaris baru yang akan dipilih nantinya bisa mengelola kompetisi lebih profesional dan bisa segera melanjutkan kompetisi Liga setelah status darurat corona dicabut kata dia 
Pengamat: Waspadai ancaman keamanan di tengah pandemi COVID-19, Jakarta Pengamat intelijen dan keamanan Stanislaus Riyanta mengingatkan aparat keamanan untuk tidak lengah menghadapi potensi ancaman terorisme kriminalitas dan konflik sosial di tengah pandemi virus corona jenis baru atau COVID Terorisme kriminalitas dan konflik massa berpotensi terjadi dengan memanfaatkan pandemi COVID katanya saat diskusi publik virtual bertajuk Implikasi Pandemi COVID dalam Perspektif Sosial Ekonomi Politik Hukum dan Keamanan di Jakarta Senin malam Menurut dia kesibukan pemerintah dalam penanganan COVID bisa menjadi celah bagi datangnya ancaman ancaman termasuk gangguan keamanan nasional Terkait terorisme kata dia ada beberapa penangkapan yang dilakukan oleh Densus Polri yang menunjukkan adanya gerakan signifikan dari kelompok teroris terutama Jemaah Anshar Daulah JAD dan Mujahidin Indonesia Timur MIT yang memanfaatkan situasi pandemi COVID Ia mencontohkan penangkapan pada masa pandemi COVID antara lain penangkapan empat orang jaringan JAD di Batang Jawa Tengah Maret satu orang di Kemayoran Jakarta Pusat April dua orang jaringan JAD ditangkap di Sidoarjo Jawa Timur pada April Penangkapan juga dilakukan terhadap empat orang jaringan JAD di Muna Sulawesi Tenggara April tiga orang terduga teroris AS AMA CM di Serang pada April dan seorang terduga teroris MH di Sidoarjo pada April Selain itu aksi teror juga telah terjadi di Poso berupa penembakan terhadap anggota Polri Briptu Ilham Suhayar yang berjaga di Bank Mandiri Syariah Poso oleh dua anggota kelompok MIT Poso pimpinan Ali Kalora Tingkat kriminalitas pada masa pandemi COVID mengalami kenaikan Polri menyatakan tingkat kriminalitas meningkat sebesar persen selama pandemi corona katanya Disebutkan Stanislaus potensi konflik massa juga bisa terjadi pada massa pandemi COVID karena adanya kelompok yang mencoba melakukan provokasi untuk konflik massa seperti kelompok Anarko Kelompok Anarko ini menentang kapitalisme dan pemerintah Selain ini provokasi provokasi dari kelompok tertentu yang mengarah kepada perlawanan terhadap pemerintah juga terjadi katanya Untuk menekan terorisme kriminalitas dan mencegah terjadinya konflik di masyarakat kata dia perlu dilakukan upaya upaya tertentu oleh pemerintah secara berjenjang yang sangat perlu untuk memenuhi kebutuhan dasar seperti sembako bagi warga di daerah PSBB dan tidak memperoleh pendapatan Masalah pangan sangat sensitif dan jika tidak terpenuhi dampaknya bisa berbahaya ujarnya Meskipun demikian Stanislaus meminta Polri perlu hati hati dan bijak dalam menangani pelaku kriminal yang didorong karena terdesak kebutuhan pangan Hubungan yang erat antara masyarakat dengan aparat keamanan akan menjadi benteng untuk mencegah gangguan keamanan Kolaborasi antara aparat keamanan dan masyarakat harus terus dilakukan agar pada masa pandemi COVID ini kriminalitas terorisme dapat dicegah dan konflik massa tidak terjadi katanya Sementara itu penasehat Ahli Kapolri Prof Muradi meyakini Indonesia akan berada pada situasi normal kembali atau new normal dalam beberapa minggu ke depan meskipun pasien virus corona terus mengalami peningkatan setiap harinya Muradi mengatakan diperlukan instrumen lain untuk memperkuat aparat keamanan dalam mengantisipasi situasi keamanan nasional agar aparat keamanan tidak mengalami degradasi dalam menegakkan aturan di tengah ketatnya pemberlakuan PSBB di masa pandemi COVID Pewarta Zuhdiar LaeisEditor Masuki M Astro 
Persipura minta pimpinan PT LIB tidak terafiliasi klub, Jakarta Manajemen Persipura Jayapura meminta agar pimpinan PT Liga Indonesia Baru PT LIB terpilih nanti tidak terafiliasi dengan klub maupun dari lembaga PSSI itu sendiri guna terhindar dari konflik kepentingan Hal tersebut diungkapkan Ketua Umum Persipura Jayapura Benhur Tommi Mano menyusul pengunduran diri Direktur Utama PT Liga Indonesia Baru LIB Cucu Somantri dan tiga komisaris LIB yaitu Sonhadji komisaris utama Hasani Abdulgani dan Hakim Putratama dalam rapat umum pemegang saham luar biasa RUPSLB yang digelar secara virtual pada Senin Kami meminta PSSI ke depan untuk menjadi pengawas dalam mengawal perjalanan PT LIB nanti dan kami yakin Ketua Umum PSSI juga inginkan hal yang sama Kita bisa memilih pimpinan PT LIB yang profesional kapabel dan berpengalaman demi perbaikan sepak bola nasional ujar Benhur dalam keterangan tertulisnya Senin Persipura sendiri mengusulkan tiga nama yang bisa menduduki kursi direksi PT LIB yakni Maruarar Sirait Tommy Welly dan Tigor Shaloom Boboy Alasannya karena mereka dinilai memiliki kapasitas untuk memimpin dan membawa sepak bola ke arah lebih baik Semoga cita cita kita untuk meraih kemajuan positif sepak bola Indonesia akan segera terkabul dengan duduknya para profesional dalam Direksi PT Liga Indonesia Baru katanya Ia juga mengajak seluruh klub peserta Liga dan Liga untuk menghentikan segala kisruh yang terjadi belakangan ini Paling penting semua pihak sama sama memiliki visi memajukan sepak bola Indonesia Jangan kita aneh aneh lagi sudah lah kami ini sudah bosan lihat pertikaian yang terjadi baik di PSSI maupun LIB berhentilah Biarkan kerja profesional di LIB dikerjakan oleh tenaga yang profesional kata dia Pewarta Asep FirmansyahEditor Irwan Suhirwandi 
Pemerintah bantu pembangunan rumah bagi Orang Rimba, Kedua belah pihak sepakat berdamai dan saling memaafkan Mereka berharap ke depan persoalan serupa tidak lagi terjadiJakarta Dinas Sosial Pemberdayaan Perempuan dan Perlindungan Anak PPA Kabupaten Merangin Provinsi Jambi menyatakan pemerintah membantu dan membimbing Orang Rimba di Jambi untuk meningkatkan taraf hidup salah satunya melalui pembangunan rumah Selain melakukan pendampingan dalam sejumlah budi daya seperti pertanian dan peternakan dalam masa pandemi akibat COVID perusahaan sawit ikut menjaga ketahanan pangan dengan menyalurkan bantuan bagi Orang Rimba di sini kata Kepala Dinas Sosial PPA Kabupaten Merangin Junaidi melalui keterangan tertulis di Jakarta Senin Junaidi yang juga salah satu saksi kesepakatan damai antara dua perwakilan tumenggung yakni Sikar dan Pakjang dengan perusahaan sawit PT SAL itu mengakui telah terjadi perdamaian Kedua belah pihak sepakat berdamai dan saling memaafkan Mereka berharap ke depan persoalan serupa tidak lagi terjadi katanya Kesepakatan damai itu disaksikan Kapolres Merangin AKBP Mokhamad Lutfi SLK dan Dandim Sarko Letkol Inf Tommy Radya Diansyah Lubis S Ap M Han Sebelumnya sempat diberitakan terjadi konflik antara perusahaan perkebunan sawit di Jambi dengan salah satu kelompok Orang Rimba Sementara itu perusahaan sawit PT Sari Aditya Loka SAL menyatakan mengambil langkah untuk berperan dalam menjaga ketahanan pangan dengan menyalurkan bahan pangan bagi masyarakat Suku Anak Dalam atau Orang Rimba di Jambi di tengah pandemi virus corona baru itu di Tanah Air Community Development Officer PT SAL Thressa mengatakan saat pandemi sekarang di mana pergerakan manusia dibatasi pemberian bahan pangan tersebut dirasakan membantu mereka Lebih dari kepala keluarga Orang Rimba berasal dari sejumlah tumenggung yakni Tumenggung Nggrib Tumenggung Nangkus Tumenggung Bepayung Tumenggung Afrizal Tumenggung Sikar Tumenggung Pak Jang dan Tumenggung Ngepas menerima manfaat program itu Kami memberikan bahan makanan pokok secara rutin setiap bulan kepada Orang Rimba yang berdampingan dengan PT SAL ujarnya Sabtu Dia menambahkan program bantuan pangan bagi Orang Rimba merupakan program penting dari perusahaan dan telah dilaksanakan sejak dengan program pertama kepada Tumenggung Sikar Kami memberikan bahan makanan tersebut bukanlah ujung dari program ketahanan pangan ujarnya 
Mantan Gubernur NTT sebut almarhum EP da Gomez pejuang kokoh, Kupang Mantan Gubernur Nusa Tenggara Timur NTT Frans Lebu Raya mengatakan almarhum EP da Gomez adalah seorang tokoh pejuang yang kokoh konsisten dan sederhana Saya secara pribadi dan keluarga turut berdukacita atas meninggalnya bapak EP da Gomez dan mendoakan arwahnya diterima di sisi Tuhan Yang Maha Kuasa Kami kehilangan seorang tokoh pejuang yang kokoh konsisten dan sederhana sampai meninggalnya kata Lebu Raya Senin terkait wafatnya EP da Gomez di Maumere Flores pada Senin Dia mengaku mengenal Om EG sapaan untuk EP da Gomez sebagai politisi yang berwibawa yang konsisten berjuang untuk kepentingan rakyat sejak jaman dulu Almarhum memulai perjuangan politiknya dengan bergabung dengan partai Katolik kemudian fusi ke Partai Demokrasi Indonesia dan lanjut berjuang melalui PDI Perjuangan katanya Saya memandangnya sebagai seorang guru yang memberikan semangat dan motivasi agar orang harus berjuang dengan ideologi dan prinsip yang tegas katanya Almarhum selalu menunjukkan juga dalam seluruh derap perjuangannya dan selalu mengingatkan yunior agar berjuang dengan jujur dan konsisten Saya sangat menghargai beliau sebagai tokoh dan kader yang juga mau mendengar orang katanya Lebu Raya mengaku almarhum juga yang mendorongnya untuk memimpin PDI Perjuangan ketika partai ini dilanda konflik dan jadi pecah Saya menjalani kepemimpinan saya di partai dengan prinsip dan ideologi yang sama Saya mengucapkan terimakasih atas jasa jasa beliau untuk partai ini dan untuk seluruh perjuangannya katanya Saya juga ingat di saat terakhir beliau menulis buku Banyak kisah tentang perjuangan yang dilukiskan dengan apik Saya mengucapkan selamat jalan Kami melanjutkan perjuanganmu Om EG tulis Lebu Raya dalam pesan WhatsApp Pada usianya ke tahun EP da Gomez meluncurkan buku ke berjudul Memaknai Nilai Ketokohan dan Kepemimpinan yang mengupas cerita sekilas tentang Frans Seda VB da Costa Ben Mang Reng Say P S da Cunha dan Laurentius Say Buku pertamanya berjudul PDI Pemilu dan DPRD Kabupaten Sikka 
WNI di Inggris diajak jadikan Indonesia kunci kemajuan peradaban, Jakarta Para warga negara Indonesia WNI yang berpartisipasi dalam acara E Ifthar iftar daring yang diadakan KBRI London pada Sabtu diajak untuk menjadikan Indonesia kunci kemajuan peradaban Ajakan itu disampaikan oleh Azyumardi Azra sejarawan senior Universitas Islam Negeri Syarif Hidayatullah Jakarta seperti disampaikan dalam keterangan tertulis dari KBRI London yang diterima di Jakarta Senin Harapan kemajuan peradaban manusia hanyalah Indonesia Banyak negara lain yang memiliki komposisi masyarakat Muslim yang banyak namun tidak dapat lepas dari perang yang terus berkecamuk dan berbagai masalah yang berkepanjangan kata Azyumardi Azra Menurut dia agar umat Muslim Indonesia bisa mewujudkan harapan dunia untuk kemajuan diperlukan kedisiplinan dalam semua aspek sebagaimana sudah diajarkan dalam Islam terlebih dalam fiqih Kita patut bersyukur bahwa Islam di Indonesia adalah Islam yang moderat dan inklusif Dalam sejarah Indonesia tidak pernah terjadi konflik sektarian yang berkepanjangan seperti terjadi di negara negara lain Di Indonesia Islam menjadi alat pemersatu suku suku bangsa yang berbeda beda ujarnya dalam ceramah dengan topik Puasa dan Pembebasan Diri Azyumardi Azra berpendapat bahwa kesalehan sosial dalam Islam kini semakin meluas dan saat ini ada cukup banyak orang orang Muslim yang menjadi filantropis pelajar dan pemikir Kita patut syukuri bahwa kita sekarang sudah berhasil menghapus mitos mitos yang kurang baik terkait Islam kata dia di hadapan WNI peserta pengajian daring dari berbagai penjuru Inggris dan Irlandia Wakil Duta Besar RI untuk Inggris Adam M Tugio menjelaskan kehadiran Azyumardi Azra dalam acara iftar daring tersebut bertujuan untuk memberikan penyegaran bagi masyarakat Muslim Indonesia yang tinggal di Inggris dan Irlandia Selain pandangan positif mengenai Islam di Indonesia banyak pesan yang disampaikan dalam ceramah Azyumardi Azra kepada WNI di Inggris dan Irlandia yang saat ini sedang menghadapi karantina akibat pandemi COVID KBRI London mengusung E Ifthar atau pengajian secara virtual sebagai cara untuk tetap menjaga silaturahmi dengan masyarakat Indonesia di Inggris dan Irlandia Dalam setiap kegiatan KBRI London menyisipkan berbagai pesan pesan imbauan kepada masyarakat mengenai perkembangan kebijakan di Inggris Irlandia dan Indonesia terkait penanganan wabah COVID Kegiatan E Ifthar itu dilaksanakan dua kali dalam sepekan menjelang berbuka puasa dan berlangsung selama bulan Ramadhan Saat ini umat Muslim di Inggris melaksanakan ibadah puasa selama jam dari pukul pagi hingga malam 
