title,content
"Perayaan Hari Quds, Iran sebut masalah Palestina isu kemanusiaan", Masalah Palestina adalah masalah kemanusiaan Pengusiran terhadap jutaan orang dari rumah mereka lahan pertanian serta tempat tinggal dan mata pencahariannya yang dilakukan dengan pembunuhan dan kejahatan pasti akan menyakiti setiap hati nurani manJakarta Pemimpin Agung Republik Islam Iran Ayatullah Seyed Ali Khamenei pada peringatan Hari Quds Internasional Jumat mengatakan masalah yang dihadapi Palestina merupakan isu kemanusiaan sehingga ia menyerukan solidaritas dunia untuk terlibat aktif mendorong perdamaian di wilayah tersebut Masalah Palestina adalah masalah kemanusiaan Pengusiran terhadap jutaan orang dari rumah mereka lahan pertanian serta tempat tinggal dan mata pencahariannya yang dilakukan dengan pembunuhan dan kejahatan pasti akan menyakiti setiap hati nurani manusia kata Ayatullah Khamenei dalam pidato politiknya sebagaimana dialihbahasakan ke Bahasa Indonesia oleh Kedutaan Besar Iran di Jakarta Oleh karena itu membatasi masalah ini hanya pada isu Palestina semata ataupun masalah Arab tentu saja merupakan kesalahan besar tambah dia Dalam pidato setebal tujuh halaman itu Khamenei menyerukan tujuh poin kepada para pendukung perjuangan rakyat Palestina Salah satu poin itu mengajak warga dunia untuk membantu membebaskan seluruh wilayah sengketa dari kekuasaan Israel dan mengembalikannya ke rakyat Palestina Tujuan dari perjuangan ini adalah pembebasan seluruh wilayah Palestina dari laut ke sungai dan kembalinya semua warga Palestina ke tanah air mereka kata Khamenei seraya menyebut pembentukan pemerintahan otonom di wilayah sengketa bukan tindakan yang tepat Dalam peringatan Hari Quds itu Khamenei juga mendukung adanya referendum yang melibatkan seluruh agama dan etnis di Palestina untuk menentukan masa depan negara mereka Palestina adalah milik orang orang Palestina dan harus diatur oleh kehendak mereka sendiri Prakarsa referendum yang melibatkan semua agama dan etnis Palestina yang tela kami sampaikan hampir dua dekade lalu adalah satu satunya kesimpulan yang perlu diambil untuk menghadapi tantangan Palestina saat ini dan esok ujar dia Dukungan terhadap referedum menurut Khamenei merupakan upaya menanggapi tudingan anti semit yang dituduhkan negara negara barat ke Iran dan Palestina Sesuai rencana ini orang orang Palestina baik Yahudi Kristen maupun muslim bersama sama mengikuti referendum untuk menentukan sistem politik negara Palestina kata dia Lewat pidato politiknya Khamenei mengkritik Perserikatan Bangsa Bangsa karena dinilai tidak membantu penyelesaian konflik di Palestina Ia juga menuding negara negara barat bertanggung jawab atas aksi penjarahan dan penjajahan yang dilakukan Israel terhadap Palestina Ia juga mengkritik negara negara di kawasan Arab yang tidak banyak membantu penyelesaian konflik di Palestina Setelah kedatangan Amerika Serikat sebagai penjaga kepentingan ini mereka telah melupakan tugas tugas kemanusiaan Islam dan politik serta semangat dan kebanggaan Arabnya dengan harapan palsu di mana perjanjian Camp David contoh nyata dari fakta pahit tersebut kata Khamenei Camp David Accords atau Perjanjian Kamp David merupakan kesepakatan politik yang ditandatangani oleh Presiden Mesir Anwar Sadat Perdana Menteri Israel Menachem pada September setelah rampungnya perundingan rahasia selama hari di Kamp David di Maryland AS Perjanjian itu berisi kesepakatan damai mengenai pengelolaan dan pembagian wilayah Palestina tanpa melibatkan rakyat Palestina Sementara itu Hari Internasional Quds atau Hari Yerusalem merupakan hari yang diperingati tiap Jumat terakhir pada bulan suci Ramadhan diinisiasi pertama kali oleh Iran pada Hari Internasional Quds diperingati tiap tahun sebagai bentuk dukungan terhadap rakyat Palestina dan bentuk kecaman terhadap Israel Pewarta Genta Tenri MawangiEditor Azis Kurmala 
Polda Riau minta BBKSDA proaktif jaga hutan lindung dari penjarahan, Pekanbaru Direktorat Reserse Kriminal Khusus Polda Riau meminta Balai Besar Konservasi Sumber Daya Alam BBKSDA Riau untuk proaktif menjaga suaka margasatwa Rimbang Baling Kampar dari aksi pembalakan liar Direktur Reserse Kriminal Khusus Polda Riau Kombes Pol Andri Sudarmadi di Pekanbaru Jumat menyampaikan hal tersebut setelah timnya berhasil menangkap satu truk tronton yang berisi penuh kayu hutan hasil penjarahan di Rimbang Baling Total kayu yang disita polisi mencapai lebih dari ribu meter kubik Kita berharap pemangku kepentingan di dalam SM Rimba Baling berperan aktif mencegah terjadinya tindak pidana di kawasan tersebut termasuk pembalakan Karhutla dan lainnya kata Andri Andri bahkan menjelaskan saat upaya pengintaian hingga penangkapan berlangsung pihaknya menemukan beberapa pos di sekitar aliran sungai yang biasa dimanfaatkan para penjahat hutan untuk melansir kayu dari dalam kawasan Kita melihat di dalam dekat pinggiran aliran sungai Desa Gema ada pos BBKSDA Polhut Walhi Beri informasi ke Polri untuk ditindaklanjuti sehingga hutan kita dapat tetap terjaga kelestariannya pinta Andri Diberitakan sebelumnya Ditreskrimsus Polda Riau menangkap satu unit truk tronton berisi lebih dari ribu meter kubik kayu hutan campuran yang diduga kuat hasil pembalakan liar kawasan hutan Suaka Marga Satwa Rimbang Baling Kampar Andri mengatakan dari penangkapan itu polisi menetapkan dua pelaku sebagai tersangka Modus kedua tersangka adalah dengan menggunakan dokumen terbang Mereka memiliki SKSHH Surat Keterangan Sahnya Hasil Hutan dari Provinsi Jambi Namun asal kayu dari Kabupaten Kampar dan Kuantan Singingi katanya Kedua tersangka yang ditangkap berikut barang bukti berupa keping kayu hutan alam dan tronton bernomor polisi BH KU itu adalah Suliadi alias Adi dan Edi Saputra alias Putra Keduanya merupakan warga Provinsi Sumatera Utara Pengungkapan yang berlangsung pada Selasa kemarin itu kata Andri merupakan hasil penyelidikan panjang kepolisian dalam usaha membongkar sindikat perusak hutan lindung di Riau Berawal dari laporan yang diterima Korps Bhayangkara sepekan sebelumnya polisi langsung menurunkan tim untuk melakukan pengintaian Hingga akhirnya polisi berhasil memetakan aktivitas bongkar muat kayu serta rute perjalanan truk tronton tersebut Selanjutnya pada Selasa pagi medio pekan ini polisi berhasil menangkap para tersangka berikut bukti kuat yang dikumpulkan terlebih dahulu Saat ini para tersangka masih ditahan dan menjalani proses hukum lebih lanjut Sementara itu Polda Riau masih akan terus mengembangkan kasus itu guna mengungkap jaringan yang lebih besar Para tersangka dijerat dengan Pasal Huruf e jo Pasal Ayat Huruf b UU RI Nomor Tahun tentang Pencegahan Pemberantasan Pengrusakan Hutan dengan ancaman hukuman lima tahun penjara denda Rp miliar Pewarta Anggi RomadhoniEditor Joko Susilo 
"Kasus COVID-19 terus bertambah, perlukah NTT terapkan PSBB?", Kupang Gugus Tugas Percepatan Penanganan COVID Nusa Tenggara Timur pada Sabtu baru saja mengumumkan tambahan kasus pasien positif COVID di NTT yang berjumlah orang Dari angka tersebut maka otomatis jumlah kasus pasien positif COVID di NTT sudah menjadi kasus dengan rincian enam orang sembuh satu meninggal dunia sisanya masih mendapatkan perawatan Mereka yang masih dirawat itu tersebar di sembilan kabupaten di provinsi NTT dari kabupaten Kota yang ada di provinsi berbasis kepulauan itu yakni Kota Kupang delapan pasien Kabupaten Manggarai Barat orang Kabupaten Sikka orang Kabupaten Ende orang Kabupaten Flores Timur orang Kabupaten Sumba Timur orang Kabupaten Nagekeo orang Kabupaten Timor Tengah Selatan orang dan Kabupaten Rote Ndao orang Dengan semakin banyaknya kasus di NTT tersebut banyak pihak mengharapkan agar pemerintah provinsi segera menerapkan pembatasan sosial berskala besar PSBB di beberapa kabupaten untuk mencegah penyebaran kasus COVID lebih luas lagi Apalagi saat ini ditemukan kasus COVID akibat transmisi lokal yang jumlahnya sudah mencapai empat kasus dengan catatan satu meninggal dan tiga masih dirawat di RSUD Johannes Kupang Ketua Fraksi Partai Nasional Demokrat Nasdem DPRD Nusa Tenggara Timur NTT Alex Ofong sendiri menilai ada beberapa daerah yang perlu menerapkan PSBB yakni Kota Kupang Manggarai Barat dan juga Kabupaten Sikka yang jumlah kasusnya tertinggi di NTT Sejumlah pasien positif COVID yang sudah dinyatakan sembuh memberikan salam kepada perawat dan tim dokter yang memberikan penghormatan kepada dirinya dan tiga rekannya di Rumah Sakit Bhayangkara Polda NTT di Kupang NTT Ahad FOTO Kornelis Kaha Kalau kita melihat perkembangan kasus di Kota Kupang dan terlebih Sikka dan Manggarai Barat Sikka mengalami kenaikan yang cukup signifikan sehingga sudah saatnya diusulkan untuk memberlakukan PSBB di tiga daerah ini katanya Namun perlu pertimbangan secara matang bukan cuma soal regulasi tetapi terlebih pada dampak pelaksanaannya dan sejauh mana efektivitasnya dalam mencegah penyebaran COVID PSBB diatur dalam UU Nomor Tahun pasal tentang Kekarantinaan Kesehatan yang diteken Presiden Jokowi Di UU itu tertulis bahwa terkait karantina ataupun PSBB suatu wilayah adalah kebijakan dari pemerintah pusat bukan daerah tersebut Hal tersebut tegaskan juga oleh Ketua Komisi V DPRD Nusa Tenggara Timur NTT Yunus Takandewa yang mengatakan bahwa penerapan pembatasan sosial berskala besar PSBB merupakan otoritas pemerintah berdasarkan kebutuhan Kalau soal penerapan PSBB tentunya menjadi otoritas pemerintah berdasarkan kebutuhan dan kepentingan wilayah masing masing katanya Lalu apakah yang harus dilakukan untuk mencegah penyebaran Virus mematikan tersebut di provinsi berbasis kepulauan itu Satu satunya cara yang harus dilakukan adalah disiplin tinggi warga dalam melaksanakan protokol kesehatan yang telah ditetapkan pemerintah Selain itu kesadaran kolektif publik menjadi spirit yang mesti kita terus tumbuhkan agar kurva COVID di NTT jangan sampai terus mengalami kenaikan Penerapan PSBB menjadi otoritas pemerintah tetapi kata kuncinya adalah disiplin tinggi karena peningkatan kasus COVID sebagian merupakan hasil transmisi lokal akibat warga mengabaikan protokol pencegahan tutur dia Setelah melihat tren angka kasus positif COVID yang terus meningkat dalam beberapa hari terakhir ini Komisi V DPRD NTT telah berkoordinasi dengan pemerintah agar dilakukan tindakan lanjutan secara komprehensif berbasis teritorial Pengendara motor melintas di samping tulisan kawasan wajib masker di pintu masuk pasar Kasih Naikoten Kota Kupang NTT Kamis Aktivitas di pasar Kasih Naikoten Kupang sepi setelah salah seorang pedagang daging sapi dinyatakan positif COVID dan meninggal pada Rabu kemarin Kornelis Kaha Dia juga mengusulkan agar pemerintah di setiap daerah perlu melakukan pelacakan orang yang kontak fisik dengan pasien terpapar untuk dilakukan penanganan protokol kesehatan secara cepat dan tepat Tetapi jika berkaca dari usulan PSBB Kabupaten Rote Ndao yang ditolak Menteri Kesehatan Terawan Agus Putranto apakah beberapa daerah di NTT sudah layak untuk menerapkan PSBB Sesuai dengan Peraturan Pemerintah Nomor Tahun dan Peraturan Menteri Kesehatan Nomor Tahun telah diatur bahwa untuk dapat ditetapkan PSBB di suatu wilayah provinsi kabupaten kota harus memenuhi beberapa kriteria Pertama jumlah kasus dan atau jumlah kematian akibat penyakit meningkat dan menyebar secara signifikan dan cepat ke beberapa wilayah kedua adalah kaitan epidemiologis dengan kejadian serupa di wilayah atau negara lain PSBB Kota Kupang Ketua Perhimpunan Dokter Umum Indonesia PDUI Provinsi Nusa Tenggara Timur NTT dr Teda Litik mengatakan perlu kajian secara hati hati dalam memutuskan untuk menerapkan pembatasan sosial berskala besar Soal diberlakukan PSBB ada persyaratan ketat yang harus diajukan oleh Gubernur kemudian dikaji oleh Satgas Nasional dan kalau sudah lengkap baru diserahkan ke Kemenkes untuk mengambil keputusan Jadi tidak mudah ungkap dia Menurut dia kalau soal indikasi transmisi lokal di Kota Kupang memang sudah memenuhi kriteria untuk menerapkan PSBB namun masih banyak aspek lain yang perlu disiapkan Aspek lain itu misalnya bantuan sosial yang menjamin bahwa semua orang tidak kelaparan karena kehabisan stok bahan makanan dan juga tidak kehabisan uang untuk membeli karena dilarang keluar rumah termasuk untuk mencari nafkah Ini berat kemudian apakah seluruh fasilitas kesehatan sudah siap baik SDM logistik dan lainnya sehingga saat PSBB tidak lagi dipusingkan dengan keterlambatan pengadaan dan pengiriman stok termasuk APD dan obat obatan penunjang katanya Selain aspek keamanan saat penerapan dimana aparat sudah siap mengamankan penjarahan pencurian dan lainnya akibat orang kelaparan Tentu tidak semudah kita bicara Dan itu sesungguhnya wewenang Gubernur sebagai yang bertanggung jawab pada daerah ini katanya Menurut dia faktor kesehatan publik dan ekonomi penting sehingga perlu kajian yang sangat hati hati untuk memutuskan PSBB Orang mengatakan mana yang mau didahulukan kesehatan publik atau faktor ekonomi Dua duanya penting bagi keberlangsungan hidup sehingga perlu kajian yang sangat hati hati untuk memutuskan PSBB katanya menambahkan Tanggapan Pemprov Gubernur Nusa Tenggara Timur Viktor B Laiskodat di hadapan wartawan saat meninjau dan meresmikan laboratorium untuk pemeriksaan sampel swab mengatakan bahwa PSBB saat ini belum dibutuhkan Kita tidak pikirkan ke sana saat ini kita bersyukur karena seluruh pasien positif yang dirawat dalam kondisi stabil dan segar bugar tutur dia Ketua Tim Gugus Tugas Percepatan Penanganan COVID Provinsi NTT Benediktus Polo Main mengatakan bahwa Pemerintah Provinsi Nusa Tenggara Timur NTT belum berencana menerapkan pembatasan sosial berskala besar PSBB walaupun ada peningkatan jumlah kasus positif COVID di daerah itu dalam beberapa hari terakhir ini Pihaknya akan melakukan evaluasi terhadap perkembangan penyebaran COVID di daerah itu 
Anggota Komisi III DPR RI apresiasi kinerja Polda Aceh, Banda Aceh Anggota Komisi III DPR I Nazaruddin Dek Gam mengapresiasi kinerja Polda Aceh yang berhasil menjalankan Satuan Tugas Satgas Aman Nusa II di Provinsi Aceh dengan baik Saya apresiasi kinerja Kapolda Aceh yang sudah menjalankan Satgas Aman Nusa II dengan baik Ini merupakan satu kesuksesan kata Nazaruddin Dek Gam di Banda Aceh Sabtu Sebelumnya Nazaruddin Dek Gam bertemu dengan Kapolda Aceh Irjen Pol Wahyu Widada Pada pertemuan tersebut Kapolda Aceh didampingi Inspektur Pengawasan Daerah Irwasda Polda Aceh Kombes Pol Marzuki Ali Basyah dan Direktur Intelijen Keamanan Polda Aceh Kombes Pol Supriadi Djalal Politisi PAN ini juga menjelaskan fokus utama Satgas Aman Nusa II adalah pencegahan penanggulangan dan penegakan hukum Satgas ini juga dalam rangka bagian dari Gugus Tugas Percepatan Penanganan COVID Saya selaku Anggota Komisi III DPR RI yang mitra kerjanya adalah Polri maka sudah wajib bagi saya untuk memantau dan mempertanyakan sejauh mana kinerja Satgas Aman Nusa II di Aceh kata Nazaruddin Dek Gam Nazaruddin Dek Gam juga mengaku puas dengan apa yang disampaikan Kapolda Aceh terkait Satgas Aman Nusa II Di mana Polda Aceh selain fokus pada COVID yang merupakan bencana nonalam juga fokus pada bencana alam seperti terjadi Aceh Tengah serta banjir di Banda Aceh dan Aceh Besar Wakil Bendahara Umum DPP PAN itu juga mengapresiasi langkah Kapolda Aceh yang mau turun langsung ke lokasi bencana seperti yang terjadi di Aceh Tengah Kapolda Aceh sudah menjalankan sesuai dengan apa yang diinstruksikan oleh Mabes Polri Kapolda juga sukses melakukan razia bahan pokok dan razia perbatasan Aceh untuk mencegah penyebaran COVID kata Presiden Persiraja klub sepak bola peserta Liga Indonesia tersebut Pada pertemuan tersebut Nazaruddin Dek Gam juga menyerahkan daftar kasus dugaan korupsi yang masih mandek atau jalan di tempat Kasus kasus tersebut ditangani di Polda Aceh Nazaruddin Dek Gam juga meminta Kapolda Aceh menyelidiki kasus dugaan korupsi pemberian izin baik izin tambang maupun izin mendirikan bangunan IMB Korupsi tidak hanya terjadi pada pengadaan barang dan jasa tapi juga pada pemberian izin Saya melihat dugaan korupsi proses pemberian izin masih luput perhatian aparat hukum Dan ini ke depan harus menjadi perhatian Polda Aceh kata Nazaruddin Dek Gam Satgas Aman Nusa II merupakan bentukan Mabes Polri meliputi Subsatgas Pidana Umum Subsatgas Ekonomi Subsatgas Siber Subsatgas Pidana Umum bertugas melakukan penindakan terhadap kejahatan konvensional seperti pencurian penjarahan perampokan tindak pidana bencana alam serta tindak pidana karantina kesehatan Subsatgas Ekonomi fokus mengawasi dan menindak penimbunan bahan makanan dan alat kesehatan penindakan pelaku ekspor antiseptik bahan baku alat pelindung diri serta penindakan terhadap obat atau alat kesehatan yang tidak sesuai standar atau izin edar Serta Subsatgas Siber tugasnya adalah melakukan penindakan hoaks COVID provokator terkait COVID melalui media sosial serta penindakan penjualan alat kesehatan melalui media daring 
Bamsoet: Kepala daerah harus amankan stok kebutuhan pokok, Jakarta Ketua MPR RI Bambang Soesatyo meminta para menteri ekonomi dan semua kepala daerah peduli sekaligus mengamankan rantai distribusi bahan kebutuhan pokok masyarakat karena efektivitas koordinasi harus terus diperbaiki dan ditingkatkan Semua kepala daerah jangan hanya fokus pada penerapan pembatasan sosial atau PSBB saja tetapi juga peduli dan sensitif terhadap stok kebutuhan pokok masyarakat Untuk mencegah panic buying kekurangan stok setiap bahan kebutuhan pokok tidak boleh mencapai skala yang ekstrim kata Bamsoet dalam keterangannya di Jakarta Jumat Dia menilai penerapan pembatasan sosial hingga Pembatasan Sosial Berskala Besar PSBB tidak boleh memutus atau merusak rantai distribusi bahan kebutuhan pokok Menurut dia Presiden Joko Widodo telah menerima laporan tentang defisit bahan kebutuhan pokok di sejumlah daerah atau provinsi misalnya defisit stok beras terjadi di tujuh provinsi Stok jagung defisit di provinsi stok cabai besar defisit di provinsi stok cabai rawit defisit di provinsi stok telur ayam defisit di provinsi dan stok gula pasir defisit di provinsi ujarnya Bamsoet menilai kekurangan stok bahan kebutuhan pokok di beberapa daerah seharusnya bisa dihindari karena ketersediaannya di dalam negeri dilaporkan lebih dari cukup Dia mencontohkan stok telur ayam melimpah di pasar begitu juga gula pasir dan ketersediaan jagung bahkan stok beras dilaporkan surplus hingga Juni Wakil Ketua Umum KADIN Indonesia itu menilai jika ada daerah yang mengalami defisit beras jagung telur ayam hingga gula pasir maka masalahnya tentu pada lalu lintas informasi antar institusi yang tidak efektif Akibatnya komoditas yang tersedia tidak terdistribusikan ke daerah yang butuh atau daerah defisit katanya Menurut dia masalah lain yang perlu diwaspadai adalah kemungkinan terganggunya rantai distribusi dari daerah surplus ke daerah defisit akibat penerapan pembatasan sosial Bamsoet menilai hal itu harus segera diatasi oleh para menteri dan kepala daerah untuk mencegah kepanikan di masyarakat 
Polri: Penyelidikan terhadap Ravio tindak lanjuti laporan masyarakat, Semua langkah penyidik untuk membuat jelas berdasarkan kejadian dan saksi bukan karena mencari cari kesalahan Jakarta Polri menegaskan bahwa penyelidikan terhadap aktivis Ravio Patra Asri RPA dilakukan untuk menindaklanjuti laporan masyarakat yang menerima pesan WhatsApp berisi ajakan berbuat ricuh Bahkan penerima pesan tidak hanya di Jakarta beberapa warga di daerah juga mengaku menerima pesan serupa Penyidik melakukan penyelidikan berdasarkan laporan masyarakat yang resah Tidak hanya di Jakarta tapi di berbagai daerah juga mendapatkan kiriman pesan tersebut dan banyak lagi saksi yang dikirimkan pesan kata Kepala Biro Penerangan Masyarakat Polri Brigjen Pol Raden Prabowo Argo Yuwono saat dihubungi di Jakarta Sabtu malam Pihaknya pun membantah penangkapan terhadap RPA adalah tindakan mencari cari kesalahan Semua langkah penyidik untuk membuat jelas berdasarkan kejadian dan saksi bukan karena mencari cari kesalahan ujarnya Jenderal bintang satu ini pun menegaskan penyelidikan kasus ini berjalan sesuai prosedur hukum yang berlaku Sebelumnya Polda Metro Jaya menangkap aktivis Ravio Patra Asri di Jalan Blora Kelurahan Menteng Jakarta Pusat pada Rabu malam Saat hendak ditangkap RPA sempat melawan petugas dengan dibantu temannya yang membawa kendaraan dinas diplomat Penyidik menangkap RPA lantaran diduga menyebarkan pesan WhatsApp berisi hasutan dan ujaran kebencian Setelah menjalani serangkaian pemeriksaan di Polda Metro Jaya RPA yang masih berstatus saksi akhirnya dipulangkan Kendati demikian penyelidikan kasus ini masih terus berjalan Hingga saat ini penyidik Polda Metro Jaya telah memeriksa empat saksi dan dua ahli dalam kasus ini Terkait indikasi pembajakan akun aplikasi pesan WhatsApp milik RPA yang diduga digunakan untuk menyebarkan pesan ujaran kebencian tersebut Argo mengatakan penyidik masih mendalami dugaan tersebut Untuk alibi akun WA WhatsApp RPA diretas ini sedang didalami Karena ada beberapa keterangan yang memerlukan waktu seperti keterangan dari server WhatsApp saksi ahli analisis dan lain lain kata mantan Kabid Humas Polda Jatim ini Pewarta Anita Permata DewiEditor Heru Dwi Suryatmojo 
Polri beberkan kronologi kasus Ravio Patra Asri, Jakarta Kepala Biro Penerangan Masyarakat Polri Brigjen Pol Raden Prabowo Argo Yuwono menjelaskan kronologi penyelidikan kasus dugaan penyebaran pesan berisi hasutan dan ujaran kebencian yang diduga melibatkan aktivis Ravio Patra Asri RPA Awalnya Polda Metro Jaya menerima laporan polisi bernomor LP IV YAN SPKT PMJ pada Rabu Kepada penyidik Polda Metro saksi mengaku mendapatkan pesan di ponselnya yang berisi ajakan untuk melakukan penjarahan nasional pada April Informasi awal dari pelapor yang melaporkan bahwa telah mendapatkan pesan di handphone nya yang berisi mengajak untuk melakukan penjarahan nasional dan ada masuk dalam pembahasan di dalam grup WA saksi kata Brigjen Argo saat dihubungi di Jakarta Sabtu malam Polisi langsung bergerak menyelidiki kasus ini dan kemudian menemukan bahwa nomor ponsel pengirim pesan tersebut adalah milik Ravio Patra Asri Lalu dilakukan pencarian Yang bersangkutan ada di Jalan Blora Kelurahan Menteng Jakarta Pusat sedang menunggu kedatangan temannya Saat didatangi polisi RPA sempat melawan dan enggan mengikuti perintah polisi Rekan RPA yang berinisial RS kemudian tiba di Jalan Blora menggunakan kendaraan dinas diplomat RS pun berusaha menghalangi polisi RPA memberontak kepada polisi dan langsung masuk ke mobil sedan yang dibawa RS sambil berteriak Kalian tidak bisa menangkap saya Saya di mobil diplomasi Namun polisi tetap memegangi RPA dan mengeluarkan RPA dari kendaraan itu Kemudian RPA dibawa ke Ditreskrimum Polda Metro Jaya untuk diperiksa Setelah menjalani serangkaian pemeriksaan di Polda Metro Jaya RPA yang masih berstatus saksi akhirnya dipulangkan Hingga saat ini penyidik Polda Metro Jaya telah memeriksa empat saksi dan dua ahli dalam kasus ini Dalam kasus ini penyidik menyita beberapa barang bukti yakni satu ponsel Samsung S warna biru satu ponsel Iphone warna silver dua laptop dan satu KTP atas nama RAVIO PATRA ASRI Terhadap barang bukti dilakukan pendalaman digital forensik katanya Terkait indikasi peretasan akun aplikasi pesan WhatsApp milik RPA yang diduga digunakan untuk menyebarkan pesan ujaran kebencian tersebut Argo mengatakan penyidik masih mendalami dugaan tersebut Sedang didalami kata mantan Kabid Humas Polda Metro Jaya ini 
