title,content
"Bersihkan Limbah Radioaktif, Bapeten-Batan Angkut 107 Drum dari Batan Indah", Jakarta Badan Pengawas Tenaga Nuklir Bapeten bersama dengan Badan Tenaga Nuklir Nasional Batan terus melakukan pembersihan di sisa limbah radioaktif di Perumahan Batan Indah Serpong Tangerang Selatan Tangsel Untuk membersihkan sisa limbah radioaktif tersebut Bapeten dan Batan menerjunkan orang petugas Tugas Batan dalam hal ini dekontaminasi itu dilakukan saat Bapeten segera dekontaminasi pada tanggal Februari Selama itu kita telah mengerahkan tidak kurang orang membersihkan kontaminan Yang kami lakukan adalah membersihkan tanah tanah yang sudah terkontaminasi dan menimbulkan paparan paparan kata Kepala Batan Anhar Riza Antariksawan di Kantor BPPT II Jalan MH Thamrin Jakarta Pusat Selasa Kami sudah mengumpulkan itu sekitar hari tadi sebanyak kurang dari drum ukuran liter berisi tanah yang terkontaminasi dan juga ada drum ukuran liter untuk tanaman tanaman yang situ ujar Anhar Simak Video Menristek Limbah Radioaktif di Tangsel Bukan Karena Kebocoran Reaktor Nuklir Gambas Video detik Selanjutnya Halaman radioaktif batan bapeten batan indah 
"Pembersihan Limbah Radioaktif di Tangsel Dilanjut Besok, 199 Drum Diangkut", Tangerang Selatan Pembersihan limbah radioaktif di perumahan Batan Indah Serpong Tangerang Selatan Tangsel dihentikan Sudah ada ratusan drum berisi tanah yang terpapar radioaktif yang dibawa petugas Total dari hari pertama sampai keenam sudah drum kata Kepala Biro Humas dan Kerjasama Badan Tenaga Nuklir Nasional Batan Heru Umbara di perumahan Batan Indah Serpong Tangerang Selatan Tangsel Selasa Dia menjelaskan radius radiasi radioaktif di Batan Indah tinggal persen saja Pengerjaan clean up akan dilanjutkan besok pagi Tadinya kita memprediksi sampai drum Tapi alhamdulillah kita sudah Kelihatannya progresnya sudah bagus lanjutnya Selanjutnya Halaman tangerang selatan radioaktif limbah radioaktif perumahan batan indah terpapar radioaktif 
Menristek: Limbah Radioaktif Batan Indah Bukan karena Kebocoran di Puspiptek, Jakarta Menteri Riset dan Teknologi Menristek Bambang Brodjonegoro menjelaskan penyebab munculnya limbah radioaktif di Perumahan Batan Indah Serpong Tangerang Selatan Tangsel Bambang memastikan kemunculan limbah radioaktif itu bukan karena ada kebocoran di pusat penelitian ilmu pengetahuan dan teknologi Puspiptek Pertama yang kami tegaskan adalah bahwa kontaminasi bahan radioaktif ini tidak terjadi sebagai akibat dari fasilitas reaktor nuklir yang memang ada di kompleks Puspiptek Serpong ya jadi ini sangat jelas bahwa penanganan kompleks berjalan dengan sangat baik Kebocoran yang kemudian berimbas pada wilayah lain apalagi wilayah ini cukup jauh dari kompleks reaktor ujar Bambang di Kantor BPPT II Jalan MH Thamrin Jakarta Pusat Selasa Kemudian prosedur dari pegawai Batan yang bekerja di wilayah kompleks reaktor sudah terjaga dengan baik sehingga potensi kebocoran yang kami katakan tadi tidak hanya kebocoran dalam arti penyalahgunaan juga relatif sudah tidak mungkin karena proses pengawasan pengecekan dan monitoring reaktor sudah sangat baik ya ucapnya Selanjutnya Halaman menristek brin menristek bambang brodjonegoro radioaktif perumahan batan indah terpapar radioaktif 
Batan: Serpihan Radioaktif di Batan Indah Sudah Diserahkan ke Polisi, Jakarta Polisi menyelidiki kasus limbah radioaktif di perumahan Batan Indah Serpong Tangerang Selatan Tangsel Badan Tenaga Nuklir Nasional Batan mengaku serpihan radioaktif yang ditemukan sudah diserahkan ke polisi Sudah diserahkan ke polisi Sudah ada berita acaranya Orang itu sudah kewenangan di kepolisian Kami hanya membantu kata Kepala Biro Humas dan Kerjasama Batan Heru Umbara di perumahan Batan Indah Serpong Tangsel Selasa Heru menjelaskan semua alat bukti yang dibutuhkan polisi sudah Batan berikan Hal hal yang bersifat administrasi juga telah diberikan zap zap batan perumahan batan indah terpapar radioaktif radioaktif mabes polri 
"Tingkat Radiasi Radioaktif di Batan Indah Terus Turun, Batan: Tinggal 10%", Jakarta Limbah radioaktif di perumahan Batan Indah Serpong Tangerang Selatan Tangsel menurun signifikan Dipastikan radiasi tinggal persen Jadi kalau dari segi penurunannya radiasi di atas persen tinggal kira kira persen lagi kata Kepala Biro Humas dan Kerja Sama Badan Tenaga Nuklir Nasional Batan Heru Umbara di perumahan Batan Indah Serpong Tangsel Selasa Heru mengatakan pagi tadi radiasi radioaktif yang mengandung unsur Cs ini tinggal persen atau sudah menurun persen Ketika dilakukan pengerjaan clean up radiasi radioaktif ini kembali menurun persen atau tersisa persen saja Dia pun mengaku senang Sebab proses clean up berjalan dengan baik zlf zlf radiasi radioaktif bapeten batan 
Batan Jelaskan Radiasi Limbah Radioaktif di Batan Indah Sudah Turun 70%, Jakarta Ada zat radioaktif di perumahan Batan Indah Serpong Tangerang Selatan Tangsel Badan Tenaga Nuklir Nasional Batan menyebut radiasi radioaktif di Batan Indah telah menurun Menurunnya itu sekarang sudah hampir persen kata Kepala Biro Humas dan Kerja Sama Badan Tenaga Nuklir Nasional Batan Heru Umbara di perumahan Batan Indah Serpong Tangsel Selasa Heru mengatakan radiasi radioaktif yang mengandung unsur Cs ini tinggal persen dari titik hotspot Radiasi ini bisa menurun berkat proses clean up yang dilakukan petugas zlf zlf radioaktif zat radioaktif limbah radioaktif nuklir batan bapeten 
Batan Tepis Isu Warga Diperiksa karena Radioaktif di Tangsel Akan Dikarantina, Jakarta Ada sembilan warga perumahan Batan Indah Serpong Tangerang Selatan Tangsel yang dilakukan pemeriksaan whole body counting WBC karena ada limbah radioaktif Badan Tenaga Nuklir Nasional Batan memastikan warga yang menjalani pemeriksaan WBC tidak akan dikarantina Ada berita ke saya Pak nanti habis diperiksa WBC nanti dikarantina Jadi mungkin mencampuradukkan kasus ini dengan virus Corona Jadi ada karantina dan lain lain Tidak ada hal seperti itu tegas Kepala Biro Humas dan Kerja Sama Badan Tenaga Nuklir Nasional Batan Heru Umbara di perumahan Batan Indah Serpong Tangsel Selasa Dia mengungkapkan warga Batan Indah diperiksa agar diketahui apakah ada yang terpapar radioaktif atau tidak Heru menjelaskan hasil WBC ini akan keluar hari mendatang Intinya kemarin setelah disampaikan pengukuran WBC warga langsung pulang ke rumah Jadi disini silakan warga keluar rumah beraktivitas seperti biasa Tidak ada hal khusus kecuali jangan ke daerah kuning area yang masih terpapar radioaktif itu ujarnya Selanjutnya Halaman batan radioaktif limbah radioaktif perumahan batan indah terpapar radioaktif perumahan batan indah 
"Masih Ada Limbah Radioaktif di Batan Indah, Pembersihan Dilanjutkan", Jakarta Pengangkutan limbah radioaktif di perumahan Batan Indah Serpong Tangerang Selatan Tangsel yang sempat terhenti dilanjutkan Garis pembatas sudah terpasang Pantauan detikcom Selasa di perumahan Batan Indah Serpong Tangsel ada ekskavator kecil dan drum drum untuk mengangkut tanah yang terpapar radioaktif Petugas pun sudah berdatangan dan sedang bersiap siap melakukan proses clean up Banyak dari petugas yang sedang memakai peralatan safety Proses clean up dilakukan seperti hari sebelumnya yakni pengukuran mapping dengan alat RDMS MONA Ketika pengukuran sudah dilakukan petugas akan mengeruk tanah yang terpapar radioaktif Truk pun sudah disiagakan untuk membawa drum Polisi dan TNI ada di sekitar lokasi untuk melakukan penjagaan zlf zlf radioaktif limbah radioaktif radioaktif batan indah bapeten batan 
Airin Percayakan ke Batan-Bapeten Ungkap Sumber Limbah Radioaktif di Tangsel, Tangerang Selatan Wali Kota Tangerang Selatan Airin Rachmi Diany meninjau ke perumahan Batan Indah Serpong Tangerang Selatan Tangsel yang terpapar limbah radioaktif Airin menyerahkan kasus ini sepenuhnya kepada pihak berwenang Kita tunggu saja ke pihak berwenang untuk menjelaskannya penyebab munculnya limbah radioaktif agar tidak simpang siur dan insyaallah mudah mudahan tidak ada kekhawatiran apa apa kata Airin di perumahan Batan Indah Tangsel Selasa Ya kita percayakan kepada Bapeten Badan Pengawas Tenaga Nuklir kepada Batan Badan Tenaga Nuklir Nasional lanjutnya Selanjutnya Halaman tangerang selatan airin rachmi diany limbah radioaktif perumahan batan indah perumahan batan indah terpapar radioaktif bapeten batan 
"Ada Limbah Radioaktif, Walkot Tangsel Airin Cek Perumahan Batan Indah Serpong", Tangerang Selatan Wali Kota Tangerang Selatan Tangsel AIrin Rachmi Diany melakukan peninjauan ke lokasi terdampak limbah radioaktif di perumahan Batan Indah Serpong Tangsel Airin meninjau lokasi didampingi beberapa perwakilan dari Batan Pantauan detikcom Selasa Airin datang ke lokasi limbah radioaktif sekitar pukul WIB Kedatangannya pun disambut Kepala Biro Humas dan Kerjasama Badan Tenaga Nuklir Nasional Batan Heru Umbara Foto Walkot Tangsel Airin Cek Batan Indah Sachirl detikcom Airin terlihat bertanya kondisi di perumahan Batan Indah ke Heru Heru pun memastikan kondisi sudah aman Usai berbincang dengan Heru Airin kemudian menemui petugas yang akan melakukan proses clean up Airin pun mengimbau petugas agar berhati hati dalam menjalankan tugasnya zap zap radioaktif limbah radioaktif perumahan batan indah perumahan batan indah terpapar radioaktif bapeten batan airin rachmi diany 
Polisi Proaktif Tangani Heboh Limbah Radioaktif, Jakarta Polisi proaktif menangani penemuan limbah radioaktif di Perumahan Batan Indah Tangerang Selatan Bareskrim Polri sudah mengambil tanah di lokasi penemuan limbah radioaktif untuk diteliti Kabareskrim Polri Komjen Listyo Sigit Prabowo akan menyelidiki penyebab adanya zat berbahaya di permukiman warga itu Sigit mengatakan penyelidikan dilakukan oleh Direktorat Tindak Pidana Tertentu Bareskrim Polri Selanjutnya Halaman round up radioaktif limbah radioaktif perumahan batan indah terpapar radioaktif 
Bapeten Duga Limbah Radioaktif dari Industri: Ini Pasti Bukan Perorangan, Jakarta Badan Pengawas Tenaga Nuklir Bapeten mengatakan limbah radioaktif di perumahan Batan Indah Serpong Tangerang Selatan Tangsel berasal dari suatu industri Bapeten memastikan zat radioaktif itu bukan dari perorangan Karena ini kan memang yang pakai pasti perusahaan Bukan perorangan Artinya nggak mungkin perorangan pakai zat radioaktif yang mengandung Cs kata Kepala Biro Hukum Kerja Sama dan Komunikasi Publik Bapeten Indra Gunawan di perumahan Batan Indah Serpong Tangsel Senin Jadi seseorang yang membuang radioaktif tingkat rendah sedang atau tinggi di regulasi UU No Tahun tentang tenaga nuklir itu itu diancam suatu pidana ucap dia zap zap bapeten perumahan batan indah perumahan batan indah terpapar radioaktif 
Bapeten-Polisi Selidiki Unsur Kelalaian Terkait Limbah Radioaktif di Tangsel, Jakarta Limbah radioaktif di perumahan Batan Indah Serpong Tangerang Selatan Tangsel belum diketahui berasal dari mana Badan Pengawas Tenaga Nuklir Bapeten memastikan saat ini pihaknya masih melakukan penyelidikan Dugaan kecerobohan maupun yang lainnya tentu saja nanti kita koordinasi dengan pihak kepolisian Jadi apakah ini ada kelalaian atau tindakan kesengajaan itu kami nanti akan berkoordinasi dengan pihak penegak hukum dalam hal ini kepolisian kata Kepala Biro Hukum Kerja Sama dan Komunikasi Publik Bapeten Indra Gunawan di perumahan Batan Indah Serpong Tangsel Senin Dia pun mengungkapkan Bapeten akan memberikan data yang dibutuhkan kepolisian untuk proses penyelidikan Indra mengatakan saat ini koordinasi awal telah dilakukan dengan kepolisian Karena tentu saja ini membutuhkan data awal yang kebetulan data awalnya masih ada barang bukti masih ada di Batan Badan Tenaga Nuklir Nasional Data datanya kita tunggu untuk bisa dikeluarkan baru nanti kita koordinasikan ke pihak kepolisian lanjutnya Simak Video Hujan Deras Pengangkutan Limbah Radioaktif di Tangsel Dihentikan Selanjutnya Halaman bapeten perumahan batan indah perumahan batan indah terpapar radioaktif radioaktif polri 
"Gegana Bantu Atasi Limbah Radioaktif, Polri Pastikan Tak Terkait Aksi Teror", Jakarta Polri membantu menyelidiki kasus terpaparnya limbah radioaktif di Perumahan Batan Indah Tangerang Selatan Dalam penyelidikan Polri tidak menemukan indikasi keterkaitan antara limbah radioaktif itu dengan aksi terorisme Sementara kami tidak berkesimpulan ke sana terkait aksi teror Semua masih dalam proses penyelidikan kata Kabag Penum Divisi Humas Mabes Polri Kombes Asep Adi Saputra kepada wartawan di Mabes Polri Jalan Trunojoyo Kebayoran Baru Jakarta Selatan Senin Asep mengatakan polisi menurunkan tim khusus dalam penyelidikan temuan limbah radioaktif tersebut Asep menyebut tim khusus itu terdiri dari jajaran Kepolisian Polda Metro Jaya Polres Tanggerang Selatan Puslabfor Polri hingga Gegana Detasemen E yang memiliki kemampuan khusus menangani limbah radioaktif fas dhn limbah radioaktif radioaktif perumahan batan indah terpapar radioaktif polri 
"Selidiki Limbah Radioaktif di Serpong, Bareskrim Ambil Sampel Tanah", Jakarta Bareskrim sudah melakukan olah tempat kejadian perkara TKP terkait limbah radioaktif di Perumahan Batan Indah Tangerang Selatan Tangsel Sampel tanah di daerah itu juga sudah diambil polisi untuk diteliti Untuk direktorat tindak pidana tertentu sendiri di Bareskrim berdasarkan hasil olah TKP sudah mengamankan beberapa sampel termasuk tanah untuk dilakukan selanjutnya penyelidikan terhadap bahan bahan tersebut dan juga penyebab dan juga mengapa daerah tersebut terpapar radioaktif jenis CS kata Kabag Penum Divisi Humas Mabes Polri Kombes Asep Adi Saputra di Bareskrim Mabes Polri Jl Trunojoyo Kebayoran Baru Jakarta Selatan Senin Dari temuan ini kemudian dilakukan penyelidikan untuk mengetahui penyebab mengapa ada terpapar radioaktif di lokasi tersebut Oleh karenanya kami dari kepolisian turut melakukan penyelidikan terhadap peristiwa itu kata Asep fas idh radioaktif radioaktif batan indah perumahan batan indah terpapar radioaktif bareskrim polri 
"Pembersihan Radioaktif di Tangsel Ditunda karena Hujan, 28 Drum Diangkut", Serpong Proses clean up di area terpapar radioaktif di perumahan Batan Indah Serpong Tangerang Selatan Tangsel dihentikan untuk hari ini Pengerjaan dihentikan karena turun hujan Pantauan detikcom Senin hujan turun di perumahan Batan Indah Serpong Tangsel Proses pengambilan tanah radioaktif di perumahan Batan Indah dihentikan Meski demikian ekskavator masih berada di sekitaran area radioaktif Beberapa petugas masih ada di sekitar lokasi Dengan memakai peralatan safety dan membawa RDMS MONA mereka terlihat melakukan mapping gbr gbr radioaktif perumahan batan indah terpapar radioaktif limbah radioaktif 
"Pohon yang Terpapar Radioaktif Ditebang, Takut Jadi Mutan?", Jakarta Limbah radioaktif di lapangan perumahan Batan Indah Serpong Tangerang Selatan Tangsel masih di clean up Badan Tenaga Nuklir Nasional Batan akan menebang pohon pohon yang sudah terpapar radioaktif Kenapa Sebagaimana dicatat Dewi Ayu Warmadewi dalam tulisan berjudul Mutasi Genetik radioaktif merupakan salah satu agen mutasi yang bisa membuat tumbuhan atau makhluk hidup bermutasi Hal ini dikarenakan paparan radioaktif memliki daya tembus yang kuat sehingga mencapai bahan genetis dalam inti sel Secara alami frekuensi mutasi terhitung rendah yakni individu Namun mutasi bisa secara spontan terjadi oleh faktor paparan radioaktif Makhluk hidup yang bermutasi baik hewan maupun tumbuhan disebut mutan Foto Burung yang diteliti Timothy mengalami mutasi dok Natgeo Untuk diketahui Zat radioaktif Cs yang mencemari kawasan permukiman di Perumahan Batan Indah Kecamatan Setu Tangerang Selatan ialah unsur yang sama dengan zat yang menyebar saat bencana nuklir Chernobyl Simak Juga Video Batan Sudah Angkut Drum Paparan Limbah Radioaktif Gambas Video detik Selanjutnya Halaman radioaktif radioaktif batan indah limbah radioaktif perumahan batan indah terpapar radioaktif 
Polisi Panggil Perusahaan Pembuang Limbah Kertas di Kawasan Industri Cilegon, Cilegon Pembuang limbah kertas di kawasan industri Cilegon Banten diamankan polisi Hasil penyelidikan limbah kertas itu berasal dari Karawang Jawa Barat Hasil pemeriksaan sementara polisi sudah mengantongi nama perusahaan penghasil limbah dan perusahaan pengangkut limbah kertas tersebut Polisi sudah melayangkan surat pemanggilan terhadap kedua perusahaan Masih proses penyelidikan Itu kan bukan limbah B yah cuma limbah doang asalnya dari Karawang Kita lagi melayangkan surat pemanggilan kata Kasatreskrim Polres Cilegon AKP Zamrul Aini saat dimintai konfirmasi Senin dhn dhn pembuang limbah kertas pembuang limbah cilegon banten 
"Dampak Radioaktif di Tangsel, Pohon di Area Terkontaminasi Akan Ditebang", Jakarta Limbah radioaktif di lapangan perumahan Batan Indah Serpong Tangerang Selatan Tangsel masih di clean up Badan Tenaga Nuklir Nasional Batan menyebut area yang terpapar radioaktif akan diremediasi Nanti diremediasi itu nanti Jadi kita kembalikan lingkungan ini seperti awal Tidak ada yang tertinggal termasuk mungkin meskipun kecil di pohon kita potong saja Kita ganti pohon baru kata Kepala Biro Humas dan Kerja Sama Batan Heru Umbara di perumahan Batan Indah Serpong Tangsel Senin Terutama mungkin yang ada buah dimakan orang Di sini kan ada pohon nangka ada jeruk kalau tidak salah Singkong atau apa gitu Nah itu yang harus kita jamin lanjutnya gbr gbr radioaktif perumahan batan indah terpapar radioaktif limbah radioaktif 
Warga Protes Bau Limbah dan Suara Bising Pabrik Mebel di Mojokerto, Mojokerto Puluhan warga berunjuk rasa di depan pabrik mebel PT Bondvast Indo Sukses di Jalan Raya Mojosari Pacet Desa Sampangagung Kecamatan Kutorejo Mojokerto Mereka memprotes aktivitas pabrik yang menghasilkan limbah cair berbau menyengat dan suara bising yang mengganggu ketenangan penduduk sekitar Warga Desa Sampangagung berunjuk rasa dengan berorasi sambil membentangkan sejumlah poster berisi tuntutan mereka Seperti Kami Tidak Terima Limbah Cair Masik ke Makam Umum Dusun Sugihwaras Warga Ingin Sehat Jangan Dikasih Bau yang Menyengat yang Menyesakkan Paru paru Kami Adanya PT Bondvast Warga Tidur tidak Nyaman karena Bising dan Bau Menyengat Sekali serta Sehat itu Mahal Jangan Cemari Udara Kami dengan Asap Pabrik Koordinator Warga Ridwan mengatakan selama ini PT Bondvast membuang limbah cairnya melalui saluran pembuangan menuju ke sungai di Desa Sampangagung Namun pada Jumat limbah tersebut meluber ke tempat pemakaman umum Dusun Sugihwaras Desa Sampangagung Hujan deras yang mengguyur Sampangagung saat itu diduga membuat limbah cair PT Bondvast meluap ke makam Makam ini persis di sebelah saluran limbah pabrik mebel tersebut Limbahnya hitam pekat Kami taruh botol selama beberapa hari tidak bisa mengendap Baunya yang kami keluhkan Entah bau cat pernis atau apa kami tidak tahu Karena warga tidak boleh masuk ke dalam pabrik kata Ridwan kepada wartawan di lokasi unjuk rasa Senin Bau menyengat dari limbah cair PT Bondvast kata Ridwan menggangu warga Desa Sampangagung khususnya penduduk Dusun Sugihwaras yang berdekatan dengan pabrik Selain itu aktivitas pabrik di malam hari mengeluarkan bau bising yang mengganggu istirahat warga di sekitarnya Malam hari aktivitas pabrik mengeluarkan suara bising Karena malam kan kondisi sunyi warga sini istirahat tidak nyaman ujarnya fat fat birojatim demo warga limbah 
10 Temuan Terkini Bapeten-Batan soal Sumber Limbah Radioaktif di Tangsel, Jakarta Limbah radioaktif bikin geger warga di Perumahan Batan Indah Serpong Tangerang Selatan Tangsel Badan Pengawas Tenaga Nuklir Bapeten dan Badan Tenaga Nuklir Nasional Batan menyelidiki sumber radioaktif itu Intip temuannya Penemuan ini bermula ketika Bapeten melakukan pengujian rutin fungsi alat pemantau radioaktivitas lingkungan bergerak mobile RDMS MONA Bapeten sudah memiliki alat ini sejak dan selalu dilakukan uji fungsi alat Pada tanggal Januari Bapeten melakukan uji fungsi dengan meliputi target area Pamulang Perumahan Dinas Puspiptek Daerah Muncul dan Kampus ITI Perumahan Batan Indah dan Stasiun KA Serpong Secara umum nilai paparan radiasi lingkungan di daerah tersebut normal namun terjadi peningkatan atau kenaikan nilai paparan radiasi di tanah kosong dekat lapangan voli Blok J lingkungan perumahan Batan Indah Perumahan ini diketahui mengandung radiasi melebihi ambang batas normal berkat pemantauan pada Januari Bapeten menemukan serpihan sumber radiasi itu pada dan Februari kemarin Bapeten langsung memasang garis pembatas safety perimeter agar warga tidak mendekat ke lokasi Tim kemudian melakukan pengecekan ulang dan penyisiran di sekitar daerah tersebut dan ditemukan nilai paparan radiasi lingkungan dengan laju paparan terukur signifikan di atas nilai normal Berikut temuan dari Bapeten dan Batan soal limbah radioaktif Video Batan Sudah Angkut Drum Paparan Limbah Radioaktif Gambas Video detik Selanjutnya Halaman limbah radioaktif radioaktif perumahan batan indah terpapar radioaktif jejak radioaktif batan bapeten 
Total Limbah Radioaktif di Batan Indah yang Sudah Diangkut 87 Drum, Tangerang Selatan Proses pengangkutan sisa limbah radioaktif di perumahan Batan Indah Serpong Tangerang Selatan Tangsel masih dilanjutkan Badan Tenaga Nuklir Nasional Batan menyebut puluhan drum berisi tanah yang terpapar radioaktif sudah diangkut Total tanah yang sudah dibawa ke Batan itu ada drum kata Kepala Biro Humas dan Kerjasama Batan Heru Umbara di perumahan Batan Indah Serpong Tangerang Selatan Senin Lalu Sabtu ada drum yang dibawa Lantas pada Senin sebanyak drum berisi tanah yang terpapar radioaktif juga sudah dibawa ke Batan Kemarin Minggu kita menyelesaikan mengangkut drum lanjutnya Simak Video Pembersihan Limbah Radioaktif di Batan Indah Dihentikan Gambas Video detik Selanjutnya Halaman limbah radioaktif radioaktif perumahan batan indah terpapar radioaktif jejak radioaktif batan bapeten 
Batan: Kami Sudah Tahu Sumber Limbah Radioaktif di Tangsel, Tangerang Selatan Badan Tenaga Nuklir Nasional Batan mengaku sudah mengetahui sumber limbah radioaktif di perumahan Batan Indah Serpong Tangerang Selatan Tangsel Namun Batan enggan menjelaskan lebih jauh Penelitian untuk identifikasi sebenarnya sudah ketahuan Kita sudah ada kita sudah tahu sumbernya Saat ini masih ada yang tertinggal di sini itu saja kata Kepala Biro Humas dan Kerja Sama Batan Heru Umbara di perumahan Batan Indah Serpong Tangsel Senin Bahkan kita lihat juga teman teman kepolisian dari BIN Badan Intelijen Negara Gegana Kita benar benar berkoordinasi Jadi bagaimana kita bisa mencari tahu asal muasal dari sumber ini ucap dia Simak Video Pembersihan Limbah Radioaktif di Batan Indah Dihentikan Gambas Video detik Selanjutnya Halaman radioaktif perumahan batan indah terpapar radioaktif limbah radioaktif serpong 
"Pakai 100 Drum dan Ekskavator, Pembersihan Radioaktif di Tangsel Lanjut", Serpong Pengangkutan limbah radioaktif di perumahan Batan Indah Serpong Tangerang Selatan Tangsel dilanjutkan Proses pembersihan dibantu ekskavator dan drum Pantauan detikcom Senin di perumahan Batan Indah Serpong Tangsel ada ekskavator kecil Petugas sudah berdatangan dan sedang bersiap siap melakukan proses clean up Peralatan safety atau keamanan diturunkan petugas dari mobil Garis pembatas pun masih terpasang Polisi dan TNI melakukan penjagaan di sekitar lokasi gbr gbr radioaktif perumahan batan indah terpapar radioaktif limbah radioaktif serpong 
Bareskrim Turun Tangan dalam Kasus Radioaktif di Perumahan Batan Indah, Jakarta Badan Reserse Kriminal Bareskrim Polri turun tangan dalam masalah ditemukannya limbah radioaktif di Perumahan Batan Indah Tangerang Selatan Tangsel Bareskrim akan menyelidiki penyebab adanya zat berbahaya itu di permukiman warga Penyelidikan dilaksanakan Bareskrim Polri kata Kabareskrim Polri Komjen Listyo Sigit Prabowo kepada detikcom Minggu malam Sigit mengatakan penyelidikan dilakukan oleh Direktorat Tindak Pidana Tertentu Bareskrim Polri Dilakukan oleh Tipidter imbuh dia Selanjutnya Halaman bareskrim polri perumahan batan indah terpapar radioaktif perumahan batan indah bapeten 
Petugas Cari Zat Radioaktif di Tangsel dengan Sensor, Tangerang Selatan Sisa zat radioaktif di perumahan Batan Indah Serpong Tangerang Selatan Tangsel masih dicari Petugas Badan Pengawas Tenaga Nuklir Bapeten menggunakan sensor untuk mendeteksi Kepala Biro Hukum Kerja Sama dan Komunikasi Publik Bapeten Indra Gunawan mengatakan sensor muncul dari alat bernama RDMS MONA Dia menjelaskan RDMS MONA mengeluarkan sinyal bila disuatu lokasi terlihat ada kenaikan radiasi Selanjutnya Halaman radioaktif limbah radioaktif tangerang selatan 
Bapeten Sebut Ada Banyak Fasilitas Nuklir di Serpong Tangsel, Tangerang Selatan Badan Pengawas Tenaga Nuklir Bapeten menjelaskan ada banyak fasilitas nuklir di kawasan Serpong Tangerang Selatan Tangsel Fasilitas nuklir ini berada dalam satu lingkungan Kita ada satu lingkungan namanya KNS Kawasan Nuklir Serpong kata Kepala Biro Hukum Kerja Sama dan Komunikasi Publik Bapeten Indra Gunawan di perumahan Batan Indah Serpong Tangsel Minggu Selanjutnya Halaman nuklir radioaktif bapeten perumahan batan indah terpapar radioaktif perumahan batan indah tangerang selatan 
Misteri 'Pembuang' Limbah Radioaktif di Batan Indah, Jakarta Badan Tenaga Nuklir Nasional Bapeten masih mengidentifikasi soal temuan limbah radioaktif di Perumahan Batan Indah Serpong Tangerang Selatan Pelaku pembuang limbah pun masih terus dicari Bapeten belum bisa mengetahui apa limbah radioaktif tersebut sengaja dibuang oleh seseorang atau ada kemungkinan lain Upaya investigasi pun dilakukan termasuk melibatkan aparat kepolisian Adanya limbah radioaktif ini juga diyakini bukan berasal dari kebocoran fasilitas nuklir yang ada di Serpong Fasilitas nuklir di Serpong dinyatakan aman Tak ada kebocoran Hari ini limbah radioaktif tersebut mulai diangkut ke Pusat Teknologi Limbah Radioaktif di Serpong Tangerang Diperkirakan total akan ada drum tanah mengandung radioaktif yang dicek Selanjutnya Halaman radioaktif limbah radioaktif reaktor nuklir bapeten batan 
