title,content
Ketua RT soal Paparan Radioaktif di Batan Indah Tangsel: Warga Aman, Tangerang Selatan Ketua RT RW Perumahan Batan Indah Serpong Tangerang Selatan Tangsel Sugiharso menyebut warganya tetap aman meski di sekitar wilayahnya terpapar radioaktif Warga merasa aman berkat langkah cepat Badan Pengawas Tenaga Nuklir Bapeten Warga nggak ada masalah karena itu kan langsung dievakuasi titik tertentu langsung dikasih garis itu sudah kata Sugiharso saat ditemui di Perumahan Batan Indah Serpong Tangsel Sabtu Aman nggak ada apa apa imbuhnya Selanjutnya Halaman perumahan batan indah terpapar radioaktif radioaktif tangerang selatan 
Begini Kondisi Lokasi Paparan Radioaktif di Batan Indah Tangsel, Tangerang Selatan Wilayah Perumahan Batan Indah Serpong Tangerang Selatan Tangsel ditemukan paparan radioaktif Kondisi di titik paparan radioaktif masih dibatasi menggunakan garis perimeter Pantuan detikcom di Blok I Perumahan Batan Indah Serpong Tangsel pada pukul WIB Sabtu ada garis perimeter berwarna kuning bertuliskan Daerah Radiasi Dilarang Melintas dari Badan Pengawas Tenaga Nuklir Bapeten Garis perimeter tersebut diikatkan ke sejumlah pohon yang melingkari sebidang tanah Sepuluh meter dari gundukan tanah tersebut ada sebuah alat berat yang ditutupi plastik terpal juga Alat berat tersebut juga termasuk yang diberi garis perimeter Selanjutnya Halaman radioaktif perumahan batan indah terpapar radioaktif tangerang selatan 
"Tenang, Radioaktif di Tangsel Tak Segawat Bencana Nuklir Chernobyl", Jakarta Unsur Cs diduga ada di kawasan Perumahan Batan Indah Tangerang Selatan Tangsel yang terpapar radioaktif Unsur itu memang ada di kawasan reaktor nuklir Chernobyl yang pernah mengalami kecelakaan tahun Namun demikian tenang saja radioaktif di Tangsel itu tak segawat bencana nuklir Chernobyl Tentu skalanya berbeda kata Kepala Biro Hukum Kerja Sama dan Komunikasi Publik Badan Pengawas Tenaga Nuklir Bapeten Indra Gunawan kepada wartawan Sabtu Selanjutnya Halaman perumahan batan indah terpapar radioaktif radioaktif bapeten batan tangerang selatan radiasi nuklir cs caesium sesium 
"Cs 137 Diduga Cemari Batan Indah, Sama Seperti Unsur Nuklir Chernobyl", Jakarta Zat Cs diduga adalah unsur radioaktif yang mencemari kawasan permukiman di Perumahan Batan Indah Kecamatan Setu Tangerang Selatan Banten Ternyata Cs adalah unsur yang sama dengan yang menyebar ke dunia akibat bencana nuklir Chernobyl Ledakan akibat kecelakaan reaktor nuklir di Chernobyl terjadi pada April di kawasan Ukraina saat itu masih menjadi kawasan Uni Soviet Peristiwa itu menjadi bencana terparah sepanjang masa mengubah daerah yang tadinya padat penduduk menjadi kota hantu dan membuat zona terlarang seluas kilometer persegi Selanjutnya Halaman perumahan batan indah terpapar radioaktif radioaktif bapeten radiasi nuklir chernobyl bencana nuklir chernobyl nuklir fukushima cs sesium caesium 
"Ditemukan di Perumahan Batan Tangsel, Ini Efek Radioaktif Pada Tubuh", Jakarta Area di Perumahan Batan Indah Tangerang Selatan diduga terpapar radioaktif Hal tersebut dikemukakan oleh Pernyataan resmi Badan Pengawas Tenaga Nuklir Bapeten tertanggal Februari Awalnya pada Januari Bapeten melakukan pemantauan dan teramati Perumahan Batan Indah mempunyai nilai paparan radiasi di atas normal Saat ini beberapa warga sekitar dicek tingkat kontaminasi radioaktif menggunakan metode whole body counting WBC Tim Batan Badan Tenaga Nuklir Nasional juga akan melakukan pemeriksaan whole body counting WBC terhadap beberapa warga di sekitar lokasi kata Kepala Biro Hukum Kerja Sama dan Komunikasi Publik Badan Pengawas Tenaga Nuklir Bapeten Indra Gunawan dalam keterangan tertulis di situs resmi Bapeten Gambas Video detik kna up radioaktif jejak radioaktif material radioaktif perumahan batan indah terpapar radioaktif radiasi 
"Ada Paparan Radiokatif di Batan Indah, 5 Warga Diperiksa di Batan", Jakarta Lima orang warga di periksa untuk dijadikan sampel setelah ditemukan paparan radioaktif di Perumahan Batan Indah Tangerang Selatan Tangsel Pemeriksaan itu akan dilakukan bergantian oleh Badan Tenaga Nuklir Nasional Batan Warga yang akan diperiksa akan didata dulu supaya nanti bergantian karena terbatasnya fasilitas Batan Kita akan ambil sample orang warga dulu kata Kepala Biro Hukum Kerja Sama dan Komunikasi Publik Badan Pengawas Tenaga Nuklir Bapeten Indra Gunawan kepada detikcom Jumat malam Tonton juga Wujud Proyek Perumahan Fiktif Syariah yang Catut Nama Yusuf Mansur Selanjutnya Halaman perumahan batan indah terpapar radioaktif radioaktif tangsel 
Unsur yang Diduga Sumber Radioaktif di Batan Indah: Cs 137, Jakarta Ada paparan radioaktif di Perumahan Batan Indah Kecamatan Setu Tangerang Selatan Banten Dugaan sementara paparan radioaktif itu berasal dari zat ini Sementara informasi masih terbatas tapi dugaannya adalah Cs kata Kepala Biro Hukum Kerja Sama dan Komunikasi Publik Bapeten Indra Gunawan kepada wartawan Sabtu dnu dnu perumahan batan indah terpapar radioaktif radioaktif radiasi nuklir bapeten tangerang selatan batan cs caesium sesium 
Warga Dilarang Dekati Titik Paparan Radioaktif di Batan Indah Tangsel, Jakarta Badan Pengawas Tenaga Nuklir Bapeten menyebut paparan radioaktif di area permukiman di Perumahan Batan Indah masih pada tingkat aman Meski begitu Bapeten meminta warga tak mendekati area terpapar yang sudah dipasang pembatas Kita juga sudah mengukur untuk di trotoar dan di jalan serta permukiman penduduk terdekat hasil pengukuran kita menunjukkan masih tingkat aman di sekitar situ Cuma memang warga kita minta untuk tidak beraktifitas atau masuk di wilayah tali kuning yang sudah kita berikan di situ kata Kepala Biro Hukum Kerja Sama dan Komunikasi Publik Bapeten Indra Gunawan kepada detikcom Jumat malam Selanjutnya Halaman perumahan batan indah terpapar radioaktif radioaktif tangerang selatan 
Paparan Radioaktif di Batan Indah Tangsel Bisa Bikin Mandul dan Kanker, Jakarta Badan Tenaga Nuklir Nasional Batan menemukan paparan radioaktif di area di Perumahan Batan Indah Tangerang Selatan Tangsel Kepala Biro Hukum Kerja Sama dan Komunikasi Publik Badan Pengawas Tenaga Nuklir Bapeten Indra Gunawan mengatakan paparan berlebihan radioaktif sangat berbahaya untuk kesehatan manusia Secara umum paparan radiasi berlebihan itu secara umum itu kan sifatnya yang karsinogenik artinnya menyebabkan kanker kemudian yang paling populer dia menyebabkan infertilitas atau kemandulan kepada orang kalau untuk yang laki laki kemudian perubahan kromosom kata Indra kepada detikcom Jumat malam Selanjutnya Halaman radiasi nuklir radioaktif perumahan batan indah terpapar radioaktif tangsel 
"Batan Indah Kena Radioaktif, Komisi VII: Harus Jadi Peringatan Keras!", Jakarta Komisi VII DPR ingin agar peristiwa terpaparnya Perumahan Batan Indah Tangerang Selatan oleh radioaktif bisa menjadi peringatan bahaya nuklir bagi lembaga yang mengurusi nuklir di Indonesia yakni Badan Tenaga Nuklir Nasional Batan dan Badan Pengawas Tenaga Nuklir Bapeten Ini harus menjadi peringatan keras Ini karena segala sesuatu tentang nuklir harus terukur secara presisi tidak boleh ada kelalaian atau kelengahan yang mengakibatkan radiasi kata Ketua Komisi VII DPR Sugeng Suparwoto kepada wartawan Sabtu dnu dnu perumahan batan indah terpapar radioaktif radioaktif cs caesium sesium radiasi nuklir komisi vii dpr sugeng suparwoto nasdem batan badan tenaga nuklir nasional bapeten 
Bapeten Cari Tahu Oknum Pembawa Serpihan Radioaktif di Batan Indah, Jakarta Area di Perumahan Batan Indah Tangerang Selatan Tangsel terpapar radioaktif Serpihan radioaktif sudah ditemukan Dari mana asal paparan radioaktif hingga ditemukan di area itu Siapa pula oknum pembawa unsur berbahaya itu Badan Pengawas Tenaga Nuklir Bapeten mengatakan saat ini Badan Tenaga Nuklir Nasional Batan sedang melakukan uji laboratorium terhadap barang bukti yang ditemukan Dari hasil forensik itu akan diketahui dari mana asal usul sumber paparan radioaktif tersebut Barang bukti yang kita kumpulkan sedang dilakukan forensik nuklir di laboratorium Batan nanti kita akan tentukan langkah selanjutnya dan nanti bisa kita ketahui apakah dari data itu bisa ditindaklanjuti tentang identitas objeknya siapa yang menggunakan dan kemudian kira kira adakah pelaku yang bisa kita tentukan dari data forensik nuklir itu kata Kepala Biro Hukum Kerja Sama dan Komunikasi Publik Bapetan Indra Gunawan kepada detikcom Jumat malam Selanjutnya Halaman radiasi nuklir radioaktif tangsel bapeten 
Tifatul: Siapa Oknum Pembuang Zat Radioaktif di Perumahan Batan Indah?, Jakarta Area di Perumahan Batan Indah Tangerang Selatan Tangsel Banten terpapar radioaktif Anggota Komisi VII DPR menduga ada oknum yang membawa zat radioaktif ke area permukiman itu Ini harus dicek ini oknum yang bawa siapa ini orangnya Kan dia nggak bisa jalan jalan sendiri barangnya bahan radioaktif Penegak hukum harus mencari oknum yang membawa itu kata anggota Komisi VII DPR dari Fraksi PKS Tifatul Sembiring kepada wartawan Sabtu Selanjutnya Halaman perumahan batan indah terpapar radioaktif radioaktif radiasi nuklir bapeten batan komisi vii dpr tifatul sembiring pks 
Ini Keterangan Lengkap soal Perumahan Batan Tangsel Kena Radioaktif, Jakarta Perumahan Batan Indah Kecamatan Setu Tangerang Selatan Banten terpapar radioaktif Di kawasan itu unsur radioaktif lebih tinggi ketimbang kawasan lainnya Hal ini diketahui dari pernyataan resmi Badan Pengawas Tenaga Nuklir Bapeten tertanggal Februari Awalnya pada Januari Bapeten melakukan pemantauan dan teramati Perumahan Batan Indah mempunyai nilai paparan radiasi di atas normal Selanjutnya Halaman perumahan batan indah terpapar radioaktif radiasi nuklir radioaktif batan bapeten 
"Area Perumahan Batan Tangsel Kena Radioaktif, Warga Dicek Kesehatannya", Jakarta Area di Perumahan Batan Indah Tangerang Selatan Tangsel terpapar radioaktif Beberapa warga pun dicek tingkat kontaminasi menggunakan whole body counting WBC Tim Batan Badan Tenaga Nuklir Nasional juga akan melakukan pemeriksaan whole body counting WBC terhadap beberapa warga di sekitar lokasi kata Kepala Biro Hukum Kerja Sama dan Komunikasi Publik Badan Pengawas Tenaga Nuklir Bapeten Indra Gunawan dalam keterangan tertulis di situs resmi Bapeten Jumat Tim uji fungsi melakukan pengecekan ulang dan penyisiran di sekitar daerah tersebut di atas dan ditemukan nilai paparan radiasi lingkungan dengan laju paparan terukur signifikan di atas nilai normal kata Indra Bapeten pun sudah melakukan dekontaminasi sebagai upaya menurunkan laju paparan radioaktif Tim Bapeten juga sudah mengambil sampel tanah dan air untuk menganalisis temuan tersebut Hasilnya laju paparan mengalami penurunan yang signifikan tapi masih tetap di atas nilai normal Jadi menurut Indra proses dekontaminasi perlu dilanjutkan agar nilai laju paparan kembali normal idn dnu bapeten radioaktif 
"Serpihan Sumber Radioaktif Ditemukan, Bapeten Ambil Sampel Tanah", Jakarta Badan Pengawas Tenaga Nuklir Bapeten dan Badan Tenaga Nuklir Nasional Batan telah menemukan sumber serpihan yang diduga menyebabkan kenaikan paparan radioaktif di Perumahan Batan Indah Tangerang Selatan Bapeten pun mengambil tanah untuk dianalisis Kepala Biro Hukum Kerja Sama dan Komunikasi Publik Bapeten Indra Gunawan menjelaskan tim gabungan Bapeten dan Batan melakukan pencarian sumber diduga penyebab kenaikan paparan radiasi pada Februari Menemukan beberapa serpihan sumber radioaktif Setelah pengangkatan serpihan sumber radioaktif tersebut dan dilakukan pemetaan ulang ditemukan bahwa laju paparan mengalami penurunan namun masih di atas nilai normal jelas Indra dalam keterangan tertulis di situs resmi Bapeten Jumat idn dnu radioaktif bapeten batan 
Area di Perumahan Batan Indah Tangsel Terpapar Radioaktif!, Jakarta Area tanah kosong di lingkungan perumahan Batan Indah Tangerang Selatan terpapar radioaktif Badan Pengawas Tenaga Nuklir Bapeten langsung memasang safety perimeter garis pembatas agar warga tidak mendekat ke lokasi Kepala Biro Hukum Kerja Sama dan Komunikasi Publik Bapeten Indra Gunawan mengatakan sejak pihaknya memiliki pemantau radioaktivitas lingkungan bergerak Mobil RDMS MONA Bapeten melakukan uji fungsi unit MONA dengan memantai radioaktivitas lingkungan di area Jabodetabek Tanggal Januari BAPETEN melakukan uji fungsi dengan target area meliputi wilayah Pamulang Perumahan Dinas Puspiptek Daerah Muncul dan Kampus ITI Perumahan Batan Indah dan Stasiun KA Serpong kata Indra dalam keterangan tertulisnya dari situs resmi Bapeten Jumat idn dnu radioaktif bapeten batan 
PT Timah Mau Suplai Thorium untuk Pembangkit Listrik, Jakarta PT Timah Tbk TINS siap menyediakan bahan baku untuk Pembangkit Listrik Tenaga Thorium PLTT Penyediaan bahan baku ini untuk menyuplai ke Thorcon International Pte Ltd yang ingin membangun PLTT di tanah air Untuk Thorium kami sudah komunikasi dengan Thorcon memang teknologinya sangat tinggi Tapi kami siap menyiapkan bahan baku kata Direktur Utama Timah Mochtar Riza Pahlevi Tabrani usai Rapat Umum Pemegang Saham Luar Biasa RUPSLB di Hotel Borobudur Jakarta Pusat Senin PT Timah ini akan memenuhi kebutuhan thorium sebanyak ton setiap tahunnya Thorium ini digunakan sebagai bahan bakar PLTT berkapasitas MW PT Timah pun sudah bekerja sama dengan Badan Tenaga Nuklir Nasional Batan Timah sudah MoU dengan Batan bahwa kami akan menyimpan thorium yang dihasilkan ungkap dia Gambas Video detik hek ara pt timah thorium pembangkit listrik 
Saat Ribuan Ton Susu Jerman Barat Tercemar Ledakan Nuklir, Jakarta Tepat tahun lalu pemerintah Jerman Barat kelimpungan dengan masalah ton susu bubuk yang terpapar radioaktif Susu tersebut berasal sapi yang digembalakan di padang rumput Alpen Rumput di kawasan itu rupanya terkontaminasi oleh isotop cesium dari ledakan reaktor Chernobyl Uni Soviet pada akhir April Pejabat kesehatan di Bremen seperti yang dikutip The New York Times mengatakan hasil tes menunjukkan tingkat radiasi mencapai becquerel per kilogram susu bubuk Angka ini jauh di atas level maksimum yang diizinkan Komunitas Eropa yakni becquerel untuk susu dan produk susu yang diperuntukkan bagi konsumsi manusia dan becquerel untuk pakan ternakSusu susu tersebut menurut The Times sudah berada dalam gerbong kereta Semuanya siap dikirimkan ke pabrik untuk diproses lebih lanjut menjadi pakan ternak Pakan ternak ini akan dikirimkan ke sejumlah negara diantaranya Mesir melalui Bremen dan ke Angola melalui Cologne Pejabat kepolisian di Bremen menduga kuat pengiriman tersebut menjadi bagian dari kesepakatan ilegal untuk menyingkirkan susu radioaktif tersebut Pejabat di Bremen dan Cologne sendiri berpendapat susu susu tersebut harus dikirim kembali ke Bavaria tempat susu tersebut dihasilkan Selanjutnya Halaman rubrik mesin waktu jerman barat susu radioaktif nuklir 
Negeri Radiasi Nuklir yang Bebas Visa buat Paspor Indonesia, Jakarta Keindahan Kepulauan Marshall mirip Maladewa Daya tariknya bertambah karena masuk daftar bebas visa bagi paspor Indonesia Tapi negara ini juga tercemar radiasi nuklir Salah satu negara masuk daftar bebas visa untuk pemegang paspor Indonesia adalah Kepulauan Marshall yang terletak di Oseania Samudra Pasifik Negara kepulauan ini memiliki pemandangan alam yang mirip Maladewa Di sana ada beberapa destinasi wisata yang terkenal seperti Pantai Laura Pulau Kecil Atol Arno Museum Alele dan Perpustakaan Publik Selain itu Kepulauan Marshall juga terkenal sebagai tempat pelestarian hiu Lautan seluas hampir juta kilometer persegi menjadi suaka bagi hiu yang menjadikannya sebagai suaka terluas di dunia Gambas Video detik pin krs bebas visa kepulauan marshall amerika serikat nuklir negara bebas visa buat paspor indonesia paspor indonesia 
"Kisah Nyata Sadako, Gadis Jepang Melawan Ganasnya Efek Bom Atom", Jakarta Tepat pada tanggal ini tahun lalu Sadako Sasaki lahir di Hiroshima Jepang Sadoko dikenang akan kisahnya melipat seribu bangau kertas jelang kematiannya di usia belia Dia wafat disebabkan penyakit kanker darah yang diperkirakan dipicu dampak radioaktif bom atom yang dijatuhkan Amerika Serikat Sadako masih berumur dua tahun saat Little Boy yang membawa sekitar kilogram Uranium menghantam daratan tanah kelahirannya pada Agustus pagi Bom yang dibawa pesawat pembom B itu membumihanguskan Hiroshima dan menewaskan ribu orang Saat perang berakhir sama seperti orang orang Jepang lainnya keluarga Sadako berusaha merekonstruksi kehidupan mereka seperti sedia kala Sadako sendiri tumbuh sehat Berprestasi dalam olahraga atletik di sekolah Dia pun punya mimpi jadi seorang guru pendidikan jasmani Jelang akhir November Sadako terkena flu Di leher dan belakang telinganya muncul benjolan yang makin lama makin membesar Beberapa bulan kemudian bintik bintik ungu terlihat di kaki kirinya Selanjutnya Halaman rubrik mesin waktu jepang bom atom hiroshima origami 
Misteri Pulau Tanpa Penghuni dengan Satu Gedung Masih Berdiri, Jakarta Hasil foto udara sebuah pulau bikin penasaran Di tengah tengah pulau ada satu gedung yang berdiri tanpa ditemani bangunan lain Pulau itu pun ternyata sudah tak berpenghuni Kisahnya kian menarik karena pulau ini masih terselubung misteri Dilansir Express co uk foto udara ini dilihat oleh seorang pengguna Reddit yang sedang mengamati pencitraan dari Google Maps Ia penasaran dengan penampakan sebuah pulau Pulau yang berada di tengah lautan itu tampak bernuansa hijau Bagian tengah memunculkan sebuah gedung persegi tanpa ada apa apa lagi di sekelilingnya Objek dalam foto itu adalah pulau Atol Johnston yang berada di antara Kepulauan Marshall dan Hawaii Gambas Video detik krs rdy pulau misterius pulau misteri 
"Jepang Akan Buang Air Sisa Radiasi Nuklir Fukushima, Apakah Aman?", Jakarta Sembilan tahun berlalu sejak reaktor nuklir Fukushima Jepang diguncang gempa dan tsunami Kini pemerintah Jepang hendak melakukan pelepasan air yang dulu tercemar radioaktif reaktor nuklir itu Soalnya wadah penyimpanan sudah penuh Badan untuk Sumber Daya Alam dan Energi Jepang telah mengajukan tiga cara untuk menangani air nuklir itu Yakni pertama melepas air itu ke lautan Kedua melepas air lewat proses penguapan Ketiga kombinasi dua cara itu tadi Pemompaan besar besaran dan sistem penyaringan telah ditempatkan di kawasan pembangkit nuklir Tiap harinya alat itu membawa berton ton air yang terkontaminasi dan menyaringnya dari unsur unsur radioaktif Selanjutnya Halaman fukushima reaktor nuklir jepang radiasi nuklir radioaktif limbah nuklir 
Lukisan Berumur 44 Ribu Tahun Ditemukan di Gua Sulawesi, Jakarta Lukisan di dinding gua yang disebut tertua di dunia ditemukan di sebuah gua di Leang Bulu Sipong Sulawesi Usianya diperkirakan ribu tahun Lukisan tersebut ditemukan pada tahun namun hasil penelitiannya baru dipublikasikan di jurnal ilmiah nature Tim periset berasal dari Griffith University di Brisbane Australia Dikutip detikINET dari Live Science lukisan ini menggambarkan figur kecil yang terlihat seperti manusia menggunakan tombak dan tali untuk memburu binatang Empat binatang adalah anoa dan dua berjenis babi liar Menariknya gambar manusia itu juga memiliki unsur binatang lantaran tampak ada ekor dan moncong Figur perpaduan manusia dan binatang ini mungkin adalah penggambaran dewa atau roh Dengan menganalisis uranium dan isotop radioaktif yang terbentuk ilmuwan mengestimasi usia lukisan tersebut setidaknya adalah tahun Panel lukisan itu lebarnya meter Saya belum pernah melihat hal semacam ini sebelumnya Memang ada ratusan seni bebatuan di wilayah ini namun belum ada yang menggambarkan perburuan kata Adam Brumm arkeolog dari Griffith Lukisan bersangkutan bukan yang tertua di dunia Tahun silam ilmuwan menemukan lukisan yang usianya diperkirakan ribu tahun di Afrika Selatan Namun demikian mungkin lukisan di Sulawesi adalah yang paling tua dalam kategori lukisan yang punya cerita dalam hal ini perburuan Simak Video Tampik Babe Ridwan Saidi Prof Agus Munandar Sebut Kerajaan Galuh Otentik Gambas Video detik rns rns arkeologi sains artikel sains 
Ironi Limbah Nuklir dalam Pembangkit Listrik, Berlin Tujuh puluh tahun setelah era nuklir dimulai tidak ada satu pun negara yang membangun tempat untuk membuang limbah nuklirnya secara aman Hal ini diungkapkan oleh sebuah laporan yang terbit pekan ini sehingga meningkatkan kekhawatiran bagi pemerintah atau negara negara yang tengah mempertimbangkan memakai tenaga nuklir sebagai alternatif dari bahan bakar fosil Menurut laporan World Nuclear Waste lebih dari ton limbah radioaktif dalam bentuk bahan nuklir batangan bekas disimpan di lokasi sementara di seluruh Eropa Beberapa disimpan di fasilitas fasilitas lama yang sudah kehabisan kapasitas dan diperkirakan masih akan digunakan selama beberapa dekade lebih lama dari yang direncanakan Menurut laporan dari Heinrich Bll Foundation yang berafiliasi dengan Partai Hijau Jerman Finlandia menjadi satu satunya negara yang membangun repositori permanen bawah tanah untuk limbah nuklir yang memancarkan radiasi dalam jumlah besar selama puluhan ribu tahun Kita berbicara tentang kerangka waktu yang melampaui skala manusia yang dapat kita pikirkan kata Arne Jungjohann ilmuwan politik dan pemimpin redaksi dari laporan tersebut Kita masih tidak tahu dimana harus menaruh limbah itu dengan aman supaya tidak akan ada yang terluka tidak rentan terhadap serangan teroris dan tidak dicuri untuk membuat bom nuklir tambahnya Di awal era nuklir bahan bahan radioaktif diencerkan dan dibuang begitu saja ke lingkungan hal itu dilakukan sebelum pemerintah pada akhirnya memutuskan menyimpan limbah nuklir dengan aman di bawah tanah Tetapi proyek proyek dari tahun dan seterusnya harus memenuhi standar keselamatan yang tinggi sampai pada batas maksimum jika memungkinkan jelas laporan tersebut Hal ini meningkatkan kekhawatiran bagi negara negara berkembang yang berencana menggunakan tenaga nuklir Tenaga Nuklir di AfrikaPopulasi perkotaan di Afrika akan meningkat dua kali lipat dalam tiga dekade mendatang membuat permintaan akan infrastruktur dan energi semakin masif Pada hanya setengah dari warga Afrika yang memiliki akses listrik padahal rata rata global sebesar seperti ditunjukkan data Bank Dunia Karena berkeinginan untuk menghubungkan warga dengan jaringan listrik dengan menghindari emisi tinggi dari negara negara Barat beberapa negara akhirnya mengeksplorasi nuklir sebagai cara memasok energi yang murah dan stabil Menurut Asosiasi Nuklir Dunia Afrika Selatan menjadi satu satunya negara dari benua Afrika yang saat ini tengah mengoperasikan pembangkit nuklir sementara belasan negara lain tengah mempertimbangkan akan membangun pembangkit nuklir atau tidak Sebuah makalah yang diterbitkan dalam jurnal sains dan teknologi menemukan bahwa di awal tahun ini beberapa negara seperti Aljazair Mesir Ghana Kenya Namibia Nigeria Tanzania Uganda dan Zambia telah menandatangani perjanjian kerja sama dengan perusahaan energi nuklir dari Rusia bernama Rosatom Sementara negara negara lainnya memiliki kontrak dengan Cina Selain meningkatkan volume listrik yang mereka hasilkan negara negara Afrika juga ingin membuat pasokan listrik mereka terjaga Negara negara seperti Nigeria dan Ghana selama ini berjuang dengan masalah pemadaman listrik yang kerap membuat warganya menggunakan generator diesel sebagai tenaga cadangan yang juga mencemari udara Precious Akanonu seorang peneliti dari Pusat Studi Ekonomi Afrika mengatakan bahwa energi nuklir dapat memainkan peran tambahan di Afrika Sampai kita mampu secara bertahap menghilangkan ketergantungan terhadap bahan bakar fosil energi nuklir akan berguna untuk menghindari ketergantungan berlebihan pada suatu sumber energi yang rapuh terhadap guncangan ujarnya Isu tenaga nuklir menuai pro kontra di kalangan aktivis lingkungan Beberapa melihatnya sebagai bagian penting dalam hal transisi dari bahan bakar fosil sebagai alat yang diperlukan untuk mengurangi emisi CO dan menghindari bencana pemanasan global Di negara negara seperti Jerman dimana pemerintahnya berjanji menghapus energi nuklir setelah bencana Fukushima pada tahun para kritikus berpendapat bahwa negara itu menjadi terpaku pada batu bara sehingga melanggar janji terkait emisi CO berdasarkan Perjanjian Paris tentang perubahan iklim Namun upaya untuk menangani limbah nuklir sejauh ini goyah Tanpa Rusia dan Slovakia karena data yang kurang lengkap laporan World Nuclear Waste menemukan bahwa hanya empat negara Prancis Inggris Ukraina dan Jerman yang bertanggung jawab atas lebih dari setengah limbah nuklir Eropa dan belum ada yang menemukan tempat bawah tanah yang dalam untuk menampung limbah nuklir selama berabad abad Laporan Heinrich Bll Foundation menyebut banyak pemerintahan menganggap enteng pembiayaan tempat pembuangan limbah nuklir dan pelucutan reaktornya dengan menerapkan aturan aturan tidak konsisten dengan mengalihkan beban keuangan dari operator pabrik ke dalam pungutan pajak masyarakat Masalah limbah nuklir yang belum terselesaikan menjadi argumen pembantah melawan masuk ke era nuklir ujar Rebecca Harms mantan anggota parlemen Eropa yang turut serta dalam pembuatan laopran tersebut Negara negara Afrika harus mempertimbangkan warisan nuklir yang telah ada selama tahun terakhir ini dan menurut kami tidak ada solusi untuk itu Dalam laporan yang diterbitkan Badan Energi Internasional IEA yang bertajuk Africa Energy Outlook kebutuhan energi di Sub Sahara Afrika diprediksi meningkat persen pada dua puluh tahun mendatang sementara energi nuklir hanya akan memasok sebagian kecil dari jumlah kebutuhan tersebut Apa yang kita lihat dalam perkembangan ekonomi di Sub Sahara Afrika di masa depan akan didukung oleh energi terbarukan dan gas alam ujar Kieren McNamara analis senior IEA Nuklir tidak termasuk tambahnya gtp rap ag ita ita dw news nuklir pembangkit nuklir 
