title,content
Teror Bom BGIS: Parsial yang Membawa Sial, Jakarta Indonesia meleduk lagi Bom bunuh diri di depan GBIS Gereja Bethel Injil Sepenuh Kepunton Solo pada tgl September telah memakan korban jiwa dan puluhan lainnya terluka sia sia Tulisan berikut ini akan melengkapi perspektif dua tulisan sebelumnya yang telah dimuat media ini Pertama Noor Huda Ismail dalam â Estafet Pelaku Bomâ detikNews com Senin menegaskan bom bunuh diri di depan GBIS merupakan indikasi bahwa faksi radikal dalam bentuk sel sel kecil tidak pernah mati Mereka bertumbuh dan melakukan aksi seiring dengan momentum Bisa dikatakan pula bahwa saat ini merupakan fase individual jihad yang bersifat leaderless tanpa figur pemimpin yang kuat anak anak muda berlomba lomba untuk berjihad dalam kapasitas sekecil apa pun Karena injeksi pandangan jihad sebagai perang atau qital sudah merasuk dan diyakini kebenarannya Sehingga pada saat ada momentum sistem pembalasan langsung teraktivasi dengan otomatis Kedua Jusman Dalle dalam Katastrofi Bom Politik detikNews com Selasa mencatat keterkaitan setiap aksi terror bom di negeri zamrud katulistiwa ini dengan peristiwa peristiwa politik yang telah menjadi perhatian khalayak ramai Kita bisa membaca pola ini misalnya Ketika sedang hangat hangatnya kasus Daftar Pemilih Tetap DPT pemilu lalu muncul ledakan bom di Hotel JW Marriot dan Ritz Carlton pada bulan Juli Ketika mega skandal bailout Bank Century sedang panas panasnya dan berefek guncangan besar pada pusat kekuasaan great disruption on centre of power saat penentuan kelanjutan kasus tersebut dengan voting pada Maret Tak berselang lama tiba tiba muncul isu bom di depan Universitas Kristen Indonesia UKI Cawangan Jakarta Timur yang melibatkan oknum wartawan saat itu Anak ZamanBagi penulis dalam perpsektif agama aksi aksi terorisme di negeri tercinta ini dengan pemuda sebagai martirnya sesungguhnya akibat daripada kerancuan dan parsialitas dalam memahami dan mengamalkan ajaran agama apapun agamanya Dengan kata lain beragama secara parsial pasti akan melahirkan sial Begitu juga beragama dengan rancu pasti akan membuahkan petaka Di Mesir seorang insinyur muda menceraikan isterinya yang tidak mau menggunakan jilbab Padahal saat yang sama dia telah menelantarkan kedua anaknya yang masih kecil hanya karena masalah jilbab itu Sementara di Irak Afghanistan Pakistan ribuan nyawa telah meregang percuma di masjid masjid justru saat mereka menunaikan ibadah privat vertikal Sedangkan di Indonesia teror bom semakin merajalela sejak awal millennium ketiga ini selain berkecambahnya kekerasan yang mengatasnamakan agama Pemuda mesir itu juga para martir bom bunuh diri atau pelaku terorisme dan anarkisme biasanya bertampang bersih baik banyak membaca atau menghafal hadits Merekalah yang selama ini disebut sebagai kaum reliji atau orang orang yang kuat semangat keberagamaannya Mereka merupakan anak baca realitas zaman yang tidak terbantahkan sejak fajar islam menyingsing lima belas abad silam Hanya saja pelakonnya saja yang berganti seiring dengan bergantinya kurun Mereka adalah para pemuda yang lebih mengedepankan perasaan tapi mengenyampingkan pemikiran memisahkan pengetahuan dari pemahaman dan banyak menghafal namun sedikit berfikir Pada skala yang lebih besar mereka serupa dengan kelompok yang memandang sinis terhadap orang orang diluar kelompok mereka menggunakan tongkat dalam upaya menegakkan amar ma ruf dan nahi munkar siap mati syahid demi menutup sebuah konser musik menganggap penghancuran botol botol minuman keras atau VCD porno sebagai jihad fi sabilillah meninggalkan pekerjaan atau kuliah sekolah memutuskan silaturrahim dengan dalih â marah karena Allahâ Mereka bukan orang jahat bukan musuh masyarakat atau pun musuh zaman yang harus disingkirkan atau dibawa ke tiang gantungan sebagaimana yang diserukan oleh sekelompok orang yang mengaku cendikiawan muslim tapi berpikir dan bertindak laiknya kaum liberal diabolis bahkan terkadang lebih liberal daripada paham liberal asli sekalipun yang membenci islam dan muslimin Khawarijisme ModernJika ditelusuri kitab kitab sirah maka akan didapatkan kemiripan mereka dengan kaum khawarij yang disebut kaum puritan islam pertama Buku buku klasik maupun kontemporer sering menukil cerita tentang kegemaran khawarijisme beribadah Syaikh Muhammad Abu Zahrah misalnya dalam Tarikh al madzahib al islamiyah mengatakan Demi Allah mereka adalah anak anak muda yang telah bersikap bak orang tua Mata mereka tidak mau menatap kejahatan kaki mereka tidak mau melangkah kepada kebatilan dan badan mereka kurus kering karena terlalu sering beribadah dan bergadang Setiap kali membaca ayat ayat tentang surgea mereka menangis karena merindukannya Dan setiap kali membaca ayat ayat tentang neraka sedu sedan keluar dari tenggorokan seolah mereka telah benar benar mendengar deru api neraka Huwaidi Tetapi di siang hari bak singa kelaparan yang siap menerkam siapa saja yang bersbeda dengan mereka Bahkan perlakuan keras mereka itu lelih keras daripada perlakuan mereka terhadap orang orang kafir Begitu kejamnya mereka hingga mencapai level takfir mengkafirkan muslim dari kelompok lain Tidak menaruh belas kasihan kepada wanita anak kecil hatta orang tua sekalipun Inilah yang menjangkiti pemuda mesir di atas juga para martir bom bunuh diri di berbagai belahan dunia islam kecuali di Palestina gerakan Negara islam Indonesia NII jamaâ ah islamiyah atau gerakan gerakan serupa lainnya Dengan kata lain mereka merupakan tamsilan khawarijisme modern di abad Sial Akibat ParsialKhawarijisme baik dulu maupun modern merupakan bukti nyata betapa parsialitas dan kerancuan dalam memahami agama ini berakibat fatal dan menghancurkan sendi sendi peradaban gemilang yang telah dibangun oleh Rasulullah bersama sahabat sahabatnya yang mulia Akibat tindakan mereka agama ini diobok obok Iman yang parsial dan rancu bukanlah fenomena baru dan lahir di masyarakat kita saja tetapi fenomena klasik yang terjadi di kalangan muslim maupun nonmuslim Catatan tentang keimanan yang parsial dan rancu dipenuhi pelbagai tidakan bodoh dan kejam baik di abad pertengahan maupun di abad modern Misalnya peperangan keji di antara katolik dan protestan kekejaman inkuisisi demi memurnikan akidah dari kesesatan Guillotin dilakukan Yakobian pasca revolusi Perancis demi mempertahankan kebebasan persaudaraan dan persamaan Juga tinta hitam sejarah yang ditorehkan kaum muda Garda Merah di Cina atas nama revolusi kebudayaan Yang perlu ditegaskan iman yang rancu atau buta bukanlah karakteristik bangsa tertentu yang tidak dimiliki oleh bangsa lain Bahwa para pemilik niat baik yang dengan lantang meneriakkan kebajikan justeru seringkali melumuri tangan mereka dengan darah manusia pada saat mereka menyangka sedang melakukan kebajikan Untuk melerai parsialitas dab kerancuan iman beragama yang membawa kesengsaraan dan petaka tersebut solusinya tak lain adalah kembali ke pemahaman islam yang sejatinya memoderasi dua esktemitas yang saling bertolak belakang ifrath pragmatis diabolis versus tafrith khawarijisme moderen Nah untuk mewujudkan pemahaman moderat dimaksud aktivitas dakwah itu harus bersinergi baik di gampong di kampus maupun di kantor Menegakkan kejujuran tidak hanya di ruang ruang bersekat tempat berasyik masyuk melakukan penghambaan privat vertikal tapi juga dalam interaksi social horizontal Penulis sepakat dengan Ketua Umum PBNU KH Said Agil Siradj yang menyebut keyakinan para bomber yang akan disambut bidadari hanyalah gombal Said juga mengajak seluruh elemen bangsa terus bekerja keras untuk membentengi pengaruh kekerasan pada generasi muda pelajar dan mahasiswa Hal itu agar tidak ada lagi korban pemikiran radikal yang mengajarkan militan sehingga menganjurkan melakukan kekerasan atas nama agama detikNews com Selasa Sebagai penutup umara dan ulama serta komunitas masyarakat madani civil society dituntut untuk mengajarkan peradaban kepada orang kebanyakan dengan pemahaman dan pengejawantahan lima karakter aksiomatik Islam nir eksesifisme berlebih lebihan atau menambah nambahi tidak pula mereduksi non distorsif proporsional totalitas saling melengkapi Itulah yang dapat mempersempit ruang bagi khawarijisme yang selalu ada di setiap masa untuk menistakan agama dan menyengsarakan pemeluknya Penulis adalah peminat kajian social keagamaan alumni UIN Syarif Hidayatullah JakartaAhmad ArifJl Tuan Dipakeh II No Jaya Baru Banda Acehbanta_lw yahoo com wwn wwn 
"Kompor Gas Meleduk di Kebon Pisang, Puluhan Rumah Terbakar ", Jakarta Kompor gas meleduk di sebuah rumah di Kampung Kebon Pisang Jakarta Utara Puluhan rumah terbakar Sekitar unit mobil pemadam kebakaran damkar dikerahkan Kejadiannya pukul WIB ujar Sarwanto petugas damkar ketika dihubungi Selasa Menurut Sarwanto api berhasil dipadamkan pada pukul WIB Tidak ada korban jiwa dalam insiden itu Namun rumah terbakar habis serta rumah sebelahnya juga ikut terbakar Karena rumah terbakar api lanjut Sarwanto pemilik rumah mengungsi ke tempat yang tidak jauh dari rumah korban nik mok 
Kompor Meleduk Penyebab Kebakaran Pabrik BH di Sunter, Jakarta Kebakaran yang menghanguskan pabrik BH milik CV Aneka Industri di Sunter Podomoro Jakarta Utara disebabkan kompor yang meleduk di sekitar pabrik itu Saat ini petugas sudah berhasil memadamkan kobaran api Sumber api berasal dari kompor meleduk milik Sun Yun San di Jalan Agung Timur IV Blok I nomor kata Kasudin Pemadam Kebakaran Jakarta Utara Irwan di lokasi kebakaran Sunter Podomoro Jakarta Utara Senin Irwan mengatakan api dari kompor yang meleduk itu langsung menyambar bangunan PT Kartini Angin kencang menyebabkan kebakaran ini meluas Akibatnya pabrik BH yang terletak di samping PT Kartini terbakar Saat ini petugas masih menyemprotkan air untuk mendinginkan lokasi kebakaran itu Selain menghanguskan CV Aneka Industri kebakaran itu juga menghanguskan sebuah gudang sepeda Tidak ada korban dalam peristiwa ini nal nvt 
Listrik di Warung Buncit Padam Sejak Pukul 23.00 WIB, Jakarta Warga di kawasan Warung Buncit Jakarta Selatan tidak merasakan listrik sejak sekitar pukul WIB Selasa Penyebabnya ada gardu listrik meleduk Padamnya listrik ini membuat aktivitas perumahan dan perkantoran yang berada di kawasan ini terganggu sebab hingga Rabu siang listrik tak juga menyala Ada trafo di sebuah gardu yang meledak kata seorang warga pada detikcom Ledakan trafo itu terdengar warga semalam Sejumlah perkantoran menggunakan genset untuk operasi seperti RS JMC Sementara itu Humas PLN Bambang Dwiyanto yang dihubungi detikcom menyatakan akan mengecek terlebih dahulu mengenai kerusakan listrik itu Saya cek dulu ya nanti saya hubungi lagi katanya kepada detikcom nal nrl 
"Red Bull Berantakan, Alonso Menang", Yeongam Nasib sial berlipat ganda dialami Red Bull di balapan perdana GP Korea Minggu Kedua pembalapnya out berantakan dan hal itu dimanfaatkan Fernando Alonso untuk meraih kemenangan Kesialan Red Bull bermula ketika Mark Webber melintir dan menabrak dinding sirkuit lalu dihantam dari belakang oleh Nico Rosberg di lap atau satu lap setelah balapan dimulai setelah tertahan selama satu jam karena hujan Vettel yang memegang pole position dan bertahan terus di depan melengkapi hari buruk timnya ketika tumbang di lap Mobilnya tiba tiba melambat sehingga begitu mudah dilewati Alonso dan Lewis Hamilton dan akhirnya meleduk Alonso mampu bertahan pada balapan yang penuh insiden ini dan berhasil mencapai podium teratas Pembalap Ferrari ini otomatis naik ke puncak klasemen sementara dengan poin Hamilton yang menjadi runner up juga merayap ke peringkat tiga dengan nilai terpaut sepuluh angka di bawah Webber Vettel Dengan koleksi angka dia kini sedikit mengecil kansnya karena balapan tinggal tersisa di Sao Paulo dan Abu Dhabi Adapun Jenson Button semakin jauh dari peluang mempertahankan gelar juaranya setelah tidak mendapatkan apa apa pada balapan hari ini Hasil GP Korea lap Â AlonsoÂ Â Â Â Â Â Â FerrariÂ Â Â Â Â Â Â Â Â Â Â Â Â Â Â Â Â Â Â h Â HamiltonÂ Â Â Â Â McLaren MercedesÂ Â Â Â Â Â Â Â Â Â Â Â Â Â MassaÂ Â Â Â Â Â Â Â FerrariÂ Â Â Â Â Â Â Â Â Â Â Â Â Â Â Â Â Â Â Â Â Â Â SchumacherÂ Â Â MercedesÂ Â Â Â Â Â Â Â Â Â Â Â Â Â Â Â Â Â Â Â Â Â KubicaÂ Â Â Â Â Â Â RenaultÂ Â Â Â Â Â Â Â Â Â Â Â Â Â Â Â Â Â Â Â Â Â Â LiuzziÂ Â Â Â Â Â Â Force India MercedesÂ Â Â Â Â Â Â Â Â Â BarrichelloÂ Â Williams CosworthÂ Â Â Â Â Â Â Â Â Â Â KobayashiÂ Â Â Â Sauber FerrariÂ Â Â Â Â Â Â Â Â Â Â Â Â Â HeidfeldÂ Â Â Â Â Sauber FerrariÂ Â Â Â Â Â Â Â Â Â Â Â Â Â HulkenbergÂ Â Â Williams CosworthÂ Â Â Â Â Â Â Â Â Â Â AlguersuariÂ Â Toro Rosso FerrariÂ Â Â Â Â Â Â Â Â Â ButtonÂ Â Â Â Â Â Â McLaren MercedesÂ Â Â Â Â Â Â Â Â Â Â Â KovalainenÂ Â Â Lotus CosworthÂ Â Â Â Â Â Â Â Â Â Â Â Â Â Â Â lap Â SennaÂ Â Â Â Â Â Â Â HRT CosworthÂ Â Â Â Â Â Â Â Â Â Â Â Â Â Â Â Â laps Â YamamotoÂ Â Â Â Â HRT CosworthÂ Â Â Â Â Â Â Â Â Â Â Â Â Â Â Â Â lapsTidak finishSutilÂ Â Â Â Â Â Â Â Force India MercedesÂ Â Â Â Â Â Â VettelÂ Â Â Â Â Â Â Red Bull RenaultÂ Â Â Â Â Â Â Â Â Â Â Â PetrovÂ Â Â Â Â Â Â RenaultÂ Â Â Â Â Â Â Â Â Â Â Â Â Â Â Â Â Â Â Â Â GlockÂ Â Â Â Â Â Â Â Virgin CosworthÂ Â Â Â Â Â Â Â Â Â Â Â Â BuemiÂ Â Â Â Â Â Â Â Toro Rosso FerrariÂ Â Â Â Â Â Â Â Â Â Di GrassiÂ Â Â Â Virgin CosworthÂ Â Â Â Â Â Â Â Â Â Â Â Â TrulliÂ Â Â Â Â Â Â Lotus CosworthÂ Â Â Â Â Â Â Â Â Â Â Â Â Â WebberÂ Â Â Â Â Â Â Red Bull RenaultÂ Â Â Â Â Â Â Â Â Â Â Â RosbergÂ Â Â Â Â Â MercedesÂ Â Â Â Â Â Â Â Â Â Â Â Â Â Â Â Â Â Â Â a s a s 
"Sudah Disosialisasi, Warga Masih Takut Pakai Elpiji", Jakarta Meski telah mendapat pengarahan penggunaan tabung elpiji Kg oleh PT Pertamina Persero warga RT RW Kelurahan Bintaro Pesanggrahan Jakarta mengaku masih ngeri terjadi ledakan seperti yang terjadi di beberapa wilayah lainnya Menurut salah satu warga di RT Lina dirinya sampai saat ini merasa was was jika memakai kompor gas elpiji Kg Padahal Lina merupakan salah satu warga yang didatangai Direktur Utama PT Pertamina Persero Karen Agustiawan Suka lihat di TV televisi meleduk ini itu Saya takut jangan jangan ada apa apa keluh Lina saat ditemui di rumahnya Kelurahan Bintaro Jakarta Minggu Hal yang sama juga diceritakan salah satu warga lain yang enggan menyebutkan nama DirinyaÂ terpaksa menggunakan elpiji Kg karena tidak adastok minyak tanah di pasaran Karena nggak ada minyak ya pakai gas Tapi dengan hati was was Kita lihat di TV TV kan ngeri tegasnya Dirut Pertamina Karen Agustiawan belakangan ini sebenarnya telah melakukan sosialisasi mengenai penggunaan elpiji Kg khususnya pemukiman padat penduduk Seperti diakui ketua RT RW Sa an warga di lingkungan Kelurahan Bintaro termasuk pemukiman padat penduduk dan diantaranya telah melakukan program konversi minyak tanah ke elpijiÂ sejak tahun Alhamdulillah disini belum ada kayak gitu ledakan Tapi kitaÂ ingin warga pada tahu semua biar nggak salah ujar Sa an saat berbincang dengandetikFinance Pemerintah melalui Pertamina memang tengah menggalakkan sosialisasi penggunaan kompor gas elpiji Kg BUMN Migas ini berusaha menarik selang dan regulator yang dianggap tidak standar dan dipakai masyarakat Selang dan Regulator baru yang ditukar dihargai masing masing Rp dan Rp Â namun ternyata ada warga yang tetap menginginkannya secara gratis Apa bisa gratis celoteh Sudirman salah satu warga diirinngi riuh dari warga lainnya Kepala Operasi Region II Pertamina Muhammad Toriq pun langsung menjawab bahwa soal gratis atau tak gratis adalah tugas pemerintah sedangkan Pertamina hanya pelaksana saja Dirinya pun mengaku saat program konversi awal dilaksanakan tahun belum ada tabung ataupun aksesoris bercap SNI Pasalnya waktu itutidak menjadi dasar yang diminta pemerintah sampai awal pabrikan belum dipersyaratkan untuk menuliskan SNI oleh pemerintah Tapi akhir sudah dipersyaratkan imbuhnya wep hen 
'Partai' Minyak Tanah Dipilih Karena Lebih Aman, Jakarta Pemilu minyak tanah vs gas yang dilakukan di RT RW Kelurahan Cipayung Jakarta Timur memutuskan Partai minyak tanah sebagai pemenang Lantas apa alasan warga menjatuhkan pilihan pada minyak tanah Takut kalau pakai gas Murahan minyak tanah aman Kalau gas kita tinggal meleduk deh kebakaran deh ujar salah seorang pemilih Nurhayati di lokasi Minggu Seperti halnya Nurhayati pemilih yang lain Turah mengatakan selain faktor aman Dirinya memilih minyak tanah karena faktor finansial Menurut Turah meski harga tabung gas Kg lebih murah dibanding harga minyak tanah yang per liternya Rp namun dirinya mengaku berat harus mengeluarkan uang sebesar harga tabung gas kg secara langsung Lebih murah gas praktis gampang tanpa nyundut Tapi beli ribunya itu susah Kalau lagi punya uang beli kalau lagi nggak ada jelas Turah Berbeda dengan Nurhayati dan Turah yang memilih minyak tanah Peni justru lebih memilih gas Alasannya selain karena penggunaannya praktis juga tidak mengotori tempat sekitar Selain itu menurut perempuan yang berprofesi sebagai pedagang makanan sarapan pagi ini harga tabung gas lebih murah dibandingkan dengan harga minyak tanah Kalau minyak tanah liter sekali ngisi besok beli lagi Se liternya Rp ribu Kalau tabung gas Kg bisa seminggu dua kali ngisi tapi harganya kan Rp ribu kata Peni Sebelumnya LSM Bendera menggelar pemilu tiruan dengan kontestan minyak tanah melawan tabung gas Tujuannya ingin mengetahui preferensi warga Apakah mereka memilih minyak tanah atau gas ddt fay 
Playground Festival 2009: Bergoyang di Atas Pasir, Jakarta Sabtu pagelaran Playground Festival yang diadakan di Pantai Carnaval Anco dipenuhi ribuan penonton Ribuan orang itu menikmati asyiknya berdansa di atas pasir Tahun adalah tahun ketiga pergelaran akbar Playground Festival digelar Dalam Playground Festival kali ini terdapat tiga panggung yakni Surya Slims Embassy Stage Coca Cola Zero Wonderbar Stage dan Surya Slims Balcony Stage Masing masing panggung menyuguhkan band dan DJ lokal maupun mancanegara Surya Slims Balcony Stage dibuka dengan aksi DJ lokal Ical Kemudian penonton dibuat bergoyang dengan permainan DJ kawakan Peter Hook dari Manchester Inggris selama dua jam DJ Bone dari Spinach ikut meramaikan Surya Slims Balcony Stage degann musik elektro Suasana yang berbeda terjadi saat Novak D Disco mulai mengisi Surya Slims Balcony Stage Dentuman musik disko dibalut dengan visual D menjadi sensasi tersendiri bagi para penonton Sama halnya dengan Surya Slim Balcony Stage pada Coca Cola Zero Wonderbar Stage diisi dengan serangkaian DJ DJ handal Salah satu yang ditunggu tunggu adalah Chicane Ai Tumbuan Johan Gielen The Thrillseekers dan Deny Clubhoppers juga ikut meramaikan Coca Cola Zero Wonderbar Stage Sedikit berbeda dengan dua panggung lainnya Surya Slims Embassy Stage menghadirkan banyak band meskipun di dalam panggung ini masih ada DJ seperti Remi Irwan dan Sasha Sayang di Surya Slims Embassy Stage sempat terjadi masalah teknis saat C U T Snaik panggung Pertukaran pun dilakukan panitia sehingga membuat the S I G I T tampillebih dulu Lagu Clover Doper menjadi pembuka penampilan the S I G I T dan penonton pun sontak meramaikan panggung ini Seolah memberikan pemanasan bagi para penonton the S I G I T tampil jor joran Bahkan sang vokalis Rektivianto Yoewono sempat membuat heboh dengan turun dari panggung dan menghampiri para penonton saat membawakan No Hook The S I G I T turun panggung C U T S akhirnya kembali lagi setelah masalah teknis Dengan dua vokalis perempuannya C U T S tampil energik dengan berkali kali mengelilingipanggung Band asal Bandung ini membawakan total lagu termasuk hitsnya Beringas dan Isabella Setalah C U T S kini giliran Agrikulture yang menggoyang Ancol Hits seperti Gossip dan Kompor Meleduk yang merupakan lagu recycle dari almarhum Benyamin Sueb sontak membuat penonton ikut bernyanyi Agrikulture juga sempat memainkan dua lagu baru mereka pada album keduanya yang akan dirilis Menjelang tengah malam penampilan yang paling dinanti kebanyakan penonton pun akhirnya dimulai Ya mereka adalah Franz Ferdinand Para penonton langsung berteriak histeris ketika Alex dkk memasuki panggung Dengan menyapa Selamat Malam Franz Ferdinand pun memulai aksinya Suara penonton semakin bergemuruh ketika Franz Ferdinand memainkan hits mereka Take Me Out Tepat pada pukul WIB band asal Skotlandia ini meninggalkan panggung Penonton yang masih belum puas dengan aksi panggung mereka bersama sama meneriakkan We want more berkali kali Dalam hitungan menit Franz Ferdinand pun kembali ke panggung untuk menghibur para fansnya di Indonesia Ribuan penonton pun kembali bergoyang menjadikan pasir sebagai lantai dansa eny eny 
Kompor Meleduk Hanguskan 1 Rumah di Tomang, Jakarta Lagi lagi akibat kompor meleduk Rumah milik Ahyar pun ludes diamuk api Keluarga Ahyar pun harus mengungsi ke kerabat terlebih dahulu hingga rumah semipermanen tersebut kembali dibangun Saksi mata Nani menyatakan kompor meleduk saat keluarga Ahyar sedang masak Saat diitinggal kompor meledak lalu merembet ke yang lain kata Nani di lokasi kebakaran RT Kota Bambu Utara Tomang Jakarta Barat Selasa Untunglah tetangga korban langsung sigap Ember ember penuh air langsung disemburkan ke kobaran api Mobil pemadam yang datang menit kemudian menyemprot seisi rumah untuk mendinginkan api Sekarang ngungsi dulu ke saudara sambil dibenerin rumahnya ucap korban Ahyar Saat ini warga yang menyemut untuk melihat kebakaran sudah mulai menyepi Sementara mobil DPKÂ meninggalkan lokasi Cepatnya api padam dikarenakan tetangga kiri kanan korban terbuat dari tembok yang tidak mudah terbakar Untungnya angin lagi enggak gede Kalau angin gede bisa ke tetangga pungkas Nani Ari nrl 
"Api Padam, Aktivitas Kembali Normal", Jakarta Usai dievakuasi pasca kebakaran saat ini puluhan tenant serta pengunjung Plaza Atrium telah beraktivitas kembali Lokasi kebakaran yaitu di Warung khas Aceh Jaly Jaly saat ini pun telah diberi police line Para pengunjung yang sebelumnya berhamburan kini kembali memborong baju serta kebutuhan lebaran yang didiskon besar besaran Stand stand makannan juga mulai banyak dipenuhi pelanggan kembali setelah sebelumnya sempat ditutup Penyebab kebakaran saat ini masih diselidiki Kemungkinan besar karena kompor meleduk kata Kapolsek Senen Kompol AL Tobing Sabtu Di selasar deretan warung Jaly jaly terdapat kurang lebih warung yang hingga saat ini belum buka karena masih dibersihkan terutama lantainya masih banyak air Sedangkan Studio saat ini juga mulai kembali dibuka Studio yang letaknya cuma sekitar meter dari lokasi kejadian kebakaran sebelumnya berhenti beraktivitas lantaran pengunjungnya lari menyelamatkan diri anw gah 
Mall dan Apartemen Poin Square Lebakbulus Gelap Gulita , Jakarta Kawasan pusat belanja dan apartemen Poin Square POINS Lebakbulus gelap gulita Diduga kuat kejadian ini akibat genset yang terbakar hari lalu Pantuan detikcom pukul WIB Selasa kawasan tersebut masih terlihat gelap Dari lantai bawah pusat perbelanjaan hingga lobi apartemen tidak ada lampu yang menyala Sejak siang hari POINS memang sudah tertutup untuk umum Semua toko termasuk Giant tutup Belum diketahui di mana para penghuni apartemen POINS diungsikan Sementara kondisi jalan di depan mall tidak terlalu padat Hanya pejalan kaki yang lalu lalang di depan pertigaan jalan Lebakbulus dan Pondok Indah tersebut Untuk diketahui saja genset POINS yang terletak di lantai dasar terbakar pada Minggu Juli lalu Asap membumbung Asap itu berasal dari genset yang meleduk yang melahirkan percikan api mad mad 
"Api Sudah Padam, 200 Karyawan Tumplek di Halaman", Jakarta Asap membumbung di pusat belanja dan apartemen Poins Square Lebak Bulus Jakarta Selatan berasal dari genset yang meleduk yang melahirkan percikan api Saat ini api berhasil dijinakkan Sekitar karyawan yang bekerja di gedung tinggi itu tumplek blek di halaman Pantauan detikcom pukul WIB sekitar unit mobil pemadam kebakaran berada di lokasi Petugas pemadam tampak terus menyiramkan air ke lantai basement bangunan itu Mereka melakukan pendinginan Sudah tidak tampak jilatan api Yang ada hanya kepulan asap menghitam Informasi dari salah satu petugas pemadam kebakaran kebakaran terjadi disebabkan oleh genset yang berada di lantai basement meledak sekitar pukul WIB Sekitar karyawan terpaksa menunggu di luar gedung hingga proses pemadaman berakhir Lalu lintas tampak tersendat dari arah Pondok Indah ke Lebak Bulus Kemudian dari arah Fatmawati ke Lebak Bulus untuk jalur sebelah kiri ditutup sehingga kendaraan hanya bisa melintas di jalur sebelah kanan nwk nrl 
Asap Membumbung dari Basement Poins Square Lebakbulus, Jakarta Asap terlihat membumbung hitam bersumber dari basement pusat belanja dan apartemen Poins Square Lebakbulus Jakarta Selatan Sekitar armada pemadam pun berdatangan Petugas Sudin Kebakaran Jakarta Selatan Sana belum mengetahui penyebab munculnya asap itu Sekitar armada dikirim lokasinya di basement katanya pada detikcom Minggu pukul WIB Namun beredar informasi bahwa asap muncul dari genset yang meleduk nrl nwk 
