title,content
BMKG Minta Warga Yogya Waspadai Potensi Hujan Lebat Sepekan ke Depan, Yogyakarta Badan Meteorologi Klimatologi dan Geologi BMKG memprediksi dalam sepekan ke depan akan terjadi hujan lebat di wilayah Daerah Istimewa Yogyakarta DIY Oleh karenanya BMKG meminta masyarakat agar waspada Berdasarkan hasil analisis dinamika atmosfer terkini pola tekanan rendah di wilayah Belahan Bumi Selatan BBS masih cukup aktif berpengaruh pada pembentukan potensi cuaca ekstrem di wilayah Jawa khususnya DIY kata Kepala Stasiun Klimatologi BMKG Yogyakarta Reni Kraningtyas dalam keterangan tertulisnya Minggu Keberadaan daerah tekanan rendah di Pesisir Australia Barat bagian utara dan di Samudera Hindia selatan Jawa Timur serta sirkulasi angin tertutup di utara Papua Barat Selanjutnya Halaman yogyakarta bmkg bmkg yogyakarta hujan lebat di yogya prakiraan cuaca birojatengdiy 
"Jadi Biang Kerok Banjir, Proyek Kereta Cepat JKT-BDG Disetop Besok", Jakarta Kementerian Pekerjaan Umum dan Perumahan Rakyat PUPR meminta proyek kereta cepat Jakarta Bandung dihentikan sementara mulai Senin Maret Pemberhentian ini dilakukan selama dua Minggu Betul pemberhentian sementara Nanti selama dua minggu akan kita evaluasi Mulai Maret kata Plt Dirjen Bina Konstruksi Kementerian PUPR Danis Sumadilaga kepada detikcom Sabtu Danis menambahkan permintaan penghentian pekerjaan proyek kereta cepat Jakarta Bandung dilakukan oleh Komite Keselamatan Konstruksi Suratnya penghentian kepada KCIC dari ketua komite keselamatan konstruksi Ya memang di bawah PUPR karena itu komite dibentuk menteri pu untuk awasi jalannya manajemen konstruksi yang baik tambahnya Terkait dengan dihentikannya pekerjaan proyek Danis mengatakan karena berbagai hal Proyek tersebut juga sempat disebut menjadi biang kerok banjir beberapa waktu lalu Macam macam berbagai hal kamu cari lah suratnya Satu terkait dengan metode kerja kedua berkaitan dengan dampak pekerjaan itu Lalu berkaitan dengan cara kerja juga K nya jelasnya Lalu ada yang berkaitan dengan pembuatan tiang di KM tambahnya Apa sih yang menjadi masalah sehingga proyek ini diberhentikan Buka halaman selanjutnya Selanjutnya Halaman kereta cepat jakarta bandung kereta cepat kcic 
Lengkap! Ini Penyebab Proyek Kereta Cepat Jakarta-Bandung Disetop, Jakarta Kementerian Pekerjaan Umum dan Perumahan Rakyat PUPR lewat Komite Keselamatan Konstruksi meminta proyek Kereta Cepat Jakarta Bandung dihentikan sementara Penghentian akan dilakukan mulai Maret kemudian proyek ini akan dievaluasi selama dua minggu Betul pemberhentian sementara Nanti selama dua minggu akan kita evaluasi Mulai Maret kata Plt Dirjen Bina Konstruksi Kementerian PUPR Danis Sumadilaga kepada detikcom Sabtu Pemberhentian proyek ini dilakukan setelah Komite Keselamatan Konstruksi melayangkan surat kepada PT Kereta Cepat Indonesia China KCIC Dalam surat tersebut disebutkan bahwa proyek kereta cepat mengganggu kondisi layanan jalan tol Jakarta Cikampek dan Purbaleunyi Gambas Video detik ara ara kereta cepat jakarta bandung kereta cepat jakarta bandung disetop kcic kementerian pupr 
"Masturbasi Dengan Kulit Pisang, Pria Ini Hampir Meninggal", Jakarta Seorang pria membagikan pengalamannya di aplikasi Reddit ketika hampir meninggal setelah masturbasi menggunakan kulit pisang Dilansir dari The New York Post saat masturbasi dengan kulit pisang ada begitu banyak cairan Awalnya ia tak mengerti apakah cairan itu berasal dari kulit pisang atau dari penisnya Namun cairan ini begitu banyak seperti genangan air Terdapat genangan air di bawah saya dan tubuh saya hampir ditutupi oleh cairan itu kata pria tersebut Ketika dia pergi ke kamar mandi untuk membersihkan cairannya secara tak sengaja kepalanya terbentur ke kursi toilet Ia terbentur karena seluruh badannya menjadi licin terkena cairan saat masturbasi Saya nyaris tidak hidup untuk menceritakan kisah ini jelasnya Gambas Video detik kna kna masturbasi dampak masturbasi kulit pisang seks oral seks 
"2 Dusun di Pasuruan Masih Terendam Banjir, Warga Butuh Air Bersih", Pasuruan Banjir yang melanda belasan desa di Pasuruan sebagian besar mulai surut Namun masih ada dusun yang terendam Ratusan kepala keluarga di dusun ini membutuhkan air bersih untuk masak dan minum Dua dusun yang masih terendam banjir yakni Dusun Kedungringin Tengah dan Balongrejo Desa Kedungringin Kecamatan Beji Terdapat sekitar KK di titik ini Sebelumnya semua dusun di Kedungringin banjir Sekarang tinggal di Dusun Kedungringin Tengah dan Balongrejo Rumah warga masih terendam Ketinggian air masih ada yang sentimeter kata Kades Kedungringin Rizky Wahyuni kepada detikcom Sabtu Simak video Jokowi Sebut Ibu Kota Baru Tak Banjir dan Macet Hadirin Tertawa Selanjutnya Halaman birojatim banjir banjir di pasuruan 
Anies Jawab Kritik DPR soal Banjir Jakarta, Jakarta DPR RI menyentil konsep naturalisasi penanganan banjir ala Gubernur DKI Jakarta Anies Baswedan Konsep yang dibuat berbeda dengan konsep ala Gubernur sebelumnya yakni Joko Widodo Jokowi tersebut dinilai tak memberi perubahan signifikan Untuk itu menurut Ketua Komisi V DPR RI Lasarus dari fraksi PDIP menantang Anies agar fokus menunjukkan kinerjanya dalam menangani banjir ketimbang repot repot mengagas konsep baru Sebetulnya kami ingin menyelesaikan perdebatan di luar terkait dengan naturalisasi dan normalisasi Tapi kami pengin dengar apa sih kerjanisasi yang telah dilakukan kata Lasarus di Gedung DPR RI Jakarta Rabu Selanjutnya Halaman anies baswedan banjir banjir jakarta dpr ri 
"Sempat Tergenang, Flyover Pasupati Bandung Lancar Dilintasi", Bandung Banjir setinggi mata kaki terjadi di atas badan jalan Flyover Pasupati Kota Bandung pada Jumat sore Diduga tersumbatnya drainase tak mampu membendung curah hujan yang tinggi Detik detik banjir tersebut sempat terekam oleh netizen Dalam tayangan berdurasi detik itu terlihat sebuah mobil tengah menerobos genangan air dari arah Suci menuju Pasteur Pasteur banjir ujar seorang pria dalam tayangan tersebut Dalam keterangannya video itu diambil sekitar pukul WIB Akibat genangan air ini disebutkan juga menyebabkan kemacetan dari arah Pasteur menuju Gasibu atau Suci bbn bbn flyover pasupati bandung banjir 
Plh Kepala BPBD DKI Akan Kedepankan Kolaborasi untuk Atasi Banjir, Jakarta Plh Kepala Pelaksana Badan Penanggulangan Bencana Daerah BPDB DKI Jakarta Sabdo Kurnianto mengatakan dirinya akan mengedepankan kolaborasi untuk menangani bencana banjir yang kerap melanda Ibu Kota Menurutnya pemerintah daerah tidak bisa bekerja sendiri dalam penanganan banjir Dengan libatkan semua unsur masyarakat dunia usaha relawan yang kita hargai itu luar basa dengan SKPD lain di Pemprov DKI Jakarta Itu semua all out Pemerintah pusat BNPB luar biasa Itulah yang kolaborasi kalau saya sebut gotong royong ucap Sabdo saat dihubungi detikcom Kamis malam Plh Kepala Pelaksana BPBD DKI Jakarta Sabdo Kurnianto kiri bersama dengan Wali Kota Jakarta Timur Anwar kanan Dok Istimewa Foto Dok IstimewaSabdo berpendapat kolaborasi dilakukan juga dalam penanganan banjir pada Januari dan Februari Menurutnya semua orang sudah bekerja keras untuk menangani masalah tersebut Dengan demikian ibaratnya baskom atau ember itu diisi dengan air yang berlebihan itu meluber dong Sederhananya seperti itu itu di mana saja di luar Jakarta juga terjadi kata Sabdo Sabdo menjelaskan BPBD tak bisa memprediksi datangnya banjir Banjir terjadi saat Jakarta dilanda hujan ekstrem Selanjutnya Halaman banjir jakarta banjir bpbd dki jakarta jakarta 
Status Tanggap Darurat Banjir di Kota Pekalongan Diperpanjang Sepekan, Pekalongan Status tanggap darurat bencana di Kota Pekalongan Jawa Tengah diperpanjang hingga sepekan ke depan mulai Kamis hingga Rabu Status ini berkaitan dengan banjir yang melanda Kota Pekalongan hingga menyebabkan ribuan warga sempat mengungsi Tanggap darurat kita perpanjang sampai Minggu depan kata Wakil Wali Kota Pekalongan Achmad Afzan Arslan Djunaid kepada detikcom melalui pesan singkat Kamis Achmad menjelaskan perpanjangan status tanggap darurat ini karena kondisi cuaca masih tidak menentu Meski saat ini titik genangan air ada yang telah surut Tentunya melihat situasi cuaca semuanya serba tidak menentu Seperti kemarin banjir pertama sekitar hingga hari surut Ternyata malamnya hujan banjir lagi terangnya Menurutnya hal ini diperkuat dengan informasi dari BMKG yang menyebutkan pada akhir Februari ini merupakan puncak musim hujan Dari BMKG menyebut tanggal merupakan puncak hujan Mudah mudahan tidak ada banjir lagi ucapnya rih mbr pekalongan banjir jawa tengah banjir pekalongan banjir birojatengdiy 
"21 Pompa Air Dikerahkan, Banjir di Kota Pekalongan Mulai Surut", Pekalongan Banjir yang menggenang di wilayah Kota Pekalongan kini mulai surut bahkan di beberapa titik sudah terlihat mengering Sebanyak pompa pun dioperasikan untuk mengalirkan air banjir Pantauan detikcom Kamis daerah yang masih tergenang banjir yakni di Kecamatan Pekalongan Barat dan Kecamatan Pekalongan Utara Di wilayah RW Pasirsari Kelurahan Pasir Kraton Kramat PKK Pekalongan Barat genangan masih terpantau sekitar cm Sejumlah kendaraan sudah terlihat lalu lalang di lokasi ini Kondisi itu berbeda dari sehari sebelumnya di mana tidak ada kendaraan yang melintas karena ketinggian air mencapai cm Selanjutnya Halaman banjir pekalongan pekalongan kota pekalongan banjir birojatengdiy banjir di kota pekalongan 
Wagub Jabar Cek Banjir di Perum Bumi Nasio Indah Bekasi: Sudah 4 Kali, Bekasi Wakil Gubernur Jawa Barat Ruzhanul Ulum meninjau lokasi banjir Perumahan Bumi Nasio Indah Jatiasih Bekasi Pria yang akrab disapa Uu ini mengaku prihatin karena banjir di kompleks perumahan tersebut bukan yang pertama kalinya Saya merasa prihatin daripada banjir ini Sudah empat kali kata Uu di Perumahan Bumi Nasio Indah Jatiasih Bekasi Kamis Uu melihat langsung kondisi banjir di Perum Nasio Indah yang sempat terendam hingga ketinggian meter pada Selasa lalu Kondisi banjir saat ini di lokasi sudah surut Kondisi banjir yang ada di wilayah ini kalau melihat air sudah surut Tetapi bekasnya ini rumah rumah kita bisa lihat tadi kasur kursi alat alat elektronik alat alat rumah tangga semuanya ada imbas dari pada banjir ini jelas Uu Uu mengaku ditugasi Gubernur Jawa Barat Ridwan Kamil mengecek banjir di Bekasi Kedatangannya ke lokasi banjir untuk memperlihatkan kehadiran pemerintah di tengah korban banjir Kami datang ke sini ditugaskan sama Gubernur Kang Emil untuk melihat situasi dan kondisi sekaligus mendengarkan keluhan warga dan juga harapan dan keinginannya serta solusi yang harus diambil baik dari Pemerintah Kota Bekasi yang hadir Pak Wakil BBWS dan lainnya kata Uu Dalam kesempatan itu Uu menyampaikan pihaknya juga memberikan bantuan kepada Pemkot Bekasi untuk menangani korban banjir Uu mengklaim Pemprov Jabar sudah semaksimal mungkin menangani korban banjir Banjir di Perumahan Bumi Nasio Indah Jatiasih Bekasi sudah surut Isal Mawardi detikcom Selanjutnya Halaman perum bumi nasio indah banjir banjir bekasi wagub jabar 
Sederet Jawaban Anies yang Dikritik Keras DPR soal Banjir, Jakarta DPR RI mempertanyakan kerjanisasi Gubernur DKI Jakarta Anies Baswedan terkait program naturalisasi penanganan banjirnya Hal itu ia sampaikan oleh Ketua Komisi V DPR RI Lasarus dari fraksi PDIP sebab kecewa dengan ketidakhadiran Anies dalam rapat penanganan banjir di DPR RI siang kemarin Rabu Sebab baru kali ini Gubernur DKI Jakarta tak hadir dalam rapat dengan DPR RI Sedangkan pejabat sebelumnya senantiasa selalu hadir Sedang Fokus BekerjaDisinggung demikian Anies Baswedan langsung angkat bicara Ditemui di kawasan Ancol Jakarta Utara Anies menyebut bukannya niat mangkir namun memang sedang fokus memberikan pelayanan ke masyarakat terdampak banjir sehingga tak sempat menghadiri undangan rapat tersebut Sebenarnya dari malam kita itu terus di lapangan bersama dengan warga karena sampai dengan tadi pagi itu masih banyak genangan genangan jadi berada di lapangan terus kata dia Rabu Karena itu ia meminta berbagai pihak memahami kondisi tersebut Termasuk DPR yang mengundangnya rapat penanganan banjir Karena itu saya sampaikan kepada semua izinkan saya bekerja bersama rakyat dulu sekarang ini bersama warga Pembahasan mengenai banjir dan lain lain kita lakukan sesudah warga bisa kembali lagi ke rumahnya masing masing dan Alhamdulillah sore ini sudah surut beber Anies Sepanjang hari ini pun ia terus melakukan koordinasi dengan instansi dan pejabat terkait agar banjir cepat surut dan masyarakat bisa kembali beraktivitas dengan normal Jabarkan Pekerjaan Penanganan Banjir Ia pun menjabarkan sejumlah kerja kerja yang dijalankannya semenjak banjir melanda sejak Februari lalu Bukan hanya pengecekan lapangan kan pengecekan lapangan itu satu memastikan bahwa kebutuhan logistik dari masyarakat itu terpenuhi Kedua pos pos kesehatan melayani semua kebutuhan paparnya Selain itu kerja lainnya yang dilakukan Anies menangani banjir kali ini ialah memastikan sistem drainase lancar tanpa hambatan sehingga genangan bisa cepat surut Ketiga tidak ada hambatan di sistem drainase sehingga proses penyurutan air itu bisa berjalan tanpa hambatan tambahnya Lebih lanjut Anies mengaku telah bekerja sejak malam kemarin untuk menangani banjir kali ini Kemudian semalaman kita mengeringkan semua jalur jalur utama karena itu tadi pagi semua jalur utama sudah bebas dari air karena genangan baik itu underpass atau pun jalan lainnya Semuanya dikerjakan Jadi ini tuh non stop paparnya Bagaimana Pencegahan Banjir Saat ditanya terkait langkah pencegahan terhadap banjir selanjutnya Anies enggan buka suara dan langsung bergegas menuju mobil buggy untuk meninggalkan lokasi Cukup pungkasnya Simak Video Anies Lebih dari RW di Jakarta Terdampak Banjir Hari Ini Gambas Video detik dna dna banjir banjir jakarta anies baswedan 
"Musim Hujan dan Banjir, Lapas Karawang Lakukan Fogging Cegah DBD", Karawang Hujan ekstrem dan musibah banjir yang mengepung wilayah Kabupaten Karawang membuat sejumlah pihak waspada Sebab banyaknya genangan air meningkatkan risiko penyebaran penyakit salah satunya demam berdarah dengue DBD Di Lembaga Pemasyarakatan kelas A Karawang misalnya sedang rutin dilakukan fogging atau pengasapan Hal itu dilakukan demi mencegah munculnya DBD dan membasmi jentik nyamuk Supaya memutus mata rantai penyebab penyakit demam berdarah kata Kamesworo Kasi Pembinaan dan Pendidikan Lapas Kelas IIA Karawang Kamis Pantauan detikcom berbekal mesin fogging tiga orang petugas menyemprotkan asap ke seluruh penjuru rutan Seluruh ruangan sel tahanan hingga selokan disemprot asap tebal Kegiatan fogging ini perlu dilakukan potensi DBD di Lapas diketahui sangat tinggi terutama di ruang tahanan ujarnya mso mso karawang banjir karawang dbd 
"Habis Banjir Terbitlah Jalanan Berlubang, Ini Tips Menghadapinya", Jakarta Setelah banjir surut ada masalah lain yang dihadapi pengguna jalan Aspal aspal kini banyak berlubang risiko kecelakaan bertambah besar Jakarta dilanda banjir pada banyak lokasi di awal pekan ini Setelah sekitar dua hari berlalu genangan air banyak yang sudah surut Jalanan kembali bisa digunakan dengan normal Tapi sebagaimana biasa terjadi usai banjir atau ada genangan air lubang lubang bermunculan di jalanan Dilansir dari CNN jalan jalan berlubang itu di antaranya terlihat di wilayah Pondok Pinang dengan kedalaman cm Pun begitu di jalan protokol seperti Tendean Pancoran Cawang Juga Jalan Gatot Subroto dan Jalan MT Haryono Pengendara biasanya secara spontan akan menghindari jalan berlubang supaya tidak terjadi hentakan keras Padahal ini tidak disarankan dilakukan Berbelok dengan mendadak saat menghindari lubang bisa menyebabkan kendaraan lain yang ada di belakang terkejut karena tidak siap Sebaiknya sebelum melakukan manuver menghindari lubang pastikan di sekitar kendaraan anda tidak ada kendaraan lain dengan jarak sangat dekat Setelah dapat dipastikan tidak ada kemungkinan bahaya datang di sekitar barulah anda bisa menghindari lubang tersebut Gambas Video detik rip din tips otomotif tips motor jalan berlubang jalan rusak 
Korban Tewas Banjir Jakarta dan Sekitarnya Bertambah Jadi 9 Orang, Jakarta Badan Nasional Penanggulangan Bencana BNPB memperbarui data korban tewas akibat banjir di Jakarta dan sekitarnya Korban tewas bertambah dari orang menjadi orang Pusat Pengendalian Operasi Pusdalops BNPB mencatat total korban jiwa akibat banjir Jakarta dan sekitarnya berjumlah orang hingga hari ini kata Kepala Pusat Data Informasi dan Komunikasi Kebencanaan BNPB Agus Wibowo dalam keterangan tertulis Kamis Berikut ini nama nama korban akibat banjir Selasa di wilayah Jakarta dan sekitar Kota Bekasi Muhamad Jamil tahun Faizin tahun Faisal Amri tahun Muhammad Khairil Amri tahun DKI Jakarta Sultan tahun Asnati tahun Agus Wijayanto tahun Kota Tangerang Selatan Desta tahun NazarSementara itu Pusdalops BPBD Kabupaten Bekasi melaporkan banjir di wilayahnya berdampak pada keluarga jiwa Data per Februari pukul WIB menyebutkan ketinggian air awal banjir beragam dari hingga cm BPBD setempat dan instansi terkait telah melakukan upaya penanganan darurat seperti evakuasi dan kaji cepat di lapangan Kondisi saat ini air genangan di beberapa titik telah surut dan di titik lainnya debit air sudah menurun kata Agus Wibowo gbr zlf banjir banjir jabodetabek bnpb 
DPRD Geram Jalan Rusak Parah di Medan Padahal APBD Besar, Medan Ruas jalan di Pasar Petisah Medan rusak parah DPRD Medan pun geram dengan kondisi tersebut mengingat APBD Medan yang dinilai besar Wakil Ketua DPRD Kota Medan dari Fraksi Gerindra Ihwan Ritonga awalnya bicara soal citra Medan yang buruk gara gara masalah jalan rusak Dia juga persoalan kebersihan menjadi masalah di Medan Kita lihat memang Medan ini nggak tahu salah di mana Tapi ini problem di Medan infrastruktur dan kebersihan Makanya imagenya selalu orang beranggapan Medan itu masalah jalan dan kebersihan ujar Ihwan Kamis haf tor biromedan medan jalan rusak jalan rusak medan 
Parah! Jalan di Pasar Petisah Medan Rusak Parah-Parit Mampet, Medan Ruas jalan di Pasar Petisah Medan Sumatera Utara Sumut rusak parah Jalan di ibu kota Sumut ini dipenuhi lubang dan berlumpur Pantauan detikcom di Jalan Rotan Pasar Petisah Kamis terlihat banyak lubang di tengah jalan Genangan air juga terlihat di lokasi Jalan yang rusak itu tampak ada yang ditimbun dengan batu ataupun pecahan keramik Selain itu parit di pinggir jalan terlihat penuh dan mampet karena banyak sampah di dalamnya idh idh jalan rusak biromedan sumut medan 
"Tiga Hari Underpass Kemayoran Tak Bisa Dilintasi, Banjir Masih 4 Meter", Jakarta Genap tiga hari underpass Kemayoran terendam banjir dan belum dapat dilintasi oleh pengendara Kini banjir di underpass Kemayoran masih setinggi meter Pantauan detikcom di underpass Kemayoran Jakarta Pusat Kamis sekitar pukul WIB genangan air masih merendam dengan ketinggian sekitar meter Hujan sempat mengguyur kawasan itu sejak pagi hari Kan di situ ada baling baling dorongnya yang suka nyangkut di sana kata Petugas Balai Besar Wilayah Sungai BBWS Angga saat membersihkan sampah Selanjutnya Halaman bajir banjir jakarta underpass kemayoran anies 
"Banjir di Jalur Pantura Pasuruan Belum Surut, Lalin Merambat", Pasuruan Banjir yang merendam belasan desa dan kelurahan di Pasuruan Raya belum surut Genangan juga masih terdapat di jalur pantura Pasuruan menyebabkan arus lalu lintas tersendat Genangan di jalan raya masih ada Dua titik genangan di Tembok Rejo dan Karangketug kata Kasatlantas Polres Pasuruan Kota AKP Ahmady Kamis Meski ada genangan cm kendaraan dari kedua arah baik dari arah Surabaya maupun Probolinggo masih bisa melintas Belasan petugas dari kepolisian dan instansi terkait terus mengatur lalu lintas Sejak semalam arus merambat Pagi ini juga bisa dilintasi meski pelan pelan Tak ada pengalihan arus terang Ahmady Salah satu pengguna jalan M Imron mengatakan ia harus memutar ke jalan jalan kelurahan untuk menghindari banjir Saya dari Bangil mau ke Kota Pasuruan harus memutar terangnya fat fat birojatim banjir di pasuruan banjir di jatim banjir 
Lengkap! Anies Jawab Kritik DPR soal Banjir, Jakarta DPR menyentil konsep naturalisasi penanganan banjir ala Gubernur DKI Jakarta Anies Baswedan dinilai tak memberi perubahan signifikan Konsep yang dibuat Anies berbeda dengan konsep ala Gubernur sebelumnya yakni Joko Widodo Jokowi Untuk itu Ketua Komisi V DPR RI Lasarus dari fraksi PDIP menantang Anies agar fokus menunjukkan kinerjanya dalam menangani banjir ketimbang repot repot mengagas konsep baru Hal itu ia sampaikan karena Komisi V kecewa dengan ketidakhadiran Anies dalam rapat penanganan banjir di DPR RI siang kemarin Ia menuturkan baru kali ini Gubernur DKI Jakarta tak hadir dalam rapat dengan DPR RI Sedangkan pejabat sebelumnya senantiasa selalu hadir Tak hanya itu Lasarus juga menyinggung alokasi anggaran Pemprov DKI Jakarta untuk konsep naturalisasi yang diusung Anies sendiri Menurutnya untuk pembebasan lahan kawasan Sungai Ciliwung saja Anies tak memberikan alokasi anggaran Ia berpendapat hal itu menunjukkan tak ada kinerja yang dihasilkan Pemprov DKI Jakarta untuk menangani banjir Sungai Ciliwung Padahal Menteri PUPR Basuki Hadimuljono terus menunggu proses pembebasan lahan demi bisa menyelesaikan normalisasi Ciliwung yang baru berjalan km dari total km Lalu Lasarus mencecar apa saja kerjanisasi yang sudah dijalankan Anies dalam menanggulangi banjir di Jakarta Selanjutnya Halaman anies baswedan banjir banjir jakarta dpr 
"Hujan Lebih 5 Jam, Belasan Desa di Pasuruan Dikepung Banjir", Pasuruan Belasan desa dan kelurahan di Pasuruan dilanda banjir akibat hujan deras yang terjadi Rabu siang hingga malam Banjir di permukiman mencapai cm Belasan desa di Kabupaten Pasuruan yang banjir di antaranya Desa Kalipang Kedawung Kulon dan Kedawung Wetan Kecamatan Grati Desa Prodo Winonangan Lor dan Wunongan Kidul Kecamatan Winongan Desa Selotambak dan Desa Tambakrejo Kecamatan Kraton Desa Kedung Ringin Kedung Boto dan Cangkring Malang Kecamatan Beji Sedangkan di Kota Pasuruan banjir merendam Kelurahan Karang Ketug Kecamatan Gading Rejo Banjir juga terjadi permukiman Kelurahan Sekar Gadung Kecamatan Purwo Rejo Sejumlah jalan kota juga tergenang Banjir karena curah hujan sangat tinggi dan berlangsung lama kata Kepala BPBD Kabupaten Pasuruan Tectona Jati saat dikonfirmasi Kamis Selain merendam permukiman genangan mencapai cm juga terjadi di jalur pantura Jalan Raya Latek Bangil dan Jalan Raya Tambakrejo Kecamatan Kraton Lalu lintas sempat macet parah fat fat birojatim banjir di pasuruan banjir banjir di jatim 
Alasan-alasan Anies Tak Penuhi Panggilan DPR Bahas Banjir, Jakarta Ketidakhadiran Gubernur DKI Jakarta Anies Baswedan saat rapat penanganan banjir Jabodetabek di Komisi V DPR membuat anggota dewan kecewa Namun Anies mengungkapkan sejumlah alasan Sejatinya Anies dijadwalkan untuk hadir dalam rapat dengar pendapat bersama Komisi V DPR pada Selasa Februari Selain Anies DPR mengundang Kepala BMKG Basarnas BNPP Gubernur Jawa Barat Ridwan Kamil dan Gubernur Banten Wahidin Halim Dari Anies hingga RK tidak hadir Selanjutnya Halaman anies baswedan banjir komisi v dpr banjir jabodetabek banjir jakarta 
"DPR Kritik Keras soal Banjir, Ini Jawaban Anies", Jakarta DPR RI menyentil konsep naturalisasi penanganan banjir ala Gubernur DKI Jakarta Anies Baswedan Konsep yang dibuat berbeda dengan konsep ala Gubernur sebelumnya yakni Joko Widodo Jokowi tersebut dinilai tak memberi perubahan signifikan Untuk itu menurut Ketua Komisi V DPR RI Lasarus dari fraksi PDIP menantang Anies agar fokus menunjukkan kinerjanya dalam menangani banjir ketimbang repot repot mengagas konsep baru Sebetulnya kami ingin menyelesaikan perdebatan di luar terkait dengan naturalisasi dan normalisasi Tapi kami pengin dengar apa sih kerjanisasi yang telah dilakukan kata Lasarus di Gedung DPR RI Jakarta Rabu Hal itu ia sampaikan karena Komisi V kecewa dengan ketidakhadiran Anies dalam rapat penanganan banjir di DPR RI siang kemarin Ia menuturkan baru kali ini Gubernur DKI Jakarta tak hadir dalam rapat dengan DPR RI Sedangkan pejabat sebelumnya senantiasa selalu hadir Ini undangan pertama di periode tapi dulu pernah mengundang Gubernur DKI Jakarta lain semuanya datang kecuali Pak Anies Baru beliau yang tidak datang dan Gubernur Jabar dan Banten ujar Lasarus Tak hanya itu Lasarus juga menyinggung alokasi anggaran Pemprov DKI Jakarta untuk konsep naturalisasi yang diusung Anies sendiri Menurutnya untuk pembebasan lahan kawasan Sungai Ciliwung saja Anies tak memberikan alokasi anggaran Ia berpendapat hal itu menunjukkan tak ada kinerja yang dihasilkan Pemprov DKI Jakarta untuk menangani banjir Sungai Ciliwung Padahal Menteri PUPR Basuki Hadimuljono terus menunggu proses pembebasan lahan demi bisa menyelesaikan normalisasi Ciliwung yang baru berjalan km dari total km Kalau tidak dibebaskan Pak Menteri tidak bisa kerja Jadi berdebat di sini perkaranya tidak normalisasi atau naturalisasi tapi tidak ada kerjanisasi pungkasnya Apa kata Anies soal itu Selanjutnya Halaman banjir banjir jakarta anies baswedan gubernur dki dpr 
"Ide Kreatif, Audi Nangkring Hindari Banjir", Jakarta Ada banyak cerita menarik dan unik dari musibah banjir di Jakarta dan beberapa area sekitarnya Salah satunya soal Audi yang nangkring supaya tak tergenang air banjir Banjir jadi momok mengerikan buat seluruh pemilik kendaraan Bukan sekadar macet yang ditimbulkan tapi juga potensi kerugian besar andai mobil atau motornya sampai terendam Berbagai macam cara dilakukan orang untuk menyelamatkan kendaraannya Dari yang unik nyeleneh dan berbagai metode lain yang memancing kreativitas Gambas Video detik lth din catatan pengendara mobil banjir banjir jakarta januari 
