title,content
Cerita Mencekam Warga Sukabumi yang Selamat saat Gempa Palu, Sukabumi Satu keluarga asal Cipelang Gede RT RW Kelurahan Karang Tengah Kecamatan Gunungpuyuh Kota Sukabumi Jawa Barat akhirnya bisa dipulangkan Pemkot Sukabumi dan jajaran kepolisian setempat dari Kota Palu Sulawesi Tengah Keluarga berjumlah enam orang itu kembali dengan selamat setelah sempat mengalami trauma mendalam ketika berada di lokasi yang terdampak gempa Selama di Kota Palu mereka menceritakan situasi yang mencekam ketika gempa terjadi hingga terpisah dari keluarga selama dua hari Selvi dan Ria sudah sejak tahun tinggal dan berkeluarga di Kota Palu mereka tinggal di Jalan Sisingamangaraja Kalau pernah lihat film tentang gempa bangunan runtuh sampai jalan terbelah suasananya memang seperti itu Dinding rumah retak lari keluar jalanan aspal terbelah Situasinya benar benar panik dan mencekam kata Selvi kepada awak media Selasa Selvi mengamankan diri di Lorong Simaja Dia bersama warga lainnya Kami dengar saat itu terjadi tsunami belum lagi tanah di perbukitan terjadi amblesan tanah Mau lari ke arah pantai ada tsunami ke bukit katanya ada likuifaksi Akhirnya menunggu bersama yang lain di Lorong Simaja katanya Ketika sampai tadi di bandara perasaan saya masih takut dengar suara keras masih kaget kaget Alhamdulillah saya bisa kembali ke Sukabumi ujar Selvi sya bbn gempa palu gempa sulteng sukabumi 
"Tol Ngawi-Mantingan bakal Molor Beroperasi, Ini Sebabnya", Ngawi Proyek tol Ngawi Solo seksi Ngawi Mantingan bakal molor dari target pengoperasian Ruas tol sepanjang Km yang dijadwalkan selesai September justru belum rampung hingga awal Oktober ini Awalnya memang bulan September tapi karena belum selesai ada penambahan penambahan untuk overpass sehingga harus diselesaikan dulu terang Humas Paket A Tol Ngawi Mantingan PT Waskita Karya Husein kepada detikcom di kantornya Walikukun Ngawi Jumat Saat ini untuk paket A ruas tol Ngawi Mantingan sepanjang sekitar Km masih dalam pengerjaan dua jalan overpass Kedua overpass itu adalah overpass Desa Jenggrik dan overoass Desa Kedungrejo yang saat ini tinggal finising saja Kalau ruas tol Ngawi Mantingan masuk Jatim itu Km yang masuk paket A hanya sekitar Km sisanya itu masuk pengerjaan paket B itu panjang Km Untuk wilayah saya paket A ada dua overpass yang belum selesai dan masih kita kerjakan finising katanya Proyek tol Ngawi Mantingan Foto Sugeng Harianto detikcomHusein menjelaskan molornya proyek ruas tol Ngawi Mantingan juga karena adanya penambahan pembebasan bidang tanah tak terduga Bidang tanah ini difungsikan untuk keperluan jalan overpass penghubung antar desa yang terbelah jalan tol Selain overpass saat ini PT Waskita Karya seksi paket A juga masih mengerjakan rumah mesin pompa air Mesin pompa ini akan difungsikan untuk menyedot air saat banjir di underpass Walikukun Ini juga mengerjakan pembuatan rumah pompa di underpass Walikukun yang jakan ya memang rendah dekat sungai sehingga rawan banjir Maka kita siapkan rumah mesin pompa air ungkapnya Proyek tol Ngawi Mantingan Foto Sugeng Harianto detikcomSementara itu paket B ruas tol Ngawi Mantingan sudah rampung pengerjaan Saat ini di paket B yang juga dikerjakan PT Waskita Karya hanya tinggal penyelesaian rest area di KM Desa Watualang Kecamatan Kedunggalar Untuk tempat saya sudah hampir selesai tinggal penyelesaian rest area dan rambu dan marka saja Setelah selesai tinggal uji kelayakan kata Humas Paket B Proyek Tol Ngawi Mantingan PT Waskita Karya Soni di kantornya Jalan Ahmad Yani Ngawi Dikatakan Soni dalam waktu dekat akan dilakukan uji kelayakan oleh Kementerian Perhubungan dan serta kementerian PUPR Jika sudah mendapat sertifikat kelayakan ruas tol Ngawi Mantingan segera dioperasikan Proyek tol Ngawi Mantingan Foto Sugeng Harianto detikcomPantauan detikcom di sepanjang ruas tol Ngawi Mantingan sepanjang Km nampak aktivitas pekerja sedang menyelesaikan pembangunan Nampak beberapa alat berat melakukan merapikan tanah di sekitar overpass Adapula pekerja yang memasang rambu dan marka jalan serta membersihkan ruas jalan dari tanah yang berserakan Karena masih pengerjaan di ruas tol Ngawi Sragen pengendara di tol dari arah Madiun harus keluar Ngawi Proyek tol Ngawi Mantingan Foto Sugeng Harianto detikcomPapan penunjuk arah menuju Solo dan Semarang di KM dari arah ruas tol Wilangan dan Madiun nampak tertutup warna hitam dan jalur nampak ditutup dengan beton pembatas jalan Ruas tol Ngawi Mantingan sepanjang Km kata Soni nerupakan bagian dari proyek tol Solo Ngawi yang dimulai pengerjaan bulan September Dari jadwal perencanaan awal ruas tol Ngawi Mantingan yang menyambungkan Sragen selesai dan dioperasikan bulan September Tol Ngawi SragenTak hanya ruas tol Ngawi Mantingan Jawa Timur molornya pengoperasian tol ternyata hingga Sragen Jawa Tengah Ruas tol sepanjang Km yang di kelola oleh PT Jasamarga Solo Ngawi JSN selaku pengembang menurut rencana akan dilakukan uji kelayakan dalam waktu dekat Kalau Ngawi sampai Mantingan memang Km kalau hingga Sragen itu masih Km yang segera kita lakukan uji kelayakan terang Direktur Utama PT Jasamarga Solo Ngawi JSN David Wijayatno saat dihubungi detikcom Jumat Molornya pengoperasian ruas tol Ngawi Sragen itu kata David karena proses pembebasan lahan tak terduga untuk overpass baru terealisasi pertengahan bulan September kemarin Sehingga lanjut David saat ini masih penyelesaian overpass saja dan untuk ruas tol sudah selesai Ruas tol segmen Sragen Ngawi tanggal Oktober ini tuntas dan akan dilanjutkan dengan Uji Laik fungsi tuturnya Diungkapkan David ruas tol Ngawi Sragen sepanjang Km itu merupakan bagian dari ruas jalan tol Ngawi Solo sepanjang km Jalan tol yang tergabung dalam Proyek Strategis Nasional PSN yang menghubungkan tol Ngawi Wilangan hingga Surabaya Diberitakan sebelumnya bahwa menurut rencana awal PT JSN menargetkan ruas tol Ngawi Sragen akan selesai pengerjaan dan beroperasi bulan September Namun belum rampung hingga awal Oktober ini dan masih prngerjaan overpass dan rest area hns hns tol jalan tol tol ngawi mantingan tol ngawi solo birojatim 
"Air Mata Ratna, ""Grasa-Grusu"" Prabowo, dan Hoax Nasional", Jakarta Sekali lagi kita melihat Indonesia terbelah bukan oleh gempa apalagi tsunami tetapi oleh hoax yang kali ini diciptakan oleh Ratna Sarumpaet dan tersebar cepat oleh konferensi pers Prabowo dan cuitan para elite politik Seandainya Ratna tidak segera melakukan konferensi pers dan mengakui kebohongannya perang di media sosial bisa berakhir ke perang antarsaudara sebangsa dan setanah air yang muaranya balik lagi ke pilihan yang berbeda di pilpres mendatang Perang tagar GantiPresiden dan TetapJokowi sudah melampaui pagar kepatutan hidup berbangsa dan bernegara Ibu Pertiwi yang matanya masih lebam karena menangisi Palu dan Donggala kembali dibuat pilu dan sakit kepala bukan karena oplas melainkan oleh ulah anak bangsa yang menghalalkan segala cara untuk berkuasa Memaknai Air Mata Ratna Bagi saya yang menyaksikan konferensi pers Ratna lewat handphone tidak saja mendengar suaranya yang bergetar saat mengakui kesalahannya melainkan melihat air mata yang tercurah Melihat dan mendengar pengakuannya perasaan iba dan jengkel bisa saja berkelindan Saat menemani anak ke sekolah saya membaca berita di koran nasional Di pojok kanan bawah ada gambar kartun pasutri Di depan suami yang melipat tangan di dada dengan wajah marah sang istri menunduk sambil berkata Maaf kemarin aku bohong Respons sang suami langsung membalikkan badan sambil berkata Halah maafmu paling juga bohong Tudingan langsung yang nyelekit ini memang membuat sakit tetapi tujuannya untuk bangkit Shock therapy Tujuannya memang membuat orang tersengat dan kembali ingat Eling lan waspada Gusti mboten sare Becik ketitik ala ketara Bagaimanapun cekatannya seekor tupai melompat akhirnya jatuh juga Sepandai pandainya kita bersandiwara akhirnya kembali ke alam nyata Urip sejatine gawe urup Api seperti apa yang sebenarnya ingin kita nyalakan Api pesta olahraga yang mengagungkan sportivitas dalam setiap rivalitas atau bara yang menghanguskan gara gara ingin menang Kasus meninggalnya Harlingga Siria dari Jackmania yang dianiaya bobotoh dari Persib menunjukkan bahwa sebagian masyarakat kita masih menghalalkan segala cara sebagai wujud fanatisme sempit Jika hal ini dibiarkan NKRI pecah jadi sebesar teri Mengartikan Grusa Grusu Bahwa saya akui bahwa saya agak grasa grusu terburu buru Tapi itu ya sudah namanya kita baru belajar tim saya ini baru Tapi tidak ada alasan kita kalau salah kita akui salah ucap Prabowo Suatu jerat bagi manusia ialah kalau ia tanpa berpikir mengatakan kudus dan baru menimbang nimbang sesudah bernazar ujar raja paling bijak di dunia Salomo Jerat itu bukan hanya menimpa Prabowo tetapi timnya yang dengan bersemangat membela Ratna Alangkah terkejutnya mereka karena yang dibela ternyata lebih dulu minta maaf sambil mencucurkan air mata Itulah sebabnya grusa grusu bukanlah tindakan yang sederhana Whoever is careless with the truth in small matters cannot be trusted in important affairs kata Albert Einstein Guru Agung berkata Tetapi Aku berkata kepadamu Setiap kata sia sia yang diucapkan orang harus dipertanggungjawabkannya pada hari penghakiman Lengkap sudah Dari sisi manusia maupun Tuhan kecerobohan harus dibayar mahal Dari sisi manusia salah satu manusia paling cerdas di muka bumi Einstein mengatakan bahwa jika untuk urusan sepele saja kita tidak dipercaya apalagi untuk mengurus hal hal yang lebih besar Dari sisi Tuhan setiap kecerobohan harus kita pertanggungjawabkan saat kita meninggal dunia nanti Jika Polri berhasil menangkap orang dengan akun yang sering menyebarkan hoax keempat orang itu bakal menerima hukuman badan di muka bumi Hukuman lain yang lebih berat menanti mereka di alam sana Pucuk Gunung EsSaya percaya penangkapan orang penyebar hoax berkenaan dengan bencana Palu dan Donggala baru permulaan Pencekalan Ratna Sarumpaet yang hendak terbang ke Chile merupakan follow up dari kebohongan tingkat dewa yang dilakukannya sehingga warganet menyebut tanggal Oktober sebagai Hari Hoax Nasional Jika orang yang ikut menyebarkan hoax Ratna disidik disidak dan disidang pengadilan bakal ramai Bukan saja karena banyaknya tersangka melainkan juga siapa yang dijadikan tersangka Saya sempat mengobrol dengan anak saya bisakah seorang capres ditersangkakan Apalagi jika teman temannya sekubu ikut diperkarakan semua Keriuhan pengadilan bukan hanya karena orang orang elite yang dijadikan tersangka melainkan demo berjilid jilid yang bisa jadi punya platform baru untuk terbit Apa jadinya bangsa ini jika tekanan massa dijadikan determinant factor untuk menjatuhkan palu pengadilan Jika ini yang terjadi maka di bawah pucuk gunung es yang tampak indah terjadi arus bawah yang mengerikan Peran Konsultan Tim Pemenangan Sejak Donald Trump di luar perkiraan banyak orang memenangkan pilpres di Amerika Serikat orang memuji konsultan kampanyenya yang berhasil menjungkirbalikkan Hillary Rodham Clinton yang punya track record yang dinilai lebih bersih ketimbang suami Melania itu Analisis para pakar politik mengatakan bahwa konsultan yang disewa dari Rusia itu memakai metode kampanye firehouse of falsehood Makanan apa pula itu Dalam bahasa awam kira kira alarm kebakaran palsu Kata kebakaran bisa menciptakan rasa takut dan trauma sehingga rakyat Amerika diharapkan memilih orang yang mampu memadamkannya siapa lagi kalau bukan Donald Trump Cerdas atau culas Pihak Trump sengaja memencet tombol alarm ini untuk mengingatkan Amerika bahwa negara adidaya tersebut sedang menuju kehancuran karena invasi asing baca China dalam berbagai lini kehidupan Data ini ditunjang dengan defisit perdagangan AS China yang berujung ke perang dagang Jika dua gajah berkelahi pasti pelanduk yang ada di tengah tengahnya mati tergencet Dampak yang dirasakan sampai ke Indonesia Kata sebagian orang yang dianggap ahli ekonomi makro salah satunya adalah melonjaknya nilai tukar dolar terhadap rupiah Kebenarannya perlu ditelisik dan bukan sekadar diulik karena kalau salah bisa dianggap menyebarkan hoax ke publik Nah apakah cara yang sama dipakai oleh orang orang di seluruh dunia termasuk Indonesia untuk memakai jasa konsultan asing baca Rusia untuk memenangkan pertarungan di pilpres Apakah sinyalir bahwa kubu Prabowo menyewa konsultan yang sama perlu disisir sampai ke hilir sehingga tidak dianggap nyinyir Ingat grusa grusu bisa membuat orang orang terpelajar pun termakan isu palsu Jika memakai cara yang sama Rusia berhasil mencaplok semenanjung Krimea apakah cara yang sama bisa diterapkan di Indonesia Yang utama adalah pertanyaan pertama yang harus kita ajukan benarkah tim pemenangan Prabowo Sandi memakai jasa konsultan asing dalam hal ini Rusia Jika jawabannya tidak buat apa dibahas Jika jawabannya ya kita baru boleh menjawab pertanyaan inti Jawaban saya sebagai orang awam adalah belum tentu atau bisa jadi malah tidak Mengapa Cara yang sukses dilakukan di luar negeri tidak menjamin kesuksesan yang sama saat diterapkan di Indonesia Kultur jaringan tanaman yang tumbuh subur di suatu lahan tidak serta merta bisa bertumbuh di kontur tanah yang berbeda habitatnya Jadi ketimbang mengembangkan sendiri teori konspirasi alangkah bijaknya jika kita menahan diri dan menyerahkan kasus hoax Ratna Sarumpaet ini ke tangan yang berwenang Biarkan kasus ini menjadi kenangan buruk yang tidak seharusnya terulang Biarlah kebenaran sejati yang menjadi pemenang Xavier Quentin Pranata pelukis kehidupan di kanvas jiwa mmu mmu ratna sarumpaet prabowo hoax 
Mengapa Terjadi Tsunami di Palu? Ini Penjelasan Badan Geologi, Jakarta Badan Geologi Kementerian ESDM menyebut tsunami yang terjadi di Palu tidak diduga karena tidak terdeteksi oleh alat peringatan Lalu apa penyebabnya Menurut Sekretaris Badan Geologi Kementerian ESDM Ratmodo Purbo tsunami yang terjadi di Palu berbeda dengan tsunami yang pernah terjadi di Indonesia sebelumnya contohnya tsunami Aceh dan tsunami akibat letusan Gunung Krakatau Untuk mengetahui seperti apa bencana tsunami itu dari sisi teknis Ratmodo mencoba memberikan penjelasan secara detail Jadi Indonesia ini kan berada di beberapa lempeng di utara ada Eurasia Plate di timur Pasific Plate dan di Selatan India Australian Plate kata Ratmodo di Kementerian ESDM Jalan Medan Merdeka Selatan Jakarta Pusat Rabu ang imk tsunami palu gempa sulteng 
Dramatisnya Kakek Arif Selamatkan Cucunya Dirawat di RS Kala Tsunami, Makassar Arif bersama istrinya Kamini masih dihantui rasa khawatir Dua orang anak dan cucunya yang masih balita tetap berada di Palu Sulawesi Tengah Bahkan komunikasi terakhir keluarganya itu sudah kehabisan stok makanan Perantau asal Semarang itu berat hati meninggalkan anak cucunya di Palu Namun mereka terpaksa melakukan hal itu demi mendapatkan pertolongan dari luar Selain kekurangan stok makanan mereka juga sudah tidak punya uang lagi untuk bertahan di sana Belum lagi bantuan juga belum masuk ke wilayahnya Kami tidak tahu harus bagaimana lagi waktu itu Akhirnya saya putuskan untuk keluar untuk mencari bantuan Tapi sampai sekarang juga belum dapat Saya khawatir dengan anak cucu saya di sana kata Arif saat ditemui di tempat penampungan Bandara Hasanuddin Rabu Warga Kelurahan Kebunena Kecamatan Palu Barat itu meninggalkan Palu sejak hari lalu melalui jalur darat Ia pun harus berjalan kaki sejauh kilometer untuk sampai ke terminal lalu naik bus melalui jalur Mamuju Sulawesi Barat ke Bandara Sultan Hasanuddin Ia berharap bantuan bisa segera tembus ke tempatnya di Palu Kami tidak mungkin bawa anak anak kecil begitu untuk keluar dari Palu Apa lagi tidak ada kendaraan Makanya kami yang terpaksa keluar dulu minimal mengurangi beban Makanya kami sangat berharap bantuan bisa segera didatangkan ke sana ujarnya Pria yang sudah tahun merantau di Palu dan bekerja sebagai pengumpul barang rongsokan itu berkisah saat terjadi gempa Ia bersama menantu dan cucunya Naila yang berumur tahun sedang berada di rumah sakit Anutapura Palu Cucunya sudah menjalani perawatan karena demam selama hari Waktu itu saya sedang menjaga cucu saya di rumah sakit Waktu gempa terjadi saya langsung mencabut selang impus dan berlarian ke lantai satu Getaran gempa yang kuat membuat kami berkali kali jatuh bangun di tangga hingga akhirnya bisa keluar lanjutnya asp asp gempa palu 
"Ini Jono Oge, Desa di Sigi yang Bergeser 3 Km karena Gempa Palu", Sigi Desa Jono Oge Kabupatren Sigi Sulawesi Tengah Sulteng harus kehilangan sebagian warganya saat gempa magnitudo melanda Sebagian daerahnya bergeser km dan hilang lalu berganti dengan perkebunan jagung Meri saat tengah berada di dalam rumahnya dan suaminya tengah membersihkan dirinya di dalam kamar mandi Pukul WITA bumi di wilayahnya berguncang Meri melarikan diri ke luar rumah dan dinding kamar mandi rumahnya pun runtuh dan memperlihatkan suaminya setengah telanjang dan segera melarikan diri menyelamatkan diri Luapan air dari lama tanah itulah yang kemudian menggulung pemukiman padat penduduk itu dari atas dan kemudian mengaduknya di dalam tanah Semuanya bergerak dan saya hanya berupaya menyelamatkan diri bersama suami saya kata Meri di Jono Oge Kabupaten Sigi Rabu Dahlan menyebut sore itu adalah sore yang tidak akan terlupakan dalam hidupnya Saat berjalan kaki di jalan raya menuju ke rumahnya secara tiba tiba jalan jalan aspal itu terbelah dan jatuh ke bawah Jalanan seperti bergelombang dan tanah saling bertabrakan Jalanan Sigi yang tadinya bisa dilihat satu garis lurus sekarang tekah berkelok kelok dan bergelombang sebutnya tfq asp gempa palu 
Detik-detik Atlet Paralayang Bondowoso Selamatkan Diri dari Gempa, Bondowoso Gempa berkekuatan SR disertai tsunami di Sulawesi Tengah beberapa saat yang lalu menyisakan trauma hebat Tak terkecuali bagi sejumlah atlet paralayang dari Jawa Timur yang ikut kejuaraan di Palu Salah satunya Wahyudi Widodo atlet paralayang asal Bondowoso yang menjadi saksi mata bencana yang disebut hampir menelan korban tersebut Saat kejadian itu saya lagi istirahat santai di depan penginapan Karena capek sehabis berlomba kisah Wahyudi saat ditemui detikcom di rumahnya Kelurahan Sekarputih Bondowoso Selasa lll lll atlet paralayang di palu gempa donggala tsunami palu bondowoso 
7 Kecamatan di Sigi Terisolasi Usai Gempa Sulteng, Jakarta Kabupaten Sigi juga turut terdampak akibat gempa yang berpusat di Donggala Sulawesi Tengah Tiga hari setelah kejadian kecamatan di Sigi masih terisolasi Tujuh kecamatan terisolir dan jalan tertutup ungkap Kepala Pusat Data Informasi dan Humas BNPB Sutopo Purwo Nugroho di kantor BNPB Jl Pramuka Jakarta Timur Senin Akses jalan longsor dan bangunan runtuh terbelah belah akibat gempa ucap Sutopo elz fjp gempa palu gempa donggala sigi gempa sulteng 
Siwon 'Super Junior' hingga Maher Zain Kirim Doa untuk Korban di Palu, Jakarta Duka yang mendalam kepada musibah gempa dan tsunami yang melanda kota Palu dan Donggala Sulawesi Tengah tak hanya dirasakan oleh publik Indonesia saja Namun selebriti luar negeri yang pernah menginjakkan kaki di Tanah Air turut mengirimkan doa Salah satunya adalah Choi Siwon atau Siwon Super Junior yang ke Indonesia saat penutupan Asian Games beberapa waktu lalu Lewat akun Twitter pribadinya ia mengirimkan doa dan duka yang mendalam Saya ingin mengungkapkan rasa duka cita yang amat dalam kepada seluruh korban tewas dan luka luka dari gempa dan tsunami yang melanda Pulau Sulawesi Indonesia Saya berdoa agar negara ini Indonesia bisa segera pulih dan hati rasa simpati saya untuk mereka PrayforIndonesia tulis Siwon seperti dikutip detikHOT Selain itu penyanyi religi asal Swedia Maher Zain juga mengucapkan ucapan serupa Di akun Instagramnya terlihat foto berlatar warna hitam dengan hastag sulawesi indonesia Ia pun memberikan lambang hati terbelah di akun Instagram pelantun Thank You Allah tersebut Sampai saat ini BNPB melaporkan korban yang tewas di Palu dan Donggala mencapai orang tia tia siwon super junior maher zain pasha ungu gempa palu tsunami palu gempa donggala Photo Gallery celeb Lin Chi ling hingga Heboh Fanmeeting Siwon Super Junior celeb Lin Chi ling hingga Heboh Fanmeeting Siwon Super Junior celeb Lin Chi ling hingga Heboh Fanmeeting Siwon Super Junior celeb Lin Chi ling hingga Heboh Fanmeeting Siwon Super Junior celeb Lin Chi ling hingga Heboh Fanmeeting Siwon Super Junior kpop Melihat Antrean yang Mengular di Fanmeeting Siwon Super Junior kpop Melihat Antrean yang Mengular di Fanmeeting Siwon Super Junior kpop Melihat Antrean yang Mengular di Fanmeeting Siwon Super Junior kpop Melihat Antrean yang Mengular di Fanmeeting Siwon Super Junior kpop Melihat Antrean yang Mengular di Fanmeeting Siwon Super Junior kpop Melihat Antrean yang Mengular di Fanmeeting Siwon Super Junior celeb Deretan Selebriti Tanah Air Foto Bareng Siwon Suju celeb Deretan Selebriti Tanah Air Foto Bareng Siwon Suju celeb Deretan Selebriti Tanah Air Foto Bareng Siwon Suju celeb Deretan Selebriti Tanah Air Foto Bareng Siwon Suju celeb Deretan Selebriti Tanah Air Foto Bareng Siwon Suju kpop Ini Potret Siwon Suju Jogging di Jakarta Sebelum Tutup Asian Games kpop Ini Potret Siwon Suju Jogging di Jakarta Sebelum Tutup Asian Games kpop Ini Potret Siwon Suju Jogging di Jakarta Sebelum Tutup Asian Games kpop Ini Potret Siwon Suju Jogging di Jakarta Sebelum Tutup Asian Games kpop Ini Potret Siwon Suju Jogging di Jakarta Sebelum Tutup Asian Games kpop Ini Potret Siwon Suju Jogging di Jakarta Sebelum Tutup Asian Games kpop Ini Potret Siwon Suju Jogging di Jakarta Sebelum Tutup Asian Games kpop Ini Potret Siwon Suju Jogging di Jakarta Sebelum Tutup Asian Games kpop Sudah Nggak Sabar Ketemu Siwon Suju di Asian Games kpop Sudah Nggak Sabar Ketemu Siwon Suju di Asian Games kpop Sudah Nggak Sabar Ketemu Siwon Suju di Asian Games kpop Sudah Nggak Sabar Ketemu Siwon Suju di Asian Games kpop Sudah Nggak Sabar Ketemu Siwon Suju di Asian Games kpop Sudah Nggak Sabar Ketemu Siwon Suju di Asian Games celeb Setahun Break Pasha Kembali Bermusik celeb Setahun Break Pasha Kembali Bermusik celeb Setahun Break Pasha Kembali Bermusik celeb Setahun Break Pasha Kembali Bermusik celeb Setahun Break Pasha Kembali Bermusik celeb Setahun Break Pasha Kembali Bermusik celeb Istri Pasha Kini Berhijab Begini Penampilannya celeb Istri Pasha Kini Berhijab Begini Penampilannya celeb Istri Pasha Kini Berhijab Begini Penampilannya celeb Istri Pasha Kini Berhijab Begini Penampilannya celeb Istri Pasha Kini Berhijab Begini Penampilannya celeb Istri Pasha Kini Berhijab Begini Penampilannya on stage Pasha Pamit dari Ungu on stage Pasha Pamit dari Ungu on stage Pasha Pamit dari Ungu on stage Pasha Pamit dari Ungu on stage Pasha Pamit dari Ungu on stage Pasha Pamit dari Ungu on stage Pasha Pamit dari Ungu on stage Pasha Pamit dari Ungu on stage Pasha Pamit dari Ungu on stage Pasha Pamit dari Ungu photo Menang Pilkada Pasha Tetap Jadi Bagian Ungu photo Menang Pilkada Pasha Tetap Jadi Bagian Ungu photo Menang Pilkada Pasha Tetap Jadi Bagian Ungu photo Menang Pilkada Pasha Tetap Jadi Bagian Ungu photo Menang Pilkada Pasha Tetap Jadi Bagian Ungu photo Menang Pilkada Pasha Tetap Jadi Bagian Ungu photo Kebahagiaan Pasha Kembali Dikaruniai Anak photo Kebahagiaan Pasha Kembali Dikaruniai Anak photo Kebahagiaan Pasha Kembali Dikaruniai Anak photo Kebahagiaan Pasha Kembali Dikaruniai Anak photo Kebahagiaan Pasha Kembali Dikaruniai Anak photo Kebahagiaan Pasha Kembali Dikaruniai Anak photo Pasha Ungu dan Mobil Sport Mewahnya photo Pasha Ungu dan Mobil Sport Mewahnya photo Pasha Ungu dan Mobil Sport Mewahnya photo Pasha Ungu dan Mobil Sport Mewahnya photo Pasha Ungu dan Mobil Sport Mewahnya photo Mobil Sport Putih Kesayangan Pasha Ungu photo Topi Cowboy Pasha Ungu photo Konser Penyejuk Hati Maher Zain di Jakarta photo Pasha Ungu Lamaran 
"Lubang Peluru Terakhir di Mercusuar Oinake, Skouw", Jayapura Pada terjadi baku tembak di Skouw kawasan tapal batas Republik Indonesia Papua Nugini Peluru sempat melesat menyeberangi tanah yang kini menjadi PLBN Terpadu Skouw dan mendarat di ketinggian mercusuar ujung timur Indonesia Ini adalah Mercusuar Oinake Distrik Muara Tami Kota Jayapura Kami berbincang dengan petugas navigasi yang menjaga mercusuar ini Aser Lanta Menara suar ini pas di titik nol Jadi dia dua fungsi pertama sebagai pemantau laut Fungsi kedua adalah sebagai garis batas kata Aser kepada detikcom di lokasi Selasa dnu fjp tapal batas tapal batas skouw tapalbatasskouw mercusuar oinake opm papua 
Jokowi: Masa Kita Terbelah Gara-gara Pilpres?, Tangerang Presiden Joko Widodo Jokowi kembali mengingatkan pentingnya menjaga persatuan dan kesatuan Jokowi tak ingin masyarakat terbelah hanya karena perbedaan pilihan politik Hal itu disampaikan Jokowi saat membagikan sertifikat hak atas tanah kepada masyarakat Kabupaten Tangerang dan Kota Tangerang Selatan di Hall A ICE BSD Tangerang Banten Rabu Saya ingin kita bersama sama saya ajak Bapak Ibu semua untuk jaga persatuan kita kerukunan kita persaudaraan kita karena kita berbeda beda Jangan sampai karena pemilihan bupati wali kota gubernur presiden kita jadi terpecah pecah Antar tetangga nggak saling sapa antar teman nggak saling sapa antar saudara nggak saling sapa kata Jokowi jor fdn presiden jokowi tangerang pilpres 
"Di Muktamar Hima Persis, Jokowi Janji Realisasikan Rusun", Jakarta Usai menyerahkan sertifikat tanah ke masyarakat Bogor Jawa Barat Presiden Joko Widodo Jokowi bertolak ke kawasan Cipayung Jakarta Timur Jokowi menghadiri Pembukaan Muktamar Himpunan Mahasiswa Persatuan Islam IX Hima Persis Jokowi tiba di lokasi acara di Pondok Pesantren Persis Ustman Bin Affan Cipayung Jakarta Timur Selasa Ketibaan Jokowi disambut meriah para mahasiswa peserta muktamar Dalam sambutannya Jokowi mengatakan dirinya sudah dua kali bertemu dengan keluarga besar Persis Yang pertama di Bandung kedua saat ini di Jakarta jor fdn presiden jokowi persis 
