title,content
"Kuliner Ekstrem Indonesia Timur, Berani Coba?", Timika Indonesia timur memang mempesona Bukan hanya alamnya kulinernya pun juga unik dan ekstrem Seperti yang satu ini ulat sagu dan cacing tambelo dari Papua Liburan ke Papua rasanya memang kurang lengkap tanpa mencicipi kuliner khasnya Seperti kehidupan masyarakatnya yang masih bersentuhan dengan alam kuliner khasnya pun ekstrie bagi yang tak biasa Mulai dari ulat sagu sampai cacing tambelo detikTravel mendapat kesempatan untuk mencicipi makanan makanan ekstrem ini beberapa waktu lalu Seperti apa bentuk dan rasanya Ulat saguPenampakan ulat sagu Afif detikTravel Ulat sagu adalah camilan warga Papua dan Maluku Ulat ini diambil dari pohon pohon sagu di hutan rimba Warnanya putih dan besarnya seperti ukuran jempol orang dewasa Tak seperti kelihatannya yang sedikit geli ulat ini punya rasa yang enak Salah satu yang suka menikmatinya adalah Suku Kamoro di pedalaman Timika Papua Ulat sagu kadang disajikan dalam perjamauan ketika mereka menerima tamu Wanita dewasa Suku Kamoro menyajikan kuliner ini Di satu nampan besar ada binatang yang berwarna putih dengan gerakan khas ala ulat Besarnya seukuran jempol orang dewasa Di ujung badannya ada warna merah sebagai kepala Itulah ulat sagu Konon ulat ini memiliki protein yang tinggi lho Ini adalah makanan sehari hari di sana Ulat ini diambil dari pohon sagu Uniknya ada dua cara untuk memakan ulat sagu ini yaitu dimakan mentah mentah dan juga dimakan setelah dimasak Rasanya pun berbeda Akan tetapi ada satu hal penting sebelum memakan ulat sagu Kepalanya harus dibuang sebab keras Saat dimakan mentah mentah ulat ini masih bergerak gerak di tangan Ada cairan yang keluar dari badannya Setelah membuang kepalanya ulat ini masih bergerak Hmm rasa penasaran untuk melahapnya malah semakin menggebu gebu Nyamm Ulat sagu mentah ini pun masuk ke dalam mulut Saat dikunyah rasanya kenyal asam dan tawar Akan tetapi rasa asam lebih mendominasi di dalam mulut ini Cairan di dalam ulatnya pun makin berasa Memang satu gigitan saja tak cukup untuk menghancurkan ulat ini di dalam mulut Kunyahnya harus berkali kali Puas mencicipi ulat sagu hidup hidup kini saatnya mencoba ulat sagu yang dimasak Ulat sagu itu dibungkus dengan lipatan pohon pisang bersama sagu sebagai tambahannya Setelah sekitar setengah jam dimasak ulat sagu dan sagunya pun matang Dari aromanya tercium bau terbakar yang harum Saat dibuka ada sagu dan ulat sagu yang terpanggang Nyamm ulat sagu yang dimasak memiliki rasa lebih nikmat dan gurih Lebih kriuk dan tidak terasa asam Kulitnya yang terpanggang justru membuta siapa pun yang mencoba jadi ketagihan Ulat akan terasa lebih nikmat saat dimakan bersama sagunya inilah cemilan khas dari Papua Sementara di Maluku ulat sagu dimasak dengan rasa yang lebih nikmat Mereka menambah bumbu dan rempah rempah lain seperti rica rica Sehingga ulat sagu di Maluku lebih kaya rasa daripada di Papua Cacing TambeloCacing yang hidup di dalam kayu yang busuk Fitraya detikTravel Selain ulat sagu masih ada lagi ini nih kuliner khas Papua yang tak kalah ekstrem Cacing Tambelo Bentuknya seperti cacing tapi kulitnya putih punya taring lembek dan berlendir Konon banyak khasiatnya untuk tubuh lho Cacing tambelo memiliki nama latin Bactronophorus thoracites Cacing ini termasuk ke dalam jenis moluska Cacing ini tidak berada di dalam tanah melainkan hidup di batang pohon yang sudah busuk Tambelo bisa bertumbuh panjang sampai cm Namun ukuran badannya ini akan tergantung dari banyaknya populasi di satu tempat Semakin banyak tambelo yang hidup maka ukuran tubuhnya akan semakin pendek Untuk menemukan cacing tambelo kamu bisa terlebih dulu bertemu Suku Kamoro di kawasan Timika Kabupaten Mimika Atau suku suku lainnya seperti Suku Agats yang menempati daerah pesisir di sepanjang kabupatennya Bagi yang belum tahu Timika ada di bagian agak selatan dari Pulau Papua Cacing tambelo sudah menjadi camilan dari suku suku tersebut Mereka suka menyantapnya ketika sedang berburu di dalam hutan Serta tak sungkan untuk menghidangkannya kepada turis yang datang Asyik Mereka akan membawa batang batang pohon yang sudah busuk dan lapuk terlebih dulu Bukan sekedar busuk Tambelo hidup di dalam kayu yang busuk oleh air laut Krak Ketika terbelah cacing tambelo yang berwarna putih terlihat menyeruak dari lubang lubang di dalam kayu Melihatnya saja mungkin sudah bikin kamu mengerenyitkan dahi Bisa jadi merasa jijik juga apalagi keluar dari batang pohon yang sudah busuk dengan bau tak sedap Sekilas cacingnya justru mirip tentakel cumi cumiTenang dulu atur nafas pelan pelan Kumpulkan nyali dan keberanian untuk mencicipi makanan khas Papua yang disebut sebagai kuliner ekstremnya Pertama cacing dibersihkan dahulu ke dalam air Setelah itu ambillah bagian kepalanya yang memiliki taring tapi bentuknya kecil Copot bagian kepalanya dan belahlah bagian tubuhnya Jangan kaget seketika itu akan keluar cairan cokelat yang sebenarnya adalah lumpur Kalau sudah bersih angkat cacing tambelo tinggi tinggi Siap siap masukan cacing tambelo ke mulut kamu pelan pelan seperti hendak menyeruputnya Setelah itu kunyahlah pelan pelan di dalam mulut Tektsturnya empuk dan rasa rasanya seperti cumi mentah Nyam Bagaimana merasa tertantang untuk mencoba Meski terlihat menyeramkan cacing tambelo bisa jadi buat kamu ketagihan Tenang saja jumlah cacing tambelo dalam satu batang pohon bisa mencapai belasan Bagi Suku Kamoro cacing tambelo dipercaya dapat membuat kejantanan pria bertambah Hal itu disebabkan kandungan proteinnya sangat tinggi sehingga bisa digunakan sebagai afrodisiak alias makanan yang dapat menambah kejantanan bagi pria Traveler yang liburan ke Papua jangan lewatkan untuk mencicipi kuliner khas ini ya bnl fay 
Rumah di Bantaran Kali Grogol Rusak Saat Pengerukan, Jakarta Rumah di bantaran kali penghubung Grogol Jakarta Barat mengalami kerusakan Dinding rumah yang menempel pada bibir sungai retak dan hampir roboh Penyebab kerusakan adalah pengerukan sungai samping Jalan Kemandoran Pluis Grogol Utara Kebayoran Lama Jakarta Selatan Lokasi tersebut merupakan perbatasan dengan Kecamatan Palmerah Jakarta Barat Saluran dikeruk melewati batas fondasi sehingga tanah runtuh dan menyebabkan rumah serta turap ambrol kata seorang pemilik rumah yang rusak bernama Erik Selasa Suyono warga lain mengatakan lantai rumahnya ambles sehingga keramik terbelah Selain itu dia menyebut tembok di rumahnya retak Pintu jendela tidak bisa dibuka kata Suyono Dimintai konfirmasi secara terpisah Suku Dinas Tata Air Jakarta Selatan mengakui adanya beberapa rumah yang rusak Pihak Dinas telah memberi tiang dari kayu di sepanjang turap yang rusak Kepala Sudin Tata Air Jakarta Selatan Holi Susanto mengatakan rumah yang rusak tidak memiliki izin Rumah tersebut seharusnya tidak menempel di bantaran sungai Rumah warga itu tidak ada IMB nya Itu bantaran sungai tak mungkin dikeluarkan IMB oleh PTSP ujar Holi saat dihubungi Holi mengatakan warga menuntut Sudin memperbaiki turap Tapi Holi memberi syarat agar masyarakat bergeser meter dari saluran penghubung sesuai aturan Mereka harus mundur sesuai aturan kalau turapnya mau diperbaiki Kalau bangunan rumah tidak dimundurkan akan membahayakan pekerja Bisa roboh nanti rumahnya saat perbaikan ujar Holi aik dhn 
Museum Peranakan Tionghoa di Tengah Pasar Lama Tangerang, Tangerang Di tengah keramaian pasar di KotaTangerang Banten terdapat sebuah museum yang menyimpan kekayaan budaya dan sejarah peranakan Tionghoa di Indonesia WartawanBBC Indonesia Sri Lestari mengunjungi Museum BentengHeritage yang didirikan pria keturunan Tionghoa atau Cina Benteng Suasana Imlek tampak kental di Pasar Lama Kota Tangerang sejumlah pedagang menjual lampion amplop untuk ang pau dan ornamen berbentuk ayam untuk menyambut Tahun Ayam Api Tak ketinggalan kuliner khas Imlek antara kue keranjang dan bandeng Sejumlah orang tampak berdoa sambil memegang dupa di Klenteng Boen Tek Bio yang berada di di tengah pasar yang merupakan cikal bakal Kota Tangerang ini Kawasan ini dulu disebut Benteng yang merujuk pada bangunan benteng di pinggir Sungai Cisadane yang dibangun untuk melindungi Vereenugde Oostindische Compagnie VOC dari serangan pasukan Kesultanan Banteng Orang Tionghoa sudah berada di Tangerang sejak melalui Teluk Naga jauh sebelum kedatangan VOC keturunan mereka kemudian disebut dengan istilah Cina Benteng Melongok Museum Benteng Heritage di TangerangToleransi antar etnis di Kota Cina Kecil LasemDi sekitar klenteng yang dibangun pada masih ada beberapa bangunan tua yang sebagian besar digunakan sebagai toko Salah satu bangunan tua itu digunakan Museum Benteng Heritage yang hampir tidak terlihat karena tertutup lapak para pedagang pasar BBC INDONESIA Bangunan Museum BentengHeritage berada di tengah pasar Di dalam museum tampak beberapa pengunjung tengah mendengarkan penjelasan dari seorang pemandu di sebuah ruang makan yang dihiasi ornamen peranakan Tionghoa Di lantai dua yang digunakan untuk menyimpan benda benda bersejarah tampak pemilik dan pendiri Museum Benteng Heritage Udaya Halim atau Lim Cin Peng meladeni sejumlah tamu Meski tinggal di Australia Udaya secara rutin kembali ke tanah air Kecintaannya terhadap budaya leluhur dan pendidikan membuat pria yang menghabiskan masa kecilnya di kawasan Pasar Lama membeli bangunan ini lalu menjadikannya sebagai museum Saya sendiri lahir di Tangerang sebagai orang Tionghoa orang Cina Benteng kata Udaya Kebetulan lagi saya suka dengan budaya dan kebudayaan Tionghoa sudah mengakar di Indonesia seharusnya lebih diperkenalkan lagi agar keindonesiaan orang Tionghoa itu juga bisa diakui sebagaimana mestinya BBC INDONESIA Udaya Halim mendirikan museum untuk memperkenalkan budaya peranakan Tionghoa di Indonesia Dia membeli bangunan yang diperkirakan didirikan pada abad ke ini dari sebuah keluarga yang telah menempatinya selama delapan generasi dengan kondisi yang tidak terawat Saya dulu tinggal di rumah itu kata Udaya sambil menunjuk sebuah rumah yang terletak di seberang museum Tapi kemudian pindah karena orangtua tak mampu dulu waktu kecil saya suka main ke rumah ini Upaya restorasiUdaya kemudian merestorasi bangunan ini selama dua tahun dengan berkonsultasi dengan para koleganya yang merupakan ahli sejarah dan arsitektur di berbagai negara Selain itu Udaya pun mengunjungi sejumlah kota di Indonesia dan Malaysia yang memiliki bangunan tua peninggalan keturunan Cina untuk mengkaji hubungan sejarahnya Ke Malaka saya sudah kali sudah sejak saya bangun ini dan ke Penang sudah lebih dari kali dan saya juga riset ke tempat tempat yang tua ke Lasem Palembang dan dalam negeri juga nah saya cari historical link nya jadi dari jejak bangunannya dan saya lihat jejak bangunannya sama dengan yang ada di Malaka pada abad akhir jelas Udaya BBC INDONESIA Seorang pemandu tengah menjelaskan ornamen di ruang makan di Museum Benteng Heritage kepada pengunjung BBC INDONESIA Relief yang bercerita tentang kisah JenderalKwang Kong yang merupakan bagian dari legendaSam Kok Dia berupaya untuk mengembalikan karakter asli bangunan tersebut dan tidak mengganti bagian dari bangunan Sebagai contoh keramik yang menutupi lantai asli bangunan tersebut berupa tegel kemudian dibongkar Di salah satu bagian bangunan terdapat semacam ukiran dari pecahan keramik yang bercerita tentang seorang tokoh dalam legenda Sam Kok yaitu Jenderal Kwang Kong yang dikenal oleh masyarakat di negeri Cina dengan sifat yang jujur gagah dan berani Udaya mengatakan masuk dulu merupakan tempat tinggal tetapi dia menduga bangunan ini awalnya didirikan sebagai rumah komunitas Tionghoa karena terletak di bagian belakang klenteng Warga keturunan Tionghoa terbelah soal AhokBenarkah sentimen anti Cina di Indonesia kini menguat Dari kebaya sampai perabotSetelah upaya restorasi Udaya mengisi bangunan ini dengan berbagai koleksi antara lain kebaya encim berbagai macam timbangan uang kuno serta perabot tua Dia mendapatkan benda benda dengan berbagai cara Setiap keping ini saya dapatkan mulai saya beli sendiri saya dapat dari masyarakat atau bahkan saya lihat menggeletak di gudang jelas Udaya kemudian menunjukkan sebuah meja dengan hiasan lukisan dari kerang Meja ini didapat dari sebuah gudang milik rekannya dalam kondisi sudah rusak berkeping keping Udaya kemudian merestorasinya selama enam bulan kemudian diketahui meja yang berasal dari Cina ini diduga sudah berada di Indonesia sejak tahun lalu BBC INDONESIA Sepatu tradisional perempuan Tionghoa dipamerkan di museum BBC INDONESIA Sejumlah timbangan kuno merupakan koleksi Museum BentengHeritage Di sebuah ruang khusus di lantai dua Udaya menyimpan koleksi kamera dan gramafon tua serta piringan hitam langka antara lain lagu genjer genjer yang dinyanyikan Bing Slamet dan lagu Indonesia Raya karya WR Supratman yang direkam pada tahun an yang sempat diperdengarkan sore itu Mantan Kepala Bidang Kebudayaan Dinas Pendidikan dan Kebudayaan Kota Tangerang Nurul Huda mengatakan Museum Benteng Heritage ini sudah menjadi salah satu cagar budaya di kawasan Pasar Lama Tangerang BBC INDONESIA Pasar Lama merupakan cikal bakal Kota Tangerang nwk nwk bbc world bbc imlek 
Patahan Gunung Es di Antartika Terus Meluas, Cardiff ADRIANLUCKMAN Gunung es besar akan melepaskan diri dari kawasan esLarsen C Retakan yang akan memicu lepasnya bongkahan es raksasa di Antartika dilaporkan makin lebar Keretakan di kawasan es Larsen C terus memanjang sejauh km sejak Januari Jika retakan itu menjalar hingga lebih dari km maka patahan itu akan melepas bongkahan es berukuran seperempat wilayah Wales di Inggris Jika hal itu terjadi maka patahan akan menjadi salah satu gunung es terbesar yang pernah tercatat menurut para peneliti di Universitas Swansea dan Aberystwyth dan British Antarctic Survey Informasi tentang meluasnya patahan di lapisan es setebal m yang mengambang di sisi timur Semenanjung Antartika berasal dari sistem satelit Sentinel Uni Eropa Satelit yang terdiri dari dua pesawat ruang angkasa memiliki kemampuan mengorbit dan bisa terus memantau kawasan Larsen C kegiatan mereka tidak terhalang cuaca karena sensor radarnya bisa melihat bisa menembus awan Gunung es besar Antarktika akan terlepasLubang ozon di Antartika terdeteksi mulai pulih Data yang diperoleh menunjukkan bahwa retakan itu kini meluas sekitar km Namun Profesor Adrian Luckman dari Universitas Swansea mengatakan dirinya tidak bisa memprediksi seberapa lama waktu yang dibutuhkan sampai patahan itu bergeser sejauh km persegi Ujung patahan baru saja memasuki kawasan es yang paling halus yang akan memperlambat kemajuan katanya kepada BBC Meskipun Anda mungkin mengharapkan adanya luas retakan untuk mempercepat bentukan gunung es namun tetap saja mustahil untuk memprediksi kapan itu akan retak karena proses patahannya sangat kompleks Saya rasa perkembangan baru ini menunjukkan sesuatu yang akan terjadi dalam beberapa minggu bahkan beberapa bulan namun ada peluang di luar bahwa pertumbuhan lebih lanjut akan berjalan lambat Terkadang perkembangan patahan dipicu oleh gelombang laut yang berasal tempat lain yang juga sulit untuk diprediksi NASA Patahan tersebut selebar m tapi diperkirakan dalamnya mencapai setengah kilometer NASA Gambar yang diambil November tahun lalu dan menunjukkan panjangnya patahan Ketika gunung es terbelah perhatian akan berpusat pada bagaimana kerusakan akan mempengaruhi struktur kawasan es yang tersisa Sebelumnya kawasan es Larsen B runtuh pada tahun Masalah ini penting karena patahan es yang mengambang biasanya menjadi penopang untuk gletser yang mengalir dari tanah di belakangnya Dalam kasus Larsen B gletser gletser berpindah cepat karena tidak ada patahan Dan itu adalah dataran es tidak patahan es mengambang yang menambah peningkatan permukaan laut Jika hal itu terjadi pada kawasan es Larsen C maka tren seperti ini akan berlanjut di Semenanjung Antartika Dalam beberapa dekade terakhir belasan patahan es besar hancur mereka lenyap secara signifikan di antaranya Prince Gustav Channel Larsen Inlet Larsen A Larsen B Wordie Muller Jones Channel dan Wilkins ESA EU COPERNICUS Sistem satelitSentinel Uni Eropa memantau luas patahan es Perkembangan lain yang harus diperhatikan adalah patahan es yang mengambang dan bagaimana ia terbawa arus dari Antartika Laut es di wilayah ini tidak berdiam di satu tempat mereka berputar searah jarum jam dengan Weddell Gyre dan gunung es bisa terbawa kadang kadang keluar ke arah Samudra Selatan jelas Prof Luckman Ini semua tergantung pada seberapa cepat gunung es pecah dan bagaimana perbandingan gunung es dengan kedalaman laut Kedalaman samudra di suatu wilayah tidak bisa diketahui dengan tepat karena lapisan es yang dekat membuat kapal penelitian sulit bergerak Banyak gunung gunung es besar diproduksi di daerah Antartika ini terhanyut oleh arus yang akhirnya membawa mereka ke bagian utara menuju wilayah luar Inggris dari South Georgia Di sana mereka bisa terperangkap di perairan dangkal yang kemudian hancur secara bertahap Pembawa alat alat kelautan ini adalah salah satu yang dimanfaatkan oleh Ernest Shackleton untuk menyelamatkan krunya ketika kapal mereka Endurance menabrak es tebal Laut Weddell tahun Thinkstock Sisa sisa gunung es terdampar di South Georgia nwk nwk bbc world bbc 
Penjelasan PVMBG Soal Fenomena Tanah Terbelah di Trenggalek, Jakarta Tanah di kawasan Trenggalek Jawa Timur retak terbelah dan membuat bangunan rusak Pusat Vulkanologi dan Mitigasi Bencana Geologi PVMBG menjelaskan penyebabnya yakni karena sifat tanah dan berbagai faktor lainnya Kawasan itu termasuk daerah yang kerentanan gerakan tanahnya tinggi kata penyelidik bumi PVMBG Herry Purnomo kepada detikcom Rabu Fenomena alam itu terjadi di Terbis Panggul Trenggalek utamanya di Dusun Krajan dan Dusun Dulur pada Selasa sore Lebar retakan bisa mencapai centimeter dengan kedalaman meter Sudah ada rumah plus satu musala yang rusak Total ada hektare tanah retak terdiri dari hektare perkampungan dan hektare pekarangan dan sawah dnu fjp 
"Enyah Persatuan, Sakitnya tuh di Sini", Seoul Anyonghaseo Hanya orang sakit yang dapat memahami arti sehat Hanya bangsa yang sedang terbelah yang mampu memberi makna hakiki persatuan Namun bangsa yang bijak adalah mereka yang mampu belajar dari pengalaman pihak lain Sejak unjuk rasa yang berakhir menyedihkan awal November lalu tema persatuan bangsa tiba tiba menyeruak Mengagetkan banyak pihak Demo yang awalnya hanya menyoal pernyataan Ahok kemudian menyodok sendi sendi kebangsaan Presiden pun jadi sibuk melakukan safari penyelamatan agar biduk bangsa ini tidak karam Dengan jurus silaturahmi aneka demo susulan yang dianggap bisa jadi tunggangan kelompok tertentu dicoba diredam Semua anak bangsa kini menanti apa yang akan terjadi pada Desember di seputaran Monas Dalam bayangan saya bangsa Indonesia saat ini tengah dirundung masalah berat Persatuan yang selama ini teguh sepertinya ada yang mencoba mengoyaknya Kalau ini benar semua anak bangsa harus melawan karena harga persatuan sangatlah mahal Bahkan tidak ternilai Foto M Aji Surya detikcomTaman kota yang berwarna sudut menawan di KoreaOmongan saya bukanlah sebuah teori Saya saat ini saya tengah hidup di tengah bangsa yang terbelah dan berperang Korea Jangan terbelalak hanya dengan K Pop yang menggema Jangan pula hanya terkesima Gangnam style kimci dan odeng yang mak nyus Di tengah ingar bingar itu semua saya jelas mendengar degup jantung ketakutan Mereka dihantui perang dan terus bermimpi persatuan Selanjutnya Halaman 
