title,content
Misteri Batu-batu Setan di Australia, Tennant Creek Anda pasti tahu hamparan batu batu granit yang ada di pinggiran pantai di Belitung Australia juga punya pemandangan seperti itu tapi bedanya berada di gurun yang tandus Namanya adalah Devils Marbles alias batu setan Devils Marbles merupakan fenomena alam yang unik dari Negeri Kangguru Bayangkan saja di tengah gurun dengan tanah yang berwarna merah seluas hektar terdapat banyak bebatuan granit yang bentuknya bulat sempurna Bagaikan telur telur raksasa Dilongok dari situs resmi pariwisata Australia Senin kawasan Devils Marbels rupanya menjadi salah satu tempat yang dikeramatkan atau disucikan oleh suku Aborigin Mereka menyebutnya dengan nama Karlu Karlu Legendanya bebatuan yang ada di Devils Marbels merupakan suatu perwujudan dari rambut para pria leluhur suku Aborigin Para pria tersebut membuat ikat kepala yang jadi perhiasan dan tak boleh digunakan oleh wanita Rambut rambut yang jatuh dari kepalanya lantas membentuk batu batu besar dan dianggap suci Terlepas dari itu batu batu di Devils Marbels sebenarnya merupakan bebatuan granit yang sudah terbentuk akibat erosi jutaan tahun lalu Para ahli mengungkapkan bentuk batu batu di sana yang bulat diakibatkan cuaca yang panas dan lahan yang kering Bentuk batunya yang bundar ada yang berdiameter meter paling besar hingga meter paling kecil Yang unik formasi bebatuan bulatnya ada yang bertumpuk dan terlihat seimbang Ada pula yang bentuk batunya terbelah dua seolah dibelah pedang Hingga kini Devils Marbles dilindungi oleh Northern Territory Aboriginal Sacred Sites Act yang dikelola oleh masyarakat Aborigin Devils Marbels dapat dikunjungi turis setiap hari Satu hal yang harus diingat Anda dilarang membuat api di sembarang tempat kecuali di lokasi yang sudah ditentukan Waktu terbaik untuk datang ke Devils Marbels adalah saat sunset Ketika itulah batu batu besar ini tampak berkilau dan berubah warna dari merah muda menjadi merah cerah karena terkena sinar matahari yang terbenam Menggagumkan Meski masih banyak misteri seputar Devils Marbels yang menyebut kalau batu batu di sana adalah fosil telur dinosaurus atau legenda legenda soal formasi bebatuan yang seimbang tempat ini sudah jadi incaran turis yang datang ke Australia Hamparan batu granitnya memang sunguh cantik Cara ke sana Lokasi Devils Marbles berada sekitar jam perjalanan dari Tennant Creek di wilayah negara bagian Northern Territory Km dari Devils Marbels terdapat Wauchope yang punya penginapan bagi wisatawan Fasilitas di sana lengkap dan menyediakan paket tur menjelajahi Devils Marbels Sedangkan di Devils Marbles Conservation ada lokasi perkemahan yang bisa didatangi turis untuk bermalam di alam liar aff aff 
Hujan Badai dan Tanah Longsor di China Tewaskan 11 Orang, Beijing Sedikitnya orang tewas akibat hujan deras dan tanah longsor yang melanda wilayah Chongqing China Sebanyak orang lainnya dilaporkan hilang serta ribuan rumah warga ambruk akibat bencana alam ini Nyaris sekitar ribu orang terpaksa mengungsi dari rumah masing masing Demikian seperti disampaikan otoritas setempat yang dikutip kantor berita Xinhua dan dilansir AFP Rabu Kementerian Urusan Sipil setempat mencatat sebanyak ribu orang di sebanyak distrik terkena dampak bencana ini Di wilayah Fengjie yang dekat dengan Sungai Yangtze terjadi tanah longsor yang menjadikan danau terbelah dua Sementara ketinggian air terus naik dalam waktu beberapa jam Akibatnya lebih dari warga setempat dievakuasi ke tempat aman Menurut Xinhua korban hilang termasuk pekerja tambang yang terkubur tanah longsor yang terjadi Senin lalu Dalam laporannya Xinhua menyebut total rumah warga ambruk akibat hujan lebat ini Sedangkan ribu rumah lainnya rusak akibat insiden yang sama nvc ita 
"Cerita Ahok Soal Satam, Batu Akik Khas Belitung Timur", Jakarta Hobi mengoleksi cincin yang berhiaskan batu akik kini tengah menjadi fenomena Hobi ini digandrungi mulai dari orang biasa hingga para pejabat Salah satunya seperti yang diceritakan oleh Wakil Gubernur DKI Jakarta Basuki Tjahaja Purnama Ahok Menurutnya batuk akik atau batu permata bukan hal yang aneh baginya Ahok mengaku memiliki banyak batu akik khas Pulau Belitung yang bernama Batu Satam Batu Satam itu cuma ada di Belitung Timur itu dari tambang yang asalnya dari meteorid jatuh kata Ahok kepada detikcom di kantornya Jl Medan Merdeka Selatan Jakarta Selasa Ahok mengatakan di rumahnya di Belitung Timur dia memiliki banyak batu Satam Sebab memang di sanalah pusat batu Satam berada Biasanya Ahok menjadikan batu tersebut sebagai hiasan cincin Saya punya banyak batunya saya jadiin cincin ucap Ahok  Sayangnya Ahok tidak terlalu suka memakai cincin sehingga batu yang dimilikinya seringkali diberikan kepada rekan yang hobi mengkoleksi batu cincin Saya enggak suka pakai cincin jadi saya juga sering kasihkan ke pejabat yang suka ucap Ahok tanpa merinci siapa pejabat yang menerima cincin darinya Dilansir oleh situs wisata jelajah belitung com dijelaskan bahwa batu Satam merupakan batu Meteor yang terbakar atau pecah di angkasa yang kemudian jatuh ke bumi dan mengendam jutaan tahun lamanya Batu ini berwarna hitam dan konon katanya hanya ada di Pulau Belitung Harga batu ini berkisar diangka ratusan ribu rupiah Nama Batu Satam berasal dari bahasa Tiongkok yang terdiri dari dua suku kata yakni SA artinya pasir dan TAM berarti empedu Batu ini memiliki ciri ciri bulat lonjong dan ada yang berbentuk tak beraturan atau dalam bentuk sudah pecah atau terbelah yang akrab di sebut dengan suiseki Ciri khas batu ini adalah pada permukaan batu memiliki goretan yang terukir secara alami yang tergesek melalui arus air di bawah tanah pada lapisan tanah dengan kedalaman kurang lebih meter Kabar yang beredar di masyarakat batu ini berfungsi sebagai penawaran racun dan memiliki kekuatan majik Karena keunikan dan kelangkaanya batu ini dijadikan sebagai batu permata dan dibuat sebagai perhiasan cincin bros dan kalung Bahkan ada yang dibuat sebagai hiasan tongkat komando Saat ini batu Satam biasa dijadikan oleh oleh atau cendramata khas Pulau Belitung slm ndr 
"Presiden SBY Rilis Video di Youtube: ""Menang Tenggang Rasa, Kalah Besar Jiwa""", Jakarta Presiden SBY merilis video di youtube Dalam tayangan berdurasi menit dengan model tanya jawab itu SBY menyampaikan sikapnya terkait hasil pemilu Kita juga menghormati Pak Prabowo Subianto Sebenarnya ketika merasa tidak bisa menerima hasil pengumuman KPU itu dan kemudian saya dengar akan membawanya ke mahkamah konstitusi inipun tidak luar biasa karena itu dibenarkan dalam mekanisme yang kita miliki sesuai dengan UUD kata SBY seperti dikutip dari video itu Jumat Berikut tanya jawab lengkap Presiden SBY dengan seorang perempuan pewawancara Penanya Tanggal Juli yang lalu adalah hari yang sangat penting hari yang istimewa tapi juga sekaligus jadi hari yang sangat menegangkan Apalagi setelah Pak Prabowo Subianto mengeluarkan pernyataan bahwa tidak lagi terlibat dalam proses penghitungan suara di KPU kemudian desas desus bermunculan bahwa akan terjadi kekacauan di negeri ini Namun dari pengamatan saya dan juga kawan kawan bapak selaku presiden tetap terlihat tenang Bagaimana bapak melihat situasi politik saat ini SBY Benar tanggal Juli kemarin memang betul menegangkan tapi kan saya memantau perkembangan situasi di seluruh tanah air Saya juga mengikuti apa yang diwartakan oleh media massa kita terutama yang di televisi televisi dan dari ruang posko saya Saya juga menjalin komunikasi dengan jajaran TNI dan Polri Beberapa kali saya menerima laporan beberapa kali saya memberikan instruksi dan pengarahan Dari semua itu saya dapat menyimpulkan bahwa situasi di tanah air kita aman tenang dan juga stabil Jika misalnya ada dinamika yang meningkat kemudian sebutlah ada ancaman terhadap gangguan keamanan kita sudah siap negara juga siap aparat keamanan baik Polri maupun TNI juga siap artinya tidak mungkin kita terdadak Oleh karena itu lah saya mengatakan insya Allah semuanya akan berjalan dengan aman saya juga punya naluri punya pengalaman dan punya logika dan satu hari setelah itu tanggal Juli dihadapan sidang kabinet terbatas saya sampaikan kepada wakil presiden para menteri serta anggota kabinet yang lainnya Insya Allah pemilihan presiden ini akan berjalan aman dan damai situasi di tanah air akan dapat kita jaga dan kita kelola dengan baik Itulah yang membuat saya tenang tidak perlu khawatir kalau terjadi apa apa dalam rangkaian pemilihan presiden ini terutama sisi stabiltas dan keamanan nasional Penanya Bapak presiden saat ini didengar kabar bahwa pasangan Prabowo Subianto dan Hatta Rajasa akan membawa hasil penghituangan suara di KPU ini ke Mahkamah Konstitusi kemudian pandangan masyarakat terbelah ada yang mengatakan bahwa ini terlalu mengada ada tapi ada juga yang mendukung langkah Pak Prabowo ini karena katanya terjadi pelanggaran pada pemilu presiden yang lalu Apa pandangan bapak SBY Dalam situasi seperti tanggal Juli kemarin ataupun sekarang ini sebaiknya kita semua itu bisa berpikir jernih dan juga saling hormat menghormati Pertama kita harus menghormati KPU sebagai lembaga penyelenggara pemilu yang mandiri dan indpenden Artinya kita mesti percaya kepada KPU dan dengan demikian juga menghormati hasil penghitungan suara yang dilakukan oleh KPU Yang kedua kita juga harus menghormati Pak Jokowi bersama Pak Jusuf kalla yang oleh KPU dalam pengumumannya kemarin dinyatakan sebagai pemenang dalam pemilihan presiden kali ini Kalau Pak Jokowi beserta tim pendukungnya bersyukur bersuka cita dan merayakannya itu wajar dan juga harus dihormati meskipun pada saat saya mengucapkan selamat melalui telepon saya sampaikan Pak Jokowi bersuka cita tentu pasti dari bapak dan tim pendukung tetapi bagus kalau juga ada tenggang rasa dengan demikian situasi yang baik tetap dapat kita jaga Pak Jokowi juga memiliki pandangan yang sama jadi saya senang Kita juga menghormati Pak Prabowo Subianto sebenarnya ketika merasa tidak bisa menerima hasil pengumuman KPU itu dan kemudian saya dengar akan membawanya ke Mahkamah Konstitusi Inipun tidak luar biasa karena itu dibenarkan dalam mekanisme yang kita miliki sesuai dnegan UUD dan undang undang yang berlaku Yang penting kalau kita sudah saling hormat menghormati dalam situasi seperti kemaren itu yang paling bijak tidak perlu ada komentar komentar yang memperkeruh suasana yang justru bisa memanaskan situasi yang ada Saya sendiri sangat hemat dalam mengeluarkan statement meskipun saya didorong melalui SMS melalui sosial media kemana Pak SBY harusnya ikut memberkan komentar dan sebagainya Saya pikir tidak perlu karena semuanya menurut pandangan saya dalam batas batas yang wajar dan tidak ada yang luar biasa dengan demikian sekali lagi saya berhemat mengeluarkan statement supaya tidak menambah tegangnya situasi yang ada Dan itulah pesan saya yang ingin saya sampaikan ketika situasi yang kita hadapi seperti itu Semua pihak yang paling baik menahan diri kalau tidak perlu mengeluarkan statement ya tidak perlu sambil memberikan penghormatan satu sama lain Penanya Nampaknya bapak sampaikan ini benar bahwa rakyat kita semakin matang dalam berdemokrasi dan juga memiliki komitmen yang tinggi untuk menjaga agar proses pemilu ini berlangsung dengan damai termasuk dengan tidak mudahnya masyarakat kita tidak terprovokasi oleh hal hal yang tidak benar Tidak kah itu menunjukkan bahwa kualitas demokrasi di negara kita makin maju Bagimana bapak melihat fenomena ini SBY Saya memiliki pandangan yang sama tentu kita bersyukur kita bangga bahwa demokrasi kita makin matang dan makin maju berarti upaya kita semua dalam melakukan konsolidasi demokrasi sebenarnya berhasil Masyarakat itu internasional memberikan pengakuan dan juga apresiasinya Sekertaris Jenderal PBB sahabat saya Ban Ki Mon juga berkomunikasi dengan saya tentang pemilu yang damai ini demikian juga sejumlah pemimpin dunia berkomunikasi dengan saya baik melalui telepon langsung maupun melalui pernyataan tertulis yang dikeluarkan oleh para pemimpin dunia tersebut Tentu ini membanggakan dan sekali lagi patut kita syukuri namun jangan cepat kita berpuas diri masih panjang perjalanannya yang harus kita tempuh sampai betul betul demokrasi kita pemilihan umum yang ada di negeri ini benar benar berkualitas dan juga bermartabat Misalnya kalau benar sinyalemen di berbagai tempat dari sejumlah kalangan masih adanya politik uang di sana sini masih adanya intimidasi atau paksaan dari sejumlah pejabat kepada masyarakat kita Yang akan saya sampaikan ini kalau politik atau demokrasi atau pemilihan umum di negeri ini biayanya amat mahal itu juga tidak baik Saya kira bukan itu demokrasi yang hendak kita tuju dan hadirkan oleh karena itu menurut saya kita sekali lagi harus bekerja sekuat tenaga untuk menyempurnakan dan membuat demokrasi serta pemilihan umum di negeri ini makin ke depan makin baik Dan ini menjadi tugas kita semua tugas dari satu generasi ke generasi yang lain dengan keyakinan insya Allah negara kita bisa insya Allah Indonesia bisa Penanya Bapak presiden jika pasangan Bapak Prabowo Subianto dan Hatta Rajasa benar benar membawa hasil pemungutan suara atau juga dugaan kecurangan di pemilu presiden ini ke Mahkamah Konstitusi apa komentar dan juga harapan bapak selaku presiden SBY Pertama saya memberikan kepercayaan kepada MK untuk bisa memproses apa yang akan disampaikan oleh pasangan Prabowo Subianto dan Hatta Rajasa tersebut dan ini sesuatu yang sekali lagi tidak luar biasa ingat dalam pemilihan presiden tahun dulu baik pasangan Ibu Megawati dan Pak Prabowo Subianto maupun pasangan Pak Jusuf Kalla dengan Pak Wiranto juga tidak menerima hasil yang diumumkan oleh KPU dan kemudian membawanya ke MK jadi ini bukan yang pertam kali Tetapi MK juga memproses secara transparan dan bertanggung jawab Kali ini saya juga memberikan dukungan sekaligus harapan kepada MK untuk menangani masalah ini dengan sebaik baiknya dan seadil adilnya Yang penting mari kita berikan pengawasan kepada MK agar yang dilakukannya tepat sesuai dnegan harapan kita semua Yang penting sebagaimana yang disampaikan oleh Pak Prabowo Subianto sendiri pada saat menyampaikan pernyataan pada tanggal Juli yang lalu masa pendukung dan konstituen Pak Prabowo diharapkan tenang sambil menghormati proses yang sedang ditempuh melalui MK karena hari ini kalau belum itu betul betul dilaksanakan Pesan atau pun komentar saya saya tetap punya keyakinan dan tentu sekaligus harapan agar segala sesuatunya bisa diproses dengan baik karena kalau saya yang penting adalah regularitas demokrasi harus dapat kita jaga Kalau pergantian kepemimpinan nasional dan pergantian pemerintahan hasil pemilihan umum itu dilaksanakan lima tahun harus bisa kita jaga harus bika tepati Artinya tanggal Oktober yang akan datang saya betul betul bisa mengakhiri tugas dan kewajiban saya memimpin negeri ini menjalankan roda pemerintahan dan kemudian presiden baru dengan pemerintahannya bisa memulai tugas dan pengabdiannya untuk bangsa dan negara dengan dukungan kita semua Oleh karena itu lah beberapa saat yang lalu banyak sekali pikiran yang menurut saya ganjil dan tidak tepat misalnya ini kalau ada apa apa diperpanjang saja pemerintahan ini selama satu tahun dan sebagainya Saya katakan itu bukan solusi itu bukan opsi yang baik justru kita semua termasuk saya pribadi harus betul betul berupaya memenuhi jadwal kenegaraan yang ada sebagaimana yang saya sampai tadi regularitas demokrasi yang harus kita junjung tinggi itulah komentar saya dan saya melihat perkembangan situasi yang akan datang insya allah akan berjalan dengan harapan kita ndr mad 
Ini Keterangan Saksi Mata yang Lihat Langsung MH17 Diroket dan Meledak, Kiev Malaysia Airlines MH ditembak jatuh dan meledak orang termasuk kru meninggal dunia Pesawat itu ditembak jatuh di perbatasan Ukraina dan Rusia Belum diketahui jelas siapa pelaku penembakan baik pihak Ukraina dan militan saling membantah Namun menurut keterangan saksi mata seperti dikutip reuters Jumat pesawat yang tengah terbang dari Amsterdam menuju Kuala Lumpur itu meledak di udara Saya sedang bekerja di ladang dengan traktor kemudian saya mendengar suara pesawat dan terdengar suara bunyi tembakan dan ledakan Kemudian saya melihat pesawat jatuh ke tanah dan terbelah dua kata saksi yang disebutkan bernama Vladimir Sedang menurut seorang anggota kelompok separatis Ukraina pro Rusia bernama Sergei dia melihat dari atas balkon rumahnya pesawat itu terbang tinggi dan dia kemudian mendengar dua kali ledakan Namun Sergei menepis kalau yang menembak pesawat itu dari pihak separatis yang ingin merdeka dari Ukraina jor ndr 
El Clasico: Lebih dari Sekadar Drama Biasa, Madrid  Setiap dongeng butuh penjahat yang bagus Kau membutuhkanku atau kau takkan berguna Karena kita sama kau dan aku  Kalimat di atas adalah ucapan perpisahan James Moriarty kepada Sherlock Holmes  dua musuh abadi yang saling membutuhkan dalam novel detektif Sherlock Holmes ciptaan Sir Arthur Conan Doyle Apa yang diucapkan tokoh antagonis James Moriarty ini mirip mirip seperti hubungan antara Real Madrid dan Barcelona Meski sama sama membenci keduanya butuh satu sama lain Meski senang melihat lawannya terpuruk sebenarnya mereka butuh agar musuhnya kuat karena kisah persaingan yang sengit hanya bisa lahir dari lawan yang seimbang sama sama kuat dan saling mengalahkan Sementara bagi Madrid dan Barcelona mereka butuh drama Tinggal masalah pembagian siapa yang ambil peran sebagai penjahat dan siapa yang akan jadi pahlawan Kebencian Abstrak untuk Mendongkrak KeuntunganBarca sering kali memposisikan diri mereka sebagai sesosok David yang sedang melawan Goliath Sikap ini juga yang kerap diamini oleh para pemain Barca Catalunya adalah negara dan Barcelona adalah tentaranya Real Madrid adalah musuh terbesar kami ucap Sir Bobby Robson eks Pelatih Barcelona Robson sebenarnya seorang Inggris yang disegani dan selalu berhati hati saat berucap Tapi komentarnya seolah membuktikan bahwa nasionalisme Catalunya memang telah menempel dalam diri setiap pemain ofisial ataupun pelatih Barcelona Ini juga yang terjadi dengan Hristo Stoichkov Kepada Franklin Foer sebagaimana diceritakan dalam buku  How Soccer Explains The World saat ditanyai tentang rivalitas antara Barcelona dan Madrid Stoichkov malah memberikan jawaban lebih keras lagi  Saya akan selalu membenci Real Madrid Lebih baik bumi terbelah dan menelan saya ketimbang harus menerima kerja dengan mereka Membicarakan Real Madrid membuat diri saya ingin muntah  ucapnya Stoichkov adalah pemain paling populer di Barcelona Ketenarannya bukan hanya berkat permainannya di lapangan tapi juga karena kelantangannya mengkampanyekan ideologi Katalunyaisme yang selalu ia banggakan Ya saat membicarakan rivalitas itu Barca selalu memposisikan diri mereka sebagai yang tertindas Sejarah lama kekejaman Jenderal Franco pada kakek nenek mereka juga sering diungkap ungkap kembali Sikap dan ucapan ucapan tersebut memang dapat dimengerti Tindakan represif yang dilakukan Franco dengan membabat habis kebudayaan bangsa Catalunya tentu sebuah tindakan yang tak bisa ditolerir Belum lagi jika bicara masalah perseteruan Catalunya dan Kastilia terkait pemerataan uang antara pusat dan daerah serta bagaimana Catalunya yang diperah bagi kumpulan tuan tanah di kota Madrid baca tulisan Barcelona dan Pemberontakan yang Tak Pernah Selesai Tapi pada saat zaman keditaktoran Franco telah usai dan Catalunya mendapatkan otonomi daerah dan bahkan selalu lebih dimanjakan ketimbang daerah lain apakah yang dilakukan Barcelona ini masih relevan Franklin Foer yang secara terang terangan mengaku sebagai fans Barcelona dan menuliskan El Clasico pada bab khusus dalam buku How Soccer Explains The World pun mengakui kelemahan argumen ini Ia menuturkan bahwa dalam kemakmuran era demokratis zaman sekarang orang Catalunya tak punya basis objektif untuk merasa ditindas Kebencian mereka terhadap Madrid hanyalah kebencian berbentuk abstrak Mereka hendak merasakan apa yang diderita ayah dan kakek mereka di bawah tirani Madrid tewas dalam perang saudara dan tak boleh menuturkan bahasanya sendiri Tapi kejadian itu tentu ada pada masa lalu Simon Kuper dalam buku  Football Against The Enemy juga memapaparkan sedikit tentang fenomena ini Menurutnya lewat sebuah derby bertajuk El Clasico cerita cerita penindasan Franco terus diulang ulang Lewat itu juga paham  Katalunyanism mulai menyebar ke seantero dunia Panji panji Estelada bendera kemerdekaan Catalunya berkibar di mana mana sebagai bukti dukungan pada Barca Laga El Clasico pun dijadikan sebagai alat propaganda efektif Hal ini bahkan diakui oleh Joan Laporta sang mantan presiden Barca Keuntungan dari El Clasico Untuk Membiayai Los GalacticosOrang orang di Madrid tak mau diam tentang sikap para Catalan ini Mereka berpendapat bahwa orang Catalunya selalu sesumbar di mata dunia tentang Catalunya yang jadi tumbal Ini dilakukan agar bisa memeras pemerintah pusat dan federasi sepakbola Spanyol untuk memberikan keuntungan kepada mereka Saat ini Catalunya adalah salah satu daerah terkaya di Spanyol Tahun lalu pun mereka menuntut untuk segera merdeka dari Spanyol karena uang pajak mereka digunakan untuk mensubsidi wilayah wilayah lain yang miskin Cerita tentang pemberontakan dan kesengsaraan Catalunya adalah alat politik untuk menekan Madrid sembari mencari simpati dunia agar mendukung kebijakan kebijakan politik mereka Meski mengeluh tentang Barca yang cari simpati Madrid pun sebenarnya senang membudayakan tentang rivalitas El Clasico Mereka juga bangga dengan kearoganannya terhadap Barca Tindak tanduk Los Blancos yang menyalip pemain pemain yang hendak berkostum Barca adalah buktinya Muai dari zaman Alfredo Di Stefano hingga David Beckham Sampai saat ini tak pernah ada ucapan maaf secara tertulis yang terlontar dari pihak Madrid atas segala tindak tanduk kelicikan yang mereka lakukan pada era Franco Richard Fitzpatrick dalam buku  El Clasico Barcelona v Real Madrid Football s Greatest Rivalry menjelaskan sebuah analisa menarik tentang rivalitas El Clasico yang sebenarnya hanyalah rekaan kedua pihak Kebencian yang dimanipulasi Fitzpatrick mengatakan bahwa panasnya El Clasico baru terasa pada tahun an atau saat John Cruyff melatih Barcelona dan menjadikannya sebagai salah satu kekuatan di Eropa Sebelum itu Madrid lebih merasa musuh terberat adalah rival sekota mereka Atl tico Madrid Fitzpatrick juga menemukan data menarik tentang rivalitas El Clasico yang terus dipupuk Madrid Hal itu terjadi karena persaingan Barca Madrid malah membuat jumlah pendukung El Real meningkat Perseteruan itu dibuat sengit sehingga membuat Spanyol terbagi menjadi dua Dan hal itu cukup sukses untuk meningkatkan jumlah suporter baik untuk Madrid ataupun Barca  Penggemar sepak bola di seluruh Spanyol akan mendukung tim lokal mereka tapi juga akan mendukung hanya salah satu dari Barcelona atau Real Madrid Saya bahkan keheranan ketika saya menemukan bahwa lebih banyak orang mendukung Real Madrid di Sevilla ketimbang mendukung Sevilla atau Real Betis  tulisnya Begitu pula dengan Blaugrana yang meraup keuntungan Siapa bilang Barcelona merepresentasikan Barca Ada banyak penggemar sepakbola di daerah sana yang tidak mendukung Barca Para pendukung Espanyol misalnya Hal yang mengagetkan dari juta jiwa penduduk Catalunya satu juta diantaranya adalah fans Madrid Tapi ketika pasar yang bernilai puluhan juta euro itu tercipta dan terbelah jadi dua maka dengan mudah klub media dan tv melakukan propaganda karena mengeksplotasi emosi suporter memang lebih mudah dilakukan dengan menjual rivalitas Elliot Turner dalam buku  Real Madrid and Barcelona The Making Of Rivalry menegaskan bahwa televisi adalah urat nadi kedua tim saat ini Televisi pula yang mengontrol sedemikian rupa agar drama ini benar benar dinikmati dan dikhayati oleh penonton Terbukti dengan rivalitas Barca Madrid sebagai salah satu faktor utama keduanya pada musim mampu meraup uang senilai juta euro dari hak siar televisi Coba bayangkan jika salah satu dari Madrid atau Barca tergelincir ke divisi bawah Akankah mereka mampu menarik uang televisi sedemikian banyak Akankah banyak yang mau menonton liga yang isinya hanya tentang satu tim besar mengalahkan tim tim kecil setiap minggunya Maka dijual lah drama berlatar belakang politik sosial dan ekonomi dalam laga bertajuk El Clasico Padahal pertandingan yang konon katanya panas ini kadang mirip seperti Pseudo Derby  jarang didengar kedua fans terlibat bentrok seperti derbi derbi lainnya Oleh karena itu membicarakan El Clasico sebenarnya kita seolah menceritakan tentang sebuah klise yang berbentuk ilusi Sebuah drama rekaan yang dibuat sedramatis mungkin hingga kini menjelma jadi salah satu rivalitas terbesar dalam sepakbola bahkan dalam dunia olahraga Bertindak sebagai pusat drama ini adalah Madrid dan Barcelona yang masing masing telah dipaksa mengambil peran sebagai hero dan anti hero Tapi apapun perannya James Moriarty sesungguhnya benar Bahwa setiap dongeng membutuhkan penjahat dan pahlawan yang bagus Barca membutuhkan Madrid dan Madrid pun membutuhkan Barca Atau drama ini tak akan berguna rin a s 
