title,content
Jabar Hari Ini: Pasien Corona Dipaksa Pulang-Vonis Biduan 'Seks Gangbang', Bandung Beragam peristiwa terjadi di Jawa Barat hari ini Kamis Dari mulai pasien terindikasi Corona dibawa pulang keluarga dari Jakarta ke Cianjur hingga biduan pemeran video seks Gangbang divonis tiga tahun penjara Warga Cianjur Terindikasi Corona Dipaksa PulangPasien terindikasi positif virus Corona atau Covid asal Cianjur dibawa pulang paksa oleh keluarganya dari rumah sakit di Jakarta Pasien perempuan yang sempat dibawa ke rumahnya itu langsung dibawa petugas kesehatan Cianjur untuk diisolasi di rumah sakit Berdasarkan informasi yang dihimpun detikcom pasien yang diduga terjangkit virus Corona asal Kecamatan Sukaresmi Kabupaten Cianjur itu tengah menjalani perawatan di Rumah Sakit Dharmais Jakarta Setelah menjalani rapid test pasien tersebut terindikasi positif COVID Namun setelah muncul hasil rapid test itu keluarga malah meminta pasien itu dipulangkan Kami dapat informasi dari pihak Rumah Sakit Dharmais ada pasien terindikasi Covid itu dibawa pulang pada Rabu petang Itu dibawa pulang paksa oleh pihak keluarga padahal semestinya harus menjalani isolasi di sana ucap juru bicara Pusat Informasi dan Koordinasi Covid Cianjur Yusman Faisal Kamis Begitu dicek ternyata pasien tersebut sudah berada di rumahnya Setelah berkoordinasi dengan pihak keluarga pasien terindikasi Covid itu langsung dibawa ke Rumah Sakit Cimacan untuk menjalani isolasi Langsung kami bawa ke rumah sakit karena memang harus diisolasi kata dia Saat ini lanjut Yusman pasien terindikasi Covid itu sudah dirujuk ke RSUD Sayang Cianjur untuk mendapatkan penanganan lebih lanjut Pasalnya kondisi kesehatan pasien tersebut terus menurun Terkait status pasien Yusman mengungkapkan hasil rapid test tersebut belum memastikan pasien positif Covid Perlu ada tes berikutnya termasuk uji laboratorium berdasarkan sampel yang sudah diambil Memang rapid test itu keakuratannya cukup besar Tapi tetap kami tunggu dulu swab dan uji laboratorium Sampelnya sudah dibawa oleh RS Dharmais tinggal menunggu hasilnya kata dia Dia menambahkan selain diduga Covid pasien tersebut memiliki riwayat penyakit kronis Makanya sebelum diuji Covid pasien juga sudah menjalani perawatan selama sebulan karena mengidap penyakit kronis ujar Yusman Selanjutnya Halaman jabar hari ini 
"3 Bocah Bandung Tewas Tenggelam, Walkot Oded Ingatkan Pengawasan Ortu", Bandung Tiga orang bocah tewas terpeleset ke parit atau saluran air di Kota Bandung Kejadian itu terjadi dalam rentang waktu kurang dari dua bulan terakhir Febuari lalu Irgi dan M Faizal warga Kecamatan Babakan Ciparay Kota Bandung dilaporkan hilang karena terpeleset ke saluran air seusai bermain bola Jasad M Faizal ditemukan pada Februari di aliran sungai yang berada di Sukamenak Kecamatan Margahayu Kabupaten Bandung dan jasad Irgi ditemukan pada Februari di Genangan Waduk Saguling Bandung Barat Kejadian bocah terpeleset ke saluran air kembali terjadi Selasa lalu Bagas terpeleset ke saluran air yang ada di Jalan Mohammad Toha saat berjalan bersama ibunya wip mud bocah hanyut bandung 
"Anak Sungai Cinambo Meluap, Perumahan Adipura Bandung Terendam Banjir", Bandung Banjir luapan anak Sungai Cinambo membuat Perumahan Adipura di Kelurahan Rancabolang Gedebage Kota Bandung tergenang air setinggi lutut orang dewasa Diduga curah hujan yang tinggi pada Senin malam membuat debit sungai meningkat hingga akhirnya naik ke permukaan warga Sekarang kami masih melakukan penyedotan hujan yang datang semalam membuat air naik ke perumahan warga ujar personel Satgas Banjir DPU Kota Bandung Munandar kepada detikcom Selasa Ia mengatakan anak sungai tersebut berada di belakang perumahan warga Berdasarkan penuturan warga kata Munandar banjir kerap terjadi belakangan ini Ya satu kompleks yang terendam mungkin sekitar ratusan rumah yang terdampak katanya yum mso bandung banjir di bandung banjir 
Arus Lalin Jalan Raya Bandung-Garut Masih Lumpuh Akibat Banjir, Sumedang Hujan deras yang mengguyur kawasan Sumedang dan Kabupaten Bandung wilayah timur mengakibatkan Jalan Raya Bandung Garut kembali tergenang Genangan tersebut berasal dari luapan air drainase yang kapasitasnya tidak kuat untuk menampung banyaknya air Sehingga ketinggian air yang menggenangi badan jalan di ini mencapai sentimeter Akibatnya kendaraan dari arah Bandung menuju Garut maupun sebaliknya tertahan hingga tidak bisa bergerak sejak pukul WIB sore Kasatlantas Polres Sumedang AKP Yudiono mengatakan untuk sejumlah kendaraan sementara pihaknya alihkan ke Jatinangor lewat simpang hingga tembus Parakan Muncang untuk yang dari Bandung Kalo yang dari garut menuju bandung konfirmasi ke wilayah Bandung Untuk kendaraan besar bisa melintas ke arah garut dari Bandung Melalui kahatex dan untuk kendaraan kecil kita alihkan lewat Jatinagor kata Yudiono saat di konfirmasi Detik com Senin Dalam penanganannya Yudiono mengatakan untuk mengurai kepadatan arus di jalur jalan nasional ini pihaknya mengerahkan personel termasuk dari Satlantas Polres Sumedang dan Polsek Cimanggung untuk siaga di lokasi Selain itu juga Kapolsek Cimanggung Kompol Herdis Suhardiman menyebutkan genangan air tersebut disebabkan hujan deras yang mengguyur kawasan tersebut sejak pukul WIB Banjir di sini memang masih terus terjadi apabila hujan deras Kami sudah kordinasi dengan pihak terkait untuk melakukan penyedotan air di sini ucap Herdis Untuk penanganan saat ini kata Herdis petugas mengalihkan arus lewat simpang untuk mengurai kepadatan kendaraan yang terhenti di titik banjir Dari cileunyi arah cileunyi tol ke simpang terus turun di Parakan Muncang kemudian ngambil lagi ke arah garut yang dari arah garut mobil kecil masuk ke arah Simpang kemudian untuk mobil besar sementara menunggu airnya surut ucapnya Herdis menuturkan Hingga saat ini tepatnya pukul WIB sejumlah kendaraan masih bertahan pasalnya ketinggian air masih tinggi sehingga mengakibatkan kendaraan sulit melewati jalur jalan raya Bandung Garut rancaekek tepatnya depan kahatex Pengaturan tetap dilaksanakan kemudian dari Cileunyi yang mau melewati arah ke warung china depan kahatex itu belum bisa dilewati sampai saat ini pukul WIB ucap Herdis Maka dari itu Herdis menghimbau agar kendaraan yang tidak bisa melintasi kawasan tersebut dapat menggunakan jalur alternatif yang sudah di tujukan oleh petugas Kemudian Kata Herdis untuk masyarakat yang tidak ada kepentingan agar tetap di rumah karena selain banjir yang mengakibatkan kendaraan terhenti hal ini juga dapat menyebabkan terjadinya penyebaran wabah Covid Pertama ikuti himbauan untuk menggunakan jalur alternatif kedua ini musim lockdown jika tidak berkepentingan harap diam di rumah dari pada datang ke tempat sehingga tidak bisa melakukan apa apa jelas Herdis mud mud banjir sumedang 
Mobil Penyedot Air Diterjunkan ke Area Banjir di Gedebage Bandung, Bandung Perempatan Gedebage Kota Bandung Jawa Barat diterjang banjir Mobil penyedot air diterjunkan Banjir di kawasan tersebut berlangsung saat hujan mengguyur sejak Senin sore Ketinggian air menggenangi jalan itu kurang lebih sentimeter kata Kapolsek Cinambo Kompol Yopy Suryawibawa Akibat banjir ini terjadi antrean kendaraan Banyak kendaraan tidak menerobos genangan air Bisa dilintasi namun kendaraan kecil tidak berani melintas Sehingga terjadi penumpukan kendaraan kata Yopy wip bbn banjir di bandung banjir gedebage bandung 
"Hujan Deras, Sejumlah Titik di Kota Bandung Terendam Banjir", Bandung Hujan deras mengguyur Kota Bandung secara merata Sejumlah wilayah mengalami banjir kecil hingga sedang Ada tiga puluh titik terdiri dari banjir dan genangan ucap Kepala Dinas Pekerjaan Umum Kota Bandung Didi Ruswandi dalam keterangannya Senin Didi mengatakan banjir di Kota Bandung berada di sejumlah area baik jalur nasional provinsi maupun jalur kota Ketinggian banjir bervariasi mulai dari sentimeter hingga tertinggi sentimeter Di Pasar Induk Gedebage ketinggian sentimeter Penyebabnya luapan sungai Cipamulihan kata Didi Berikut data lengkap banjir di Kota Bandung Jalan Kopo ketinggian air cm Jalan Terusan Pasirkoja Simpang Soekarno Hatta ketinggian cm Jalan Leuwipanjang Peta ketinggian cm Jalan Cibaduyut ketinggian cm Jalan Cibaduyut bawah terowongan ketinggian cm Jalan Babakan Ciparay ketinggian cm Jalan Soekarno Hatta Simpang Gedebage ketinggian cm Pasar Induk Gedebage ketinggian cm Jalan Rancabolang ketinggian cm Babakan Penghulu Gedebage ketinggian cm Jalan Margasari ketinggian cm Pasar Kordon ketinggian cm Jalan Soekarno Hatta Panyileukan ketinggian cm Bumi Adipura ketinggian cm Jalan Rumah Sakit ketinggian cm Jalan Rumah Sakit Simpang Gedebage ketinggian cm Jalan AH Nasution SPBU Cikadut ketinggian cm RT RW Kelurahan Cigending Ujungberung ketinggian cm Jalan Antapani Lama ketinggian cm Jalan Cibodas Raya ketinggian cm Jalan Arcamanik Endag ketinggian cm Jalan Jakarta ketinggian cm Jalan Kacapiring ketinggian cm Jalan Laswi ketinggian cm Jalan Kangkug Kaler ketinggian cm Jalan Simpang Gatot Subroto ketinggian cm Jalan Turangga ketinggian cm Jalan Cibangkong ketinggian cm Jalan Jendral Sudirman ketinggian cm Jalan Ahmad Yani Simpang Supratman ketinggian cm dir mud banjir bandung 
"Suho 'EXO' Rilis MV 'Let's Love', Fans Ramaikan Tagar #LETSLOVESUHO", Jakarta Yang dinantikan oleh EXO L sebutan buat fans EXO akhirnya tiba SM Entertainment secara resmi merilis MV untuk lagu andalan di album debut solo Suho Self Portrait yang berjudul Let s Love Berdurasi menit detik video tersebut diunggah lewat channel YouTube SMTOWN Suho menampilkan sisi emosionalnya lewat video dan lagu bernuansa pop rock balada tersebut Video dikemas artistik dalam beberapa set studio yang berbeda Di salah satu adegan Suho tampak berjalan di lorong kosong nan panjang di adegan lain terlihat dia tengah berdiri di atas genangan air Gambas Youtube Simak Video Suho EXO Berangkat Wamil Hari Ini Gambas Video detik sro dar suho suho exo suho exo debut suho exo debut solo exo Photo Gallery kpop Foto foto D O Xiumin EXO Sejeong gugudan dan Yoon Ji Sung untuk Musikal Militer kpop Foto foto D O Xiumin EXO Sejeong gugudan dan Yoon Ji Sung untuk Musikal Militer kpop Foto foto D O Xiumin EXO Sejeong gugudan dan Yoon Ji Sung untuk Musikal Militer kpop Foto foto D O Xiumin EXO Sejeong gugudan dan Yoon Ji Sung untuk Musikal Militer kpop Foto foto D O Xiumin EXO Sejeong gugudan dan Yoon Ji Sung untuk Musikal Militer kpop Foto foto D O Xiumin EXO Sejeong gugudan dan Yoon Ji Sung untuk Musikal Militer kpop Foto foto D O Xiumin EXO Sejeong gugudan dan Yoon Ji Sung untuk Musikal Militer kpop Foto foto D O Xiumin EXO Sejeong gugudan dan Yoon Ji Sung untuk Musikal Militer kpop Wamil Hari Ini Intip Potret Suho EXO dari Masa ke Masa kpop Wamil Hari Ini Intip Potret Suho EXO dari Masa ke Masa kpop Wamil Hari Ini Intip Potret Suho EXO dari Masa ke Masa kpop Wamil Hari Ini Intip Potret Suho EXO dari Masa ke Masa kpop Wamil Hari Ini Intip Potret Suho EXO dari Masa ke Masa kpop Wamil Hari Ini Intip Potret Suho EXO dari Masa ke Masa kpop Wamil Hari Ini Intip Potret Suho EXO dari Masa ke Masa kpop Wamil Hari Ini Intip Potret Suho EXO dari Masa ke Masa kpop Wamil Hari Ini Intip Potret Suho EXO dari Masa ke Masa photo EXO Bikin Histeris di HUT Transmedia photo EXO Bikin Histeris di HUT Transmedia photo EXO Bikin Histeris di HUT Transmedia photo EXO Bikin Histeris di HUT Transmedia photo EXO Bikin Histeris di HUT Transmedia photo EXO Bikin Histeris di HUT Transmedia photo EXO Bikin Histeris di HUT Transmedia photo EXO Bikin Histeris di HUT Transmedia photo EXO Bikin Histeris di HUT Transmedia photo Potret Kpopers Menanti Aksi EXO di HUT Transmedia photo Potret Kpopers Menanti Aksi EXO di HUT Transmedia photo Potret Kpopers Menanti Aksi EXO di HUT Transmedia photo Potret Kpopers Menanti Aksi EXO di HUT Transmedia photo Potret Kpopers Menanti Aksi EXO di HUT Transmedia photo Potret Kpopers Menanti Aksi EXO di HUT Transmedia photo Potret Kpopers Menanti Aksi EXO di HUT Transmedia photo Pedagang Merchandise EXO Membludak di TSM Cibubur photo Pedagang Merchandise EXO Membludak di TSM Cibubur photo Pedagang Merchandise EXO Membludak di TSM Cibubur photo Pedagang Merchandise EXO Membludak di TSM Cibubur photo Pedagang Merchandise EXO Membludak di TSM Cibubur photo Pedagang Merchandise EXO Membludak di TSM Cibubur photo Pedagang Merchandise EXO Membludak di TSM Cibubur photo Pedagang Merchandise EXO Membludak di TSM Cibubur photo Penggemar EXO Padati TSM Cibubur photo Penggemar EXO Padati TSM Cibubur photo Penggemar EXO Padati TSM Cibubur photo Penggemar EXO Padati TSM Cibubur photo Penggemar EXO Padati TSM Cibubur photo Penggemar EXO Padati TSM Cibubur photo Penggemar EXO Padati TSM Cibubur photo Penggemar EXO Padati TSM Cibubur kpop Lay EXO Ulang Tahun Medsos Ramai HoneyLayDay kpop Lay EXO Ulang Tahun Medsos Ramai HoneyLayDay kpop Lay EXO Ulang Tahun Medsos Ramai HoneyLayDay kpop Lay EXO Ulang Tahun Medsos Ramai HoneyLayDay kpop Lay EXO Ulang Tahun Medsos Ramai HoneyLayDay kpop Lay EXO Ulang Tahun Medsos Ramai HoneyLayDay celeb Lady Gaga Zaira Wasim EXO hingga Ayu Ting Ting celeb Lady Gaga Zaira Wasim EXO hingga Ayu Ting Ting celeb Lady Gaga Zaira Wasim EXO hingga Ayu Ting Ting celeb Lady Gaga Zaira Wasim EXO hingga Ayu Ting Ting celeb Lady Gaga Zaira Wasim EXO hingga Ayu Ting Ting celeb Lady Gaga Zaira Wasim EXO hingga Ayu Ting Ting celeb Lady Gaga Zaira Wasim EXO hingga Ayu Ting Ting celeb Lady Gaga Zaira Wasim EXO hingga Ayu Ting Ting celeb Lady Gaga Zaira Wasim EXO hingga Ayu Ting Ting celeb Lady Gaga Zaira Wasim EXO hingga Ayu Ting Ting kpop Momen momen EXO Disambut Donald Trump kpop Momen momen EXO Disambut Donald Trump kpop Momen momen EXO Disambut Donald Trump kpop Momen momen EXO Disambut Donald Trump kpop Momen momen EXO Disambut Donald Trump kpop Momen momen EXO Disambut Donald Trump kpop Suho EXO Semringah Dapat Kemeja Batik kpop Suho EXO Semringah Dapat Kemeja Batik kpop Suho EXO Semringah Dapat Kemeja Batik kpop Suho EXO Semringah Dapat Kemeja Batik kpop Suho EXO Semringah Dapat Kemeja Batik kpop Suho EXO Semringah Dapat Kemeja Batik kpop Resmi Pacaran dengan Kai EXO Jennie BLACKPINK Bikin Fans Sakit Hati kpop Resmi Pacaran dengan Kai EXO Jennie BLACKPINK Bikin Fans Sakit Hati kpop Resmi Pacaran dengan Kai EXO Jennie BLACKPINK Bikin Fans Sakit Hati kpop Resmi Pacaran dengan Kai EXO Jennie BLACKPINK Bikin Fans Sakit Hati kpop Resmi Pacaran dengan Kai EXO Jennie BLACKPINK Bikin Fans Sakit Hati kpop Resmi Pacaran dengan Kai EXO Jennie BLACKPINK Bikin Fans Sakit Hati kpop Resmi Pacaran dengan Kai EXO Jennie BLACKPINK Bikin Fans Sakit Hati kpop Resmi Pacaran dengan Kai EXO Jennie BLACKPINK Bikin Fans Sakit Hati kpop Resmi Pacaran dengan Kai EXO Jennie BLACKPINK Bikin Fans Sakit Hati kpop Ini Alasan Kenapa Chanyeol Bikin Wanita Klepek klepek kpop Ini Alasan Kenapa Chanyeol Bikin Wanita Klepek klepek kpop Ini Alasan Kenapa Chanyeol Bikin Wanita Klepek klepek kpop Ini Alasan Kenapa Chanyeol Bikin Wanita Klepek klepek kpop Ini Alasan Kenapa Chanyeol Bikin Wanita Klepek klepek kpop Ini Alasan Kenapa Chanyeol Bikin Wanita Klepek klepek kpop Ini Alasan Kenapa Chanyeol Bikin Wanita Klepek klepek kpop Ini Alasan Kenapa Chanyeol Bikin Wanita Klepek klepek kpop Ini Alasan Kenapa Chanyeol Bikin Wanita Klepek klepek kpop Hari Ini Don t Mess Up My Tempo Rilis Lihat Teaser Individunya Yuk kpop Hari Ini Don t Mess Up My Tempo Rilis Lihat Teaser Individunya Yuk kpop Hari Ini Don t Mess Up My Tempo Rilis Lihat Teaser Individunya Yuk kpop Hari Ini Don t Mess Up My Tempo Rilis Lihat Teaser Individunya Yuk kpop Hari Ini Don t Mess Up My Tempo Rilis Lihat Teaser Individunya Yuk kpop Hari Ini Don t Mess Up My Tempo Rilis Lihat Teaser Individunya Yuk kpop Hari Ini Don t Mess Up My Tempo Rilis Lihat Teaser Individunya Yuk kpop Hari Ini Don t Mess Up My Tempo Rilis Lihat Teaser Individunya Yuk kpop Hari Ini Don t Mess Up My Tempo Rilis Lihat Teaser Individunya Yuk kpop Hari Ini Don t Mess Up My Tempo Rilis Lihat Teaser Individunya Yuk kpop Hari Ini Don t Mess Up My Tempo Rilis Lihat Teaser Individunya Yuk kpop Hari Ini Don t Mess Up My Tempo Rilis Lihat Teaser Individunya Yuk kpop HappyChenDay Rayakan Ultah ke Yuk Intip Transformasi Chen EXO kpop HappyChenDay Rayakan Ultah ke Yuk Intip Transformasi Chen EXO kpop HappyChenDay Rayakan Ultah ke Yuk Intip Transformasi Chen EXO kpop HappyChenDay Rayakan Ultah ke Yuk Intip Transformasi Chen EXO kpop HappyChenDay Rayakan Ultah ke Yuk Intip Transformasi Chen EXO kpop HappyChenDay Rayakan Ultah ke Yuk Intip Transformasi Chen EXO kpop HappyChenDay Rayakan Ultah ke Yuk Intip Transformasi Chen EXO kpop HappyChenDay Rayakan Ultah ke Yuk Intip Transformasi Chen EXO kpop HappyChenDay Rayakan Ultah ke Yuk Intip Transformasi Chen EXO kpop HappyChenDay Rayakan Ultah ke Yuk Intip Transformasi Chen EXO kpop HappyChenDay Rayakan Ultah ke Yuk Intip Transformasi Chen EXO celeb Cerita Anji Dibully hingga Disumpahi Mati oleh Anak SMP celeb Cerita Anji Dibully hingga Disumpahi Mati oleh Anak SMP celeb Cerita Anji Dibully hingga Disumpahi Mati oleh Anak SMP celeb Cerita Anji Dibully hingga Disumpahi Mati oleh Anak SMP celeb Cerita Anji Dibully hingga Disumpahi Mati oleh Anak SMP celeb Cerita Anji Dibully hingga Disumpahi Mati oleh Anak SMP celeb Cerita Anji Dibully hingga Disumpahi Mati oleh Anak SMP kpop Ini Teaser Foto Album Baru EXO kpop Ini Teaser Foto Album Baru EXO kpop Ini Teaser Foto Album Baru EXO kpop Ini Teaser Foto Album Baru EXO kpop Ini Teaser Foto Album Baru EXO kpop Ini Teaser Foto Album Baru EXO kpop Ini Teaser Foto Album Baru EXO kpop Ini Teaser Foto Album Baru EXO kpop Ini Teaser Foto Album Baru EXO kpop Daebak Aksi Para Idol Kpop di Busan One Asia Festival kpop Daebak Aksi Para Idol Kpop di Busan One Asia Festival kpop Daebak Aksi Para Idol Kpop di Busan One Asia Festival kpop Daebak Aksi Para Idol Kpop di Busan One Asia Festival kpop Daebak Aksi Para Idol Kpop di Busan One Asia Festival kpop Daebak Aksi Para Idol Kpop di Busan One Asia Festival kpop Daebak Aksi Para Idol Kpop di Busan One Asia Festival kpop Daebak Aksi Para Idol Kpop di Busan One Asia Festival kpop Daebak Aksi Para Idol Kpop di Busan One Asia Festival kpop Daebak Aksi Para Idol Kpop di Busan One Asia Festival kpop Daebak Aksi Para Idol Kpop di Busan One Asia Festival kpop Daebak Aksi Para Idol Kpop di Busan One Asia Festival kpop EXOclusive Kai Chen Sehun yang Misterius dan Dreamy kpop EXOclusive Kai Chen Sehun yang Misterius dan Dreamy kpop EXOclusive Kai Chen Sehun yang Misterius dan Dreamy kpop EXOclusive Kai Chen Sehun yang Misterius dan Dreamy kpop EXOclusive Kai Chen Sehun yang Misterius dan Dreamy kpop EXOclusive Kai Chen Sehun yang Misterius dan Dreamy kpop EXOclusive Kai Chen Sehun yang Misterius dan Dreamy kpop Sisi Gelap EXO di Foto Teaser Monster kpop Sisi Gelap EXO di Foto Teaser Monster kpop Sisi Gelap EXO di Foto Teaser Monster kpop Sisi Gelap EXO di Foto Teaser Monster kpop Sisi Gelap EXO di Foto Teaser Monster kpop Sisi Gelap EXO di Foto Teaser Monster kpop Sisi Gelap EXO di Foto Teaser Monster kpop Sisi Gelap EXO di Foto Teaser Monster kpop Sisi Gelap EXO di Foto Teaser Monster kpop Sisi Gelap EXO di Foto Teaser Monster kpop EXO di Foto Teaser EX ACT Siapa Paling Kece kpop EXO di Foto Teaser EX ACT Siapa Paling Kece kpop EXO di Foto Teaser EX ACT Siapa Paling Kece kpop EXO di Foto Teaser EX ACT Siapa Paling Kece kpop EXO di Foto Teaser EX ACT Siapa Paling Kece kpop EXO di Foto Teaser EX ACT Siapa Paling Kece kpop EXO di Foto Teaser EX ACT Siapa Paling Kece kpop EXO di Foto Teaser EX ACT Siapa Paling Kece kpop EXO di Foto Teaser EX ACT Siapa Paling Kece kpop EXO di Foto Teaser EX ACT Siapa Paling Kece 
