title,content
Dhuuuaar! Mobil Ini Meledak Karena Dipakai Jualan Tahu Bulat, Jakarta Niat hati ingin tampil beda penjual tahu bulat dengan mobil penumpang ini malah jadi viral Mobilnya malah meledak dan terbakar habis Umumnya tahu bulat dijajakan menggunakan mobil pick up atau bak terbuka Para pedagang biasa melengkapi alat jualannya dengan kompor tabung gas dan alat masak Area yang luas menjadikan jenis mobil ini cukup aman menampung berbagai alat masak selain itu tipe mobil ini juga didesain dengan atap terbuka Menggoreng tahu bulat pastinya lebih santai Foto istimewa twitter akulukaBaca juga Keren Tukang Sayur Keliling Ini Jualan Pakai Mobil Mewah Rp Juta Tapi tampaknya penjual tahu bulat yang satu ini merasa jualan dengan mobil bak terbuka terlalu mainstream Ia pun memilih mobil penumpang sebagai lapak jualanya Tapi nahas usahanya ini malah berujung tragis Cuitan pemilik akun twitter akuluka ini langsung menghebohkan jagad dunia maya Dengan caption tahu bulat dibakar di mobil dadakan lima ratusan gurih gurih enyoy unggahan ini juga dilengkapi dua foto sebuah mobil yang terbakar Setelah diusut ternyata penyebab timbulnya api berasal dari kompor yang diletakkan di dalam kabin mobil Mobil merek Toyota Avanza ini termasuk mobil penumpang yang pastinya akan membahayakan jika dipakai untuk berjualan tahu bulat Mobil ini memiliki interior yang banyak terbuat dari kain dan kulit Jelas bahan ini sangat mudah terbakar jika tersulut api Apalagi mobil juga memiliki desain tertutup yang membuat sirkulasi udara cukup terbatas Alhasil sedikit tersulut api maka habislah seluruh bagian dalam mobil Di foto ini terlihat bagian dalam mobil diisi dengan alat masak tahu bulat lengkap dengan gas kilogram Hampir seluruh bagian mobil hangus terbakar Bisa dilihat juga lapisan kulit pada jok ikut dilalap api Terlihat juga beberapa butir tahu bulat yang sudah digoreng Tampaknya penjual tahu bulat ini langsung sadar kalau ada api yang tersulut sehingga kebakaran hanya menghabiskan bagian dalam mobil saja Tampak eksterior mobil masih terlihat utuh Foto istimewa twitter akulukaBaca juga Jualan di Tempat Nyleneh Para Penjual Makanan Ini Sukses Bikin NgakakBelum jelas lokasi kejadian kebakaran ini namun banyak netizen langsung memberikan komentar Cuitan ini pun sudah dibagikan ulang lebih dari kali Kemarin jualan sayur pake Xpander ini jualan tahu bulat pake Avanza Orang yang jualan pada hobi doang atau gimana sih kata satu netizen Lah kan harusnya pake bak terbuka malih kenapa pake mini bus Ya jelas overheat dalemnya meleduk deh an cuit netizen Simak Video Jelajahi Sumatera Gordon Ramsay Ditantang Masak Rendang Gambas Video detik dvs odi mobil terbakar tahu bulat jualan tahu bulat pakai mobil mobil tahu bulat mobil tahu bulat terbakar 
Warga: Kabel yang Terbakar di Cikini Sering Keluarkan Suara Ledakan, Jakarta Kabel bawah tanah di Cikini Jakarta Pusat meledak pagi hari tadi Warga menyebut kabel itu sudah mengeluarkan tanda tanda bahaya akan muncul ledakan api sejak satu bulan lalu Salah seorang karyawan sekitar lokasi bernama Imron mengatakan kabel itu beberapa hari terakhir ini sering meledak Ia menyebut ledakan kabel itu juga menimbulkan bunyi Sebelum kejadian pagi ini berapa hari memang udah meledak meledak mulu itu kebel kata Imron di Jalan Cikini Raya Menteng Jakarta Pusat Minggu Iya bunyi pletak pletak Ada api kecil tapi mati lagi tambah Imron Selain Imron Bimbim mengatakan kabel itu sudah mengeluarkan tanda tanda akan meledak sejak bulan lalu Bimbim mengaku Sabtu malam kemarin kabel juga sudah mengeluarkan suara seperti ledakan api Nah waktu bulan kemarin udah ada rasa meledak meledak gitu udah ada Pas paginya ada api malamnya nggak ada api Cuma meleduk meleduk doang Pas paginya jam baru tuh keluar api Meleduk dulu dug baru keluarin api jelas Bimbim zap zap proyek trotoar cikini kabel terbakar cikini 
Kakek Nekat Jualan Pisang di Tengah 'Ganasnya' Demo, Jakarta Rezeki bisa dicari di mana saja bahkan di medan perang sekalipun Begitulah ibaratnya menggambarkan sosok Samin kakek berusia tahun asal Ciputat Di tengah maraknya aksi demo mahasiswa Samin tetap menjual barang dagangannya yakni pisang dan sukun Ia menjualnya di bawah tangga penyeberangan Stasiun Palmerah yang menempel pagar DPR Itu adalah lokasi yang kerap ricuh Samin telah kali berjualan di lokasi tersebut Tiga tiganya saat demo berujung kerusuhan Demo pertama saya di sini aja Sudah kali rusuh katanya kepada detikcom di sela kesibukannya di Palmerah Jakarta Selasa Gambas Video detik dna dna 
"Kebakaran Rumah di Grobogan, Pria Penderita Stroke Tewas Terbakar", Grobogan Kebakaran sebuah rumah warga di Kabupaten Grobogan menewaskan pemiliknya Diduga api berasal dari ledakan korek api Kebakaran rumah di Jalan Raden Patah Gang Cemara Dusun Pucang RT Kelurahan Grobogan di rumah Wandi ujar Kepala Badan Penanggulangan Bencana Daerah Kabupaten Grobogan Endang Sulistyaningsih kepada detikcom melalui pesan singkat Selasa Korban yang bernama lengkap Wandi bin Surawin Peristiwa ini terjadi pada sekitar pukul WIB pagi tadi sip sip grobogan kebakaran tewas terbakar birojatengdiy 
"Rumah Kontrakan Habis Terbakar, Nenek Ratini Jatuh Pingsan", Depok Rumah kontrakan tiga pintu di Pancoranmas Depok habis terbakar Seorang nenek bernama Ratini yang tinggal di salah satu kontrakan sempat pingsan setelah mengetahui rumahnya terbakar Meterannya itu yang meleduk itu kontrakan punyaku bawahnya pakaian pakaian kebakar kata Ratini di lokasi Jalan Duren I Rangkapan Jaya Pancoranmas Depok Selasa Kebakaran terjadi sekitar pukul WIB siang tadi Tujuh unit mobil damkar diturunkan ke lokasi dan api padam sekitar pukul WIB Ratini saat itu sedang duduk di depan rumahnya Dia sempat mendengar bunyi ledakan sebelum kebakaran terjadi Ratini lalu berlari minta tolong tapi api terus membesar Melihat api semakin membara Ratini kemudian jatuh pingsan maa mea kebakaran kebakaran di depok depok 
Tukang Tambal Ban di Nganjuk Tewas Saat Kompresornya Meledak, Nganjuk Seorang tukang tambal ban di Nganjuk tewas terkena ledakan tabung kompresor Korban bernama Romlan warga Desa Selo Kecamatan Bagor Jadi korban terkena ledakan tabung kompresor tempat dia bekerja di jasa tambal ban truk ujar Kasat Reskrim Polres Nganjuk AKP Nikolas Bagas saat dihubungi detikcom Selasa Tabung kompresor itu kata Nikolas meledak sekitar pukul WIB Sedangkan Romlan menghembuskan napas terakhir satu jam setelah kejadian yakni saat dirawat di RS Bhayangkara Nganjuk Simak Video Video Kiai Pacitan Tahun Berdakwah Tanpa Jemaah Gambas Video detik sun bdh birojatim kompresor meledak tukang tambal ban 
"Apple Siap Rilis Perangkat Layar Lipat, Tapi Bukan iPhone", Jakarta Tren ponsel layar lipat tengah menjangkiti para vendor global Apple tak mau ketinggalan soal itu namun yang ditawarkan bukan iPhone yang merupakan produk andalannya Awal tahun ini memang tersiar kabar Apple mendaftarkan paten iPhone layar lipat Namun nyatanya produk yang ditawarkan justru hadir dari lini iPad Menurut analis yang mengetahui project ini seperti dikutip dari GSMArena Minggu Apple sedang mengerjakan iPad dengan layar fleksibel Simak Video Produksi iPhone Akan Pindah ke India Gambas Video detik rns rns apple iphone ipad 
Powerbank Terbakar Bikin Pesawat Ini Mendarat Darurat, Jakarta Pesawat milik Virgin Atlantic terpaksa mendarat darurat Kamis lalu karena ada sebuah kursi yang terbakar yang disebabkan oleh battery pack portabel atau powerbank Pesawat itu sebenarnya berada dalam perjalanannya dari bandara JFK di New York menuju bandara Heathrow di London Namun terpaksa mendarat darurat di bandara Logan di Boston setelah ada api dan asap yang muncul dari kursi seorang penumpang Untungnya semua penumpangnya yang berjumlah orang berhasil dievakuasi dengan selamat demikian dikutip detikINET dari The Verge Jumat Simak Video Dulu Dikira Jualan Powerbank Siapa Sangka Vivo Kini Laris Manis Gambas Video detik asj krs powerbank powerbank terbakar aturan powerbank di pesawat 
Apple Hapus Ratusan Aplikasi Judi dan Pornografi, Jakarta Untuk pertama kalinya Apple mengungkap ke publik jumlah aplikasi yang dihapus di App Store berdasarkan permintaan dari pemerintah di berbagai negara China paling banyak melobi Apple untuk menyingkirkan Aplikasi dari App Store Berdasarkan laporan transparansi tersebut Apple mengatakan ada permintaan dari negara untuk menghapus aplikasi lokal di mana aplikasi di antaranya untuk dihapus berasal dari pemerintah China Dilansir dari Tech Crunch China mengklaim permintaan itu berdasarkan aplikasi yang dimaksud dinilai melanggar hukum tentang perjudian dan pornografi Apple tidak membeberkan aplikasi mana saja yang telah dienyahkan dari toko aplikasi miliknya itu Namun yang pasti penghapusan tersebut dilakukan sejak Juli sampai Desember Lalu ada Vietnam dan Austria yang juga mengajukan penghapusan beberapa aplikasi lokal yang melanggar peraturan perjudian Adapun Kuwait yang beralasan permintaan penghapusan aplikasi karena bertentangan undang undang privasi agt krs apple app store aplikasi 
"Heboh Gas Bocor di Pabrik Krakatau Steel, Begini Penjelasannya", Cilegon Warga di sekitar pabrik PT Krakatau Steel dihebohkan dengan informasi gas bocor Dugaan gas bocor itu disertai keluarnya api dari cerobong blast furnace Foto kepulan asap gas disertai api tersebar di media sosial dengan imbauan agar orang orang khususnya karyawan pabrik memakai masker sebagai pelindung Senior External Communication PT Krakatau Steel Vicky Fadillah mengatakan peristiwa itu biasa terjadi saat ada kendala di bagian blast furnace Kendala itu disebut seperti pipa yang tersumbat Namanya produksi kan ada lancar ada tidak yang tadi itu adalah ada trouble di ujungnya sehingga itu terpaksa harus di flaring dibuang Kalau nggak di flaring meleduk pabriknya malah jadi masalah di situ katanya kepada wartawan di Cilegon Rabu zak zak gas bocor krakatau steel cilegon 
"Diduga Kompor Meleduk, Sebuah Rumah di Surabaya Ludes Terbakar", Surabaya Sebuah rumah semi permanen padat penduduk di Jalan Gembong Gang VI nomor ludes dilalap api Tidak ada korban jiwa dalam kebakaran tersebut Api diduga berasal dari kompor yang meleduk Salah seorang saksi sekaligus tetangga rumah Suhariyono mengatakan saat kebakaran dirinya tengah beristirahat di dalam rumahnya Namun ia dikagetkan dua anak yang berteriak meminta tolong karena ada kebakaran Saya sedang leyeh leyeh Sekitar pukul WIB kok tiba tiba ada dua anak yang berteriak minta tolong ada kebakaran Saya pikir bergurau Terus saya lihat ke belakang api sudah membakar rumah kata Suhariyono kepada detikcom Senin sun iwd kebakaran di surabaya kompor meleduk birojatim 
"Api Mengamuk Pascadebat, Dumai-Bengkalis Siaga Asap", Pekanbaru Joko Widodo menyatakan dalam tiga tahun terakhir tidak ada kebakaran hutan Hal itu disampaikan dalam debat capres pada Minggu lalu Faktanya kini asap semakin mengamuk Kita ingin kebakaran hutan lahan gambut tidak terjadi lagi Ini bisa kita atasi Dalam tiga tahun tidak terjadi kebakaran hutan lahan gambut ujar Jokowi di lokasi debat The Sultan Hotel Jakarta Minggu Menurut Jokowi keberhasilan mengurangi kebakaran hutan dan lahan merupakan kerja sama semua pihak asp rvk kebakaran hutan 
"Fahri Curiga Ada yang Bakar Lahan Pascadebat, TKN: Ngomporin!", Jakarta Tim Kampanye Nasional TKN Joko Widodo Jokowi Ma ruf Amin meminta Wakil Ketua DPR Fahri Hamzah tidak membuat isu yang menyesatkan TKN mengingatkan Fahri tidak menyebar rumor yang tidak benar terkait kebakaran lahan Jangan jangan Fahri lagi pengin ngomporin sesuatu deh asalkan jangan sampai kompornya meleduk di tangan sendiri Nanti malah dirinya yang terbakar isu kata anggota TKN Inas Nasrullah Zubir saat dimintai konfirmasi detikcom Rabu malam Soal masih adanya kebakaran seperti data yang disampaikan BNPB tentu kita harus akui karena itu faktanya Di negara negara maju sekalipun kebakaran hutan seperti itu kerap kali terjadi Namun yang paling penting sebetulnya adalah ada upaya pemerintah jelasnya Ace mengatakan Jokowi telah bertindak tegas terhadap pelaku pembakaran lahan Tindakan tegas tidak hanya dilakukan kepada perorangan tapi juga pihak korporasi Pemerintahan Jokowi bersikap tegas kepada siapa pun pihak baik perorangan maupun korporasi yang melakukan pembakaran hutan untuk membuka lahan tuturnya fdu mae tkn jokowi ma ruf amin pemilu kebakaran lahan kebakaran hutan dan lahan pilpres 
2.100 Advokat Siap Kawal Jokowi-Amin Lawan Serangan Hoax, Jakarta Advokat Indonesia Maju mendeklarasikan dukungan kepada Joko Widodo Ma ruf Amin Mereka akan menangkal hoax yang dipakai untuk menyerang pasangan nomor urut itu Kami hadir untuk melawan hoax termasuk membuat pelaporan pelaporan kepada institusi hukum kepemiluan Bawaslu Polri kata Ketua Umum Advokat Indonesia Maju Sandi E Situngkir di Rumah Aspirasi Rakyat Jalan Proklamasi No Jumat Tiga minggu lalu kami menyampaikan somasi terbuka kepada pasangan Prabowo Sandi Di dalam somasi itu satu ada banyak pernyataan pernyataan yang tidak betul yang disampaikan oleh pasangan Prabowo Sandi termasuk Badan Pemenangan Nasional dan struktur di bawahnya yang kecenderungan itu adalah pernyataannya tidak benar tidak memiliki fakta ungkapnya Foto Lisye Sri Rahayu detikcom jbr elz pilpres jokowi ma ruf amin prabowo sandiaga hoaks jokowi prabowo bawaslu 
"Soal Politik Kompor, Fahri Sindir Jubir Presiden Jadi Caleg-Timses", Jakarta Wakil Ketua DPR RI Fahri Hamzah kembali bicara terkait pernyataan Presiden Jokowi soal adanya pihak kompor yang suka membuat situasi tahun politik panas Fahri menilai semestinya Jokowi memiliki juru bicara jubir yang dapat menyampaikan maksud perkataannya bukan jubir yang sibuk nyaleg Fahri mengatakan sebenarnya dalam pertarungan Pilpres Jokowi ataupun Prabowo saling memancing Ya namanya juga dua pihak ya saling mancing memancinglah Nggak ada satu pihak memancing dan yang satu cuma jadi ikan kan nggak ada Keduanya pancing memancing itu biasa kata Fahri di kompleks DPR Jakarta Selasa Cuma stamina dia Jokowi untuk tidak marah itu kan bersumber dari fakta bahwa mungkin masih banyak yang berkata apa adanya Lama lama orang mungkin di sekitarnya itu mungkin tidak berkata apa adanya Salah dalam memberikan persepsi sehingga Pak Jokowi kelihatan gusar dengan keadaan Santai saja dulu pemilu dari dulu juga begini yang penting jawab persoalan dengan jujur imbuhnya Fahri lalu menyindir Jokowi yang kini dinilai kehilangan jubir Menurutnya jubir presiden kini lebih sibuk nyaleg daripada menjelaskan persoalan negara kepada publik Misalnya ya hari ini Pak Jokowi kehilangan juru bicara Padahal harusnya juru bicara itu yang ada tapi jangan jubir jadi caleg dong jangan jubir jadi timses Yang kita omongin ini jubir negara kata Fahri Fahri menegaskan Jokowi merupakan kepala negara dan kepala pemerintahan Karena itu dibutuhkan jubir negara yang bukan calon anggota legislatif caleg Dia Jokowi sebagai kepala negara perlu juru bicara negara yang bukan caleg yang bukan orang yang lagi punya beban politik dan konflik kepentingan dalam jabatannya itu ujarnya yld idh politik kompor jokowi fahri hamzah pilpres 
PKS Curigai Jokowi soal 'Kompor': untuk Hindari Tuntutan Janji, Jakarta PKS mencurigai pernyataan Presiden Joko Widodo Jokowi soal adanya pihak kompor yang suka membuat situasi tahun politik panas Menurut PKS Jokowi belakangan sengaja mengeluarkan pernyataan kontroversial demi menghindari tuntutan janji kampanye Kami justru curiga Pak Jokowi sengaja memunculkan istilah istilah baru untuk menghindari tuntutan publik terhadap janji janji kampanye yang tak mampu ditepati dan menghindari kampanye yang bersifat substantif kata Direktur Pencapresan PKS Suhud Alynudin kepada wartawan Selasa Suhud mengatakan pernyataan kontroversial para elite politik berimbas kepada masyarakat Ia merasa kasihan kepada publik yang selalu dijejali konten kampanye yang tidak cerdas tsa dnu jokowi politik kompor pks pilpres 
Prabowo: Biarkan Survei-survei Itu Bilang Apa, Balikpapan Capres nomor urut Prabowo Subianto berpesan kepada pendukungnya untuk menghiraukan sejumlah manuver lembaga survei yang selama ini dianggapnya hanya berpihak kepada yang memiliki dana Biarkan survei survei itu bilang apa Karena survei itu bisa dibayar Kalau saya mau menang bisa saja saya bayar survei untuk bilang saya menang kata Prabowo seperti dikutip dalam keterangan tertulis Senin Hal itu disampaikannya dalam acara Gerakan Nasional Cinta Prabowo GNCP yang digelar di Balikpapan Kalimantan Timur Minggu Menurut Prabowo yang membuat seorang mampu memenangi pilpres bukan berdasarkan hasil survei melainkan perjuangan keras seperti yang dilakukan warga Balikpapan kepadanya idr idr prabowo pilpres 
"Jokowi: Pembangunan Hasilnya Tak Instan, Seperti Minum Pil Pahit", Jakarta Selama empat tahun pemerintahannya Presiden Joko Widodo Jokowi berfokus pada pembangunan fisik yakni infrastruktur Menurut Jokowi hasil dari pembangunan tersebut tidaklah instan Kadang kadang apa yang kita kerjakan hasilnya tidak instan hasilnya tidak bisa langsung kita nikmati Itulah pil kadang kadang pahit kadang kadang sakit ujar Jokowi di acara HUT ke Metro TV di gedung Metro TV Jakarta Barat Senin Jokowi lantas memberikan analogi hijrah terkait alasannya gencar membangun infrastruktur Tujuan pembangunan tersebut adalah agar bisa bersaing dengan negara lain Kita semua ingin mencari ini hijrah hijrah dari yang konsumtif ke produktif Kita ingin hijrah menuju bangsa yang produktif bangsa yang efisien bangsa yang kompetitif Karena tanpa ini saya meyakini sangat berat bagi kita untuk berkompetisi dengan negara negara lain kata dia Baca Juga Politik Kompor Meleduk di Pilpres Jokowi juga menyampaikan fokus pembangunan pemerintah tidak terpusat di Jawa Jokowi mendorong adanya pemerataan Kalau saya orang politik yang bener memang dibangun di Jawa karena penduduk padat persen penduduk kita ada di Jawa kurang lebih Rythm ekonomi cepat kalau dibangun di sini rythm politiknya juga baik karena persen penduduk itu ada di Jawa Tapi risiko itu sudah kita hitung dan kita memilih yang ingin ujar Jokowi Baca Juga Jokowi Minta Revolusi Mental Diperluas dkp fdu revolusi mental presiden jokowi jokowi 
Politik Kompor Meleduk di Pilpres 2019, Jakarta Presiden Joko Widodo Jokowi menyebut banyak pihak yang memanfaatkan momen pilihan politik untuk membuat suasana menjadi panas Kubu Prabowo Subianto Sandiaga Uno menyebut justru Jokowi lah yang menjadi kompor yang memanaskan situasi saat ini Polemik ini berawal dari pernyataan Jokowi saat berbicara tentang panasnya kondisi negara pada tahun politik ini Dia mengatakan seharusnya masyarakat dibiarkan menentukan pilihan politik masing masing tanpa dipanas panasi Kita ini saudara sebangsa dan setanah air Jangan lupakan itu Ini karena banyak kompor karena dipanas panasi dikompor kompori jadi panas semuanya kata Jokowi di hadapan masyarakat adat Komering Raya Sumsel di Griya Agung Kota Palembang Minggu Pernyataan Jokowi ditanggapi oleh jubir BPN Prabowo Sandiaga Andre Rosiade Ia menuding justru Jokowi lah yang menjadi kompor karena belakangan capres no urut itu kerap membuat pernyataan kontroversial seperti politik genderuwo politikus sontoloyo dan ingin menabok penyebar hoax PKI elz tor politik kompor jokowi prabowo subianto pilpres 
Hanura: Pilpres 2019 Terasa Panas karena Dendam Kesumat Lawan Jokowi, Jakarta Presiden Joko Widodo Jokowi menilai banyak pihak yang memanfaatkan momen pilihan politik dengan membuat suasana menjadi panas Hanura sepakat Ketua DPP Partai Hanura Inas Nasrullah Zubir mengatakan Pilpres ini memang terasa panas Apalagi karena Jokowi kembali melawan Prabowo Subianto Dalam Pilpres ini memang terasa cukup panas terutama karena hadirnya lawan Pak Jokowi yang pernah nyungsep di Pilpres yang lalu yang tentunya meninggalkan rasa kesal penasaran dan sebel yang sangat luar biasa bukan Atau dengan kata lain dendam kesumat gitu lo kata Inas kepada wartawan Senin Menurut Inas karena dendam kekalahan pada Pilpres itulah maka lawan politik Jokowi cenderung melakukan berbagai upaya agar bisa memenangkan kontestasi politik kali ini Hal tersebutlah yang kemudian disinggung Jokowi sebagai kompor mae elz politik kompor jokowi prabowo subianto jokowi ma ruf amin hanura pilpres 
Hanura Balik Sindir Mardani soal Ahokers, Jakarta Wakil Ketua Badan Pemenangan Prabowo Subianto Sandiaga Uno Mardani Ali Sera menilai cawapres Ma ruf Amin akan kesulitan meyakinkan pendukung Ahok atau Ahokers untuk memberikan suara pada Pilpres Hanura balas menyindir Mardani Yang pasti sih bahwa Ahokers nggak suka sama Mardani apalagi sama Prabowo Sandi yang justru tukang ngomporin umat pada saat itu kata Ketua DPP Partai Hanura Inas Nasrullah Zubir kepada detikcom Kamis Inas menjelaskan Ma ruf dalam jabatannya sebagai Ketua MUI menyampaikan dalil agama terkait kasus yang membuat Ahok akhirnya dipenjara Pak Ma ruf pada saat itu hanya menyampaikan dalil dalam agama Islam ujarnya mae fdn mardani ali sera ahoker ahokers pilpres hanura ma ruf amin 
"Lapindo Kelola Lagi Blok Brantas, ESDM: Yang Lain Takut", Jakarta Pemerintah memberikan kontrak selama tahun wilayah kerja WK Brantas kepada Lapindo Brantas Inc Kontrak tersebut diberikan pemerintah mengingat tidak ada investor lain yang mau mengelola blok tersebut Direktur Jenderal Minyak dan Gas Bumi Migas Kementerian Energi dan Sumber Daya Mineral ESDM Djoko Siswanto menerangkan para investor khawatir kasus lumpur Lapindo terulang lagi Sehingga hanya Lapindo mengajukan diri Yang lain nggak ngajukan takut Yang lain takut nanti blow out lagi ribut kaya gitu Lapindo satu satunya yang terimakasih mau lanjutkan Yang lain nggak berani karena kasus lumpur Lapindo kata dia di Kementerian ESDM Jakarta Jumat Namun Djoko mengatakan kondisi sekarang sudah aman Kegiatan operasional di Blok Brantas masih berjalan Tapi kan sekarang udah aman sudah ngebor lagi udah kerja lagi nggak ada kecelakaan lagi Sayang kan ada produksi buat masyarakat situ ada jargas penerimaan negara safe kan sudah aman ungkapnya lapindo lapindo brantas pt brantas abipraya lumpur lapindo 
Netizen Keluhkan Macet Parah Arteri Pondok Indah, Jakarta Aksi penolakan warga atas pengosongan rumah di Kompleks Kodam Tanah Kusir Kebayoran Lama Jakarta Selatan berimbas macet parah di kawasan Arteri Pondok Indah Kejadian ini pun mulai terjadi pada saat jam orang orang akan berangkat kerja sekitar pukul Pagi Kemacetan terjadi sejak sebelum bundaran Pondok Indah karena terjadi aksi bakar ban oleh warga dari Kompleks Kodam di Tanah Kusir Kebayoran Lama Jaksel yang protes terkait pengosongan rumah Aksi tersebut terjadi di ruas jalan Lebak Bulus mengarah ke Gandaria yang digunakan para pekerja sebagai akses menuju kantor Demi menghindari kemacetan para pengguna jalan pun berupaya mengambil rute alternatif Meski saat ini kondisi beberapa jalanan sudah berangsur normal cuitan Arteri Pondok Indah masih bertengger di jajaran trending topik Twitter Indonesia Terpantau detikINET Rabu netizen mengeluhkan soal kemacetan tersebut namun banyak pula yang menginformasikan update terkait kemacetan Foto Screenshot TwitterBagi warga di himbau untuk tidak melintas Jalan Arteri Pondok Indah ke dua arah di tutup total akibat adanya kerumunan masa di pertigaan Kostrad Jalan Cendrawasih Kel Kebayoran Lama Selatan Kec Kebayoran Lama Jakarta Selatan pic twitter com PB oJg Lhâ GP Ansor Kebayoran Lama Ansor_KebLama May Arteri Pondok Indah Gandaria dan Radio Dalam tepatnya diKomplek KostrADSudah bisa di lalui lagi Setelah tadi di blokade dengan pembakaran Ban di tengah jalanâ Jean i v a n ð G DL K NG_ May arteri pondok indah meleduk jarang tentara bikin macet sekalinya iya luar biasaâ ninus randomnus May Padahal di sudut Pondok Indah yang lain kalau ada bakar an justru malah menyebabkan ketenangan bukan kepanasan Biasanya diselingin sama yang bikin hangat Kalau lagi pengen panas baru ada kerusuhan zamanomdulu pic twitter com kf M RMBFTâ Edo Ketaren edwardketaren May Menikmati pemandangan macet pondok indah untung udh sampe lokasi Pasangan ini cute pic twitter com LQXgPlpTqyâ Bramantoro Bramantoro May apakah kerusuhan di lapas brimob kelapa dua dan aksi bakar ban di kostrad pondok indah merupakan sekuel drama pengalihan isu dolar yang menembus empat belas ribu â v n v n May Arteri Pondok Indah pagi ini Hati hati melintas disana pic twitter com bl pQcBMWsâ StopNarkoba kangmeirza May korban suicide teroris depok demo pondok indah pembunuhan polisi today s local news are darker than usual yes â Mandhut mandhut May Jadi hari ini orang orang lebih sibuk di pondok indah dari pada ngantri promo Jco â JAK TANJUNG BARAT JTanjungBarat May Pondok indah knpa ada tronton baris ngabisin jalan kenapa ohh kenapaaaa macet woyyâ Jimmy Jimbo JimJimbo_ May macet kak gara gara demo di pondok indah demonya pagi pagi lagi kan tjakep https t co BjK EQT lâ yosua eka putra yozbaonk May jsn rns pengosongan rumah pengosongan rumah dinas tni twitter kodam jaya 
Cerita Warga yang Panik Saat Tabung Gas Meledak di MCK, Jakarta Warga di RT RW Kampung Melayu Jatinegara Jakarta Timur panik saat mendengar ledakan dari dalam MCK umum Rupanya ledakan itu disebabkan oleh tabung gas yang bocor Suara ledakan kencang saya panik karena merasa anak saya sedang di dalam MCK sedang mandi Tapi ternyata anak saya sudah selesai mandi kata salah satu warga Nurhayati di lokasi kejadian Sabtu Ia menyatakan saat itu ada sejumlah warga yang sedang memasak tak jauh dari lokasi ledakan Namun tak ada warga di luar MCK yang turut menjadi korban Warga sedang menggoreng kentang baru menyalakan kompor Tiba tiba terjadi ledakan di dalam MCK Untungnya saat itu nggak jadi korban tidak berada persis di depan pintu masuk MCK Jadi hanya warga yang berada di dalam MCK yang terkena ledakan ujarnya haf nkn ledakan tabung gas tabung gas meledak di mck kampung melayu 
