title,content
Anyir! 20 Karung Limbah Jeroan Hewan di Sungai Bikin Geram Warga Klaten, Klaten Warga di sekitar Jembatan Pandan Simping Jalan Yogya Solo Klaten dibikin geram karena ada sekitar karung berisi limbah hewan Limbah tersebut menimbulkan bau anyir Kalau dibuangi darah di lokasi itu baru sekali ini Kalau sampah sudah berulang kali ujar Ketua RT Dusun Pandan Desa Somopuro Kecamatan Jogonalan Istiyarno pada detikcom Rabu Istiyarno mengaku mendapat laporan dari warga terkait limbah darah dan jeroan itu pada Rabu pagi Namun sebenarnya keberadaan limbah itu sudah dicurigai sejak Selasa karena menimbulkan bau anyir Sebab darah kan baunya anyir Darah apa kita belum tahu lanjut Istiyarno Selanjutnya Halaman klaten limbah hewan birojatengdiy limbah hewan dibuang sembarangan 
"Fenomena Ribuan Cacing Muncul di Jawa, BMKG DIY: Perubahan Iklim Mendadak", Yogyakarta Ratusan cacing tanah tiba tiba muncul di Solo dan Klaten dan dikaitkan dengan terjadinya gempa besar Badan Meteorologi Klimatologi dan Geofisika BMKG DIY menilai kemunculan cacing tanah itu berkaitan dengan perubahan kondisi cuaca dan lingkungan yang mendadak Soal pemunculan cacing massal di Solo dan Klaten memang sering dikaitkan dengan akan adanya gempa besar kata Kepala Stasiun Geofisika BMKG DIY Agus Riyanto kepada detikcom Senin Agus menyebut karakter hewan memang menjadi salah satu indikator yang diamati oleh para ahli Namun hal tersebut baru sebagian kecil saja dari upaya dalam prekursor gempa Dari catatan catatan kemunculan cacing dengan peristiwa gempa bumi di Taiwan kemunculan cacing tanah dilaporkan pada hari menjelang terjadinya gempa Chi Chi Allen dkk tuturnya Selanjutnya Halaman cacing tanah cacing tanah di klaten cacing tanah di solo bmkg diy birojatengdiy gempa 
Saat Kemunculan Cacing Tanah Dikaitkan dengan Pertanda Gempa, Jakarta Fenomena keluar ribuan cacing dari tanah di Solo dan Klaten Jawa Tengah memunculkan beragam spekulasi Bahkan ada spekulasi yang mengaitkan fenomena munculnya ribuan cacing ini dengan gempa bumi Di Klaten cacing ini keluar di perkarangan rumah warga Jumlahnya ribuan dan tampak seperti mie Persis seperti jemuran mi saking banyaknya Jenis apa kami tidak tahu tapi badannya nggilap mengkilap ungkap warga Dusun Socawetan Desa Socakangsi Kecamatan Jatinom Klaten Suranto pada detikcom di rumahnya Minggu Selanjutnya Halaman cacing cacing tanah cacing tanah di klaten cacing tanah di solo bmkg lipi birojatengdiy round up 
Cacing Tanah Bermunculan di Jawa Tanda Gempa Bumi? Ini Penjelasan BMKG, Jakarta Cacing tanah bermunculan di tanah Jawa Apakah ini pertanda alam seperti akan terjadinya gempa bumi BMKG memberi penjelasan Isu kemunculan cacing yang dikaitkan dengan akan terjadinya gempa bukan tak berdasar Beberapa peristiwa gempa merusak di dunia di antaranya memang diawali adanya gejala alamiah berupa kemunculan cacing tanah secara massal kata Kepala Bidang Mitigasi Gempa Bumi dan Tsunami BMKG Daryono dalam keterangannya Minggu Pada peristiwa gempa Haicheng China beberapa hari sebelumnya juga dilaporkan adanya kemunculan cacing tanah yang sangat banyak ke permukaan tanah sebut Daryono Beberapa sumber pustaka lain juga mengungkap fenomena kemunculan cacing tanah menjelang gempa seperti kajian Chen dkk Rikitake Whitehead dan Ulusoy dan Liso dan Fidani imbuh dia Selanjutnya Halaman bmkg cacing cacing tanah gempa 
Teka-teki Umur Ikan Terbesar Dunia Terungkap Lewat Tes Bom Atom, Perth Data tes bom atom yang dilakukan pada masa Perang Dingin membantu para ilmuwan untuk mengetahui umur ikan terbesar dunia secara pasti Hiu paus adalah hewan besar dengan gerakan lamban dan jinak Binatang ini biasanya hidup di perairan tropis Hewan ini panjang umurnya tetapi para ilmuwan sejak lama berusaha keras untuk mengetahui dengan pasti umur hewan yang terancam punah ini Dengan menggunakan warisan radioaktif dunia sekarang mereka memiliki metode yang dapat digunakan untuk membantu kelangsungan hidup spesies ini Hiu paus adalah ikan terbesar serta hiu terbesar yang masih hidup Jepang melelang daging paus hasil perburuan komersial pertama Sempat dihentikan tahun Jepang lanjutkan praktik perburuan paus komersialPaus sperma mati dengan sampah seberat kg di dalam perutnyaPanjang tubuhnya bisa mencapai meter dengan berat rata rata sekitar ton Totol totol warna putihnya membuat binatang ini mudah diidentifikasi Hiu paus mencari plankton Getty Images Hiu paus memakan plankton dan berenang dalam jarak yang jauh untuk mendapatkan makanannya Binatang ini sangat disukai pada wisatawan di sejumlah tempat karena hiu paus sering kali membiarkan para penyelam berenang di sampingnya Meski demikian spesies ini sekarang dimasukkan dalam kelompok terancam punah karena kegiatan nelayan yang berlebihan di tempat tempat seperti Thailand dan Filipina Banyak hal terkait dengan spesies ini masih misterius terutama terkait dengan bagaimana cara mengetahui umur mereka dengan tepat Padahal para peneliti mengatakan ini adalah hal yang mendasar agar dapat memahami tingkat pertumbuhannya Informasi ini dipandang sangat penting agar hiu paus tetap dapat bertahan hidup di masa depan Hiu paus sangat menarik perhatian para wisatawan dan jinak Getty Images Para peneliti sebelumnya menghitung garis garis yang terlihat jelas pada tulang belakang bangkai hiu paus Mirip dengan cincin pada batang pohon lingkaran ini bertambah jumlahnya seiring dengan bertambahnya umur binatang Tetapi para peneliti belum yakin terkait berbagai hal terkait dengan seberapa sering cincin dapat terbentuk dan alasan di baliknya Sekarang mereka menemukan cara yang lebih tepat dalam mengetahui umur sebenarnya dari hiu paus Pada akhir tahun an beberapa negara termasuk AS Uni Sovyet Inggris Raya Perancis dan China melakukan sejumlah tes bom atom di berbagai tempat yang berbeda Seorang anak di Indonesia bermain bersama hiu paus Getty Images Salah satu hal yang dihasilkan berbagai ledakan tersebut adalah penggandaan sejenis atom atau isotop bernama Karbon di atmosfer Dengan berjalannya waktu setiap makhluk hidup di bumi menyerap Karbon tambahan yang masih tersisa Tetapi para peneliti sekarang mengetahui tingkat kehancuran isotop Hal ini adalah sebuah faktor penting dalam menentukan umur Semakin tua sebuah makhluk akan semakin banyak Karbon yang ditemukan Jadi binatang manapun yang hidup kemudian menyerap peningkatan Karbon ke bagian tubuh mereka yang padat atau keras kata penulis laporan Dr Mark Meekan dari Australian Institute of Marine Science di Perth Australia Ini berarti kita memiliki pengukur waktu di dalam tulang belakang kita dapat mengetahui periodisasi kehancuran isotop Salah satu kesulitan dalam mengetahui umur hiu ini adalah akses untuk mendapatkan sampel tulang belakang Tetapi tim ini berhasil menemukan dua spesimen dari hiu paus yang telah lama mati Benda ini tersimpan di Pakistan dan Taiwan Kajian tersebut mengisyaratkan bahwa umur makhluk ini memang sangat panjang Binatang ini hidup sangat lama kemungkinan bisa sampai tahun kata Dr Meekan Ini membawa pengaruh besar sekali terhadap spesies itu Ini mengisyaratkan bahwa berbagai kegiatan nelayan yang berlebihan membawa pengaruh yang besar Para ilmuwan mengatakan hasil kajian mereka menjelaskan mengapa jumlah hiu paus turun drastis di tempat tempat seperti Thailand dan Taiwan di mana kegiatan memancing dilakukan Binatang ini tidak bisa hidup jika dieksploitasi manusia kata Dr Meekan Baru baru saja spesies terancam ini dikelompokkan ke dalam kategori terancam punah Daftar Merah IUCN atau Serikat Dunia bagi Konservasi Alam Para peneliti percaya riset yang mereka lakukan akan membantu usaha konservasi Lewat kemampuan memperkirakan dengan tepat umur hiu paus para peneliti dapat memberikan panduan yang lebih tepat terkait dengan keadaan populasi binatang dan apakah kegiatan nelayan masih dapat diizinkan Di kebanyakan daerah tropis pariwisata hiu paus menarik banyak orang Para peneliti mengatakan dukungan terhadap kerja sama antar negara di sepanjang jalur hidup hiu paus adalah kunci bagi kelangsungan hidup mereka Hiu paus adalah duta besar yang menakjubkan bagi kehidupan laut dan spesies yang telah membuat begitu banyak orang keluar dari kemiskinan kata Dr Meekan Ini adalah sebuah berita baik dan ini menunjukkan ternyata terdapat sisi positif dari awan bom atom tambahnya Kajian ini diterbitkan di jurnal Frontiers in Marine Science nvc nvc bbc magazine bbc hiu paus 
Menambang Fosfor dari Air Kencing, Berlin Semua organisme perlu fosfor untuk tetap hidup Manusia perlu miligram mineral ini per hari Sebagai bagian unsur Adenosin Tri Phospat ATP fosfor memasok energi jadi bagian penting dinding sel DNA protein dan enzim Fosfor yang masuk tubuh lewat makanan juga menjamin agar gigi dan tulang tidak rapuh Tanaman memperoleh unsur fosfor dari pupuk Unsur ini biasanya diperoleh dengan cara ditambang dari batuan Penambangannya di Marokko Sahara Barat Cina Yordania dan Afrika Selatan merusak lingkungan karena dilakukan secara besar besaran Selain itu unsur fosfor biasanya terkandung dalam batuan bersama unsur lain yang membahayakan kesehatan seperti logam berat kadmiun atau unsur radioaktif uranium Penambangan besar besaran juga memicu makin menipisnya cadangan mineral dan dalam dekade mendatang dikhawatirkan akan habis Proyek daur ulang air kencingSebetulnya unsur ini bisa didaur ulang dari air kencing manusia Unsur fosfor yang dikonsumsi manusia lewat makanan biasanya dibuang keluar tubuh lewat air kencing Sayangnya selama ini fosfor dan mineral berharga lain yang terkandung di dalamnya terbuang begitu saja di saluran pembuangan air kotor Karena itu Bastian Etter menggagas proyek recycling air kencing Kami ingin berkontribusi untuk penghematan sumber daya alam ujar Etter menjelaskan Untuk menampung air kencing proyek yang dinamai Urin Express menyiapkan tempat penampungan berupa toilet mobil yang dipasang di stadion stadion atau tempat keramaian umum Proyek daur ulang fosfor dari air kencing diujicoba di kawasan pemukiman kumuh di Afrika Selatan dan Nepal Di kawasan itu tidak ada sistem saluran pembuangan air kotor dan toilet mobil disambut baik oleh warga Hasilkan fosfor dan air bersihDalam proyek percobaan itu dalam waktu dua hari dari liter air kencing bisa dipanen liter pupuk cair dan liter air Itu bisa langsung digunakan memupuk dan mengairi lahan pertanian seluas meter persegi Akan tetapi itu bukan tujuan utama dari proyek tersebut kata Etter Targetnya adalah sekaligus memperoleh mineral berharga memanfaatkan air secara bijak dan menyediakan sarana WC untuk kawasan yang tidak memilikinya Dengan membubuhkan bahan kimia cairan fosfor bisa dijadikan kristal Sementara airnya bisa diolah lebih lanjut menjadi air bersih Menuju siklus ekonomi tertutupSerupa dengan proyek yang digagas UrinExpress perusahaan daerah pengolahan air di Berlin BWB dalam skala lebih besar juga menambang fosfor dari saluran air kotor sejuta warga di ibukota Jerman itu Di instalasi pengolahan air kotor disaring dan dibersihkan dengan teknologi tinggi untuk kemudian dialirkan lagi ke perairan terbuka Hasil filtrasi adalah sedimen yang mengandung banyak mineral berharga Namun juga logam berat sisa hormon sisa bahan obat obatan dan bahan beracun berbahaya lainnya Untuk menambang fosfor dari sedimen kotoran manusia itu diperlukan teknik dan metode lebih canggih Setelah lima tahun melakukan riset kami menemukan proses kimia fisikalis menggunakan mikroorganisme untuk memisahkan kristal fosfor dari sirkulasi air ujar Andreas Lengeman pakar teknik pengolahan BWB Dengan proses teknik tinggi fosfor dijadikan kristal bercampur dengan magnesium dan amonium yang disebut MAP Karena molekul fosfor selalu terikat dengan mineral lain seperti kalsium atau magnesium kristalnya disebut phospat ujar Lengemann BWB bisa menjual ton phosphat yang diberi merk paten Berliner Pflanze setiap tahunnya Dengan uang hasil penjualan sebagian ongkos pengolahan air kotor dan penggantian pipa yang tersumbat batu sedimen air kencing bisa ditutup Sebuah siklus ekonomi tertutup bisa tercapai jika efisiensinya signifikan Sayangnya sejauh ini baru persen sisa fosfor dalam air kencing yang berhasil didaurulang dan belum bisa menutupi seluruh biaya yang diperlukan pungkas orang penting BWB Yang jelas potensi air kencing sebagai tambang emas baru atau lebih tepatnya tambang fosfor kini mulai dilirik banyak perusahaan besar karena prospek bisnisnya cukup cerah as yf ita ita dw fosfor kencing 
Polda Jatim Terjunkan Tim Bantu Pemprov Lacak Penderita Corona, Surabaya Polda Jatim mengirim tim bantuan untuk membantu Pemprov Jatim dalam melacak penderita corona Tim dilengkapi sejumlah peralatan dan dibekali kemampuan khusus Selain tim Polda Jatim juga memberikan bantuan berupa disinfektan masker Serta menyiagakan personelnya untuk penanganan dan pencegahan merebaknya virus corona di Jawa Timur Bantuan tersebut diterima langsung Wakil Gubernur Jatim Emil Elestianto Dardak dan Sekda Provinsi Jatim yang merangkap Ketua Satgas Penanganan Covid di Jatim Heru Tjahjono Ada salah satu bantuan dari Polda Jatim yang berbeda dari biasanya Yakni personel Tim Kimia Biologi Radiologi KBR dari Polda Jatim yang diperbantukan untuk Gugus Tugas Penanganan Covid Selanjutnya Halaman birojatim corona virus corona polda jatim pemprov jatim corona di jatim 
Polda Jatim Kirim Tim Bantu Pemprov Tracing Penderita Corona, Surabaya Polda Jawa Timur mengirim ribuan tim untuk membantu pemerintah provinsi melakukan tracing atau melacak penderita corona Tim ini juga dilengkapi sejumlah peralatan yang sudah dibekali kemampuan khusus Kapolda Jatim Irjen Luki Hermawan memaparkan tim dari Satuan Brimob tersebut berjuluk Tim KBR atau Kimia Biologi Radioaktif Polda Jawa Timur baru saja memesan tambahan pakaian untuk tim KBR yang dimiliki oleh satuan Brimob kita sudah ada karena kekurangan kami baru saja macam sebanyak baru datang yang nanti akan kami gunakan untuk tim yang sudah memiliki pelatihan yaitu KBR kimia biologi radioaktif ini yang pernah diperagakan ke Brimob Watukosek papar Luki di Mapolda Jatim Jalan Ahmad Yani Surabaya Jumat Ada ribuan tim lengkap dengan perlengkapan ada tenda dengan dekontaminasi Ini yang hari ini kami akan memBKO kan tim KBR ke Grahadi Kami sudah koordinasi dengan ibu gubernur mulai sore hari ini selama kali jam anggota dari KBR yang dengan perlengkapan atau peralatan lengkap stand by yang bisa digerakkan di posko imbuhnya hil fat birojatim virus corona corona corona di jatim polda jatim pemprov jatim 
"Cegah Virus Corona, Kantor Wali Kota Medan Disemprot Disinfektan", Medan Kantor Wali Kota Medan Sumatera Utara disemprot cairan disinfektan Penyemprotan dilakukan guna mencegah penyebaran virus Corona COVID Pantauan detikcom di lokasi Kamis sekitar pukul WIB seluruh ruangan yang ada di Kantor Wali Kota disemprot Seluruh tangga dan pagar kantor juga disemprot Disinfektan Kami dari KBR Brimob ujar salah seorang petugas penyemprotan Foto Kantor Wali Kota Medan disemprot disinfektan Foto Ahmad Arfah detikcom mae mae biromedan virus corona kantor wali kota medan 
Kapolda Sultra Rakor Bareng Bupati-Wali Kota Bahas Penanganan Corona, Kendari Polda Sulawesi Tenggara Sultra bersama pemerintah setempat serta seluruh instansi terkait menggelar rapat koordinasi penanganan dan antisipasi penyebaran wabah virus Corona Sejumlah bupati dan wali kota di Sultra hadir Rapat digelar di Aula Dhacara Polda Sultra Rabu Kapolda Sultra Brigjen Merdisyam mengatakan pertemuan ini merupakan tindak lanjut dari rapat sebelumnya Ini merupakan tindak lanjut dari gugus tugas yang sudah dibentuk Pak Gubernur di mana mengacu pada Kepres No Tahun percepatan penanganan penyebaran virus corona kata Merdisyam idh idh biromakassar kendari corona kapolda sultra 
"Cegah Corona, Polisi di NTB Siaga Semprotkan Disinfektan di Fasilitas Umum", Mataram Polda NTB tengah bersiaga untuk mencegah penyebaran virus Corona di wilayahnya Sebanyak orang yang masuk tim personel telah disiapkan untuk melakukan upaya penyebaran Corona Tim ini akan bekerja sama dengan pemerintah daerah selama status siaga darurat COVID berlangsung atau sejak ditetapkannya status darurat oleh Gubernur NTB Minggu lalu Selanjutnya Halaman biromakassar mataram cegah corona corona indonesia ntb 
"Cegah Corona, Bandara Internasional Lombok Disemprot Disinfektan", Mataram Badaran Internasional Lombok BIL Nusa Tenggara Barat kini disterilisasi Petugas melakukan penyemprotan cairan disinfektan pada setiap sudut bandara Penyemprotan untuk mengantisipasi penyebaran virus corona COVID Penyemprotan dilakukan tim Kimia Biologi dan Radioaktif KBR dari Satuan Brimob Kepolisian Daerah Nusa Tenggara Barat Jadi sesuai dengan petunjuk untuk kegiatan hari ini penyemprotan cairan disinfektan kita laksanakan di bandara kata Kasat Brimobda NTB Kombes Komaruz Zaman dalam keterangannya pada detikcom Selasa Tonton juga Bersih bersih Bandara Adi Soemarmo Cegah Wabah Corona Gambas Video detik idn idn biromakassar mataram corona cegah corona 
"Pandemi Corona, Alun-alun Bandung dan Masjid Agung Disemprot Disinfektan", Bandung Cegah penyebaran virus Corona atau Covid tim gabungan yang terdiri dari personel Gegana Brimob Polda Jawa Barat Polrestabes Bandung dan Pemerintah Kota Bandung melakukan pembersihan dan menyemprotkan disinfektan di kawasan Alun alun hingga Masjid Raya Bandung Jawa Barat Kapolrestabes Bandung Kombes Pol Ulung Sampurna Jaya mengatakan tim gabungan itu terdiri dari sekitar orang Kegiatan tersebut juga dilakukan sebagai sosialisasi pola hidup bersih sehat PHBS kepada masyarakat guna mengantisipasi penularan virus Corona Kegiatan ini juga untuk menyosialisasikan bahwa kita harus bersih diri sendiri dulu Kita tahu penyakit itu ada namun kita jangan panik tetap waspada kata Ulung kepada wartawan di Masjid Raya Bandung Sabtu wip mso bandung masjid raya jabar alun alun bandung 
Polri: Lokasi Penemuan Radioaktif di Batan Indah Sudah Aman dari Paparan, Jakarta Polisi menyatakan dua lokasi penemuan zat radioaktif di Kompleks Perumahan Batan Indah Tangerang Selatan Tangsel sudah dalam kondisi terbebas dari paparan Polisi mengatakan kedua lokasi telah di clean up Bahwa terkait dengan dampak dari radioaktif ini maka sampai dengan hari ini berdasarkan proses panjang dan juga clean up dinyatakan bahwa di area tersebut dalam kondisi aman dan layak ditempati kata Kabag Penum Divisi Humas Polri Kombes Asep Adi Saputra di Bareskrim Mabes Polri Kebayoran Baru Jakarta Selatan Jumat Karena pihak Bapeten dan Batan sangat concern terhadap bagaimana keberlanjutan komunitas supaya di sana menjadi lebih tenang ucap Asep Selanjutnya Halaman polri perumahan batan indah perumahan batan indah terpapar radioaktif 
Batan Akan Periksa Kesehatan Penghuni Rumah Penyimpan Zat Radioaktif Ilegal, Jakarta Badan Tenaga Nuklir Nasional Batan akan memeriksa kesehatan penghuni rumah serta para tetangga SM tersangka penyimpan zat radioaktif ilegal Batan hendak memastikan kondisi mereka dalam keadaan aman dari paparan radioaktif yang selama ini disimpan oleh SM Kami nanti akan melakukan semacam koordinasi dengan warga setempat terutama yang tinggal di rumah tersebut Nanti kami akan coba koordinasikan ingin meyakinkan bahwa penduduk yang tinggal di situ aman kata Kepala Biro Humas dan Kerja Sama Batan Heru Umbara di Bareskrim Mabes Polri Jalan Trunojoyo Kebayoran Baru Jakarta Selatan Jumat Setelah ditemukannya berbagai zat radioaktif di lokasi Heru mengaku pihaknya memang belum memeriksa warga yang tinggal di dalam dan sekitar kediaman SM Heru mengatakan pihaknya baru menerima permohonan pemeriksaan warga Kalau kasus yang di rumah memang belum ada pemeriksaan terhadap warga Jadi baru dilimpahkan ke Batan ini permohonannya Jadi kami Batan menunggu koordinasi dari Polri dan Bapeten Badan Pengawas Tenaga Nuklir ujar Heru aud isa radioaktif batan ilegal batan indah 
Barang Bukti Kasus Simpan Zat Radioaktif Ilegal Dititipkan Polisi ke Batan, Jakarta Polisi mengatakan pihaknya masih mengembangkan dan perlu menyelesaikan berkas perkara atas nama tersangka SM warga Kompleks Perumahan Batan Indah Tangerang Selatan Tangsel Selama proses pemberkasan perkara polisi mengatakan barang bukti berupa zat radioaktif dan barang barang yang telah terkontaminasi dititipkan ke pihak Batan Barang barangnya kami titipkan di Batan ujar Direktur Tindak Pidana Tertentu Brigjen Agung Budijono di Bareskrim Mabes Polri Jalan Trunojoyo Kebayoran Baru Jakarta Selatan Jumat Mohon maaf dalam press release ini kami tidak menghadirkan barang buktinya karena ini demi keselamatan kita bersama karena ada alat dan perlakuan khusus terhadap barang bukti itu terang Agung Sebelumnya diberitakan polisi menetapkan SM sebagai tersangka karena menyimpan zat radioaktif secara ilegal Meski berstatus tersangka SM tak ditahan Ancamannya memang kita tidak bisa lakukan penahanan karena ancaman kurungan penjaranya di bawah tahun Untuk pengembangan kami masih dalam proses kata Agung aud gbr radioaktif radioaktif batan indah perumahan batan indah terpapar radioaktif 
"Jadi Tersangka, Penyimpan Zat Radioaktif di Batan Indah Tak Ditahan", Jakarta Warga yang juga karyawan Badan Tenaga Nuklir Nasional Batan SM ditetapkan sebagai tersangka oleh Bareskrim Polri karena menyimpan zat radioaktif secara ilegal Meski berstatus tersangka SM tak ditahan Ancamannya memang kita tidak bisa lakukan penahanan karena ancaman kurungan penjaranya red di bawah lima tahun Untuk pengembangan kami masih dalam proses kata Direktur TIndak Pidana Tertentu Brigjen Agung Budijono di Bareskrim Mabes Polri Jalan Trunojoyo Kebayoran Baru Jakarta Selatan Jaksel Jumat Kami terapkan Pasal UU Nomor tentang Ketenaganukliran jelas Agung Selanjutnya Halaman radioaktif radioaktif batan indah bareskrim 
Warga Penyimpan Zat Radioaktif di Perumahan Batan Indah Jadi Tersangka, Jakarta Polisi telah mengusut tuntas kasus ditemukannya zat radioaktif di Perumahan Batan Indah Tangerang Selatan Tangsel Polisi telah menetapkan SM warga perumahan tersebut sebagai tersangka Dari hasil gelar perkara SM ditetapkan sebagai tersangka kata Karo Penmas Divisi Humas Polri Brigjen Argo Yuwono di Mabes Polri Jalan Trunojoyo Kebayoran Baru Jakarta Selatan Jumat Argo mengatakan pihaknya akan menjelaskan perkembangan kasus ini selengkapnya siang nanti Ya nanti lebih lengkapnya saat konferensi pers ujar Argo aud idn mabes polri batan bapeten radioaktif 
Tentang Tumor Tiroid yang Diidap Thalita Latief, Jakarta Melalui unggahan video di akun Instagram nya Thalita Latief mengaku mengidap tumor tiroid Thalita Latief mengidap tumor tiroid stadium dan diketahuinya sejak Januari Tiroid merupakan kelenjar di bagian leher yang bentuknya menyerupai kupu kupu Kelenjar ini memproduksi hormon tiroid yang mengatur metabolisme tubuh denyut jantung temperatur mood dan proses proses penting lainnya pada hampir setiap sel di tubuh Gejala ini merupakan hal yang wajar dialami karena mirip bermacam keluhan akibat gaya hidup modern Banyak orang tidak sadar bahwa kelenjar tiroid mereka bermasalah Karena itu penyakit ini disebut juga silent killer Gambas Video detik nwy erd kanker tiroid penyebab kanker tiroid adalah kelenjar tiroid thalita latief tumor tiroid dyouthizen genzipedia 
"Dalami Kasus Radioaktif di Batan Indah, Polisi Periksa 6 Saksi Lagi", Jakarta Polisi kembali memeriksa saksi terkait temuan limbah radioaktif di Perumahan Batan Indah Tangerang Selatan Hari ini ada orang saksi baru yang diperiksa polisi Hari ini kita menambah lagi ada saksi yang kita lakukan pemeriksaan kata Karo Penmas Divisi Humas Polri Brigjen Argo Yuwono di Mabes Polri Jalan Trunojoyo Jakarta Selatan Jumat Intinya yang berkaitan dengan kegiatan keluar masuknya limbah radioaktif tersebut ujarnya abw mae perumahan batan indah terpapar radioaktif perumahan batan indah radioaktif radioaktif batan indah polri 
Brimob Simulasi Pencegahan dan Penanganan Virus Corona Depan Kapolri, Pasuruan Kapolri Jenderal Idham Azis membuka Rakernis Korp Brimob Polri di Pusdik Brimob Watukosek Pasuruan Idham disambut simulasi pencegahan dan penanganan Virus Corona Simulasi yang dilakukan Satuan KBR Kimia Biologi dan Radioaktif digelar di Lapangan Hitam Simulasi mengambil tema pencegahan penyebaran Virus Corona di bandara Simulasi dimulai dengan kedatangan kendaraan yang mengangkut sejumlah peralatan dan personel yang mengenakan baju khusus Para personel kemudian mempersiapkan peralatan yang dibutuhkan WNI di Kapal Diamond Princess Sembuh dari Corona Selanjutnya Halaman birojatim virus corona corona kapolri idham azis brimob 
Polisi Akan Periksa Bapetan-Batan soal SM Buka Jasa Dekontaminasi Radioaktif, Jakarta Polisi menyebut SM warga Batan Indah Tangerang Selatan Tangsel yang menyimpan zat radioaktif di rumahnya membuka jasa dekontaminasi radioaktif Polisi bakal memeriksa sejumlah orang dari Badan Pengawas Tenaga Nuklir Bapeten dan Badan Tenaga Nuklir Nasional Batan untuk mendalami hal itu Minggu ini juga ada beberapa rekan rekan dari Batan dan Bapeten yang dimintai keterangan dengan penyidik sehubungan dengan peristiwa tersebut kata Kabag Penum Divisi Humas Polri Kombes Asep Adi Saputra di Hotel Mercure Ancol Jakarta Utara Selasa Asep mengatakan saat ini SM masih berstatus sebagai saksi SM juga akan kembali diperiksa dalam pekan ini Selanjutnya Halaman perumahan batan indah perumahan batan indah terpapar radioaktif zat radioaktif tangsel 
