title,content
"Penumpang Curhat Soal Penerbangan, Maskapainya Minta Maaf", London Seorang penumpang curhat di Twitter tentang buruknya pengalaman terbangnya selama jam jam Maskapai Inggris pun langsung minta maaf Bagaimana perasaan traveler jika terbang selama jam dan mendapatkan pelayanan yang buruk Kesal Tentu saja Itulah yang dirasakan seorang penumpang British Airways yang mendapatkan pengalaman buruk terbang selama jam Dilansir detikcom dari beragam sumber Selasa penumpang ini terbang dari Mumbai ke London menggunakan maskapai British Airways Selama terbang dia mendapatkan pelayanan dan ragam masalah Dia pun meluapkan kekesalannya di Twitter Martin Chalk pria tahun asal West Yorkshire Inggris menuliskan pengalaman terbangnya yang menyebalkan Lengkap dengan video selama di pesawat dia pun berbagi cerita perjalanannya British_Airways Not a good flight Broken seat which kept reclining unbelievably uncomfortable sub zero temperatures food that looked like rats had got to first and even the toilet door fell off mid flight Oh well at least I can watch some films for hours Nope pic twitter com XhRbFNp IIâ Martin Chalk mcchalk September Chalk mendapatkan bangku yang tidak nyaman Dia merasakan dudukannya sangat tipis dan dia juga bisa merasakan hentakan penumpang yang duduk di belakangnya Pesawat juga terlihat sangat tua Saat pembagian makanan pun Chalk juga dibuat makan hati karena tampilan makanan yang didapatkannya Dia mendapatkan roti yang telah gepeng dan terkesan seperti digigit tikus Sepertinya nasibb Chalk memang sedang tidak baik Saat ke toilet tiba tiba saja pintu toilet copot dan membuatnya terpana Tetiba saja ditangannya pintu tersebut jatuh dan membuat kaget pramugari Bahkan pramugarinya berkomentar dia belum pernah melihat kejadian ini selama tahun penerbangannya BACA JUGA Mabuk dan Dilarang Naik Pesawat Penumpang Tonjok PilotMasalahnya tidak berhenti di situ saja Chalk juga tidak bisa menikmati hiburan di pesawat karena layar video tidak bisa diam di posisinya karena engsel penahannya rusak Uggh Selain Chalk penumpang lain juga mengeluhkan suhu di dalam pesawat yang terlalu dingin Bayangkan saja bagaimana rasanya terbang jam dengan kondisi ruangan seperti itu Menanggapi cuitan Chalk yang telah viral juru bicara British Airways pun angkat bicara Mereka melontarkan minta maaf Kami bangga dengan kualitas layanan yang kami berikan kepada penumpang di pesawat Kami akan menyegarkan kembali armada serta meningkatkan layanan katering untuk semua kabin Kami menyesal bahwa standar kami turun dan tidak memenuhi harapan penumpang di kesempatan ini ujarnya BACA JUGA Ricuh di Pesawat Ada Penumpang Ngaku Tuhan Simak Video Tolak Kelonggaran PM Inggris Perpanjang Lockdown Gambas Video detik wsw aff london inggris pesawat penumpang pesawat wisatawan twitter 
Kawanan Lebah Bikin Pesawat Air India Tertunda Berjam-jam, New Delhi Sebuah penerbangan maskapai Air India tertunda selama beberapa jam dikarenakan kawanan lebah Kawanan lebah mendarat di jendela kokpit dan bahkan sempat menyerang staf lapangan saat mereka mencoba mengusir serangga tersebut Serangga tersebut mendarat di jendela pesawat hanya beberapa saat sebelum pesawat maskapai India tersebut dijadwalkan lepas landas dari kota Kolkata India timur pada Minggu waktu setempat Pesawat tersebut mengangkut penumpang termasuk Menteri Informasi Bangladesh Cara lain dengan menggunakan wiper kaca depan pesawat juga gagal mengusir lebah lebah tersebut Akhirnya para petugas mencoba cara lain yakni dengan menyemprot serangga tersebut dengan air ita ita india air india pesawat india 
Teori Habibie Jadi Kunci Pengembangan Pesawat Modern, Jakarta Hari ini traveler bisa keliling dunia naik pesawat berbadan lebar Pesawat macam itu tidak bisa dibikin tanpa teori ciptaan BJ Habibie Mendiang Presiden RI BJ Habibie terkenal dengan jasanya menemukan Teori Crack Progression hingga mendapat julukan Mr Crack Ternyata teorinya menjadi jawaban inovasi pesawat masa kini Dihimpun detikcom dari berbagai sumber Kamis Teori crack progression atau keretakan pesawat merupakan cara yang digunakan untuk mengantisipasi struktur badan pesawat agar lebih kuat Teori itu ditemukan Presiden ke RI tersebut pada dekade an Pemikiran Habibie ini menjadi jawaban dari teka teki aviasi selama tahun untuk adanya penerbangan komersial Teori ini dapat mengkalkulasi keretakan pesawat untuk mendeteksi rambatan kerusakan kontruksi agar pesawat tidak mudah jatuh dan aman untuk digunakan secara komersil Dengan hitungan yang terinci dan detail BJ Habibie berhasil membantu industri untuk membuat armada pesawat yang aman Produsen pesawat Airbus bahkan menerapkan teori Habibie untuk pesawat komersilnya mulai dari tipe A yang diproduksi sejak tahun Bukan saja teori BJ Habibie juga merealisasikan pesawat karya Indonesia N Gatotkaca Pada tahun pesawat N pertama kali mengudara dan juga menjadi sebuah kado ulang tahun RI ke Pesawat ini merupakan jenis armada penumpang sipil regional komuter turboprop baling baling dengan kapasitas hingga penumpang Produksi prototipe pertama yakni N PA dengan versi Gatotkaca diluncurkan Agustus dan N PA diberi nama versi Krincing Wesi yang diluncurkan Agustus Namun kelanjutan produksi dan prosesnya harus terhenti karena krisis moneter BJ Habibie kembali merealisasikan pesawat asli Indonesia R Proyek ini dikembangkan oleh PT Regio Aviasi Industri RAI dengan PT DI dan dikabarkan akan selesai tahun dan membutuhkan dana kurang lebih Rpp triliun Kini pesawat bahkan menjadi sebuah alat transportasi paling aman di dunia BJ Habibie pun yang dahulu memiliki cita cita menghubungkan Indonesia dengan pesawat sudah mulai terwujud Berbagai pulau di Indonesia bisa dijangkau traveler naik pesawat terbang Selamat jalan Eyang dirgantara Tanah Air lahir dan besar dengan karyamu Simak Video Selamat Jalan Bapak Teknologi Indonesia BJ Habibie Gambas Video detik sna fay bj habibie meniggal dunia bj habibie meninggal dunia bj habibie pesawat 
Habibie dan Pemerintahan Singkat yang Transformatif, Jakarta Pada era an sebagian besar anak anak di Taman Kanak Kanak TK sampai Sekolah Dasar SD memiliki cita cita menjadi insinyur agar dapat membuat pesawat terbang seperti Habibie Dari situ dapat dilihat bahwa Habibie adalah sosok yang melekat bukan hanya pada kalangan dewasa melainkan pada kalangan anak anak juga Belakangan memasuki ketika Hasri Ainun Habibie wafat B J Habibie mengalami pukulan batin mendalam karena belahan jiwanya telah berpulang terlebih dulu Untuk mengenang belahan jiwanya Habibie membuat sebuah film dokudrama dengan judul Habibie Ainun pada bercerita tentang percintaan di antara mereka berdua di tengah pasang surutnya badai sosial politik Indonesia Semenjak dokudrama itu lepas landas sosok Habibie dikenal sebagai laki laki romantis dan setia Kisah cinta antara Habibie dan Ainun menjadi inspirasi bagi seluruh pasangan suami istri dari ragam kalangan Sampai ia tidak memangku jabatan pemerintahan lagi Habibie tetap menjadi sosok yang dekat dengan masyarakat dalam teknologi maupun percintaan Namun apakah sosok BJ Habibie hanya sebatas ilmu pengetahuan teknologi dan percintaan Didorong Roh SejarahSedikit orang mengenang sosok Habibie sebagai seorang pemimpin pasca Orde Baru runtuh Sebagian menganggap bahwa ia adalah seorang teknokrat cerdas sehingga kepemimpinan politiknya tidak secerah kepemimpinannya memimpin industri teknologi seperti pesawat terbang Sebagian juga menganggap ia hanya meneruskan kepemimpinan dari Soeharto sehingga tidak terdapat gebrakan politik baru Ditambah lagi pada era kepemimpinannya Timor Timur lepas dari Negara Kesatuan Republik Indonesia NKRI membuat rasa nasionalisme sebagian publik tersayat Habibie berkuasa kurang lebih selama hari sebuah jangka waktu pemerintahan yang pendek Tetapi dalam masa pemerintahan yang singkat ia mampu melakukan gebrakan gebrakan reformis dialektis dalam bidang ekonomi politik hukum dan HAM serta kajian perempuan Pada masa krisis itu ia berupaya melahirkan pemerintahan sipil yang demokratis kritis sebuah angan angan dalam tekanan rezim otoriter Selama Orde Baru berkuasa pers dibungkam sehingga wacana pemikiran kritis mengalami kemandekan aliran Tetapi pada era pemerintahan Habibie pers memperoleh kebebasannya lewat UU No tahun tentang pers Ini menjadi tonggak kebebasan pers di Indonesia yang sebelumnya dibungkam oleh rezim Orde Baru Bukan hanya itu jauh sebelum era Abdurahman Wahid Habibie juga memberikan kebebasan kepada etnis Tionghoa untuk berbicara dan mengajarkan bahasa Mandarin Selain itu ia juga mengadakan referendum bagi Timor Timur di bawah Perserikatan Bangsa Bangsa PBB untuk memilih merdeka atau otonomi khusus di bawah pemerintah Republik Indonesia Realitas berkata rakyat Timor Timur lebih memilih untuk merdeka dari Republik Indonesia dan pemerintahan Habibie menerimanya sebagai hasil dari dialog antara Republik Indonesia dengan Timor Timur Sebuah keputusan politik yang membuat dirinya kurang populis dan dipandang sebelah mata oleh sebagian publik dan elite politik Ia juga meminta maaf atas pelanggaran Hak Asasi Manusia HAM masa lalu guna membangun masyarakat yang adil terbuka dan demokratis Tampaknya roh sejarah menggiringnya untuk melakukan pembaruan total sehingga ia tidak menyia nyiakan waktu untuk melakukan transformasi dalam masyarakat Indonesia Dapat dilihat dari kebijakan kebijakan yang dilahirkannya bahwa kebenaran bersifat interuptif dan historis Bergerak sangat cepat sekaligus mengejutkan sehingga banyak pihak yang belum dapat menerima kebenaran yang dihidupinya Akhirnya ia menjadi sosok yang tak populis dalam soal sosial politik namun pemerintahannya berhasil menegakkan kebenaran sehingga berdampak secara intelektual sosial kala itu Peletak Dasar DemokrasiSetelah melihat kenang kenangan demokratis Habibie maka dapat dikatakan bahwa ia merupakan peletak dasar demokrasi Indonesia sekalipun pertanggungjawabannya ditolak oleh parlemen Ia telah memperjuangkan nilai nilai imajinatif anak anak intelektual yang diinjak injak oleh Orde Baru dalam masa pemerintahannya yang singkat Habibie berhasil mengawal agenda Reformasi dalam pemerintahan yang masih kental dengan kultur Orde Baru Oleh karena itu The Washington Post pada September menyatakan bahwa his Habibie unpopular presidency was the shortest in modern Indonesia s history but was transformative Masa pemerintahan Habibie adalah masa pemerintahan yang tidak populer dalam ingatan masyarakat Indonesia namun ia berhasil mematahkan sendi sendi otoritarianisme Orde Baru Tampaknya kesetaraan dan kebebasan adalah prinsip dasar Habibie untuk mentransformasi Indonesia pasca Soeharto Kedua nilai itu merupakan roh dari demokrasi tanpa kesetaraan dan kebebasan dalam masyarakat demokrasi yang berlangsung adalah semu belaka Sepertinya ia belajar dari masa kekelaman sosial politik di Jerman pada Perang Dunia Kedua sehingga ia ingin membangun sebuah masyarakat demokratis humanis di Indonesia Oleh sebab itu ia menghidupi nilai nilai demokratis dalam masa pemerintahannya agar memicu sejarah baru dalam masyarakat Indonesia Alhasil ia mewariskan nilai nilai itu untuk tetap dihidupi agar tidak menjadi artefak demokrasi di masa lampau Tak heran jika Amnesty Internasional Indonesia mengatakan bahwa jangan sampai upaya HAM yang didorong oleh Habibie terbengkalai sia sia dan cita cita Reformasi luntur tanpa bekas Ini merupakan peringatan bahwa pekerjaan Habibie belum selesai sehingga perlu dikawal hari ini agar negara ini tidak jatuh ke dalam beban kelampauannya Dengan demikian kita layak mengenangnya bukan hanya sebagai bapak ilmu pengetahuan dan teknologi melainkan juga bapak demokrasi Indonesia dari kenang kenangan pemerintahannya yang berusia hari Fially Fallderama salah satu pendiri Ruang Inkarnasi Sosial Risol alumnus STFT Jakarta mmu mmu bj habibie bj habibie meninggal bj habibie meninggal dunia 
Melihat Habibie di Layar Lebar, Jakarta Semasa hidup kehidupan BJ Habibie sempat diangkat ke layar lebar Kisah filmnya diadaptasi dari memoar yang ia tulis juga pasang surutnya menjalani karier sebagai insinyur dan ahli pesawat terbang Berikut film film yang mengabadikan sosok Habibie Keduanya berpasangan menjadi sosok Habibie dan Ainun Dirilis pada film ini membawa perjalanan keduanya saat masih menjalin asmara hingga menikah Film ini masuk dalam daftar film nasional terlaris sepanjang masa dengan perolehan penonton Rudy HabibieEmpat tahun setelah Habibie Ainun rumah produksi MD Pictures merilis film sempalan dari sosok Habibie berjudul Rudy Habibie Kisahnya bergulir tentang Habibie muda yang jatuh bangun menempuh pendidikan di Jerman Ia berusaha mencapai impiannya menjadi seorang insinyur dan ahli pesawat terbang Film ini dibintangi oleh Reza Rahadian juga diramaikan sejumlah bintang lain di antaranya Chelsea Islan Pandji Pragiwaksono juga Indah Permatasari dan Ernest Prakasa Simak Video Selamat Jalan Bapak Teknologi Indonesia BJ Habibie Gambas Video detik doc nu bj habibie bj habibie meninggal bj habibie meninggal dunia Photo Gallery celeb Reza Rahadian Boyong Bintang Habibie Ainun Ziarah celeb Reza Rahadian Boyong Bintang Habibie Ainun Ziarah celeb Reza Rahadian Boyong Bintang Habibie Ainun Ziarah celeb Reza Rahadian Boyong Bintang Habibie Ainun Ziarah celeb Reza Rahadian Boyong Bintang Habibie Ainun Ziarah celeb Reza Rahadian Boyong Bintang Habibie Ainun Ziarah celeb BCL Tak Ingin Komentari Larangan Selfie di Makam BJ Habibie celeb BCL Tak Ingin Komentari Larangan Selfie di Makam BJ Habibie celeb BCL Tak Ingin Komentari Larangan Selfie di Makam BJ Habibie celeb BCL Tak Ingin Komentari Larangan Selfie di Makam BJ Habibie celeb BCL Tak Ingin Komentari Larangan Selfie di Makam BJ Habibie celeb BCL Tak Ingin Komentari Larangan Selfie di Makam BJ Habibie celeb BCL Tak Ingin Komentari Larangan Selfie di Makam BJ Habibie celeb Melihat Kembali Perayaan Ulang Tahun BJ Habibie di Pesawat celeb Melihat Kembali Perayaan Ulang Tahun BJ Habibie di Pesawat celeb Melihat Kembali Perayaan Ulang Tahun BJ Habibie di Pesawat celeb Melihat Kembali Perayaan Ulang Tahun BJ Habibie di Pesawat celeb Melihat Kembali Perayaan Ulang Tahun BJ Habibie di Pesawat celeb Melihat Kembali Perayaan Ulang Tahun BJ Habibie di Pesawat celeb Melihat Kembali Perayaan Ulang Tahun BJ Habibie di Pesawat celeb Surprise Bintang Srikandi Rayakan Ulang Tahun B J Habibie celeb Surprise Bintang Srikandi Rayakan Ulang Tahun B J Habibie celeb Surprise Bintang Srikandi Rayakan Ulang Tahun B J Habibie celeb Surprise Bintang Srikandi Rayakan Ulang Tahun B J Habibie celeb Surprise Bintang Srikandi Rayakan Ulang Tahun B J Habibie celeb Surprise Bintang Srikandi Rayakan Ulang Tahun B J Habibie celeb Surprise Bintang Srikandi Rayakan Ulang Tahun B J Habibie red carpet BJ Habibie Hadiri Gala Premiere Rudy Habibie red carpet BJ Habibie Hadiri Gala Premiere Rudy Habibie red carpet BJ Habibie Hadiri Gala Premiere Rudy Habibie red carpet BJ Habibie Hadiri Gala Premiere Rudy Habibie red carpet BJ Habibie Hadiri Gala Premiere Rudy Habibie photo BCL dan Reza Rahadian Buka Puasa Bareng BJ Habibie 
Keluarga Korban Tragedi Ethiopian Airlines Bertemu Menteri TransportasiÂ AS, Washington DC Keluarga dari beberapa korban tragedi jatuhnya pesawat Ethiopian Airlines ET bertemu dengan Menteri Transportasi Amerika Serikat AS Elaine Chao Pertemuan yang berlangsung selama dua jam ini juga membahas soal Boeing MAX jenis pesawat yang jatuh di Ethiopia pada Maret lalu Seperti dilansir Reuters Rabu Paul Njoroge yang kehilangan tiga anaknya istri dan ibu mertuanya dalam tragedi Ethiopian Airlines menjadi salah satu keluarga korban yang bertemu Chao di Washington DC Pertemuan digelar enam bulan setelah tragedi Ethiopian Airlines yang menewaskan orang Hidup saya tidak bergerak satu inci pun ucap Njoroge dalam pertemuan yang digelar di kompleks kantor Departemen Transportasi AS itu Saya tidak tahu bagaimana lagi untuk menjalani kehidupan ini imbuhnya nvc ita ethiopian airlines jatuh boeing max amerika serikat 
Pintu Pesawat Baru Boeing 777X Meledak Saat Uji Tekanan Tinggi, Washington Insiden terjadi pada Boeing X pesawat penumpang jenis baru saat tahap pengujian untuk sertifikasi baru baru ini Bagian pintu kargo pesawat buatan raksasa penerbangan Amerika Serikat tersebut meledak saat pengujian dalam tekanan tinggi Hal ini mencuat di tengah krisis yang masih menyelimuti Boeing terkait pesawat jenis MAX yang terlibat dua kecelakaan maut beberapa bulan lalu Pesawat jenis MAX sendiri tengah di grounded secara global usai kecelakaan Lion Air JT dan Ethiopian Airlines ET yang menewaskan total orang Seperti dilansir AFP Senin insiden pada Boeing X yang merupakan pesawat penumpang untuk penerbangan jarak jauh ini terjadi saat pengujian muatan final sebagai bagian dari proses sertifikasi yang diawasi oleh para inspektur dari Otoritas Penerbangan Federal Amerika Serikat FAA nvc ita boeing boeing x amerika serikat 
"Eropa Tolak Terima Putusan FAA Soal Boeing 737 MAX, Akan Lakukan Tes Terpisah", Berlin Pengawas penerbangan Eropa tidak akan menerima putusan Amerika Serikat soal keamanan pesawat bermasalah Boeing Max European Aviation Safety Agency EASA akan menjalankan tes mereka sendiri sebelum memutuskan apakah akan menyetujui pesawat itu diperbolehkan untuk mengudara lagi Boeing Max dilarang mengudara sejak bulan Mei tahun ini sesudah kecelakaan maut salah satunya di Indonesia Boeing umumkan rangkaian perbaikan pesawat MaxBoeing klaim telah tuntaskan pemutakhiran perangkat lunak pesawat MaxMaskapai mana saja yang mengoperasikan Boeing Max EASA menyatakan kepada US Federal Aviation Administration FAA bahwa mereka tak akan mengirim delegasi pada persetujuan keamanan dalam surat yang dikirim pada tanggal April Tidak lazim Patrick Ky Direktur EksekutifEASA mengungkapkan empat syarat yang mereka berikan kepada pihak berwenang AS dalam presentasi di depan komite transportasi dan pariwisata Parlemen Eropa hari Senin Sikap Eropa yang keras ini merupakan pukulan terhadap harapan Boeing agar bisa kembali dengan cepat mengudara lagi Eropa mempekerjakan ahli penerbangan dan rapat dua sampai tiga kali seminggu dengan teknisi Boeing untuk memastikan banyak hal sebelum memutuskan sendiri apakah Max boleh mengudara lagi Reuters Ini juga merupakan sebuah langkah yang sangat tidak lazim dalam praktek regulasi penerbangan internasional yang biasanya saling menerima standar satu sama lain Pesawat Boeing Max tidak lagi mengudara secara komersial sejak pesawat Ethiopian Airlines jatuh sesaat sesudah lepas landas pada tanggal Maret menewaskan orang Peristiwa ini terjadi tak lama sesudah pesawat maskapai Lion Air jatuh tanggal Oktober menewaskan orang Boeing ubah nama Max pada pesawat pesanan maskapai EropaBoeing melarang terbang seluruh armada pesawat MaxMengapa Garuda Indonesia batalkan pemesanan pesawat Boeing Max Dalam kedua kecelakaan penyelidik memfokuskan kepada peran sistem perangkat lunak bernama MCAS Maneuvering Characteristics Augmentation System yang dirancang untuk membuat pesawat ini lebih mudah diterbangkan Hasil penyelidikan memperlihatkan perangkat lunak dan kegagalan pada sensor menyebabkan pilot tak bisa mengendalikan pesawat Empat syarat Presentasi Patrick Ky ini memperlihatkanketidaksediaan mengirim delegasi ini menjadi salah satu dari empat syarat yang harus dipenuhi sebelum penerbangan Max diperbolehkan lagi di Eropa Ketiga syarat lainnya adalah penelitian desain tambahan yang lebih luas secara independen oleh EASA dua kecelakaan maut itu dianggap telah dimengerti dengan baik dan awak penerbangan telah dilatih dengan cukup terkait perubahan perubahan terhadap pesawat Max EASA mensyaratkan banyak sekali terhadap Max dengan upaya yang belum pernah dilakukan sebelumnya yang melibatkan ahli penerbangan dan dua atau tiga kali pertemuan daring per minggu dengan teknisi Boeing Ada juga rencana uji coba penerbangan selama seminggu penuh dengan pesawat yang telah dimodifikasi di pusat uji coba penerbangan Boeing di Seattle Boeing Max Amerika Serikat menolak terapkan larangan terbangBoeing merugi Rp triliun karena larangan terbang Max Saya kehilangan semua anak saya dalam pesawat Boeing yang jatuh Boeing telah mengerjakan rangkaian perubahan terhadap sistem kendali terbang Max untuk menghindari masalah di MCAS Selain perubahan pada pesawat mereka juga mengusulkan perubahan cara pelatihan pilot Laporan di Amerika menyebutkan Boeing berharap mendapatkan izin keamanan dari FAA bulan depan dan pihak maskapai bisa segera menerbangkan lagi Max tahun ini Persetujuan FAA akan membuat maskapai Amerika bisa menerbangkan lagi pesawat ini Tetapi maskapai Eropa termasuk Norwegian Air yang kepayahan sesudah Max tak mengudara akan membutuhkan izin dari EASA sebelum membolehkan Max kembali mengudara nvc nvc bbc world bbc boeing max boeing 
China Bikin Drone 'Spiderman' yang Bisa Berburu dan Lumpuhkan Pesawat, Beijing Otoritas China mengklaim telah mengembangkan jenis drone baru yang bisa berburu dan melumpuhkan drone drone lain bahkan pesawat kecil Drone baru buatan China ini bisa menembakkan sebuah jaring seluas meter persegi ke arah targetnya Seperti dilansir CNN Kamis drone baru China ini dibahas dalam laporan militer China yang dimuat dalam situs mereka yang berbahasa Inggris Terperangkap oleh jaring drone milik musuh seharusnya kehilangan tenaga dan jatuh ke daratan demikian laporan militer China yang dikutip CNN Selanjutnya Halaman china drone drone militer 
