title,content
"Bagai Neraka Dunia, Kota Ini Punya Api Abadi di Bawah Tanah", Pennsylvania Julukannya kota ini adalah Neraka Dunia Kota ini juga tak memiliki penghuni dan punya api abadi di bawah tanahnya Perkenalkan inilah Kota Centralia Sebuah kota kecil di Colombia County Pennsylvania Meski kecil kota ini berkembang pesat karena menjadi pertambangan batu bara Menurut catatan sejarah Centralia sudah menjadi pemukiman dari organisasi rahasia Irlandia sejak dulu Di tahun an penduduk mulai membuat jalan masuk ke tambang Pada tahun pemukiman di Centralia semakin berkembang Memiliki populasi hingga jiwa Centralia pun menjadi kota kecil yang berkembang Kota Centralia di Pennsylvania Foto Getty Images iStockphoto Dalam perjalanannya menjadi kota tambang Centralia memiliki satu masalah umum sampah Munculnya tikus dan bau tak sedap dari tumpukan sampah membuat Centralia tak indah Pada Mei Dewan Kota mengusulkan untuk melakukan pembersihan tempat sampah Cara paling praktis adalah dengan membakarnya Pembakaran dilakukan di semua tempat sampah Tak sadar ada tempat sampah yang berada dekat dengan lubang bekas tambang Kobaran api kemudian merembet ke bawah tanah melalui lubang tersebut Di dalamnya api menyala melahap habis tambang sampai kedalaman meter Kobaran api terus berlangsung Selanjutnya Halaman pennsylvania kota centralia amerika serikat tambang 
"4 Fakta Laut Merah, Kisah Nabi Musa hingga Air Terasin di Dunia", Jakarta Laut Merah yang terletak di Jazirah Arab selalu mengundang rasa penasaran karena berbagai faktor Mulai dari warnanya hingga sejarahnya dalam kehidupan Nabi Musa AS Dengan pesona tersebut banyak yang berkunjung ke areal yang juga dikenal dengan nama Laut Teberau ini untuk menyaksikan keindahannya Laut Merah dengan bentuk cenderung memanjang memisahkan benua Asia dan Afrika dengan beberapa negara yang berbatasan langsung Simak Video LDR sama Keluarga Bikin Hampers Sendiri Yuk Gambas Video detik row erd ramadhan laut merah kisah nabi musa musa mesir arab saudi hikmah detik muslim detik ramadhan 
Dua Pencari Pakan Ternak Tewas Tersambar Petir di Sawah Jombang, Jombang Hujan deras disertai petir menelan korban jiwa di Kabupaten Jombang Dua warga Kota Santri tewas tersambar petir saat mencari pakan ternak di sawah Korban pertama sambaran petir pertama yaitu Anang Djuwaheni warga Jalan Bali Kelurahan Jombatan Kecamatan Kabupaten Jombang Korban tersambar petir saat mencari rumput di tanah kavling Kelurahan Jombatan sore tadi sekitar pukul WIB Saat kejadian lokasi sedang diguyur hujan deras disertai petir Saksi Sujarwan mendengar bunyi petir tepat di samping rumahnya seperti menyambar sesuatu Kemudian saksi melihat korban sudah tergeletak di kavling kosong dekat pohon jati dalam keadaan meninggal Pohon jati di samping korban terbelah kena petir kata Kapolsek Jombang AKP Wilono saat dikonfirmasi detikcom Minggu Melihat kejadian ini lanjut Wilono Sujarwan melapor ke Polsek Jombang Polisi melakukan olah TKP dan meminta keterangan saksi Sedangkan petugas medis memeriksa tubuh korban yang sudah tak bernyawa Jenazah kami serahkan ke keluarganya karena pihak keluarga menyadari ini sebagai musibah ujarnya fat fat birojatim tersambar petir tewas tersambar petir 
Kisah Nabi Musa Membelah Laut hingga Tenggelamnya Firaun di Laut Merah, Jakarta Nabi Musa merupakan salah satu utusan Allah di muka bumi Selama hidupnya Nabi Musa diberikan cobaan bertubi tubi Kisah Nabi Musa pun diceritakan dalam Al Quran Misalnya seperti membelah lautan Nabi Musa diberikan mukjizat oleh Allah SWT untuk membelah laut dan menenggelamkan Firaun serta pasukannya Nabi Musa diketahui sebagai orang yang berani menentang kepemimpinan Firaun Bahkan Nabi Musa telah berusaha meluluhkan hati Firaun karena telah melampaui batas Namun hal itu gagal dan membuat Firaun memerintahkan pasukan untuk menangkap Nabi Musa Nabi Musa dan para pengikutnya pun dikejar kejar oleh pasukan Firaun Namun mereka terjebak di ujung perbatasan dengan laut sehingga tak ada jalan keluar kecuali melewati laut yang dikenal dengan nama Laut Merah Dipukul lah tongkat tersebut ke tanah hingga membelah lautan Nabi Musa dan pengikutnya pun berjalan di tengah tengah laut yang terbelah tersebut pay erd kisah nabi musa kisah nabi musa membelah laut kisah teladan nabi musa as mukjizat nabi musa kisah nabi musa lengkap hikmah berita islam detik muslim 
Dilema Memulangkan Mantan ISIS, Jakarta Pemerintah Indonesia saat ini tengah mengkaji kemungkinan memulangkan Warga Negara Indonesia WNI yang telah bergabung dengan ISIS Setelah kekalahan ISIS pada pertengahan para pengikutnya berada dalam ketidakpastian karena harus berurusan dengan hukum setempat di mana mereka tertangkap Sejauh ini Suriah Irak dan Turki merupakan negara negara yang berhasil menahan para tentara teroris asing atau sering disebut Foreign Terrorist Fighters Kekalahan ISIS belakangan memang menjadi masalah baru bagi negara negara di dunia Presiden Amerika Serikat Donald Trump dan Presiden Prancis Emanuel Macron misalnya sempat saling sindir terkait mekanisme yang akan dipilih untuk merespons keberadaan warga negara mereka yang berada di sel sel pemerintah Turki Suriah dan Irak Apakah akan memulangkan atau membiarkan mereka terombang ambing tanpa status kewarganegaraan Namun demikian Turki sendiri sebagai salah satu negara yang berhasil menangkap dan menahan para simpatisan ISIS pada akhir menyatakan akan memulangkan para mantan ISIS ke negara asal mereka masing masing Jumlah Simpatisan ISIS Jika merujuk data jumlah pengikut ISIS yang datang dari luar negeri tidaklah sedikit Propaganda Abu Bakr Al Baghdadi berhasil mempengaruhi simpatisan dari berbagai penjuru dunia Dari Eropa mencapai angka negara eks Uni Soviet mencapai Amerika Utara Afrika Utara Timur Tengah dan Asia Tenggara orang The Soufan Group Data serupa juga diterbitkan oleh International Centre for Counter Terorism ICCT pada yang menyebutkan tentang kecenderungan generasi muda dari negara negara Eropa Barat seperti Prancis Jerman dan Inggris yang mendominasi angka pengikut ISIS Rusia Today Jumlah di atas tentu saja mengalami penurunan karena sebagian dari pengikut ISIS meninggal dalam pertempuran dan sebagian lainnya pindah untuk mencari perlindungan di negara negara yang belum stabil Sikap IndonesiaPemerintah Indonesia sendiri kelihatannya dalam posisi dilematis karena di satu sisi mereka yang bergabung ISIS merupakan WNI yang mengingkari kesetiaan kepada negara bergabung dengan ISIS untuk terlibat sebagai tentara dan pengikut adalah pelanggaran konstitusi Indonesia Sementara di sisi lain pemerintah Indonesia merasa memiliki tanggung jawab moral untuk mengembalikan mereka ke Tanah Air Ketika isu pemulangan WNI mantan ISIS mengemuka respons masyarakat Indonesia terbelah sebagian mendukung sebagian lainnya menolak Pemerintah dan DPR juga tidak berada dalam satu suara terkait mekanisme repatriasi mantan pejuang yang sebagian besar merupakan wanita dan anak anak itu CNN Indonesia Membawa pulang WNI yang pernah silau oleh propaganda ISIS bukanlah pekerjaan mudah Memulangkan mereka tidak semudah memulangkan tenaga kerja Indonesia yang mengalami persoalan administrasi di negara negara Timur Tengah Ada konsekuensi yang harus diantisipasi ketika mereka kembali ke Indonesia Guna merespons masalah tersebut ada beberapa hal yang perlu menjadi perhatian pemerintah Pertama BNPT selaku koordinator dalam urusan pencegahan dan penanggulangan terorisme perlu melakukan kajian dan assessment dengan melibatkan berbagai kementerian dan universitas untuk melihat dampak dampak yang ditimbulkan oleh kepulangan mereka Sebab dalam diri para simpatisan teroris masih tersisa ideologi teror Kedua Indonesia perlu mempelajari pengalaman Jerman Inggris dan Australia yang baru baru ini memulangkan warga mereka dari Timur Tengah Indonesia membutuhkan pengalaman negara negara tersebut dalam upaya deradikalisasi jangka pendek dan jangka panjang untuk warga yang pernah bergabung dengan organisasi teror paling berbahaya dalam sepuluh tahun terakhir itu Terakhir penegakan hukum terhadap mantan pengikut ISIS sangat diperlukan agar bisa menjadi pelajaran bagi tindakan serupa di masa depan Sekaligus mengirim pesan kepada masyarakat bahwa negara pasti memberikan hukuman bagi setiap tindakan teror yang membahayakan masyarakat dan stabilitas nasional M Sya roni Rofii Doktor Hubungan Internasional Marmara University Turki Direktur Eksekutif Center for Indonesia and International Affairs CIFA dosen Hubungan Internasional FISIP UIN Syarif Hidayatullah Jakarta mmu mmu wni eks isis pemulangan wni eks isis repatriasi wni 
3 Strategi Asman Abnur Jika Terpilih Jadi Ketum PAN, Jakarta Kontestasi pemilihan Ketua Umum PAN yang direncanakan bakal digelar Februari mendatang sudah memunculkan beberapa nama kandidat calon ketua umum Mereka bahkan telah memaparkan langkah dan strategi jika terpilih untuk rebound di mengingat PAN mengalami keterpurukan suara pada Pileg lalu Ketua DPP PAN Sahrin Hamid sebagai salah satu loyalis Asman Abnur menyebutkan untuk rebound di ada tiga strategi yang nantinya akan dimainkan Caketum Asman Abnur Di antaranya adalah harmonisasi pemantapan strategi atas dan strategi bawah Pertama harmonisasi internal Bahwa pertarungan paska kongres tentunya masing masing terbelah dalam pilihan pilihan politik kandidasi dalam kontestasi kongres Dinamika tersebut sedikit banyak membawa konsekuensi bagi internal partai dan juga sebagai ujian Karena jika tidak mampu mengelola efek pasca kongres maka yang terjadi adalah ekspresi kemenangan yang berlebihan dan penyingkiran yang kalah akibatnya migrasi kader ke partai lain ujarnya dalam keterangan tertulis Sabtu prf ega pan asman abnur caketum pan 
"Kisah Mutilasi Perempuan Muda, Puluhan Tahun Tak Terpecahkan", Jakarta Pagi hari tahun lalu Betty Bersinger berjalan kaki dari rumahnya di Leimert Park Los Angeles Amerika Serikat menuju toko reparasi sepatu bersama putrinya yang berusia tahun Saat melintas di depan sebuah tanah kosong matanya terantuk pada benda berwarna putih yang tergeletak di atas rerumputan liar tak begitu jauh dari trotoar Awalnya Bersinger mengira benda itu sebuah maneken Namun karena merasa janggal dia memutuskan melihat lebih dekat Kecurigaan Bersinger benar benda itu sebenarnya sesosok mayat yang terbelah dua di bagian pinggang Dia bergegas ke rumah terdekat dan menelpon polisi Untuk mempercepat investigasi polisi Los Angeles meminta bantuan Federal Bureau of Investigation FBI Sidik jari mayat dikirimkan ke markas FBI di Washington Dari hasil identifikasi korban ternyata bernama Elizabeth Short alias Bette berusia tahun yang tinggal di Hollywood Rekam jejak Bette juga terungkap dari arsip FBI Bette tercatat pernah melamar pekerjaan sebagai kasir pertokoan di Camp Cooke kompleks militer di California pada Januari Perempuan yang lahir pada Juli itu juga punya catatan kriminal Polisi pernah menangkapnya karena mabuk saat usianya di bawah umur jelang akhir Selanjutnya Halaman rubrik mesin waktu mutilasi pembunuhan amerika serikat 
"Tanah Amblas di Pacitan Resahkan Warga, Ahli Geologi Akan Didatangkan", Pacitan Tanah amblas membelah lahan milik warga Desa Mantren Kecamatan Punung Pacitan Warga pun resah Mereka khawatir rekahan terus membesar hingga mengenai permukiman yang hanya berjarak meter Takut kalau mengenai permukiman masyarakat Lokasi ini kan juga dekat dengan jalan raya keluh Suwito warga setempat kepada detikcom Sabtu Sejauh ini lanjut pria yang menjabat Ketua RT RW ini warga tak bisa berbuat banyak kecuali hanya melapor kepada aparat Mereka berharap segera ada penanganan Setidaknya dengan memasang tanda bahaya atau pembatas Kalau dimintai bantuan berupa tenaga warga di sini sepenuhnya siap membantu imbuhnya iwd iwd tanah amblas tanah amblas di pacitan birojatim 
10 Single Paling HOT di 2019, Jakarta Single menjadi salah satu hal yang penting dalam pengkaryaan di ranah musik Sebuah single bisa berarti banyak hal Bisa berarti lagu tersebut menjadi jagoan dalam sebuah album bisa juga menjadi perkenalan untuk mengetahu isi album bahkan identitas musik sang musisi Di tahun ini ada sejumlah single yang sukses didengarkan banyak orang dan menjadi bahan perbincangan detikHOT merangkum single paling HOT di tahun ini Apa saja Simak daftarnya berikut ini Adu Rayu Yovie Widianto feat Glenn Fredly Tulus Adu Rayu menjadi salah satu lagu paling banyak dibicarakan di tahun ini Sebab video klip lagu tersebut dibintangi oleh tiga aktor dan aktris papan atas yakni Chicco Jerikho Velove Vexia dan Nicholas Saputra Melihat cerita yang disuguhkan video klipnya sejumlah warganet terbelah mendukung Chicco dan mendukung Nicholas Selain karena video klipnya yang fenomenal lagu ini juga berhasil mendapatkan sejumlah penghargaan dari ajang AMI Awards Gambas Youtube Masa Masa The Adams Tahun ini The Adams merilis album baru yang berjudul Agterplaas setelah tahun absen merilis karya Sebelumnya mereka lebih dulu memperkenalkan single Pelantur dan Masa Masa sebagai jembatan menuju album Masa Masa merupakan lagu yang digarap oleh Ario Hendarwan dengan lirik yang ditulis bersama sama para personel The Adams dan Hasief Ardiansyah Lagu bernapaskan indie rock tersebut bercerita mengenai nostalgia di masa SMA The Adams mengenang indahnya kenangan bersama teman teman yang dilalui saat masa remaja Gambas Youtube Kembali RaisaSetelah melahirkan buah hatinya Raisa sempat memutuskan rehat sejenak dari dunia musik Kembali menjadi lagu yang menandai kembalinya penyanyi kelahiran Juni itu ke industri hiburan Lagu tersebut ditulis Raisa bersama Mikha Angelo dari The Overtunes Ini merupakan kali pertama keduanya berkolaborasi Gambas Youtube Kembali ke Awal Glenn Fredly Nyaris satu dekade Glenn Fredly tidak mengeluarkan album solonya Tahun ini Glenn pecah telor dengan merilis Romansa ke Masa Depan Kembali ke Awal menjadi salah satu single dalam album tersebut Lagu tersebut sekaligus menjadi soundtrack dari film Twivortiare yang diangkat dari novel karya Ika Natassa dan dibintangi Reza Rahadian dan Raihaanun Gambas Youtube Tiba Tiba Batu Efek Rumah Kaca Vokalis Efek Rumah Kaca Cholil Mahmud yang sebelumnya bermukim di Amerika Serikat kini kembali ke Indonesia Sebelum pulang ke Tanah Air Cholil sempat mengajak rekan rekan satu bandnya untuk merekam lagu di Negeri Paman Sam itu Tiba Tiba Batu menjadi lagu yang direkam Cholil di AS sebelum pulang Dalam sebuah wawancara ia mengaku lagu itu berangkat dari peristiwa yang terjadi di keseharian yang terjadi di Indonesia dan juga Amerika Serikat Gambas Youtube Senja Teduh Pelita Maliq D Essentials Tahun ini grup musik Maliq D Essentials telah menginjak usia tahun berkarier di industri musik Untuk merayakannya mereka merilis sebuah single berjudul Senja Teduh Pelita Lagu ini bercerita mengenai restu yang diberikan alam semesta lewat tanda tanda ketika dua orang sedang jatuh hati Senja Teduh Pelita direkam di Jakarta dan melalui proses mixing di Abbey Road Studio London Inggris Gambas Youtube Wanitaku NOAH Bisa dibilang Wanitaku adalah salah satu single kenang kenangan yang direkam dan dirilis sebelum Uki resmi meninggalkan NOAH Lagu tersebut terdapat di album Keterkaitan Keterikatan Musik dari lagu ini diciptakan oleh Ariel dan liriknya ditulis Ariel bersama dengan Pongki Barata Gambas Youtube Tak Ingin Pisah Lagi Marion Jola feat Rizky Febian Lagu Tak Ingin Pisah Lagi adalah perwujudan dari duet yang dilakukan oleh dua idola remaja Bagaimana tidak di tahun ini karier Marion Jola dan Rizky Febian tengah terbilang gemilang Tak Ingin Pisah Lagi ditulis oleh LaleIlmanNino Dalam sebuah wawancara Marion Jola mengaku berduet dengan Rizky Febian adalah salah satu mimpinya yang menjadi kenyataan Gambas Youtube VCR Goodnight Electric Lama tidak terdengar di tahun ini Goodnight Electric kembali merilis dua single VCR adalah lagu pertama yang dirilis trio elektronik tersebut sebelum kemudian mengeluarkan Erotika Single VCR sekaligus menjadi lagu yang mengobati kerinduan para penggemar Goodnight Electric setelah sekian lama Dalam lagu ini Goodnight Electric berkolaborasi dengan Priscilla Jamail dari Monday Math Class sebagai penyanyi latar Gambas Youtube Kala Senja Eva Celia Kala Senja menjadi single kedua yang Eva Celia rilis dari mini album Lifeline Introduction Dalam lagu itu ia mengajak Aaron Sterling yang merupakan drummer pengiring John Mayer untuk bekerja sama Lagu tersebut sekaligus menjadi lagu bahasa Indonesia pertama yang dirilis oleh Eva Celia Kala Rindu berbicara mengenai perasaan rindu Gambas Youtube Simak Video Adib Hidayat Platform Digital Musik Perbaiki Penghasilan Musisi Gambas Video detik srs dar top ten topten musik Photo Gallery on stage Potret Penyanyi Muda yang Bunuh Diri karena Tak Kuat Karantina on stage Potret Penyanyi Muda yang Bunuh Diri karena Tak Kuat Karantina on stage Potret Penyanyi Muda yang Bunuh Diri karena Tak Kuat Karantina on stage Potret Penyanyi Muda yang Bunuh Diri karena Tak Kuat Karantina on stage Potret Penyanyi Muda yang Bunuh Diri karena Tak Kuat Karantina on stage Potret Penyanyi Muda yang Bunuh Diri karena Tak Kuat Karantina on stage Histeris Penonton untuk Yovie Nuno di dHOT Music Setia Menjaga Hati on stage Histeris Penonton untuk Yovie Nuno di dHOT Music Setia Menjaga Hati on stage Histeris Penonton untuk Yovie Nuno di dHOT Music Setia Menjaga Hati on stage Histeris Penonton untuk Yovie Nuno di dHOT Music Setia Menjaga Hati on stage Histeris Penonton untuk Yovie Nuno di dHOT Music Setia Menjaga Hati on stage Histeris Penonton untuk Yovie Nuno di dHOT Music Setia Menjaga Hati on stage Histeris Penonton untuk Yovie Nuno di dHOT Music Setia Menjaga Hati on stage Histeris Penonton untuk Yovie Nuno di dHOT Music Setia Menjaga Hati on stage Aksi Krisdayanti di Musik Spesial Cerita Tentang Kita on stage Aksi Krisdayanti di Musik Spesial Cerita Tentang Kita on stage Aksi Krisdayanti di Musik Spesial Cerita Tentang Kita on stage Aksi Krisdayanti di Musik Spesial Cerita Tentang Kita on stage Aksi Krisdayanti di Musik Spesial Cerita Tentang Kita on stage Aksi Krisdayanti di Musik Spesial Cerita Tentang Kita on stage Aksi Krisdayanti di Musik Spesial Cerita Tentang Kita on stage Marion Jola hingga Brisia Jodie di Musik Spesial Cerita Tentang Kita on stage Marion Jola hingga Brisia Jodie di Musik Spesial Cerita Tentang Kita on stage Marion Jola hingga Brisia Jodie di Musik Spesial Cerita Tentang Kita on stage Marion Jola hingga Brisia Jodie di Musik Spesial Cerita Tentang Kita on stage Marion Jola hingga Brisia Jodie di Musik Spesial Cerita Tentang Kita on stage Marion Jola hingga Brisia Jodie di Musik Spesial Cerita Tentang Kita on stage Marion Jola hingga Brisia Jodie di Musik Spesial Cerita Tentang Kita celeb Curhat Marion Jola Soal Video Buka Jaket yang Viral celeb Curhat Marion Jola Soal Video Buka Jaket yang Viral celeb Curhat Marion Jola Soal Video Buka Jaket yang Viral celeb Curhat Marion Jola Soal Video Buka Jaket yang Viral celeb Curhat Marion Jola Soal Video Buka Jaket yang Viral celeb Curhat Marion Jola Soal Video Buka Jaket yang Viral celeb Curhat Marion Jola Soal Video Buka Jaket yang Viral on stage Bukan Cuma Jerinx Ini Musisi yang Tolak RUU Permusikan on stage Bukan Cuma Jerinx Ini Musisi yang Tolak RUU Permusikan on stage Bukan Cuma Jerinx Ini Musisi yang Tolak RUU Permusikan on stage Bukan Cuma Jerinx Ini Musisi yang Tolak RUU Permusikan on stage Bukan Cuma Jerinx Ini Musisi yang Tolak RUU Permusikan on stage Bukan Cuma Jerinx Ini Musisi yang Tolak RUU Permusikan on stage Bukan Cuma Jerinx Ini Musisi yang Tolak RUU Permusikan on stage Bukan Cuma Jerinx Ini Musisi yang Tolak RUU Permusikan on stage Saat Jazz Dikawinkan dengan Calung Banyumasan on stage Saat Jazz Dikawinkan dengan Calung Banyumasan on stage Saat Jazz Dikawinkan dengan Calung Banyumasan on stage Saat Jazz Dikawinkan dengan Calung Banyumasan on stage Saat Jazz Dikawinkan dengan Calung Banyumasan on stage Saat Jazz Dikawinkan dengan Calung Banyumasan on stage Kocak Ini Versi Panjang dari Album Terkenal on stage Kocak Ini Versi Panjang dari Album Terkenal on stage Kocak Ini Versi Panjang dari Album Terkenal on stage Kocak Ini Versi Panjang dari Album Terkenal on stage Kocak Ini Versi Panjang dari Album Terkenal on stage Kocak Ini Versi Panjang dari Album Terkenal on stage Kocak Ini Versi Panjang dari Album Terkenal on stage Kocak Ini Versi Panjang dari Album Terkenal on stage Kocak Ini Versi Panjang dari Album Terkenal kpop NE hingga S E S Video Musik Termahal di Dunia kpop NE hingga S E S Video Musik Termahal di Dunia kpop NE hingga S E S Video Musik Termahal di Dunia kpop NE hingga S E S Video Musik Termahal di Dunia kpop NE hingga S E S Video Musik Termahal di Dunia kpop NE hingga S E S Video Musik Termahal di Dunia kpop NE hingga S E S Video Musik Termahal di Dunia kpop NE hingga S E S Video Musik Termahal di Dunia on stage Ini Aksi Down For Life Band Metal Asal Solo yang Pakai Batik di Jerman on stage Ini Aksi Down For Life Band Metal Asal Solo yang Pakai Batik di Jerman on stage Ini Aksi Down For Life Band Metal Asal Solo yang Pakai Batik di Jerman on stage Ini Aksi Down For Life Band Metal Asal Solo yang Pakai Batik di Jerman on stage Ini Aksi Down For Life Band Metal Asal Solo yang Pakai Batik di Jerman on stage Ini Aksi Down For Life Band Metal Asal Solo yang Pakai Batik di Jerman on stage Ini Aksi Down For Life Band Metal Asal Solo yang Pakai Batik di Jerman on stage Ini Dax J DJ yang Divonis Hukuman Bui karena Remix Azan on stage Ini Dax J DJ yang Divonis Hukuman Bui karena Remix Azan on stage Ini Dax J DJ yang Divonis Hukuman Bui karena Remix Azan on stage Ini Dax J DJ yang Divonis Hukuman Bui karena Remix Azan on stage Ini Dax J DJ yang Divonis Hukuman Bui karena Remix Azan on stage Ini Dax J DJ yang Divonis Hukuman Bui karena Remix Azan on stage Aseel Omran Penyanyi Cantik dari Arab yang Cover Meraih Bintang Via Vallen on stage Aseel Omran Penyanyi Cantik dari Arab yang Cover Meraih Bintang Via Vallen on stage Aseel Omran Penyanyi Cantik dari Arab yang Cover Meraih Bintang Via Vallen on stage Aseel Omran Penyanyi Cantik dari Arab yang Cover Meraih Bintang Via Vallen on stage Aseel Omran Penyanyi Cantik dari Arab yang Cover Meraih Bintang Via Vallen on stage Aseel Omran Penyanyi Cantik dari Arab yang Cover Meraih Bintang Via Vallen on stage Aseel Omran Penyanyi Cantik dari Arab yang Cover Meraih Bintang Via Vallen on stage Aseel Omran Penyanyi Cantik dari Arab yang Cover Meraih Bintang Via Vallen on stage Aseel Omran Penyanyi Cantik dari Arab yang Cover Meraih Bintang Via Vallen on stage Jannine Weigel YouTuber Cantik yang Cover Lagu Tema Asian Games on stage Jannine Weigel YouTuber Cantik yang Cover Lagu Tema Asian Games on stage Jannine Weigel YouTuber Cantik yang Cover Lagu Tema Asian Games on stage Jannine Weigel YouTuber Cantik yang Cover Lagu Tema Asian Games on stage Jannine Weigel YouTuber Cantik yang Cover Lagu Tema Asian Games on stage Jannine Weigel YouTuber Cantik yang Cover Lagu Tema Asian Games on stage Jannine Weigel YouTuber Cantik yang Cover Lagu Tema Asian Games on stage Jannine Weigel YouTuber Cantik yang Cover Lagu Tema Asian Games on stage Penampilan Taylor Swift Jadi Pelakor di Klip Sugarland on stage Penampilan Taylor Swift Jadi Pelakor di Klip Sugarland on stage Penampilan Taylor Swift Jadi Pelakor di Klip Sugarland on stage Penampilan Taylor Swift Jadi Pelakor di Klip Sugarland on stage Penampilan Taylor Swift Jadi Pelakor di Klip Sugarland on stage Penampilan Taylor Swift Jadi Pelakor di Klip Sugarland on stage Penampilan Taylor Swift Jadi Pelakor di Klip Sugarland on stage Raisa Cantik Tampil Serba Putih saat Rilis Single Terbarunya on stage Raisa Cantik Tampil Serba Putih saat Rilis Single Terbarunya on stage Raisa Cantik Tampil Serba Putih saat Rilis Single Terbarunya on stage Raisa Cantik Tampil Serba Putih saat Rilis Single Terbarunya on stage Raisa Cantik Tampil Serba Putih saat Rilis Single Terbarunya on stage Raisa Cantik Tampil Serba Putih saat Rilis Single Terbarunya on stage Keseruan Sheila On Manggung di PRJ on stage Keseruan Sheila On Manggung di PRJ on stage Keseruan Sheila On Manggung di PRJ on stage Keseruan Sheila On Manggung di PRJ on stage Keseruan Sheila On Manggung di PRJ on stage Keseruan Sheila On Manggung di PRJ on stage Serunya SHVR Ground Hari Pertama Siap untuk Pesta Nanti Malam on stage Serunya SHVR Ground Hari Pertama Siap untuk Pesta Nanti Malam on stage Serunya SHVR Ground Hari Pertama Siap untuk Pesta Nanti Malam on stage Serunya SHVR Ground Hari Pertama Siap untuk Pesta Nanti Malam on stage Serunya SHVR Ground Hari Pertama Siap untuk Pesta Nanti Malam on stage Serunya SHVR Ground Hari Pertama Siap untuk Pesta Nanti Malam on stage Serunya SHVR Ground Hari Pertama Siap untuk Pesta Nanti Malam on stage Serunya SHVR Ground Hari Pertama Siap untuk Pesta Nanti Malam on stage Yuk Intip Pembuatan Klip No Tears Left to Cry Ariana Grande on stage Yuk Intip Pembuatan Klip No Tears Left to Cry Ariana Grande on stage Yuk Intip Pembuatan Klip No Tears Left to Cry Ariana Grande on stage Yuk Intip Pembuatan Klip No Tears Left to Cry Ariana Grande on stage Yuk Intip Pembuatan Klip No Tears Left to Cry Ariana Grande on stage Yuk Intip Pembuatan Klip No Tears Left to Cry Ariana Grande celeb Deretan Bintang Hadir di Coachella celeb Deretan Bintang Hadir di Coachella celeb Deretan Bintang Hadir di Coachella celeb Deretan Bintang Hadir di Coachella celeb Deretan Bintang Hadir di Coachella on stage Frances Bean Putri Cantik Kurt Cobain Jajal Panggung Musik on stage Frances Bean Putri Cantik Kurt Cobain Jajal Panggung Musik on stage Frances Bean Putri Cantik Kurt Cobain Jajal Panggung Musik on stage Frances Bean Putri Cantik Kurt Cobain Jajal Panggung Musik on stage Frances Bean Putri Cantik Kurt Cobain Jajal Panggung Musik on stage Frances Bean Putri Cantik Kurt Cobain Jajal Panggung Musik on stage Frances Bean Putri Cantik Kurt Cobain Jajal Panggung Musik 
