title,content
"Buntut Heboh Banyak Balon Udara di Langit, Airnav Terbitkan Notam", Solo Airnav Indonesia akhirnya menerbitkan peringatan atau notice to airmen Notam terkait kemunculan benda misterius di langit yang ternyata balon udara Pesawat diminta berhati hati saat melintas di beberapa kawasan di Jawa Tengah Tadi siang setelah ramai ada sesuatu di langit Solo kita keluarkan Notam agar pilot juga berhati hati saat melintas di Pekalongan dan Wonosobo kata General Manager Airnav Indonesia cabang Solo Dheny Purbo Hariyanto saat dihubungi detikcom Minggu Dia mengaku tidak dapat mengecek secara langsung benda apa yang terbang di langit Solo Namun berdasarkan laporan masyarakat diduga benda itu adalah balon udara Soalnya kebetulan ini sedang tidak ada pesawat yang terbang jadi tidak ada laporan ke kami Daripada ambil risiko kita keluarkan Notam saja ujarnya Selanjutnya Halaman solo benda misterius di langit solo airnav indonesia birojatengdiy viral 
97 Orang Tewas dan 2 Selamat dalam Insiden Pesawat Maskapai Pakistan Jatuh, Islamabad Sedikitnya orang tewas dalam insiden jatuhnya pesawat maskapai Pakistan International Airlines PIA di Karachi Pakistan Dua orang lainnya berhasil selamat dari insiden tragis ini Seperti dilansir AFP Sabtu pesawat penumpang jenis Airbus A milik maskapai PIA ini berupaya melakukan sejumlah pendekatan untuk mendarat di Bandara Internasional Jinnah Karachi saat kecelakaan terjadi pada Jumat waktu setempat Pesawat dengan nomor penerbangan ini tiba tiba menabrak area permukiman dan merusak sejumlah gedung Laporan AFP menyebut pesawat ini membawa awak dan penumpang Informasi ini mengkoreksi laporan sebelumnya yang menyebut pesawat penumpang ini membawa orang saat kecelakaan terjadi nvc idh pakistan pesawat jatuh di pakistan pesawat jatuh pakistan international airlines 
"Sebelum Jatuh, Pilot Pakistan Airlines Laporkan Gangguan Mesin: Mayday!", Karachi Pesawat Pakistan International Airlines bernomor penerbangan PK yang terbang dari Lahore jatuh sebelum mendarat di Bandara Internasional Jinnah di Karachi Pesawat sempat berputar putar di udara sebelum akhirnya jatuh Kami lanjut langsung Pak kami kehilangan mesin kata pilot pesawat nahas itu sebelum jatuh di permukiman kumuh kawasan selatan Karachi Jumat Selanjutnya Halaman pesawat pakistan jatuh pesawat jatuh di pakistan karachi pakistan 
"Pesawat Pakistan Angkut 107 Orang Jatuh, 2 Orang Dikabarkan Selamat", Karachi Pesawat Pakistan International Airlines bernomor penerbangan PK jatuh di kawasan permukiman di selatan Karachi Otoritas setempat menyatakan orang di dalam pesawat tewas namun ada kabar mengatakan orang selamat Dilansir Associated Press AP Jumat Wali Kota Karachi Wasim Akhtar mengatakan semua orang di dalam pesawat telah tewas akibat kecelakaan itu dnu knv pakistan pesawat jatuh di pakistan pakistan airlines karachi pesawat pakistan jatuh 
Video Pesawat Jatuh di Permukiman Karachi Tewaskan 107 Orang, Jakarta Pesawat komersial yang mengangkut penumpang dan kru jatuh di permukiman dekat Bandara Internasional Jinnah Karachi Pakistan Jumat Pesawat yang terbang dari Lahore ini tinggal puing Seluruh penumpang dan kru tewas Gambas Video detik trw trw pesawat jatuh 
Pesawat Berpenumpang Seratusan Orang Jatuh di Permukiman Pakistan, Karachi Pesawat penumpang jatuh di di Pakistan Pesawat itu membawa lebih dari orang mengalami kecelakaan di kawasan selatan Karachi Dilansir AFP Jumat pesawat itu jatuh di permukiman asap hitam tebal dnu dhn pakistan kecelakaan pesawat karachi pesawat jatuh pesawat jatuh di pakistan kecelakaan pesawat di pakistan 
"2Â Pesawat Aerobatik Kanada Jatuh, Pilot Alami Cedera", Kanada Tim aerobatik angkatan udara elit Kanada mengalami kecelakaan pesawat saat melakukan aksi penghormatan atas penanganan virus Corona di British Columbia Kanada Akibat kecelakaan pesawat ini seorang pilot alami patah tulang leher dan punggung Seperti dilansir AFP Senin insiden kecelakaan pesawat tersebut terjadi di halaman depan sebuah rumah tak lama setelah lepas landas dari Bandara Kamloops Pesawat itu dan satu pesawat lainnya menabrak halaman depan rumah Pesawat Snowbirds pasukan Kanada jatuh di sekitar Bandara Kamloops cuit akun twitter Angkatan Udara Kanada Prioritas kami saat ini adalah memantau status personel kami dan personel darurat pendukung sambungnya maa dkp kanada kecelakaan pesawat pilot 
Misteri Dentuman Senin Dini Hari di Jateng yang Belum Terpecahkan, Yogyakarta Dentuman yang didengar secara luas di Jawa Tengah pada Senin dini hari lalu hingga saat ini masih menjadi misteri Beragam pendapat muncul terkait penyebab dentuman tersebut Fenomena dentuman itu terdengar secara luas di Jawa Tengah Meliputi Boyolali Solo Karanganyar Sragen Grobogan Blora Kudus hingga Pati Suaranya keras sekali sekitar pukul WIB Arahnya dari atas Setelah itu saya rasakan getaran cukup kencang dua buah genting saya sampai melorot ujar Huriyanto warga Desa Gading Kecamatan Tanon Sragen saat dihubungi detikcom Senin Huriyanto melanjutkan usai mendengar suara kencang seluruh anggota keluarganya langsung berlari keluar rumah Namun setelah diperiksa tidak ada apa apa di luar Hanya tersisa suara ternak yang turut resah merespons dentuman keras tersebut Selanjutnya Halaman yogyakarta dentuman dentuman di jateng dentuman dini hari dentuman misterius jateng jawa tengah birojatengdiy 
Saat Tentara Langit Menyelam Evakuasi Pilot Tenggelam di Sentani, Jayapura Pesawat yang mengangkut logistik dan alat kesehatan jatuh di Danau Sentani Jayapura Papua Pesawat tersebut kemudian tenggelam ke dasar danau Pilot pesawat milik Mission Aviation Fellowship MAF Joyce Chaisin Lin tewas dan ikut tenggelam Jenazah Joyce terperangkap di dalam kokpit Pesawat jatuh tepat di tengah tengah danau antara Kampung Yoboi dan Kamyagha Dua anggota TNI AU melakukan proses evakuasi pilot Mereka adalah Peltu Absent Tinus Simbiring dan Sertu Elisa Womsiwor Selanjutnya Halaman round up biromakassar pesawat jatuh danau sentani pesawat jatuh tni au 
Fakta-fakta Terbaru Jatuhnya Pesawat MAF di Danau Sentani Papua, Jakarta Pesawat milik Mission Aviation Fellowship MAF jatuh di Danau Sentani Papua Pesawat itu ternyata membawa alat kesehatan penanganan wabah virus Corona Pesawat MAF PK MEC tipe Kodiak ini dipiloti Joyce Lin take off pada Selasa Mei pukul WIT dari Bandara Sentani menuju Mamit Kabupaten Tolikara WAJJ WAVS Sekira pukul WIT pesawat hilang kontak Pesawat lalu jatuh di tengah tengah danau di atas permukaan air dan tenggelam Pesawat kargo tersebut membawa logistik bahan makanan dan tidak berpenumpang Berikut fakta fakta terbaru jatuhnya pesawat MAF di Danau Sentani Papua Bawa Alat Kesehatan CoronaJuru bicara Satgas COVID Provinsi Papua dr Silwanus Sumule menyampaikan rasa dukacita yang mendalam atas jatuhnya pesawat milik MAF di Danau Sentani Pesawat itu ternyata membawa alat kesehatan penanganan wabah virus Corona Kami Satgas COVID Provinsi Papua ingin menyampaikan duka yang sangat mendalam kepada keluarga besar Mission Aviation Fellowship MAF dan pilot Capt Joyce Lin atas accident pesawat yang jatuh di Danau Sentani ujar Silwanus kepada wartawan Selasa malam Silwanus mengatakan pesawat MAF kode PK MEC yang jatuh di Danau Sentani Kabupaten Jayapura pada Selasa pagi itu membawa sejumlah alat kesehatan yang akan digunakan tenaga medis di Distrik Mamit Kabupaten Tolikara Selanjutnya Halaman round up pesawat jatuh danau sentani kecelakaan pesawat danau sentani pesawat jatuh biromakassar 
"Ahli IT, Ini Sosok Pilot Wanita Pesawat MAF yang Jatuh di Danau Sentani", Jakarta Pihak Mission Aviation Fellowship MAF bersedih dan kehilangan atas tewasnya Joyce Lin Pesawat yang dipiloti Joyce mengalami kecelakaan dan terjatuh di Danau Sentani Jayapura Papua Keluarga Mission Aviation Fellowship MAF sangat sedih dengan kehilangan rekan dan teman mereka Joyce Lin demikian pernyataan dari MAF yang dimuat di situs resminya seperti dilihat detikcom Rabu Pihak MAF menyatakan Joyce satu satunya orang dalam pesawat tersebut MAF menyatakan Joyce sangat bahagia bekerja di Indonesia Selanjutnya Halaman pesawat jatuh danau sentani papua kecelakaan pesawat pesawat jatuh biromakassar 
Cerita 2 Anggota TNI AU Evakuasi Pilot Pesawat Jatuh di Danau Sentani, Jakarta Dua anggota TNI AU jadi dua dari empat penyelam yang melakukan proses evakuasi pilot pesawat pengangkut logistik milik Mission Aviation Fellowship MAF yang jatuh di Danau Sentani Jayapura Papua Keduanya ialah Peltu Absent Tinus Simbiring dan Sertu Elisa Womsiwor Bagaimana bisa tentara langit menyelam selamatkan pilot wanita WN Amerika Serikat bernama Joyce Chaisin Lin Danlanud Silas Papare Jayapura Marsma TNI Tri Bowo Budi Santoso mengatakan kedua anggotanya memang punya kualifikasi menyelam Kebetulan anggota saya pelatih dan atlet selam Penyelam yang evakuasi korban Ada orang dua anggota SAR dan dua anggota TNI AU Memang mereka atlet selam satu lagi pelatih selam kata Marsma Tri Bowo saat dihubungi Rabu Selanjutnya Halaman biromakassar tni au danau sentani pesawat jatuh danau sentani 
Nahas Pesawat Kargo Jatuh di Sentani Papua, Jayapura Sebuah pesawat Cesna pengangkut logistik milik Mission Aviation Fellowship MAF terjatuh di Danau Sentani Jayapura Provinsi Papua Insiden nahas itu menewaskan seorang pilot warga negara Amerika Serikat Joyce Chaisin Lin Peristiwa jatuhnya pesawat tersebut terjadi Selasa sekitar pukul Wit Saat itu pesawat yang diterbangkan Joyce hendak membawa logistik menuju kabupaten Tolikara Benar tadi pagi sekitar pukul Wit pesawat Cargo jenis Cesna milik MAF jatuh di Danau Sentani dekat kampung Hobong ujar Kapolres Jayapura AKBP Victor Dean Makboan saat dihubungi detikcom Selasa Selanjutnya Halaman biromakassar round up sentani jayapura papua kecelakaan pesawat 
Kronologi Pesawat Jatuh di Danau Sentani hingga Jenazah Pilot Dievakuasi, Jayapura Pesawat Cesna pengangkut logistik milik Mission Aviation Fellowship MAF jatuh di Danau Sentani Jayapura Papua setelah menit take off Jenazah pilot wanita WN Amerika Serikat bernama Joyce Chaisin Lin Begini kronologinya Tim SAR gabungan telah mengevakuasi korban ke RS Bhayangkara untuk dilakukan tindakan medis Sementara itu untuk badan pesawat talah berhasil dievakuasi dari dasar danau kata Kabid Humas Polda Papua kombes Ahmad Musthofa kamal dalam keterangannya Selasa Adapun dalam kecelakaan penerbangan ini tidak berdampak terhadap arus penerbangan di Bandara Sentani Kabupaten Jayapura Penerbangan ini merupakan penerbangan dukungan logistik dan tidak berpenumpang ujarnya Berikut kronologi pesawat jatuh di Danau Sentani hingga pilot dievakuasi Pukul WITPesawat jenis kodiak K PK MEC milik MAF take off dari Bandara Sentani tujuan Distrik Mamid Kabupaten Tolikara Pukul WITPilot memanggil tower Mayday dan meminta RBT mendarat darurat selanjutnya petugas tower memanggil namun tidak ada jawaban dari pilot Pesawat hilang kontak Pukul WITPolsek Kawasan Bandara Sentani mendapat informasi dari masyarakat yang di TKP langsung bergerak menuju TKP lokasi jatuhnya pesawat tepat di tengah tengah danau antara Kampung Yoboi dan Kamyagha Tim dipimpin Aiptu Pit Suhartono beserta anggota Tonton juga Pesawat Cargo Jatuh di Danau Sentani Papua Gambas Video detik Selanjutnya Halaman biromakassar jayapura pesawat jatuh danau sentani papua 
Saksi Lihat Pesawat MAF Meledak di Udara Sebelum Jatuh ke Danau Sentani, Jayapura Pesawat pengangkut logistik milik Mission Aviation Fellowship MAF jatuh di Danau Sentani Jayapura Papua dan menewaskan pilot Warga mengaku sempat melihat pesawat meledak sebelum jatuh ke danau Dari keterangan saksi yang melihat bahwa sekitar pukul WIT pesawat MAF PK MEC yang pada saat itu terbang melewati danau meledak di atas ketinggian dan jatuh di tengah tengah danau di atas permukaan air dan tenggelam masuk ke dalam air Kabid Humas Polda Papua Kombes Ahmad Musthofa Kamal dalam keterangannya Selasa Tim SAR gabungan telah mengevakuasi korban ke RS Bhayangkara untuk dilakukan tindakan medis Sementara itu untuk badan pesawat talah berhasil dievakuasi dari dasar danau ujarnya Selanjutnya Halaman biromakassar pesawat jatuh danau sentani sentani papua 
Pesawat MAF Hilang Kontak 2 Menit Setelah Lepas Landas di Bandara Sentani, Jayapura Kepala Basarnas Jayapura Zainul Thahar mengungkapkan peristiwa detik detik pesawat pengangkut logistik milik MAF Mission Aviation Fellowship jatuh ke Danau Sentuni Papua Zainul menyebut pesawat itu hilang kontak menit setelah lepas landas Karena baru menit setelah take off hilang kontak maka perkiraan belum jauh dari bandara dan benar pesawat jatuh di ujung landasan tepatnya di perairan Danau Sentani ujar Zainul kepada wartawan Selasa zap zap biromakassar jayapura pesawat jatuh danau sentani papua 
"Tak Dengar Dentuman, Warga di Pati-Blora Lihat Benda Mirip Bintang Jatuh", Pati Sejumlah warga di Jawa Tengah mendengar suara dentuman misterius pada dini hari tadi Sedangkan sejumlah warga di Pati dan Blora mengaku tak mendengar suara itu tapi melihat benda mirip bintang jatuh di saat yang bersamaan Jam seperti meteor jatuh berwarna hijau neon dan ekornya warna kuning api ujar Dita Alif Ivan Syah warga Desa Mojoagung Kecamatan Trangkil Pati kepada detikcom melalui pesan singkat Senin Meski begitu Dita mengaku tak mendengar dentuman yang banyak diceritakan warga Jateng lainnya Saya bersama teman teman desa yang lagi asik ngopi melihat secara jelas kejadian itu Tapi saya dengar tadi tidak ada dentuman Sayangnya tidak sempat saya ambil gambarnya lanjutnya Selanjutnya Halaman pati blora dentuman misterius dentuman di jateng birojatengdiy viral info viral 
New York Times Raih Tiga Penghargaan Pulitzer yang Legendaris, New York Pengumuman para pemenang Pulitzer Prize tadinya dijadwalkan untuk April lalu namun diundur dua minggu karena wabah corona Pengumuman sekarang dilakukan di New York secara online Penghargaan Pulitzer dianggap sebagai penghargaan paling bergengsi dalam dunia jurnalisme dan telah diberikan setiap tahun sejak Tahun ini pengumuman harus ditunda karena wabah Covid menyebar di AS terutama di negara bagian New York Harian New York Times mendapat tiga penghargaan yaitu dalam kategori laporan internasional untuk pemberitaan tentang pemerintahan Vladimir Putin di Rusia dan dalam kategori laporan investigatif tentang praktek pemberian kredit yang sangat eksploitatif di industri taksi New York City Penghargaan ketiga diraih NYT dalam kategori commentary untuk sebuah esai tentang penelitian perbudakan di AS Raksasa surat kabar AS lainnya The Washington Post mendapat penghargaan dalam kategori explanatory reporting untuk laporan sains yang menjelaskan dampak suhu udara ekstrem terhadap Bumi Penghargaan foto jurnalistik untuk kantor berita AP dan ReutersPenghargaan dalam kategori pemberitaan nasional diraih harian The Seattle Times untuk laporan laporan mereka tentang salah konstruksi pada pesawat Boeing MAX yang menjadi penyebab dua kecelakaan pesawat jenis ini dalam rentang waktu enam bulan dan menewaskan seluruh penumpang dan awak pesawat Pesawat yang jatuh adalah milik Lion Air di Indonesia pada Oktober dan Ethiopian Air Maret dekat Addis Abeba Setelah kecelakaan fatal itu semua pesawat Boeing MAX di seluruh dunia dilarang terbang Menurut penelitian tim pakar kecelakaan itu terutama disebabkan oleh kesalahan sistem kontrol otomatis MCAS Penghargaan untuk kategori foto jurnalistik diraih kantor berita The Associated Press AP dan kantor berita Reuters dengan foto foto kekerasan di Kashmir dan berita foto aksi protes di Hong Kong Penghargaan khusus untuk aktivis anti rasismeDewan Pulitzer juga mengumumkan penghargaan khusus untuk jurnalis investigatif dan aktivis hak hak sipil Ida Bell Wells â Melalui tulisan tulisannya Ida Bell Wells mengungkap bagaimana hukuman mati tanpa pengadilan digunakan sebagai alat penindasan terhadap warga Afrika Amerika Penghargaan itu diberikan untuk laporan laporannya yang luar biasa berani tentang kekerasan yang mengerikan dan ganas terhadap warga Afrika Amerika selama era hukuman mati tanpa pengadilan tulis Dewan Pulitzer Ida Bell Wells lahir dan dibesarkan di Amerika bagian selatan dan menjadi seorang aktivis hak hak sipil akhir abad dan awal abad Bekerja sebagai jurnalis dia sering membuat laporan tentang segregasi rasial dan perlakuan diskriminatif warga kulit hitam Tahun an dia mendokumentasikan hukuman mati tanpa pengadilan dan menyelidiki klaim bahwa hukuman mati tanpa pengadilan hanya diperuntukkan bagi penjahat kulit hitam Praktik kejam ini itu juga digunakan untuk menghilangkan ancaman persaingan ekonomi dan politik dan untuk melanggengkan kekuasaan kaum kulit putih hp vlz rtr ap ita ita dw new york times pulitzer prize 
Mr. Crack dan Al-Qur'an, Jakarta Retak jatuh terbakar meledak dan pecah berkeping Kecelakaan maut yang pasti membawa petaka Sulit mencari selamat akibat pesawat jatuh dari jarak yang terbang jauh dari permukaan bumi Itulah keadaan pesawat terbang yang bisa mengalami keretakan pada ketinggian tertentu Itu terjadi sebelum Mr Crack memajukan hasil temuan besarnya Crack Progression Theory yang mampu menyelamatkan dunia penerbangan it s great Mr Crack adalah julukan kepada mantan Presiden Republik Indonesia ke Bacharuddin Jusuf BJ Habibie Ia pernah mengenyam pendidikan di Institut Teknologi Bandung ITB Di ITB Habibie sudah terkenal memiliki otak cemerlang Ia memperoleh beasiswa untuk melanjutkan studi di Jerman sebelum kuliahnya selesai Namun sayang ketika di Jerman Habibie si pemilik intelligence quotient IQ di atas Einstein ini tidak pernah mampu mengalahkan peringkat kelas dua orang temannya Mereka keturunan Yahudi Habibie baru mampu mengungguli mereka setelah teman Rudy panggilan Habibie itu membukakan rahasia mengapa mereka selalu memperoleh peringkat di atas Habibie Quran Ya just it Al Quran Hasil karya biasanya langsung merujuk kepada siapa yang membuatnya Lukisan yang sangat bagus pasti dihasilkan oleh pelukis yang luar biasa Karya arsitektur yang rumit bisa merujuk kepada siapa yang mengarsitekinya Teknologi secanggih teknologi yang dihasilkan dari Crack Progression Theory pasti dirancang oleh orang yang memiliki kemampuan jauh di atas rata rata Mr Crack Al Quran adalah kitab suci wahyu Ilahi wahyu Sang Maha Pencipta Pencipta alam semesta Siapa pun terkesiap jika harus mengagumi semesta Para pakar sengaja menghitung dan membuktikan bahwa jumlah seluruh penguapan yang terjadi dari seluruh permukaan bumi dikurangi seluruh jumlah air yang turun ke bumi maka selisihnya adalah nol Jika air yang naik dari bumi ke langit lebih banyak dari yang turun bumi akan kering tak ada kehidupan Jika air yang turun dari langit melebihi yang naik bumi tergenang seluruh bumi tertutup air Itu baru satu fenomena Belum fenomena yang lain mengapa oksigen harus berkadar sekitar persen di udara Lebih tinggi dari kadar itu bisa terjadi kebakaran di mana mana Kurang dari itu para juru masak tidak mampu menyalakan kompor Semesta diciptakan dalam keseimbangan yang sangat tinggi dan sangat terukur Keseimbangan dinamis yang menjamin keberlangsungan seluruh kehidupan Al Quran adalah firman Allah swt yang memiliki sifat Maha Sempurna Jadi pastilah Al Quran ini merupakan bacaan yang sangat sempurna kesempurnaan yang sebagiannya digambarkan oleh sempurnanya alam semesta Al Quran tidak hanya Maha Sempurna dari sisi isinya nilai sastranya pun sangat mempesona Para penyair Qurays yang paling unggul sekali pun terlihat miris ketika harus berhadapan dengan al Quran Di surat apa saja dan di ayat yang mana pun nilai nilai sastra dalam kitab suci ini tiada tertandingi baik pada zaman al Quran diturunkan hingga zaman modern ini Al Quran bahkan sanggup melemahkan dasar dasar kemampuan para penyair segi kemurnian segi tarikan segi ransangan meniupkan rasa damai dan nikmat mengikat dan mempesona Ungkapan jujur dari pembesar Qurays ketika itu terdokumentasi ketika Umar bin Khattab dan Walid bin Mughirah pada suatu malam mendengar salah seorang pengikut Nabi saw membaca Al Qur an dekat Ka bah Umar bin Khattab berkata Demi aku mendengar ayat ayat suci Al Qur an alangkah murninya kata kata itu alangkah agung dan mulianya pecah perasaan hatiku aku menangis dan kemudian aku masuk Islam Pengaruh Bacaan Pramoedya Ananta Toer Pram adalah sastrawan yang pernah aktif di Lembaga Kebudayaan Rakyat Lekra organisasi kebudayaan yang dekat dengan PKI Buku buku karya Pram khususnya di jaman orde baru tidak hanya dilarang tapi dirampas dan dibakar Bukan hanya buku beberapa naskah miliknya pun banyak yang dibakar dan hilang entah ke mana Hal ini karena karya tulis bahan bacaan bisa mempengaruhi sikap bahkan jiwa para pembacanya Tidak mungkin pemerintah orde baru bakal sedemikian gigih berupaya mengadang karya karya Pram jika bahan bacaan tidak memberikan efek yang signifikans Setidaknya efek negatif terhadap stabilitas pemerintah di jaman itu Pengaruh bacaan kepada pembacanya jika dibaca secara obyektif tidak didasarkan pada praduga negatif subyektif memiliki dampak salah satu dari sepasang nilai baik atu buruk Bacaan yang baik akan mengubah pembacanya ke arah baik demikian sebaliknya Konsep ini digunakan di dalam upaya penyediaan bahan bacaan yang baik bagi anak anak Bacaan al Quran memengaruhi siapa pun yang membacanya secara obyektif mampu memiliki struktur yang sempurna mengikuti kesempurnaan al Quran Ia mengubah Habibie mampu memperoleh nilai rata rata dari Technische Hochschule Die Facultaet Fuer Maschinenwesen Aachen Jerman Habibie lulus summa cum laude mutlak sempurna Selain Crack Progression Theory yang sangat fenomenal itu Habibie mampu mengoleksi penghargaan dunia terkait kedirgantaraan Allah swt memerintah para hambaNya yang beriman bertaqwa untuk selalu berkata dengan perkataan yang tepat Perkataan demikian mudah digapai oleh orang yang meneladani al Quran melalui membacanya secara istiqamah sebagaimana Habibie Allah swt menjamin kepada siapa saja orang beriman bertaqwa yang selalu berkata dengan perkataan yang tepat perubahan pada seluruh aktifitasnya menjadi baik Perbuatan demikian mengantar kepada digapainya ampunan Allah swt Jika setiap amalnya baik shaleh dan kekeliruannya sudah diampunkan Tuhan maka wajar kalau hamba yang demikian berhak atas fasilitas mendapat pelajaran langsung dati Tuhan memiliki kemampuan pasti membedakan mana yang benar dan mana yang bukan memiliki solusi dari setiap persoalan mampu dengan mudah mengeksekusi solusi itu serta ia mampu memperoleh rizki dari tempat yang tidak diduga Mari kita istiqamah membaca Quran supaya layak memiliki kelebihan yang sempurna ini paling tidak mampu menyamai kelebihan yang dimiliki Mr Crack Habibie AbdurachmanGuru Besar Fakultas Kedokteran Universitas Airlangga Takmir Masjid FK Unair Artikel ini adalah kiriman pembaca detikcom Seluruh isi artikel menjadi tanggung jawab pengirim sepenuhnya erd erd hikmah kolom hikmah ramadhan ramadhan detik muslim habibie 
